_id,title,text,query
<dbpedia:Vitamin>,Vitamin,"A vitamin (US /ˈvaɪtəmɪn/ and UK /ˈvɪtəmɪn/) is an organic compound and a vital nutrient that an organism requires in limited amounts. An organic chemical compound (or related set of compounds) is called a vitamin when the organism cannot synthesize the compound in sufficient quantities, and it must be obtained through the diet; thus, the term ""vitamin"" is conditional upon the circumstances and the particular organism.",definition of vitamins
<dbpedia:Vittorio_De_Sica>,Vittorio De Sica,"Vittorio De Sica (Italian pronunciation: [vitˈtɔːrjo de ˈsiːka]; 7 July 1901 – 13 November 1974) was an Italian director and actor, a leading figure in the neorealist movement.Four of the films he directed won Academy Awards: Sciuscià and Bicycle Thieves were awarded honorary Oscars, while Ieri, oggi, domani and Il giardino dei Finzi Contini won the Best Foreign Language Film Oscar.",victorio de siica who starred in
<dbpedia:Economy_of_Vietnam>,Economy of Vietnam,"The economy of Vietnam is a developing planned economy and market economy. Since the mid-1980s, through the Đổi Mới reform period, Vietnam has made a shift from a highly centralized planned economy to a socialist-oriented market economy which use both directive and indicative planning (see Five-Year Plans of Vietnam). Over that period, the economy has experienced rapid growth. Nowadays, Vietnam is in a period of being integrated into the global economy.",what is vietnam's economy like
<dbpedia:Violin>,Violin,"The violin, also called a fiddle, is a string instrument, usually with four strings tuned in perfect fifths. It is the smallest, highest-pitched member of the violin family of string instruments, which also includes the viola, and the cello. The modern word is derived from the Italian word violino, literally meaning 'small viola'. Someone who plays the violin is called a violinist or a fiddler.",is the violin a fiddle
<dbpedia:Vinland>,Vinland,"Vinland or Vineland (Old Norse Vínland) is the name given to the area of coastal North America and Newfoundland explored by Norse Vikings, where Leif Erikson first landed in ca. 1000, approximately five centuries prior to the voyages of Christopher Columbus.In 1960, archaeological evidence of the only known Norse settlement in North America (outside Greenland) was found at L'Anse aux Meadows on the northern tip of the island of Newfoundland.",when did vikings reach the island of newfoundland
<dbpedia:USS_Constitution>,USS Constitution,"USS Constitution is a wooden-hulled, three-masted heavy frigate of the United States Navy, named by President George Washington after the Constitution of the United States of America. Launched in 1797, Constitution was one of six original frigates authorized for construction by the Naval Act of 1794 and the third constructed.",what is the constitution
<dbpedia:Valkyrie_(magazine)>,Valkyrie (magazine),"Valkyrie was a UK role-playing magazine. The magazine was started in 1994. It was published by Partisan Press and edited originally by Dave Renton (original editor of Role Player Independent) and then taken over by Jay Forster.  Renton held the post from 1994 to 1998 and Forster from 1999 to 2003.Some claimed that it was the successor to White Dwarf amongst the UK role-playing community with numerous contributors from across the hobby, including Phil Masters and Marcus Rowland.",what is a valkyrie
<dbpedia:Vermouth>,Vermouth,"Vermouth (UK /ˈvɜrməθ/; or US /vərˈmuːθ/ ver-MOOTH) is an aromatized wine, a type of fortified wine flavored with various botanicals (roots, barks, flowers, seeds, herbs, spices).   The modern versions of the beverage were first produced in the mid to late 18th century in Turin, Italy.  While vermouth was traditionally used for medicinal purposes, its true claim to fame is as an aperitif, with fashionable cafes in Turin serving it to guests around the clock.",what is vermouth
<dbpedia:Vacuum>,Vacuum,"Vacuum is space void of matter. The word stems from the Latin adjective vacuus for ""vacant"" or ""void"". An approximation to such vacuum is a region with a gaseous pressure much less than atmospheric pressure.  Physicists often discuss ideal test results that would occur in a perfect vacuum, which they sometimes simply call ""vacuum"" or free space, and use the term partial vacuum to refer to an actual imperfect vacuum as one might have in a laboratory or in space.",what is a vacuum
<dbpedia:Military_in_Vatican_City>,Military in Vatican City,"The State of Vatican City is an enclave country which lies entirely within Rome, the capital of Italy.  The responsibility for defending the state from an aggressor lies primarily with the Italian Armed Forces. Vatican City has within its territory the Pontifical Swiss Guard or Swiss Guard. The Swiss Guard is a small force maintained by the Holy See and is responsible for the safety of the Pope, including the security of the Apostolic Palace.",who is guardian of vampiric city
<dbpedia:Visigoths>,Visigoths,"The Visigoths (UK: /ˈvɪzɪˌɡɒθs/; US: /ˈvɪzɪˌɡɑːθs/, Latin: Visigothi, Wisigothi, Vesi, Visi, Wesi, or Wisi) were branches of the nomadic tribes of Germanic peoples referred to collectively as the Goths. These tribes flourished and spread during the late Roman Empire in Late Antiquity, or the Migration Period. The Visigoths emerged from earlier Gothic groups (possibly the Thervingi) who had invaded the Roman Empire beginning in 376 and had defeated the Romans at the Battle of Adrianople in 378.",vikings definition
<dbpedia:Vanuatu>,Vanuatu,"Vanuatu (English /ˌvɑːnuːˈɑːtuː/ vah-noo-AH-too or /vænˈwɑːtuː/ van-WAH-too; Bislama IPA: [vanuaˈtu]), officially the Republic of Vanuatu (French: République de Vanuatu, Bislama: Ripablik blong Vanuatu), is an Oceanian island nation located in the South Pacific Ocean.",where is vanuatu
<dbpedia:Velodrome>,Velodrome,"A velodrome is an arena for track cycling. Modern velodromes feature steeply banked oval tracks, consisting of two 180-degree circular bends connected by two straights. The straights transition to the circular turn through a moderate easement curve.",what is a velodrome
<dbpedia:Vint_Cerf>,Vint Cerf,"Vinton Gray ""Vint"" Cerf (/ˈsɜrf/; born June 23, 1943) is an American Internet pioneer, who is recognized as one of ""the fathers of the Internet"", sharing this title with American engineer Bob Kahn and Donald Davies.",who is vint cerf
<dbpedia:Andreas_Vesalius>,Andreas Vesalius,"Andreas Vesalius (31 December 1514–15 October 1564) was a Brabançon anatomist, physician, and author of one of the most influential books on human anatomy, De humani corporis fabrica (On the Fabric of the Human Body). Vesalius is often referred to as the founder of modern human anatomy. He was born in Brussels, which though now part of Belgium, was then part of the Habsburg Netherlands.",who is andreas vesalius?
<dbpedia:Viroid>,Viroid,"Viroids are the smallest infectious pathogens known, consisting solely of short strands of circular, single-stranded RNA without protein coats. They are mostly plant pathogens, some of which are of economical importance. Viroid genomes are extremely small in size, ranging from 246 to 467 nucleobases. In comparison, the genome of the smallest known viruses capable of causing an infection by themselves are around 2,000 nucleobases in size.",what is a virus viroids
<dbpedia:Vernor_Vinge>,Vernor Vinge,"Vernor Steffen Vinge (/ˈvɜrnər ˈvɪndʒiː/; born October 2, 1944) is a retired San Diego State University (SDSU) Professor of Mathematics, computer scientist, and science fiction author.",who is vernor vinge
<dbpedia:Vietnamese_cuisine>,Vietnamese cuisine,"Vietnamese cuisine encompasses the foods and beverages of Vietnam, and features a combination of five fundamental tastes (Vietnamese: ngũ vị) in the overall meal. Each Vietnamese dish has a distinctive flavor which reflects one or more of these elements. Common ingredients include fish sauce, shrimp paste, soy sauce, rice, fresh herbs, and fruits and vegetables.",different types of vietnam foods
<dbpedia:Batavia_(ship)>,Batavia (ship),"Batavia (Dutch pronunciation: [baːˈtaːviaː]) was a ship of the Dutch East India Company (VOC). It was built in Amsterdam in 1628 and armed with 24 cast-iron cannons, and a number of bronze guns. Batavia, shipwrecked on her maiden voyage, was made famous by the subsequent mutiny and massacre that took place among the survivors. A twentieth-century replica of the ship, also called the Batavia, can be visited in Lelystad, Netherlands.",what kind of ship was batavia?
<dbpedia:Amsterdam_(VOC_ship)>,Amsterdam (VOC ship),"The Amsterdam (Dutch pronunciation: [ˌɑmstərˈdɑm]) was an 18th-century cargo ship of the Dutch East India Company. The ship started its maiden voyage from Texel to Batavia on 8 January 1749, but was wrecked in a storm on the English Channel on 26 January 1749. The shipwreck was discovered in 1969 in the bay of Bulverhythe, United Kingdom, and is sometimes visible during low tides. The wreck site is protected under the Protection of Wrecks Act since 1974.",when was the amsterdam ship wreck
<dbpedia:VAX>,VAX,"VAX  was an instruction set architecture (ISA), developed by Digital Equipment Corporation (DEC) in the mid-1970s. The VAX-11/780, introduced on October 25, 1977, was the first of a range of popular and influential computers implementing that architecture.A 32-bit complex instruction set computer based on DEC's earlier PDP-11, VAX ""\virtual address extension"") was designed to extend or replace DEC's various PDP ISAs.",what is a vax
<dbpedia:Volvox>,Volvox,"Volvox is a genus of chlorophytes, a Division of green algae. It forms spherical colonies of up to 50,000 cells. They live in a variety of freshwater habitats, and were first reported by Antonie van Leeuwenhoek in 1700. Volvox developed its colonial lifestyle 200 million years ago.",what is volvox
<dbpedia:Vladimir_Nabokov>,Vladimir Nabokov,"Vladimir Vladimirovich Nabokov (/nəˈbɔːkəf, ˈnæbəˌkɔːf, -ˌkɒf/; Russian: Влади́мир Влади́мирович Набо́ков, pronounced [vlɐˈdʲimʲɪr nɐˈbokəf], also known by the pen name Vladimir Sirin; 22 April [O.S. 10 April] 1899c – 2 July 1977) was a Russian-American novelist. His first nine novels were in Russian, and he achieved international prominence after he began writing English prose.",vladimir nabokov name
<dbpedia:Vim_(text_editor)>,Vim (text editor),Vim (/vɪm/; a contraction of Vi IMproved) is a clone of Bill Joy's vi editor for Unix. It was written by Bram Moolenaar based on source for a port of the Stevie editor to the Amiga and first released publicly in 1991. Vim is designed for use both from a command-line interface and as a standalone application in a graphical user interface.,what is vim
<dbpedia:Voltaic_pile>,Voltaic pile,"The voltaic pile was the first electrical battery that could continuously provide an electrical current to a circuit. It was invented by Alessandro Volta, who published his experiments in 1800.",when was the first voltaic pile invented
<dbpedia:Viking_Age>,Viking Age,"The Viking Age is the period A.D. 793–1066 in European history, especially Northern European and Scandinavian history, following the Germanic Iron Age. It is the period of history when Scandinavian Norsemen explored Europe by its seas and rivers for trade, raids and conquest. In this period, the Norsemen also settled in Norse Greenland, Newfoundland, and present-day Faroe Islands, Iceland, Normandy, Scotland, England, Ukraine, Ireland, Russia and Anatolia.",when was the vikings age
<dbpedia:Venice_Film_Festival>,Venice Film Festival,"The Venice Film Festival or Venice International Film Festival (Italian: Mostra Internazionale d'Arte Cinematografica della Biennale di Venezia, ""International Exhibition of Cinematographic Art of the Venice Biennale""), founded in 1932, is the oldest film festival in the world and one of the ""Big Three"" film festivals alongside the Cannes Film Festival and Berlin International Film Festival.The film festival is part of the Venice Biennale, which was founded by the Venetian City Council in 1895.",what is the festival of venice
<dbpedia:Vi>,Vi,"vi /ˈviːˈaɪ/ is a screen-oriented text editor originally created for the Unix operating system. The portable subset of the behavior of vi and programs based on it, and the ex editor language supported within these programs, is described by (and thus standardized by) the Single Unix Specification and POSIX.The original code for vi was written by Bill Joy in 1976, as the visual mode for a line editor called ex that Joy had written with Chuck Haley.",what is vi vi
<dbpedia:Vesicle_(biology_and_chemistry)>,Vesicle (biology and chemistry),"In cell biology, a vesicle is a small structure within a cell, consisting of fluid enclosed by a lipid bilayer membrane. Vesicles can form naturally, for example, during the processes of secretion (exocytosis), uptake (phagocytosis and endocytosis) and transport of materials within the cytoplasm. Alternatively, they may be prepared artificially, in which case they are called liposomes.",what is a vesicle in a cell
<dbpedia:Vladimir_Arnold>,Vladimir Arnold,"Vladimir Igorevich Arnold (alternative spelling Arnol'd, Russian: Влади́мир И́горевич Арно́льд, 12 June 1937 – 3 June 2010) was a Soviet and Russian  mathematician.",who is arnold
<dbpedia:Vaccination>,Vaccination,"Vaccination is the administration of antigenic material (a vaccine) to stimulate an individual's immune system to develop adaptive immunity to a pathogen. Vaccines can prevent or ameliorate morbidity from infection. When a sufficiently large percentage of a population has been vaccinated, this results in herd immunity. The effectiveness of vaccination has been widely studied and verified; for example, the influenza vaccine, the HPV vaccine, and the chicken pox vaccine.",what is a vaccine
<dbpedia:Vulture>,Vulture,"Vulture is the name given to two groups of scavenging birds of prey: the New World vultures, including the Californian and Andean condors; and the Old World vultures, including the birds that are seen scavenging on carcasses of dead animals on African plains. Research has shown that some traditional Old World vultures (including the bearded vulture) are not closely related to the others, which is why the vultures are to be subdivided into three taxa rather than two.",what is the vulture
<dbpedia:Vocative_case>,Vocative case,"The vocative case (abbreviated VOC, voc.) is the case used for a noun that identifies a person (animal, object, etc.) being addressed or, occasionally, the determiners of that noun. A vocative expression is an expression of direct address where the identity of the party spoken to is set forth expressly within a sentence.",define vocative cases
<dbpedia:Vagina>,Vagina,"The vagina is a sex organ that is part of the female genital tract. It is a muscular and tubular in structure. In humans, the vagina extends from the vulva to the uterus. The outer vaginal opening may be partly covered by a membrane called the hymen. At the deep end, the cervix (neck of the uterus) bulges into the vagina. The vagina allows for sexual intercourse and childbirth.",define vagina
<dbpedia:Vietnam_veteran>,Vietnam veteran,"A Vietnam veteran is someone who served in the armed forces of participating countries during the Vietnam War.The term has been used to describe veterans who were in the armed forces of South Vietnam, the United States armed forces, and countries allied to them, whether or not they were actually stationed in Vietnam during their service.",where did they serve in vietnam
<dbpedia:Volcano>,Volcano,"A volcano is a rupture on the crust of a planetary-mass object, such as Earth, that allows hot lava, volcanic ash, and gases to escape from a magma chamber below the surface.Earth's volcanoes occur because its crust is broken into 17 major, rigid tectonic plates that float on a hotter, softer layer in its mantle. Therefore, on Earth, volcanoes are generally found where tectonic plates are diverging or converging.",where are volcanoes found
<dbpedia:Vangelis>,Vangelis,"Evangelos Odysseas Papathanassiou (Greek: Ευάγγελος Οδυσσέας Παπαθανασίου [evˈaɲɟelos oðiˈseas papaθanaˈsiu]; born 29 March 1943), known professionally as Vangelis (Greek: Βαγγέλης [vaɲˈɟelis]; English pronunciation: /væŋˈɡɛlɨs/), is a Greek composer of electronic, progressive, ambient, jazz, pop rock, and orchestral music.",who is vangelis
<dbpedia:Verðandi>,Verðandi,"In Norse mythology, Verðandi (Old Norse, meaning possibly ""happening"" or ""present""), sometimes anglicized as Verdandi or Verthandi, is one of the norns. Along with Urðr (Old Norse ""fate"") and Skuld (possibly ""debt"" or ""future""), Verðandi makes up a trio of Norns that are described as deciding the fates (wyrd) of people.",who is verthandi?
<dbpedia:V-chip>,V-chip,"V-chip is a generic term for technology used in television set receivers in Canada, Brazil and the USA, which allows the blocking of programs based on their ratings category. It is intended for use by parents to manage their children's television viewing. Televisions manufactured for the United States market since 1999 and all units as of January 2000 are required to have the V-chip technology. The idea for blocking programs in this way was patented by Brett West and John P.",what is a v chip
<dbpedia:Vitamin_K>,Vitamin K,"Vitamin K refers to a group of structurally similar, fat-soluble vitamins the human body needs for complete synthesis of certain proteins that are required for blood coagulation, and also certain proteins that the body uses to control binding of calcium in bone and other tissues. The vitamin K-related modification of the proteins allows them to bind calcium ions, which they cannot do otherwise. Without vitamin K, blood coagulation is seriously impaired, and uncontrolled bleeding occurs.",what is vitamin k
<dbpedia:Vladimir_Vernadsky>,Vladimir Vernadsky,"Vladimir Ivanovich Vernadsky (Russian: Влади́мир Ива́нович Верна́дский; Ukrainian: Володи́мир Іва́нович Верна́дський; 12 March [O.S. 28 February] 1863 – 6 January 1945) was a Russian, Ukrainian, and Soviet mineralogist and geochemist who is considered one of the founders of geochemistry, biogeochemistry, and of radiogeology, founder of the Ukrainian Academy of Sciences (now National Academy of Sciences of Ukraine). His ideas of noosphere were an important contribution to Russian cosmism.",who is vladimir vernadsky
<dbpedia:Vegetarian_cuisine>,Vegetarian cuisine,"Vegetarian cuisine is based on food that meets vegetarian standards by not including meat and animal tissue products. For lacto-ovo vegetarianism (the most common type of vegetarianism in the Western world), eggs and dairy products such as milk and cheese are permitted. For lacto vegetarianism, the earliest known type of vegetarianism (recorded in India), dairy products such as milk and cheese are permitted.",what is vegetarian food
<dbpedia:Visual_cortex>,Visual cortex,"The visual cortex of the brain is the part of the cerebral cortex responsible for processing visual information. This article addresses the ventral/dorsal model of the visual cortex. Another model for the perceptual/conceptual neuropsychological model of the visual cortex was studied by Raftopolous. In Russian neuropsychology, yet another model was discussed by Alexander Luria for the anterior/posterior approach to understanding the visual cortex.",visual cortex definition
<dbpedia:Vocal_loading>,Vocal loading,Vocal loading is the stress inflicted on the speech organs when speaking for long periods.,vocal load definition
<dbpedia:Volt>,Volt,"The volt (symbol: V) is the derived unit for electric potential, electric potential difference (voltage), and electromotive force. The volt is named in honour of the Italian physicist Alessandro Volta  (1745–1827), who invented the voltaic pile, possibly the first chemical battery.",how does the word volt
<dbpedia:Voltage>,Voltage,"Voltage, electric potential difference, electric pressure  or electric tension (denoted ∆V or ∆U) is the difference in electric potential energy between two points per unit electric charge.",voltage voltage definition
<dbpedia:Video_editing_software>,Video editing software,"Video editing software is application software which handles the post-production video editing of digital video sequences on a computer non-linear editing system (NLE).  It has replaced traditional flatbed celluloid film editing tools and analogue video tape-to-tape online editing machines.NLE software is typically based on a timeline interface paradigm where sections of moving image video recordings, known as clips, are laid out in sequence and played back.",what is video editing software
<dbpedia:Volatile_Organic_Compounds_Protocol>,Volatile Organic Compounds Protocol,The Protocol to the 1979 Convention on Long-Range Transboundary Air Pollution Concerning the Control of Emissions of Volatile Organic Compounds or Their Transboundary Fluxes (known as the Volatile Organic Compounds Protocol or the VOC Protocol) is a protocol to the Convention on Long-Range Transboundary Air Pollution which aims to provide for the control and reduction of emissions of volatile organic compounds in order to reduce their transboundary fluxes so as to protect human health and the environment from adverse effects.,what is the vol protocol
<dbpedia:Vampyrellidae>,Vampyrellidae,"The Vampyrellidae are a group of cercozoans with filose pseudopods and lacking shells.  Vampyrella is typical of the group, which also contains genera such as Platyreta and Arachnula.The term ""Aconchulinida"" is sometimes used for vampyrellid. It has been described as an order.",what is vampyrellidae
<dbpedia:Economy_of_Venezuela>,Economy of Venezuela,"The economy of Venezuela is largely based on the petroleum sector and manufacturing. Revenue from petroleum exports accounts for more than 50% of the country's GDP and roughly 95% of total exports. Venezuela is the fifth largest member of OPEC by oil production. From the 1950s to the early 1980s the Venezuelan economy experienced a steady growth that attracted many immigrants, with the nation enjoying the highest standard of living in Latin America.",what is venezuela largely based on
<dbpedia:Villa_Savoye>,Villa Savoye,"Villa Savoye (French pronunciation: ​[saˈvwa]) is a modernist villa in Poissy, in the outskirts of Paris, France.",where is villa savoye
<dbpedia:Victimology>,Victimology,"Victimology is the study of victimization, including the relationships between victims and offenders, the interactions between victims and the criminal justice system — that is, the police and courts, and corrections officials — and the connections between victims and other social groups and institutions, such as the media, businesses, and social movements. Victimology is however not restricted to the study of victims of crime alone but may include other forms of human rights violations.",what is victimology
<dbpedia:Virtual_reality>,Virtual reality,"Virtual Reality (VR), which can be referred to as immersive multimedia or computer-simulated life, replicates an environment that simulates physical presence in places in the real world or imagined worlds and lets the user interact in that world.",what is virtual reality
<dbpedia:Varuna>,Varuna,"Varuna (/ˈvɜrʊnə, ˈvɑːrə-/; Sanskrit: Varuṇa वरुण, Malay: Baruna) is the Hindu god of the water and of the celestial ocean, as well as a god of law of the underwater world. A Makara is his mount. The origin of Varuna is in ancient Vedic religion. Originally the chief god of the Vedic pantheon, Varuna was replaced by Indra and later faded away with the ascendancy of Shiva and Vishnu.",what is varuna
<dbpedia:Vela_(constellation)>,Vela (constellation),"Vela is a constellation in the southern sky. Its name is Latin for the sails of a ship, and it was originally part of a larger constellation, the ship Argo Navis, which was later divided into three or four parts, the others being Carina, Puppis and, according to some authorities, Pyxis. With an apparent magnitude of 1.8, its brightest star is the hot blue multiple star Gamma Velorum, one component of which is the brightest Wolf-Rayet star in the sky.",where is vela
<dbpedia:Video_game_console>,Video game console,"A video game console is a device that outputs a video signal or visual image to display a video game.  The term ""video game console"" is used to distinguish a console machine primarily designed for consumers to use for playing video games in contrast to arcade machines or home computers.",define video game console
<dbpedia:Vladimir_Markovnikov>,Vladimir Markovnikov,"Vladimir Vasilyevich Markovnikov (Russian: Влади́мир Васи́льевич Марко́вников), also spelled as Markownikoff (December 22, 1837 – February 11, 1904), was a Russian chemist.",who was vladimir markovnikov
<dbpedia:Vulgate>,Vulgate,"The Vulgate (/ˈvʌlɡeɪt, -ɡɪt/) is a late fourth-century Latin translation of the Bible that became, during the 16th century, the Catholic Church's officially promulgated Latin version of the Bible.The translation was largely the work of St. Jerome, who, in 382, was commissioned by Pope Damasus I to revise the Vetus Latina ""\Old Latin"") collection of biblical texts in Latin then in use by the Church.",what does a vulgate mean
<dbpedia:Video_art>,Video art,Video art is a type of art which relies on moving pictures and comprises video and/or audio data. Video art came into existence during the late 1960s and early 1970s as new consumer video technology became available outside corporate broadcasting.,what is art video
