_id,title,text,query
"<dbpedia:Winifred,_Montana>","Winifred, Montana","Winifred is a town in north-central Fergus County, Montana, United States. The population was 208 at the 2010 census. Winifred was founded in 1913 as the terminus of a newly built branch line of the Chicago, Milwaukee, St. Paul and Pacific Railroad ""\the Milwaukee Road"").  It is popularly believed to have been named after one of the railroad owner's two daughters (the other being Christina, another small town about 15 miles away).","what county is winifred, mt in"
"<dbpedia:Martin_City,_Montana>","Martin City, Montana","Martin City is a census-designated place (CDP) in Flathead County, Montana, United States.",what county is martin city mt in?
"<dbpedia:Lakeside,_Montana>","Lakeside, Montana","Lakeside is a census-designated place (CDP) in Flathead County, Montana, United States. The population was 1,679 at the 2000 census.",where is lakeside mt
<dbpedia:Sean_Waltman>,Sean Waltman,"Sean Michael Waltman (born July 13, 1972) is an American professional wrestler. He wrestled for the World Wrestling Federation (WWF, now called WWE) under the ring names 1–2–3 Kid and X-Pac intermittently between 1993 and 2002, World Championship Wrestling (WCW) as Syxx, and Total Nonstop Action Wrestling (TNA) as Syxx-Pac and Sean Waltman.He is signed with WWE working in their Legends program.",who is sean waltman
"<dbpedia:Kalispell,_Montana>","Kalispell, Montana","Kalispell (Ktunaxa: kqaya·qawa·kǂuʔnam, Salish: qlispél) is a city in, and the county seat of, Flathead County, Montana. The 2013 Census estimates put Kalispell's population at 20,972. The Kalispell Micropolitan Statistical Area has a population of 93,068 and it is the largest city and commercial center of northwest Montana. The name Kalispell is a Salish word meaning ""flat land above the lake"". Kalispell is also the gateway to Glacier National Park.",what county is kalispell mt
"<dbpedia:Belgrade,_Montana>","Belgrade, Montana","Belgrade is a city in Gallatin County, Montana, United States. The population was 7,389 at the 2010 census. It is the largest city in Montana that is not a county seat.The original townsite of Belgrade was established and filed in the Gallatin County Clerk and Recorder's Office by Thomas B. Quaw, a businessman from the midwest, in July 1881.",population of belgrade montana
<dbpedia:Noises_Off>,Noises Off,"Noises Off is a 1982 play by the English playwright Michael Frayn. The idea for it came in 1970, when Frayn was watching from the wings a performance of The Two of Us, a farce that he had written for Lynn Redgrave. He said, ""It was funnier from behind than in front, and I thought that one day I must write a farce from behind.""  The prototype, a short-lived one-act play called Exits, was written and performed in 1977.",who wrote noises off
<dbpedia:Philosophy_of_physics>,Philosophy of physics,"In philosophy, the philosophy of physics studies the fundamental philosophical questions underlying modern physics, the study of matter and energy and how they interact. The philosophy of physics begins by reflecting on the basic metaphysical and epistemological questions posed by physics: causality, determinism, and the nature of physical law.",philosophy of physics
"<dbpedia:Four_Corners,_Montana>","Four Corners, Montana","Four Corners is a census-designated place (CDP) in Gallatin County, Montana, United States. The population was 3,146 at the 2010 census. It is part of the Bozeman, MT Micropolitan Statistical Area.","where is four corners, mt"
"<dbpedia:Glendive,_Montana>","Glendive, Montana","Glendive is a city in and the county seat of Dawson County, Montana, United States. Glendive was established by the Northern Pacific Railway when they built the transcontinental railroad across the northern tier of the western United States from Minnesota to the Pacific Coast.",where is glendive mt
<dbpedia:List_of_Indian_reservations_in_the_United_States>,List of Indian reservations in the United States,"This is a list of Indian reservations and other tribal homelands in the United States. In Canada, the Indian reserve is a similar institution.",what is the american reservation system
"<dbpedia:Manhattan,_Montana>","Manhattan, Montana","Manhattan is a town in Gallatin County, Montana, United States. The population was 1,520 at the 2010 census. It is part of the 'Bozeman Micropolitan Statistical Area'.",what county is manhattan montana in
<dbpedia:Homicide>,Homicide,"Homicide is the act of a human being causing the death of another human being. There are both unintentional and intentional homicides, and many different types of homicides are generally treated very differently in human societies; such classes of homicide can include murder, abortion, manslaughter, euthanasia, and execution.",definition of homicide
"<dbpedia:Ryegate,_Montana>","Ryegate, Montana","Ryegate is a town in and the county seat of Golden Valley County, Montana, United States. The population was 245 at the 2010 census. Ryegate is situated on the north bank of the Musselshell River.",ryegate mt is in what county
"<dbpedia:Whitefish,_Montana>","Whitefish, Montana","Whitefish (Salish: epɫx̣ʷy̓u, ""has whitefish"") is a city in Flathead County, Montana, United States. The population was 6,357 at the 2010 census. It is home to a ski resort on Big Mountain called Whitefish Mountain Resort. Former Montana Governor Brian Schweitzer hails from Whitefish.","where is whitefish, mt"
"<dbpedia:North_Browning,_Montana>","North Browning, Montana","North Browning is a census-designated place (CDP) in Glacier County, Montana, United States. The population was 2,408 at the 2010 census.",what county is north browning mt in
<dbpedia:Education_in_the_United_States>,Education in the United States,"Education in the United States is provided by public schools and private schools.Public education is universally required at the K–12 level, and is available at state colleges and universities for all students. K–12 public school curricula, budgets, and policies are set through locally elected school boards, who have jurisdiction over individual school districts.",what are the u.s. school districts
"<dbpedia:East_Glacier_Park_Village,_Montana>","East Glacier Park Village, Montana","East Glacier Park is a census-designated place (CDP) in Glacier County, Montana, United States. The population was 363 on the 2010 United States Census.","what county is east glacier park, montana in"
"<dbpedia:Willow_Creek,_Montana>","Willow Creek, Montana","Willow Creek is a census-designated place (CDP) in Gallatin County, Montana, United States. The population was 210 at the 2010 census. It is part of the Bozeman, MT Micropolitan Statistical Area.",what county is willow creek in mt
"<dbpedia:South_Browning,_Montana>","South Browning, Montana","South Browning is a census-designated place (CDP) in Glacier County, Montana, United States. The population was 1,677 at the 2000 census. South Browning is a rural village on the Blackfeet Indian Reservation. It is near to the town of Browning.",what county is south browning mt
<dbpedia:Shays'_Rebellion>,Shays' Rebellion,"Shays‍ '​  Rebellion was an armed uprising in Massachusetts (mostly in and around Springfield) during 1786 and 1787. Revolutionary War veteran Daniel Shays led four thousand rebels (called Shaysites) in rising up against perceived economic injustices by Massachusetts, and in a later attempt to capture the United States' national weapons arsenal at the U.S. Armory at Springfield.",what was shays' rebellion
"<dbpedia:Three_Forks,_Gallatin_County,_Montana>","Three Forks, Gallatin County, Montana","Three Forks is a city in Gallatin County, Montana, United States and is located within the watershed valley system of both the Missouri and Mississippi rivers drainage basins — and is historically considered the birthplace or start of the Missouri River. The population was 1,869 at the 2010 census.",what county is three forks mt
"<dbpedia:Jordan,_Montana>","Jordan, Montana","Jordan is a town in and the county seat of Garfield County, Montana, United States. The population was 343 at the 2010 census.",where is jordan mt
<dbpedia:Spectral_theorem>,Spectral theorem,"In mathematics, particularly linear algebra and functional analysis, the spectral theorem is any of a number of results about linear operators or matrices. In broad terms, the spectral theorem provides conditions  under which an operator or a matrix can be diagonalized (that is, represented as a diagonal matrix in some basis). Intuitively, diagonal matrices are computationally quite manageable, so it is of interest to see whether an arbitrary matrix can be diagonalized.",definition of spectral theorem
"<dbpedia:Starr_School,_Montana>","Starr School, Montana","Starr School is a census-designated place (CDP) in Glacier County, Montana, United States. The population was 248 at the 2000 census.",where is starr school
"<dbpedia:Cut_Bank,_Montana>","Cut Bank, Montana","Cut Bank is a city in and the county seat of Glacier County, Montana, United States, located just east-south-east of the ""cut bank"" (gorge) geographical feature which formed canyon-like along the eponymously named Cut Bank Creek river. The population was 2,919 at the 2010 census.",what county is cut bank mt in
"<dbpedia:Gildford,_Montana>","Gildford, Montana","Gildford is a census-designated place (CDP) in Hill County, Montana, United States. The population was 185 at the 2000 census.",what county is gildford mt in
"<dbpedia:Beaver_Creek,_Montana>","Beaver Creek, Montana","Beaver Creek is a census-designated place (CDP) in Hill County, Montana, United States. The population was 291 at the 2000 census.",what county is beaver creek mt
"<dbpedia:Agency,_Montana>","Agency, Montana","Agency is a census-designated place (CDP) in Hill County, Montana, United States. The population was 324 at the 2000 census, and 348 according to a 2007 estimate.",what county is agency montana in?
"<dbpedia:Lavina,_Montana>","Lavina, Montana","Lavina is a town in Golden Valley County, Montana, United States. The population was 187 at the 2010 census. The town is situated on the north bank of the Musselshell River.",where is lavina mt
"<dbpedia:Herron,_Montana>","Herron, Montana","Herron is a census-designated place (CDP) in Hill County, Montana, United States. The population was 100 at the 2000 census.",herrons mt is what county
"<dbpedia:Philipsburg,_Montana>","Philipsburg, Montana","Philipsburg is a town in and the county seat of Granite County, Montana, United States. The population was 820 at the 2010 census.  The town was named after the famous mining engineer Philip Deidesheimer, who designed and supervised the construction of the ore smelter around which the town originally formed.",what county is philipsburg mt in?
"<dbpedia:West_Yellowstone,_Montana>","West Yellowstone, Montana","West Yellowstone is a town in Gallatin County, Montana, adjacent to Yellowstone National Park. The population was 1,271 at the 2010 census. The town is served by Yellowstone Airport. It is part of the Bozeman, MT Micropolitan Statistical Area. It was founded in June 1908 when the Oregon Short Line Railroad was completed.",what county is yellowstone montana in
"<dbpedia:Bozeman,_Montana>","Bozeman, Montana","Bozeman is a city in and the county seat of Gallatin County, Montana, United States, in the southwestern part of the state.  The 2010 census put Bozeman's population at 37,280 and the 2014 census estimate put the population at 41,660 making it the fourth largest city in the state. It is the principal city of the Bozeman, MT Micropolitan Statistical Area, consisting of all of Gallatin County with a population of 97,304.",what county is bozeman mt in
"<dbpedia:Browning,_Montana>","Browning, Montana","Browning is a town in Glacier County, Montana, lying within the confines of the Blackfeet Indian Reservation. The population was 1,016 at the 2010 United States Census.","what county is browning, mt in"
"<dbpedia:Drummond,_Montana>","Drummond, Montana","Drummond is a town in Granite County, Montana, United States. The population was 309 at the 2010 census.",what county is drummond mt in
"<dbpedia:Havre,_Montana>","Havre, Montana","Havre (/ˈhævər/ HAV-ər) (Assiniboine: Bahásaba ) is a city in, and the county seat of, Hill County, Montana, United States.  It is said to be named after the city of Le Havre in France. The population was 9,310 at the 2010 census.",where is havre mt
"<dbpedia:Havre_North,_Montana>","Havre North, Montana","Havre North is a census-designated place (CDP) in Hill County, Montana, United States. The population was 973 at the 2000 census.",what county is havre north mt in
<dbpedia:Section_Thirty-three_of_the_Canadian_Charter_of_Rights_and_Freedoms>,Section Thirty-three of the Canadian Charter of Rights and Freedoms,"Section 33 of the Canadian Charter of Rights and Freedoms is part of the Constitution of Canada.  It is commonly known as the notwithstanding clause (or ""la clause dérogatoire"" in French), or as the override power, and it allows Parliament or provincial legislatures to override certain portions of the Charter.  It was, and continues to be, perhaps the most controversial provision of the Charter.",canada's notwithstanding clause definition
<dbpedia:Fail_Safe_(1964_film)>,Fail Safe (1964 film),"Fail Safe is a 1964 Cold war thriller film directed by Sidney Lumet, based on the 1962 novel of the same name by Eugene Burdick and Harvey Wheeler. It portrays a fictional account of a Cold War nuclear crisis. The film features performances by veteran actors Henry Fonda, Dan O'Herlihy, Walter Matthau and Frank Overton.",what year was fail safe based on
<dbpedia:Supreme_Court_of_Canada>,Supreme Court of Canada,"The Supreme Court of Canada (French: Cour suprême du Canada) is the highest court of Canada, the final court of appeals in the Canadian justice system. The court grants permission to between 40 and 75 litigants each year to appeal decisions rendered by provincial, territorial and federal appellate courts.",where is supreme court of canada
<dbpedia:Matt_Slocum>,Matt Slocum,"For the southern jam band pianist, see Matt Slocum (keyboardist).  For the jazz drummer and lead musician on the album Portraits, see Matt Slocum (drummer).Matt Slocum (born 27 December 1972) is a guitarist, cellist, pianist and composer, known for his work as the principal songwriter and lead guitarist of Sixpence None the Richer.In 1991, Slocum played guitar with Chris Taylor on a garage-band tape release called A Place to Hide Away (Part 1).",who is matt slocum
<dbpedia:Leigh_Nash>,Leigh Nash,"Leigh Bingham Nash (born June 27, 1976) is an American singer-songwriter who is the lead vocalist for the pop band Sixpence None the Richer and is also a member of Fauxliage and Movement Nashville. Her debut solo album, Blue on Blue, was released on August 15, 2006 by One Son/ Nettwerk record labels.",who is leigh nash
<dbpedia:Death_squad>,Death squad,"A death squad is an armed group that conducts extrajudicial killings or forced disappearances of persons for the purposes of political repression, genocide, or revolutionary terror. These killings are often conducted in ways meant to ensure the secrecy of the killers' identities.Death squads may have the support of domestic or foreign governments (see state terrorism). They may comprise a secret police force, paramilitary groups, government soldiers, policemen, or combinations thereof.",what is a death squad
<dbpedia:Adam_Again>,Adam Again,"Adam Again was a rock band founded and led by vocalist Gene Eugene, with Riki Michele on vocals, Paul Valadez on bass, Jon Knox on drums, Greg Lawless on guitar. Dan Michaels often played saxophone.Thom Jurek of AllMusic has described them as ""inventive and artfully canny."" The band never achieved commercial viability and quit touring and recording together in 2000. On March 20, 2000 Eugene died in his recording studio, the ""fabulous"" Green Room.",who was the original singer in adam again
<dbpedia:Progressive_Conservative_Party_of_Canada>,Progressive Conservative Party of Canada,"The Progressive Conservative Party of Canada (French: Parti progressiste-conservateur du Canada) (PC) (1942–2003) was a Canadian federal political party with a centre-right stance on economic issues and, after the 1970s, a centrist stance on social issues.The party began as the Conservative Party in 1867, becoming Canada's first governing party under Sir John A. Macdonald, and for years was either the governing party or the largest opposition party.",what party are the pc
"<dbpedia:Inverness,_Montana>","Inverness, Montana","Inverness is a census-designated place (CDP) in Hill County, Montana, United States. The population was 55 at the 2010 census.",what county is inverness mt in
<dbpedia:John_Edward_Robinson>,John Edward Robinson,"John Edward Robinson (born December 27, 1943) is a convicted serial killer, con man, embezzler, kidnapper, and forger who was found guilty in 2003 of three murders  and received the death sentence for two of them.",who is john robinson
<dbpedia:Senate_of_Canada>,Senate of Canada,"The Senate of Canada (French: Sénat du Canada) is a component of the Parliament of Canada, along with the House of Commons and the Monarch (represented by the Governor General). The Senate is modelled after the House of Lords and consists of 105 Members appointed by the Governor General on the advice of the Prime Minister. Seats are assigned on a regional basis, with each of the four major regions receiving 24 seats and the remainder of the available seats being assigned to smaller regions.",how many senators are in canada
"<dbpedia:Sangrey,_Montana>","Sangrey, Montana","Sangrey is a census-designated place (CDP) in Hill County, Montana, United States. The population was 263 at the 2000 census.",what county is sangrey montana in
"<dbpedia:Rudyard,_Montana>","Rudyard, Montana","Rudyard is a census-designated place (CDP) in Hill County, Montana, United States. The population was 275 at the 2000 census.",what county is rudyard mt in
"<dbpedia:Jefferson_City,_Montana>","Jefferson City, Montana","Jefferson City is a census-designated place (CDP) in Jefferson County, Montana, United States. The population was 295 at the 2000 census. It is part of the Helena Micropolitan Statistical Area.","what county is jefferson city, mt"
"<dbpedia:Hingham,_Montana>","Hingham, Montana","Hingham is a town in Hill County, Montana, United States. The population was 118 at the 2010 census.",what county is hingham mt in
"<dbpedia:Kremlin,_Montana>","Kremlin, Montana","Kremlin is a census-designated place (CDP) in Hill County, Montana, United States. The population was 126 at the 2000 census.",what county is kremlin mt in
"<dbpedia:West_Havre,_Montana>","West Havre, Montana","West Havre is a census-designated place (CDP) in Hill County, Montana, United States. The population was 284 at the 2000 census.",where is havre
"<dbpedia:St._Pierre,_Montana>","St. Pierre, Montana","St. Pierre is a census-designated place (CDP) in Hill County, Montana, United States. The population was 289 at the 2000 census.",where is saint pierre mt?
"<dbpedia:Saddle_Butte,_Montana>","Saddle Butte, Montana","Saddle Butte is a census-designated place (CDP) in Hill County, Montana, United States. The population was 138 at the 2000 census.",saddle butte montana is what county
"<dbpedia:Montana_City,_Montana>","Montana City, Montana","Montana City is a census-designated place (CDP) in Jefferson County, Montana, United States. The population was 2,715 at the 2010 census. It is part of the Helena Micropolitan Statistical Area.",what county is montana city mt in
"<dbpedia:Whitehall,_Montana>","Whitehall, Montana","Whitehall is a town in Jefferson County, Montana, United States. The population was 1,038 at the 2010 census. It is part of the Helena Micropolitan Statistical Area.The town is nestled in the Jefferson Valley, which is shadowed by the Tobacco Root and Highland Mountain ranges and sits in the heart of the Deerlodge National Forest.",where is whitehall in montana
"<dbpedia:Finley_Point,_Montana>","Finley Point, Montana","Finley Point (Salish: sčc̓méple ) is a census-designated place (CDP) in Lake County, Montana, United States. As per the 2000 United States Census its population is 493.",what county is finley point mt
"<dbpedia:Big_Arm,_Montana>","Big Arm, Montana","Big Arm (Ktunaxa: k̓upawi¢q̓nuknana Salish: ɫqʷqʷʔeʔ,) is a census-designated place (CDP) in Lake County, Montana, United States. The population was 131 at the 2000 census.250px",what county is big arm montana in
"<dbpedia:Kerr,_Montana>","Kerr, Montana","Kerr is a census-designated place (CDP) in Lake County, Montana, United States. The population was 17 at the 2000 census.","what county is kerr, mt in"
"<dbpedia:Rollins,_Montana>","Rollins, Montana","Rollins (Salish: qʷɫqʷɫe, Ktunaxa: ʔa·q̓anquwuk) is a census-designated place (CDP) in Lake County, Montana, United States. The population was 183 at the 2000 census.",what county is rollins mt in?
"<dbpedia:Elmo,_Montana>","Elmo, Montana","Elmo (Salish: sqʷe, ""inlet in the lake"") is a census-designated place (CDP) in Lake County, Montana, United States. The population was 143 at the 2000 census.","what county is elmo, mt in"
"<dbpedia:Kings_Point,_Montana>","Kings Point, Montana","Kings Point is a census-designated place (CDP) in Lake County, Montana, United States. The population was 169 at the 2000 census.",what county is kings point montana in
"<dbpedia:Rocky_Point,_Montana>","Rocky Point, Montana","Rocky Point is a census-designated place (CDP) in Lake County, Montana, United States. The population was 107 at the 2000 census.",what county is rocky point mt in
"<dbpedia:Kicking_Horse,_Montana>","Kicking Horse, Montana","Kicking Horse is a census-designated place (CDP) in Lake County, Montana, United States. The population was 80 at the 2000 census.",what county is kicking horse mt in
<dbpedia:Application_of_tensor_theory_in_engineering>,Application of tensor theory in engineering,Tensors are frequently used in engineering to describe measured quantities.,what is the meaning of tensor theory
"<dbpedia:Helena_Valley_Southeast,_Montana>","Helena Valley Southeast, Montana","Helena Valley Southeast is a census-designated place (CDP) in Lewis and Clark County, Montana, United States. The population was 8,227 at the 2010 census. It is part of the Helena Micropolitan Statistical Area.",where is helena valley
"<dbpedia:Woods_Bay,_Montana>","Woods Bay, Montana","Woods Bay is a census-designated place (CDP) in Lake County, Montana, United States. The population was 661 at the 2010 census.",what county is woods bay mt
"<dbpedia:Augusta,_Montana>","Augusta, Montana","Augusta is a census-designated place (CDP) in Lewis and Clark County, Montana, United States. The population was 284 at the 2000 census. It is named after the daughter of D. J. Hogan, an early rancher.Augusta is part of the Helena Micropolitan Statistical Area.",where is augusta montana
"<dbpedia:Helena_Valley_West_Central,_Montana>","Helena Valley West Central, Montana","Helena Valley West Central is a census-designated place (CDP) in Lewis and Clark County, Montana, United States. The population was 7,883\t at the 2010 census. It is part of the Helena Micropolitan Statistical Area.","what county is helena valley, mt in?"
"<dbpedia:Turtle_Lake,_Montana>","Turtle Lake, Montana","Turtle Lake (Salish: čɫqq̓liʔ ) is a census-designated place (CDP) in Lake County, Montana, United States. The population was 194 at the 2000 census.","where is turtle lake, mt?"
"<dbpedia:Charlo,_Montana>","Charlo, Montana","Charlo (Salish: sallu ) is a census-designated place (CDP) in Lake County, Montana, United States. The population was 439 at the 2000 census.",what county is charlo montana in?
"<dbpedia:Ravalli,_Montana>","Ravalli, Montana","Ravalli (Salish: sk̓ʷɫólqʷe, sk̓ʷɫʔó) is a census-designated place (CDP) in Lake County, Montana, United States. The population was 119 at the 2000 census. At one time Charlie Allard, the country's leading expert on breeding bison, owned the country's largest herd of buffalo in Ravalli.",where is ravalli montana
"<dbpedia:St._Ignatius,_Montana>","St. Ignatius, Montana","St. Ignatius  (Salish: snyél̓mn, Ktunaxa: ʔa·kikqǂaǂaǂuk̓pǂiʔit) is a town in Lake County, Montana, United States. The population was 842 at the 2010 census. The town is located on the Flathead Indian Reservation.","where is st. igittus, mt"
"<dbpedia:Helena_Valley_Northwest,_Montana>","Helena Valley Northwest, Montana","Helena Valley Northwest is a census-designated place (CDP) in Lewis and Clark County, Montana, United States. The population was 3,482 at the 2010 census. It is part of the Helena Micropolitan Statistical Area.",where is helena valley northwest mt
"<dbpedia:Boulder,_Montana>","Boulder, Montana","Boulder is a town in and the county seat of Jefferson County, Montana, United States. It is on the north bank of the Boulder River between Butte and Helena, slightly east of the Continental Divide, at the intersection of Interstate 15 and Montana Highway 69. The population was 1,183 at the 2010 census.",what county is boulder mt in
"<dbpedia:Helena_Valley_Northeast,_Montana>","Helena Valley Northeast, Montana","Helena Valley Northeast is a census-designated place (CDP) in Lewis and Clark County, Montana, United States. The population was 3,470 at the 2010 census. It is part of the Helena Micropolitan Statistical Area.",what county is helena valley mt in
"<dbpedia:Rexford,_Montana>","Rexford, Montana","Rexford is a town in Lincoln County, Montana, United States. The population was 105 at the 2010 census.","what county is rexford, mt in?"
