_id,title,text,query
"<dbpedia:Vale,_Oregon>","Vale, Oregon","Vale is a city in Malheur County, Oregon, United States, about 12 miles (19 km) west of the Idaho border. It is at the intersection of U.S. Routes 20 and 26, on the Malheur River at its confluence with Bully Creek.Vale was selected as Malheur's county seat in 1955, 68 years after the county was founded. As of the 2010 census, the city had a total population of 1,874, down from 1,976 in 2000. Vale is part of the Ontario, OR–ID Micropolitan Statistical Area.",where is vale oregon
<dbpedia:Älvkarleby_Municipality>,Älvkarleby Municipality,Älvkarleby Municipality (Älvkarleby kommun) is a municipality in Uppsala County in east central Sweden. Its seat is located in the town of Skutskär.The municipality is one of few in the country which has not been amalgamated since it was created out of a parish when the first local government acts of Sweden were implemented in 1863.,where is elvkarleby
"<dbpedia:Aurora,_Oregon>","Aurora, Oregon","Aurora is a city in Marion County, Oregon, United States. It was founded as a religious commune in 1856 by Dr. William Keil who named the settlement after his daughter. The population was 918 at the 2010 census. It is part of the Salem Metropolitan Statistical Area.",what county is aurora or
<dbpedia:Tierp_Municipality>,Tierp Municipality,Tierp Municipality (Tierps kommun) is a municipality in Uppsala County in east central Sweden. Its seat is located in the town of Tierp.,where is tierp municipality in sweden
<dbpedia:Håbo_Municipality>,Håbo Municipality,Håbo Municipality (Swedish: Håbo kommun) is a municipality in Uppsala County in east central Sweden. Its seat is located in the town of Bålsta.The municipality was formed in connexion with the local government reform of 1952.,where is hbo?
"<dbpedia:Aumsville,_Oregon>","Aumsville, Oregon","Aumsville is a city in Marion County, Oregon,  United States.  The population was 3,584 at the 2010 census. It is part of the Salem Metropolitan Statistical Area.",what county is aumsville oregon
"<dbpedia:Brooks,_Oregon>","Brooks, Oregon","Brooks is an unincorporated community in Marion County, Oregon, United States. For statistical purposes, the United States Census Bureau has defined Brooks as a census-designated place (CDP). The census definition of the area may not precisely correspond to local understanding of the area with the same name.  As of the 2010 census the population was 398.",where is brooks or
<dbpedia:Östhammar_Municipality>,Östhammar Municipality,Östhammar Municipality (Östhammars kommun) is a municipality in Uppsala County in east central Sweden. Its seat is located in the city of Östhammar.The present municipality was created during the local government reform in the late sixties and early seventies. Already in 1967 the City of Öregrund joined the City of Östhammar in a common municipality. It was the first time a former city joined another local government unit.,where is steinhammar
"<dbpedia:Detroit,_Oregon>","Detroit, Oregon","Detroit is a city in Marion County, Oregon,  United States. It was named for Detroit, Michigan, in the 1890s because of the large number of people from Michigan in the community. The population was 202 at the 2010 census. It is part of the Salem Metropolitan Statistical Area.",what county is detroit oregon in
"<dbpedia:Butteville,_Oregon>","Butteville, Oregon","Butteville is a census-designated place and unincorporated community in Marion County, Oregon, United States. (considered a ghost town) For statistical purposes, the United States Census Bureau has defined Butteville as a census-designated place (CDP). The census definition of the area may not precisely correspond to local understanding of the area with the same name. As of the 2010 census the population was 265. It is part of the Salem Metropolitan Statistical Area.",what county is butteville or in
"<dbpedia:Hubbard,_Oregon>","Hubbard, Oregon","Hubbard is a city in Marion County, Oregon, United States. The population was 3,173 at the 2010 census. It is part of the Salem Metropolitan Statistical Area.",what county is hubbard oregon
"<dbpedia:Hayesville,_Oregon>","Hayesville, Oregon","Hayesville is a census-designated place and unincorporated community in Marion County, Oregon, United States, just outside the city limits of Salem but within the city's urban growth boundary. It is part of the Salem Metropolitan Statistical Area. For statistical purposes, the United States Census Bureau has defined Hayesville as a census-designated place (CDP). The census definition of the area may not precisely correspond to local understanding of the area with the same name.",what county is hayesville oregon in
"<dbpedia:Gervais,_Oregon>","Gervais, Oregon","Gervais /dʒərˈveɪs/ is a city in Marion County, Oregon, United States. The population was 2,464 at the 2010 census. It is part of the Salem Metropolitan Statistical Area.",what county is gervais or
"<dbpedia:Four_Corners,_Oregon>","Four Corners, Oregon","Four Corners is a census-designated place (CDP) in Marion County, Oregon, United States, just outside the city limits of Salem but within the city's urban growth boundary. It is part of the Salem Metropolitan Statistical Area. The population of the CDP was 13,922 at the 2000 census. It is named after the intersection of State Street and Lancaster Drive.",what county is four corners oregon in
"<dbpedia:Donald,_Oregon>","Donald, Oregon","Donald is a city in Marion County, Oregon, United States. The population was 979 at the 2010 census. It is part of the Salem Metropolitan Statistical Area.",where is donald oregon
"<dbpedia:Labish_Village,_Oregon>","Labish Village, Oregon","Labish Village is a census-designated place (CDP) in Marion County, Oregon, United States. The population was 376 at the 2000 census. It is part of the Salem Metropolitan Statistical Area.",where is labish village oregon
"<dbpedia:Mt._Angel,_Oregon>","Mt. Angel, Oregon","Mt. Angel is a city in Marion County, Oregon,  United States. It is 18 miles (29 km) northeast of Salem, Oregon, on Oregon Route 214.  The population was 3,286 at the 2010 census. Mt. Angel is part of the Salem Metropolitan Statistical Area.",what county is mt. angel oregon in
"<dbpedia:St._Paul,_Oregon>","St. Paul, Oregon","St. Paul is a city in Marion County, Oregon,  United States. It is named after the Saint Paul Mission founded by Archbishop François Norbert Blanchet, who arrived in the Oregon Country in 1838 to minister to the Catholic inhabitants of French Prairie. The population was 421 at the 2010 census. The city is part of the Salem Metropolitan Statistical Area.",what county is st paul oregon in
"<dbpedia:Jefferson,_Oregon>","Jefferson, Oregon","Jefferson is a city in Marion County, Oregon, United States. It is part of the Salem Metropolitan Statistical Area. The population was 3,098 at the 2010 census.  It is home to the annual Mint Harvest Festival and is the self-proclaimed ""Mint Capital of the World"" as well as ""Frog Jumping Capital of Oregon.""",where is jefferson oregon
"<dbpedia:Mehama,_Oregon>","Mehama, Oregon","Mehama is an unincorporated community in Marion County, Oregon, United States, located on Oregon Route 22 and the North Santiam River. For statistical purposes, the United States Census Bureau has defined Mehama as a census-designated place (CDP). The census definition of the area may not precisely correspond to local understanding of the area with the same name. The population was 283 at the 2000 census.",what county is mehama oregon
"<dbpedia:Stayton,_Oregon>","Stayton, Oregon","Stayton is a city in Marion County, Oregon, United States, located 12 miles (19 km) southeast of the state capital, Salem, on Oregon Route 22. It is south of Sublimity and east of Aumsville. Located on the North Santiam River, Stayton is a regional agricultural and light manufacturing center. The population was 7,644 at the 2010 census. It is part of the Salem Metropolitan Statistical Area.","where is stayton, oregon"
"<dbpedia:Keizer,_Oregon>","Keizer, Oregon","Keizer /ˈkaɪzər/ is a city located in Marion County, Oregon, United States, along the 45th parallel.  As of the 2010 United States Census, its population was 36,478. It lies inside of the Willamette Valley and is part of the Salem Metropolitan Statistical Area. It was named after brothers Thomas Dove (T. D.) and John Brooks (J. B.) Keizur, two pioneers who arrived in the Wagon Train of 1843, and later filed donation land claims.",what county is keizer oregon in
"<dbpedia:Marion,_Oregon>","Marion, Oregon","Marion is an unincorporated community in Marion County, Oregon, United States. For statistical purposes, the United States Census Bureau has defined Marion as a census-designated place (CDP). The census definition of the area may not precisely correspond to local understanding of the area with the same name. The population was 313 at the 2010 census. Marion is part of the Salem Metropolitan Statistical Area.",what county is marion oregon in
"<dbpedia:Scotts_Mills,_Oregon>","Scotts Mills, Oregon","Scotts Mills is a city in Marion County, Oregon, United States. The population was 357 at the 2010 census.  It is 2 miles (3 km) south of Marquam and Oregon Route 213, between Silverton and Molalla.Scotts Mills is part of the Salem Metropolitan Statistical Area. It is near the site of the 1993 Scotts Mills earthquake.",where is scotts mills
"<dbpedia:Silverton,_Oregon>","Silverton, Oregon","Silverton is a city in Marion County, Oregon, United States. The city is situated along the 45th parallel about 12 miles (19 km) northeast of Salem, in the eastern margins of the broad alluvial plain of the Willamette Valley. The city is named after Silver Creek, which flows through the town from Silver Falls into the Pudding River, and thence into the Willamette River. Silverton was originally called Milford, then Silver Creek; on July 16, 1855, Silver Creek became Silverton.",what county is silverton or
"<dbpedia:Turner,_Oregon>","Turner, Oregon","Turner is a city in Marion County, Oregon, United States. The population was 1,854 at the 2010 census. It is part of the Salem Metropolitan Statistical Area. The community was incorporated by the Oregon Legislative Assembly on February 10, 1905.",where is turner oregon
"<dbpedia:Irrigon,_Oregon>","Irrigon, Oregon","Irrigon is a city in Morrow County, Oregon, United States, on the Columbia River and U.S. Route 730. The city is part of the Pendleton–Hermiston Micropolitan Statistical Area. The population was 1,826 at the 2010 census.Irrigon was incorporated on February 28, 1957. The Umatilla Chemical Depot and the Umatilla Chemical Agent Disposal Facility are about 4 miles (6 km) south of the city near the intersection of Interstate 84 (I-84) and Interstate 82 (I-82).",where is irrigon or
"<dbpedia:Sublimity,_Oregon>","Sublimity, Oregon","Sublimity is a city in Marion County, Oregon,  United States.  The population was 2,681 at the 2010 census. It is part of the Salem Metropolitan Statistical Area.",what county is sublimity oregon in
"<dbpedia:Heppner,_Oregon>","Heppner, Oregon","The city of Heppner is the county seat of Morrow County, Oregon, United States. The population was 1,291 at the 2010 census. Heppner is part of the Pendleton-Hermiston Micropolitan Area.",what county is heppner oregon in
"<dbpedia:Lexington,_Oregon>","Lexington, Oregon","Lexington is a city in Morrow County, Oregon, United States. The population was 238 at the 2010 census. It is part of the Pendleton–Hermiston Micropolitan Statistical Area.",what county lexington oregon
"<dbpedia:Ione,_Oregon>","Ione, Oregon","Ione is a city in Morrow County, Oregon, United States. The population was 329 at the 2010 census. It is part of the Pendleton–Hermiston Micropolitan Statistical Area.",what county is ione or
"<dbpedia:Biggs_Junction,_Oregon>","Biggs Junction, Oregon","Biggs Junction is an unincorporated community in Sherman County, Oregon, United States. For statistical purposes, the United States Census Bureau has defined Biggs Junction as a census-designated place (CDP). The census definition of the area may not precisely correspond to local understanding of the area with the same name.Biggs Junction is located on the south side of the Columbia River at the junction of Interstate 84/U.S. 30 and U.S.",what county is biggs junction oregon
"<dbpedia:Eola,_Oregon>","Eola, Oregon","Eola is an unincorporated community in Polk County, Oregon, United States four miles west of Salem on Oregon Route 22 at the confluence of Rickreall Creek and the Willamette River.For statistical purposes, the United States Census Bureau has defined Eola as a census-designated place (CDP). The census definition of the area may not precisely correspond to local understanding of the area with the same name. The population of the CDP was 49 at the 2000 census.",where is eola oregon
"<dbpedia:Wood_Village,_Oregon>","Wood Village, Oregon","Wood Village is a city in Multnomah County, Oregon, United States. The population was 3,878 at the 2010 census. Despite the name, Wood Village is classified as a city.",what county is wood village oregon in
"<dbpedia:Woodburn,_Oregon>","Woodburn, Oregon","Woodburn is a city in Marion County, Oregon, United States. Incorporated in 1889, the community had been platted in 1871 after the arrival of the railroad. The city is located in the northern end of the Willamette Valley along Interstate 5 between Portland and Salem.",what county is woodburn or
"<dbpedia:Grand_Ronde,_Oregon>","Grand Ronde, Oregon","Grand Ronde is a census-designated place (CDP) and unincorporated community in Polk and Yamhill counties, Oregon, United States. The name of the community is a variation of the French Grande Ronde or ""fine large valley"", a description given to the area by the employees of the Hudson's Bay Company, who were French-Canadian. The population was 271 at the 2000 census. It is part of the Salem Metropolitan Statistical Area.",what county is grand ronde oregon in
"<dbpedia:Boardman,_Oregon>","Boardman, Oregon","Boardman is a city in Morrow County, Oregon, United States on the Columbia River and Interstate 84. As of the 2010 census the population was 3,220. It is part of the Pendleton–Hermiston Micropolitan Statistical Area.",where is boardman oregon
"<dbpedia:Troutdale,_Oregon>","Troutdale, Oregon","Troutdale is a city in Multnomah County, Oregon, U.S.A., north of Gresham and east of Wood Village. As of the 2010 census, the city population was 15,962. The city serves as the western gateway to the Historic Columbia River Highway, the Mount Hood Scenic Byway, and the Columbia River Gorge.",population of troutdale oregon
"<dbpedia:Independence,_Oregon>","Independence, Oregon","Independence is a city in Polk County, Oregon, United States, on the west bank of the Willamette River along Oregon Route 51, and east of nearby Monmouth.  It is part of the Salem Metropolitan Statistical Area. Thirty square blocks of the oldest part of Independence form the National Register of Historic Places-listed Independence Historic District.The population was 8,590 at the 2010 census.",what county is independence oregon
"<dbpedia:Falls_City,_Oregon>","Falls City, Oregon","Falls City is a city in Polk County, Oregon, United States. The population was 947 at the 2010 census. It is part of the Salem Metropolitan Statistical Area.",falls city or
"<dbpedia:Fairview,_Oregon>","Fairview, Oregon","Fairview is a city in Multnomah County, Oregon,  United States. As of the 2010 census, the city population was 8,920.",what county is fairview oregon in
"<dbpedia:Cape_Meares,_Oregon>","Cape Meares, Oregon","Cape Meares is a census-designated place (CDP) and unincorporated community in Tillamook County, Oregon, United States. The population was 110 at the 2000 census.The community of Cape Meares is named after the natural feature Cape Meares, which in turn was named after John Meares, a British explorer. According to Oregon Geographic Names, Cape Meares briefly had its own post office, from 1953-1954.",where is cape meares oregon located
"<dbpedia:Maywood_Park,_Oregon>","Maywood Park, Oregon","Maywood Park is a city in Multnomah County, Oregon, United States. The name came from a comment made by the wife of the man who developed the original subdivision, E.F. Taylor, who remarked one winter night how attractive the woods were in May.  An enclave within the city of Portland, the residents of the city voted to incorporate in 1967 in an unsuccessful attempt to stop the construction of Interstate 205.  The population was 752 at the 2010 census.",what county is maywood park or
"<dbpedia:Rickreall,_Oregon>","Rickreall, Oregon","Rickreall (RICK-ree-awl) is an unincorporated community in Polk County, Oregon, United States. For statistical purposes, the United States Census Bureau has defined Rickreall as a census-designated place (CDP). The census definition of the area may not precisely correspond to local understanding of the area with the same name. The population of the CDP was 57 at the 2000 census. Rickreall is part of the Salem Metropolitan Statistical Area.",where is rickreall or
"<dbpedia:Dallas,_Oregon>","Dallas, Oregon","The city of Dallas is the county seat of Polk County, Oregon, United States. The population was 14,583 at the 2010 census.Dallas is along Rickreall Creek, about 15 miles (24 km) west of Salem, at an elevation of 325 feet (99 m) above sea level. It is part of the Salem Metropolitan Statistical Area.",what county is dallas or in
"<dbpedia:Rufus,_Oregon>","Rufus, Oregon","Rufus is a city in Sherman County, Oregon, United States. The population was 249 at the 2010 census.  The city was named for an early settler, Rufus Carrol Wallis.",what county is rufus oregon in
"<dbpedia:Hebo,_Oregon>","Hebo, Oregon","Hebo is an unincorporated community in Tillamook County, Oregon, United States. For statistical purposes, the United States Census Bureau has defined Hebo as a census-designated place (CDP). The census definition of the area may not precisely correspond to local understanding of the area with the same name. The population of the CDP was 231 at the 2000 census.",where is hebo oregon
"<dbpedia:Gresham,_Oregon>","Gresham, Oregon","Gresham /ˈɡrɛʃəm/ is a city located in Multnomah County, Oregon, United States immediately east of Portland. It was named after the American Civil War general, and Postmaster General, Walter Quinton Gresham. The population was 105,594 at the 2010 census, making Gresham the fourth largest city in Oregon.",what county is gresham oregon in
"<dbpedia:Wasco,_Oregon>","Wasco, Oregon","Wasco is a city in Sherman County, Oregon, United States. The population was 410 at the 2010 census.",what county is wasco oregon in
"<dbpedia:Grass_Valley,_Oregon>","Grass Valley, Oregon","Grass Valley is a city in Sherman County, Oregon, United States. The population was 164 at the 2010 census.",what county is grass valley oregon
"<dbpedia:Beaver,_Oregon>","Beaver, Oregon","Beaver is an unincorporated community in Tillamook County, Oregon, United States, located on U.S. Route 101 and the Nestucca River, about 12 miles south of Tillamook. For statistical purposes, the United States Census Bureau has defined Beaver as a census-designated place (CDP). The census definition of the area may not precisely correspond to local understanding of the area with the same name. The population of the CDP was 122 at the 2010 census.",what county is beaver oregon in?
"<dbpedia:Cloverdale,_Oregon>","Cloverdale, Oregon","Cloverdale is an unincorporated community in Tillamook County, Oregon, United States. For statistical purposes, the United States Census Bureau has defined Cloverdale as a census-designated place (CDP). The census definition of the area may not precisely correspond to local understanding of the area with the same name. The population was 242 at the 2000 census.",what county is cloverdale oregon
"<dbpedia:Bay_City,_Oregon>","Bay City, Oregon","Bay City is a city in Tillamook County, Oregon, United States. The population was 1,286 at the 2010 census.",what county is bay city or
"<dbpedia:Moro,_Oregon>","Moro, Oregon","Moro is a city in Sherman County, Oregon, United States. The population was 324 at the 2010 census. It is the county seat of Sherman County (the smallest county seat in Oregon). Moro was incorporated on February 17, 1899, by the Oregon Legislative Assembly.",what county is moro oregon
"<dbpedia:Garibaldi,_Oregon>","Garibaldi, Oregon","Garibaldi /ˌɡærɨˈbɔːldi/ is a city in Tillamook County, in the U.S. state of Oregon. The population was 779 at the 2010 census.",where is gardibaldi oregon
"<dbpedia:Oceanside,_Oregon>","Oceanside, Oregon","Oceanside is a census-designated place (CDP) and unincorporated community in Tillamook County, Oregon, United States. The population was 361 at the 2010 census. Oregon Route 131's northern terminus is in the community, which is just north of Netarts. Symons State Park is in Oceanside, while Three Arch Rocks National Wildlife Refuge lies just offshore.",what county is oceanside or
"<dbpedia:Neskowin,_Oregon>","Neskowin, Oregon","Neskowin /ˈnɛskoʊ.ɪn/ is an unincorporated community in Tillamook County, Oregon, United States, near where Slab Creek empties into the Pacific Ocean. For statistical purposes, the United States Census Bureau has defined Neskowin as a census-designated place (CDP). The census definition of the area may not precisely correspond to local understanding of the area with the same name. The population of the CDP was 169 at the 2000 census.",what county is neskowin oregon
"<dbpedia:Monmouth,_Oregon>","Monmouth, Oregon","Monmouth (/ˈmɒnməθ/ is a city in Polk County, Oregon, United States. It was named for Monmouth, Illinois, the origin of its earliest settlers. The population has reached 9,534 as of the 2010 census and it is part of the Salem Metropolitan Statistical Area.",where is monmouth oregon located
"<dbpedia:Manzanita,_Oregon>","Manzanita, Oregon","Manzanita /ˌmænzəˈniːtə/ is a coastal city in Tillamook County, Oregon, United States. It is located on U.S. Route 101 about 25 miles south of Seaside and 25 miles north of Tillamook. The population was 598 at the 2010 census.",where is manzanita oregon
"<dbpedia:Netarts,_Oregon>","Netarts, Oregon","Netarts /ˈniːtɑrts/ is an unincorporated community in Tillamook County, Oregon, United States; it is a census-designated place (CDP). The population was 744 at the 2000 census.","what county is netarts, or"
"<dbpedia:Pacific_City,_Oregon>","Pacific City, Oregon","Pacific City is a census-designated place (CDP) and unincorporated community in Tillamook County, Oregon, United States. The population was 1,027 at the 2000 census. Pacific City's main attraction is the Cape Kiwanda State Natural Area.",what county is pacific city oregon in?
"<dbpedia:Rockaway_Beach,_Oregon>","Rockaway Beach, Oregon","Rockaway Beach is a city in Tillamook County, Oregon, United States. The population was 1,312 at the 2010 census.",what county is rockaway beach oregon
"<dbpedia:Nehalem,_Oregon>","Nehalem, Oregon","Nehalem /niːˈheɪləm/ is a city in Tillamook County, Oregon, United States. Incorporated in 1889, the city is on the Nehalem River at Nehalem Bay of the Pacific Ocean. It is bisected by U.S. Route 101. The population was 271 at the 2010 census.",where is nehalem oregon located
"<dbpedia:Cayuse,_Oregon>","Cayuse, Oregon","Cayuse is a census-designated place (CDP) and unincorporated community in Umatilla County, Oregon, United States, located 11 miles east of Pendleton on the Umatilla Indian Reservation. The population was 59 at the 2000 census. It is part of the Pendleton–Hermiston Micropolitan Statistical Area.According to Oregon Geographic Names, Cayuse, named for the Cayuse people, began as a railroad station and post office, which was established in 1867. Cayuse post office was discontinued in 2002.",where is cayuse oregon located
"<dbpedia:Gopher_Flats,_Oregon>","Gopher Flats, Oregon","Gopher Flats is a census-designated place (CDP) in Umatilla County, Oregon, United States. The population was 401 at the 2000 census. It is part of the Pendleton–Hermiston Micropolitan Statistical Area.",where is gopher flats oregon
"<dbpedia:Wheeler,_Oregon>","Wheeler, Oregon","Wheeler is a city in Tillamook County, Oregon, United States. The population was 414 at the 2010 census.",what county is wheeler oregon
"<dbpedia:Echo,_Oregon>","Echo, Oregon","Echo is a city in Umatilla County, Oregon, United States. The population was 699 at the 2010 census. It is part of the Pendleton–Hermiston Micropolitan Statistical Area.",where is echo oregon located
"<dbpedia:Tillamook,_Oregon>","Tillamook, Oregon","The city of Tillamook /ˈtɪləmʊk/ is the county seat of Tillamook County, Oregon, United States. The city is located on the southeast end of Tillamook Bay on the Pacific Ocean. The population was 4,935 at the 2010 census.A 2015 episode of the Hodgee Films/Maker Studios series Consider the Source prominently featured Tillamook and the Tillamook Cheese Factory.",where is tillamook oregon
<dbpedia:Moonshine>,Moonshine,"Moonshine, white lightning, mountain dew, hooch, homebrew,  and white whiskey are terms used to describe high-proof distilled spirits that are generally produced illicitly. Moonshine is typically made with corn mash as the main ingredient.",what is moonshine?
"<dbpedia:Kirkpatrick,_Oregon>","Kirkpatrick, Oregon","Kirkpatrick is a census-designated place (CDP) in Umatilla County, Oregon, United States. The population was 172 at the 2000 census. It is part of the Pendleton–Hermiston Micropolitan Statistical Area.",what county is kennedy or in
