_id,title,text,query
"<dbpedia:Gaylord,_Michigan>","Gaylord, Michigan","Gaylord is a city in and the county seat of Otsego County, Michigan, United States.  The population was 3,645 at the 2010 census. The city is also the seat of the Roman Catholic Diocese of Gaylord; it is by far the smallest settlement serving as the location of an active Roman Catholic cathedral in the United States.Gaylord styles itself as an ""Alpine Village"" and the city center features many buildings with Tyrolean traverse style motifs.",what county is gaylord michigan
"<dbpedia:Elmira_Township,_Michigan>","Elmira Township, Michigan","Elmira Township is a civil township of Otsego County in the U.S. state of Michigan. The population was 1,598 at the 2000 census.",what county is elmira michigan
"<dbpedia:Bunkerville,_Nevada>","Bunkerville, Nevada","Bunkerville is an unincorporated town and census-designated place in Clark County, Nevada, United States. The population was 1,303 at the 2010 census.",what county is bunkerville nevada in
"<dbpedia:Cal-Nev-Ari,_Nevada>","Cal-Nev-Ari, Nevada","Cal-Nev-Ari is a census-designated place on U.S. Route 95 in Clark County, Nevada, United States, near the state's southernmost point. As of the 2010 census, the town had a population of 244. The town's name is a syllabic abbreviation of California, Nevada, and Arizona.Cal-Nev-Ari was created in the mid-1960s by Nancy and Slim Kidwell, who acquired a 640-acre (2.6 km2) section of land from the U.S. government and commenced development of an airport-based community.",what county is cal-nev-ari
"<dbpedia:Port_Sanilac,_Michigan>","Port Sanilac, Michigan","Port Sanilac is a village in Sanilac Township, Sanilac County in the U.S. state of Michigan. The population was 623 at the 2010 census.",what county is port sanilac michigan
"<dbpedia:York,_Nebraska>","York, Nebraska","York is a city and county seat of York County, Nebraska, United States. As of the 2010 census, the city population was 7,766.  It is the home of York College and the Nebraska Correctional Center for Women.","what county is york, ne in?"
"<dbpedia:Livingston_Township,_Michigan>","Livingston Township, Michigan","Livingston Township is a civil township of Otsego County in the U.S. state of Michigan. The population was 2,339 at the 2000 census.",what county is livingston mi in
"<dbpedia:Enterprise,_Nevada>","Enterprise, Nevada","Enterprise  is an unincorporated town and census-designated place and part of Las Vegas Township in Clark County, Nevada, United States, south of Las Vegas. The population was 108,481 at the 2010 census, up from 14,676 at the 2000 census. As an unincorporated town, it is governed by the Clark County Commission with input from the Enterprise Town Advisory Board.  Enterprise was formed in December, 1996.",what county is enterprise nv located
"<dbpedia:Ira_Township,_Michigan>","Ira Township, Michigan","Ira Township is a civil township of St. Clair County in the U.S. state of Michigan.  The population was 6,966 at the 2000 census.","where is ira, michigan"
"<dbpedia:Kenockee_Township,_Michigan>","Kenockee Township, Michigan","Kenockee Township is a civil township of St. Clair County in the U.S. state of Michigan.  The population was 2,423 at the 2000 census.",where is kenockee township michigan
"<dbpedia:Blue_Diamond,_Nevada>","Blue Diamond, Nevada","Blue Diamond is a census-designated place (CDP) in Clark County, Nevada, United States. The population was 290 at the 2010 census.The town includes a park, city pool, library, elementary school, event hall, church, and mercantile / gas station. The mercantile (general store) was built in 1942 and originally sold household staples and sundries to residents who were mostly miners for the Blue Diamond gypsum board company. The store has maintained its original external look.",where is blue diamond nevada
"<dbpedia:Leonidas_Township,_Michigan>","Leonidas Township, Michigan","Leonidas Township is a civil township of St. Joseph County in the U.S. state of Michigan. The population was 1,239 at the 2000 census.",what county is leonidas michigan in
"<dbpedia:Lockport_Township,_Michigan>","Lockport Township, Michigan","Lockport Township is a civil township of St. Joseph County in the U.S. state of Michigan. The population was 3,814 at the 2000 census.",what county is lockport mi in
"<dbpedia:Boulder_City,_Nevada>","Boulder City, Nevada","Boulder City is a city in Clark County, Nevada, United States. It is approximately 26 miles (42 km) southeast of the city of Las Vegas. As of the 2010 census, the population of Boulder City was 15,023.Boulder City is one of only two cities in Nevada that prohibit gambling, the other being Panaca.",where is boulder nevada located
"<dbpedia:Fallon,_Nevada>","Fallon, Nevada","Fallon is a city in Churchill County, Nevada, United States, in the western part of the state. The population was 8,606 at time of the 2010 census. Fallon is the county seat of Churchill County and is located in the Lahontan Valley.Fallon and Churchill County are mostly agricultural areas. Although the area is arid, approximately 50,000 acres (200 km2) of its pastureland are irrigated with water from the Truckee–Carson Irrigation District. The principal crop grown is alfalfa for livestock feed.",what county is fallon nevada in
"<dbpedia:Henderson,_Nevada>","Henderson, Nevada","Henderson, officially the City of Henderson, is a city in Clark County, Nevada, United States. It is the second largest city in Nevada, after Las Vegas, with an estimated population of 270,811 in 2013. The city is part of the Las Vegas metropolitan area, which spans the entire Las Vegas Valley. Henderson occupies the southeastern end of the valley, at an elevation of approximately 1,330 feet (410 m).In 2011, Forbes magazine ranked Henderson as America's second safest city.","where is henderson, nv"
"<dbpedia:Indian_Springs,_Nevada>","Indian Springs, Nevada","Indian Springs is an unincorporated town and census-designated places in Clark County, Nevada, United States. The population was 991 at the 2010 census.",what county is indian springs nv in
"<dbpedia:Moapa,_Nevada>","Moapa, Nevada","Moapa Town is a census-designated place (CDP) in Clark County, Nevada, United States. The population was 1,025 at the 2010 census. It is the largest town in Clark County by land area. Both the second and the third tallest structures in Nevada, the Moapa Entrevision Tower and the Moapa Kemp Tower respectively, are located in Moapa.",what county is moapa nevada in
"<dbpedia:Bloomingdale,_Michigan>","Bloomingdale, Michigan","Bloomingdale is a village in Van Buren County in the U.S. state of Michigan. The population was 454 at the 2010 census. The village is located within Bloomingdale Township and is the township seat.In the 1930s oil was discovered within the village limits, but pumping has now ceased due to lack of oil. Bloomingdale was thought to be a rising city but when the oil ceased so did the attraction.",what county is bloomingdale michigan
"<dbpedia:Three_Rivers,_Michigan>","Three Rivers, Michigan","Three Rivers is a city in St. Joseph County in the US state of Michigan.  The population was 7,811 at the 2010 census.Three Rivers derives its name from the confluence of the St. Joseph River with its tributaries the Rocky and Portage Rivers.  It is the home of St. Gregory's Abbey, a Benedictine monastery of the Episcopal Church that was established in 1946.",what county is three rivers michigan
"<dbpedia:Laughlin,_Nevada>","Laughlin, Nevada","Laughlin /ˈlɔːf.lɪn/ is an unincorporated town and census-designated place in Clark County, Nevada, United States, and a port located on the Colorado River. Laughlin is 90 miles (140 km) south of Las Vegas, located in the far southern tip of Nevada. It is best known for its gaming, entertainment, and water recreation. As of the 2010 census, the population was 7,323.",what county is laughlin nv
"<dbpedia:Moapa_Valley,_Nevada>","Moapa Valley, Nevada","Moapa Valley is an unincorporated town and census-designated place in Clark County, Nevada, United States. As of the 2010 census, it had a population of 6,924. The valley in which the community lies, also named Moapa Valley, is about 40 miles (64 km) long and lies roughly northwest to southeast.",what county is moapa valley nevada
"<dbpedia:Mount_Charleston,_Nevada>","Mount Charleston, Nevada","Mount Charleston is an unincorporated town and census-designated place in Clark County, Nevada, United States. The population was 357 at the 2010 census.Named for nearby Mount Charleston, the highest point in Clark County, the town is in a valley of the Spring Mountains to the northwest of Las Vegas, noted for its hiking trails, and for the Mount Charleston Lodge, a rustic hotel.",what county is mt charleston nv in
"<dbpedia:Decatur,_Michigan>","Decatur, Michigan","Decatur is a village in Van Buren County in the U.S. state of Michigan. The population was 1,819 at the 2010 census. The village is located within Decatur Township.",what county is decatur mi
"<dbpedia:Northfield_Township,_Michigan>","Northfield Township, Michigan","Northfield Township is a civil township of Washtenaw County, located north of Ann Arbor in the U.S. state of Michigan.  The population was 8,245 at the 2010 census. The unincorporated community of Whitmore Lake lies within the northern portion of the township, on its border with Green Oak township in Livingston County.",what county is northfield mi in
"<dbpedia:Manchester_Township,_Michigan>","Manchester Township, Michigan","Manchester Township is a civil township of Washtenaw County in the U.S. state of Michigan. The population was 4,569 at the 2010 census. The Village of Manchester is located within the township.","what county is manchester, mi"
"<dbpedia:Lincoln_Park,_Michigan>","Lincoln Park, Michigan","Lincoln Park is a city in Wayne County in the U.S. state of Michigan. It lies in an area of cities and communities known as Downriver. The population was 38,144 at the 2010 census. The settlement was organized as a village in 1921, and reorganized as a city in 1925. The area was originally home to the Potawatomi Indians who ceded the land to a French settler, Pierre St. Cosme, in 1776.",where is lincoln park mi
"<dbpedia:Barton_Hills,_Michigan>","Barton Hills, Michigan","Barton Hills is a village in Washtenaw County in the U.S. state of Michigan. As of the 2010 census, the village population was 294. The village is located just northwest of Ann Arbor. The streets in the village were formerly owned by the Barton Hills Maintenance Corporation but were purchased by the Village itself in 2010.","what county is barton hills, michigan in?"
"<dbpedia:Sandy_Valley,_Nevada>","Sandy Valley, Nevada","Sandy Valley is an unincorporated town which is a census-designated place (CDP) in the Mesquite Valley in west-central Clark County, Nevada, United States. Sandy Valley has variant name of Sandy, Nevada.  The population was 2,051 at the 2010 census. Sandy Valley is bordered on the East by the southern extension of the Spring Mountains and on the west by the California state line.",what county is sandy valley nevada in
"<dbpedia:Mesquite,_Nevada>","Mesquite, Nevada","Mesquite is a city in Clark County, Nevada, United States, adjacent to the Arizona state line and 80 miles (130 km) northeast of Las Vegas on Interstate 15. As of the 2010 United States Census, it had a population of 15,276. The city is located in the Virgin River valley. It is home to a growing retirement community, as well as several casino resorts and golf courses.",where is mesquite nevada
"<dbpedia:Goodsprings,_Nevada>","Goodsprings, Nevada","Goodsprings is a census-designated place (CDP) in Clark County, Nevada, United States. The population was 229 at the 2010 census.",where is goodsprings nevada
"<dbpedia:Livonia,_Michigan>","Livonia, Michigan","Livonia is a city in the northwest part of Wayne County in the U.S. state of Michigan. Livonia is a large suburb with an array of traditional neighborhoods (most of which were built in the 1950s and 1960s) connected to the metropolitan area by freeways. The population was 96,942 at the 2010 census, making it Michigan's ninth largest municipality.",what county is livonia mi in
"<dbpedia:Coon_Rapids,_Minnesota>","Coon Rapids, Minnesota","Coon Rapids is a northern suburb of Minneapolis, and is the largest city in Anoka County, Minnesota, United States.  The population was 61,476 at the 2010 census, making it the thirteenth largest city in Minnesota and the seventh largest Twin Cities suburb.",what county is coon rapids mn in
"<dbpedia:Centerville,_Minnesota>","Centerville, Minnesota","Centerville is a city in Anoka County, Minnesota, United States. The population was 3,792 at the 2010 census.",what county is centerville mn in
"<dbpedia:Harper_Woods,_Michigan>","Harper Woods, Michigan","Harper Woods is a city located on the eastside of suburban Detroit, Michigan, United States. The city is located in Wayne County. As of the 2010 census, the city population was 14,236.","where is harper woods, mi"
"<dbpedia:Gardnerville_Ranchos,_Nevada>","Gardnerville Ranchos, Nevada","Gardnerville Ranchos is a census-designated place (CDP) in Douglas County, Nevada, United States. As of the 2010 census, the CDP population was 11,312. The area is the namesake for the Gardnerville Ranchos Micropolitan Statistical area which includes other areas of Douglas County.",where is gardnerville ranchos
"<dbpedia:St._Francis,_Minnesota>","St. Francis, Minnesota","St. Francis is a city in Anoka County, Minnesota, United States. The population was 7,218 at the 2010 census.Minnesota State Highway 47 serves as a main route in the city.  Other routes include Ambassador Boulevard.",what county is st francis mn in
"<dbpedia:Whitney,_Nevada>","Whitney, Nevada","Whitney (formerly East Las Vegas) is an unincorporated town and census-designated place in Clark County, Nevada, United States. The population was 38,585 at the 2010 census.",whitney nevada population
"<dbpedia:Sunrise_Manor,_Nevada>","Sunrise Manor, Nevada","Sunrise Manor is an unincorporated town and part of Las Vegas Township in Clark County, Nevada, United States, located on the western base of Frenchman Mountain, east of Las Vegas. The population was 189,372 at the 2010 census. If Sunrise Manor were to be incorporated, it would be one of the largest cities in Nevada. Sunrise Manor was formed in May 1957.",where is sunrise manor
"<dbpedia:Paradise,_Nevada>","Paradise, Nevada","Paradise is an unincorporated town and census-designated place (CDP) in Clark County, Nevada, United States, adjacent to the city of Las Vegas. The population was 223,167 at the 2010 census. As an unincorporated town, it is governed by the Clark County Commission with input from the Paradise Town Advisory Board.  Paradise was formed on December 8, 1950.Paradise contains McCarran International Airport; the University of Nevada, Las Vegas; and most of the Las Vegas Strip.",what county is paradise in
"<dbpedia:North_Las_Vegas,_Nevada>","North Las Vegas, Nevada","North Las Vegas  is a city in Clark County, Nevada, United States, located in the Las Vegas Valley. As of the 2010 census it had a population of 216,961, with an estimated population of 226,877 in 2013. The city was incorporated on May 16, 1946. It is located in the Las Vegas metropolitan area and is the fourth largest city in the state of Nevada.",what county is north las vegas nevada in
"<dbpedia:Summerlin_South,_Nevada>","Summerlin South, Nevada","See Summerlin, Nevada for more information.Summerlin South, also seen on maps as South Summerlin, is an affluent census-designated place (CDP) in Clark County, Nevada, United States, on the western edge of the Las Vegas Valley and adjacent to the Red Rock Canyon National Conservation Area. It is so named because it is a southward extension of the master-planned community of Summerlin. Nearly all of Summerlin South is in ZIP code 89135.",where is summerlin nv
"<dbpedia:Kingsbury,_Nevada>","Kingsbury, Nevada","Kingsbury is a census-designated place (CDP) in Douglas County, Nevada, United States. The population was 2,152 at the 2010 census.",kingsbury nevada is in what county
"<dbpedia:Stateline,_Nevada>","Stateline, Nevada","Stateline is a census-designated place (CDP) on the east shore of Lake Tahoe in Douglas County, Nevada,  United States.  The population was 842 at the 2010 census. The population swells considerably during the busy winter and summer seasons, due to the high number of hotel rooms and rental accommodations available.",what county is stateline nevada
"<dbpedia:Atlanta_Township,_Becker_County,_Minnesota>","Atlanta Township, Becker County, Minnesota","Atlanta Township is a township in Becker County, Minnesota, United States. The population was 113 as of the 2000 census.",what county is atlanta mn in?
"<dbpedia:Sauk_Rapids,_Minnesota>","Sauk Rapids, Minnesota","Sauk Rapids is a city in Benton County, Minnesota, United States. The population was 12,773 at the 2010 census and is 13,348 according to 2014 census estimates. It is located on a set of rapids on the Mississippi River near its confluence with the Sauk River.Sauk Rapids is part of the St. Cloud Metropolitan Statistical Area.",where is sauk rapids mn
"<dbpedia:Big_Stone_Township,_Big_Stone_County,_Minnesota>","Big Stone Township, Big Stone County, Minnesota","Big Stone Township is a township in Big Stone County, Minnesota, United States. The population was 253 at the 2000 census.",what county is big stone township mn in
"<dbpedia:Winchester,_Nevada>","Winchester, Nevada","Winchester is an unincorporated town and census-designated place (CDP) and part of Las Vegas Township in Clark County, Nevada, United States that contains part of the Las Vegas Strip. It is one of a number of CDPs in the unincorporated urbanized area directly south of Las Vegas. The population was 27,978 at the 2010 census. It is governed by the Clark County Commission with advice from the Winchester Town Advisory Board.",what county is winchester nevada in
"<dbpedia:Zephyr_Cove–Round_Hill_Village,_Nevada>","Zephyr Cove–Round Hill Village, Nevada","Zephyr Cove–Round Hill Village is a former census-designated place (CDP) in Douglas County, Nevada, United States. The population was 1,649 at the 2000 census. For the 2010 census, the area was split into the Zephyr Cove and Round Hill Village CDPs.",where is zephyr cove nv
"<dbpedia:Johnson_Lane,_Nevada>","Johnson Lane, Nevada","Johnson Lane is a census-designated place (CDP) in Douglas County, Nevada, United States. It lies in the south side of the Carson City metropolitan area. The population was 6,490 at the 2010 census.",where is johnson lane
"<dbpedia:White_Earth,_Minnesota>","White Earth, Minnesota","White Earth is a census-designated place (CDP) in Becker County, Minnesota, United States. The population was 580 at the 2010 census.White Earth was named after the White Earth Indian Reservation, and that took its name from the White Earth Lake.",where is white earth mn
"<dbpedia:Indian_Hills,_Nevada>","Indian Hills, Nevada","Indian Hills is a census-designated place (CDP) in Douglas County, Nevada, United States. It lies on the south side of the Carson City metropolitan area. The population was 5,627 at the 2010 census.",indian hills nv is in what county
"<dbpedia:Spring_Valley,_Nevada>","Spring Valley, Nevada","Spring Valley  is an unincorporated town and census-designated place and part of Las Vegas Township in Clark County, Nevada, United States, located 2 miles (3 km) west of the Las Vegas Strip. The population was 178,395 at the 2010 census.  Spring Valley was formed in May, 1981.",where is spring valley nevada
"<dbpedia:Cobden,_Minnesota>","Cobden, Minnesota","Cobden is a city in Brown County, Minnesota, United States. The population was 36 at the 2010 census.","where is cobden, mn"
"<dbpedia:Little_Rock,_Beltrami_County,_Minnesota>","Little Rock, Beltrami County, Minnesota","Little Rock is a census-designated place (CDP) within the Lower Red Lake unorganized territory in Beltrami County, Minnesota, United States. The population was 1,208 at the 2010 census.",where is little rock mn
"<dbpedia:New_Germany,_Minnesota>","New Germany, Minnesota","New Germany is a city in Carver County, Minnesota, United States. The population was 372 at the 2010 census. A large share of the early settlers being natives of Germany caused the name to be selected.",where is new germany mn
"<dbpedia:Stately_Township,_Brown_County,_Minnesota>","Stately Township, Brown County, Minnesota","Stately Township is a township in Brown County, Minnesota, United States.  The population was 206 as of the 2000 census. Stately Township was organized in 1879.",where is stately mn
"<dbpedia:Burnstown_Township,_Brown_County,_Minnesota>","Burnstown Township, Brown County, Minnesota","Burnstown Township is a township in Brown County, Minnesota, United States. The population was 260 as of the 2000 census.",what county is burnstown mn in
"<dbpedia:Stark_Township,_Brown_County,_Minnesota>","Stark Township, Brown County, Minnesota","Stark Township is a township in Brown County, Minnesota, United States. The population was 384 as of the 2000 census.",what county is stark mn in
"<dbpedia:Federal_Dam,_Minnesota>","Federal Dam, Minnesota","Federal Dam is a city in Cass County, Minnesota, United States. The population was 110 at the 2010 census. It is part of the Brainerd Micropolitan Statistical Area.",where is federal dam mn
"<dbpedia:Searchlight,_Nevada>","Searchlight, Nevada","Searchlight is a census-designated place (CDP) and unincorporated town in Clark County, Nevada, United States, at the topographic saddle between two mountain ranges. As of the 2010 census it had a population of 539.","what county is searchlight, ne in"
"<dbpedia:Springfield,_Minnesota>","Springfield, Minnesota","Springfield is a city in Brown County, Minnesota, United States. The population was 2,152 at the 2010 census.U.S. Highway 14 serves as a main route in the community. This location is in the middle of some of Minnesota's most productive farmland. It has the state's only brick plant, operated by Acme-Ochs Brick",where is springfield mn
"<dbpedia:Spring_Creek,_Nevada>","Spring Creek, Nevada","Spring Creek is a census-designated place (CDP) in central Elko County, in northeastern Nevada in the western United States.  It mainly serves as a bedroom community for the businesses and industries in and around the nearby city of Elko. It is part of the Elko Micropolitan Statistical Area. The population was 12,361 at the 2010 census.","what county is spring creek, nevada"
"<dbpedia:Owyhee,_Nevada>","Owyhee, Nevada","Owyhee is a census-designated place (CDP) in Elko County, Nevada, United States, along the banks of the Owyhee River. The population was 953 at the 2010 census. It is part of the Elko Micropolitan Statistical Area.",where is owyhee
"<dbpedia:Gould_Township,_Cass_County,_Minnesota>","Gould Township, Cass County, Minnesota","Gould Township is a township in Cass County, Minnesota, United States. The population was 249 as of the 2000 census. Gould Township was named for M. I. Gould, a lumberman and local landowner.","what county is gould, mn"
"<dbpedia:McDermitt,_Nevada–Oregon>","McDermitt, Nevada–Oregon","McDermitt is an unincorporated community straddling the Nevada–Oregon border, in Humboldt County, Nevada, and Malheur County, Oregon, in the United States. McDermitt's economy has historically been based on mining, ranching, and farming, although the last mining operation closed in 1990, resulting in a steady decline in population.As of the 2010 census, the combined population was 513. Seventy-five percent of the residents were American Indian, predominantly Northern Paiute.",where is mcdermitt
"<dbpedia:Watertown_Township,_Carver_County,_Minnesota>","Watertown Township, Carver County, Minnesota","Watertown Township is a township in Carver County, Minnesota, United States. The population was 1,432 as of the 2000 census.",what county is watertown mn
"<dbpedia:Maple_Township,_Cass_County,_Minnesota>","Maple Township, Cass County, Minnesota","Maple Township is a township in Cass County, Minnesota, United States. The population was 291 as of the 2000 census. Maple Township was named from the groves of sugar maple trees within its borders.",what county is maple township mn in
"<dbpedia:West_Wendover,_Nevada>","West Wendover, Nevada","West Wendover is a small city in Elko County, Nevada, United States. The population was 4,410 at the 2010 census. It is part of the Elko micropolitan area. West Wendover is located on the eastern border of Nevada and the western edge of the Great Salt Lake Desert and is contiguous with Wendover, Utah, with which it is sometimes confused. Interstate 80 runs just north of the cities, while Interstate 80 Business (Wendover Boulevard) runs through the two cities.","what county is wendover, nevada in"
"<dbpedia:Loon_Lake_Township,_Cass_County,_Minnesota>","Loon Lake Township, Cass County, Minnesota","Loon Lake Township is a township in Cass County, Minnesota, United States. The population was 376 as of the 2000 census. This township took its name from Loon Lake.",where is loon lake mn
"<dbpedia:Bena,_Minnesota>","Bena, Minnesota","Bena (/ˈbiːnə/ BEE-nə) is a city in Cass County, Minnesota, United States. The population was 116 at the 2010 census. It is part of the Brainerd Micropolitan Statistical Area.",what county is bena mn
"<dbpedia:Gardnerville,_Nevada>","Gardnerville, Nevada","Gardnerville is a census-designated place (CDP) in Douglas County, Nevada, United States, adjacent to the county seat of Minden. The population was 5,656 at the 2010 census.U.S. Route 395 runs through the center of Gardnerville. State Route 207, known as Kingsbury Grade, connects Gardnerville to Stateline and U.S. Route 50.",where is gardnerville nv located
