_id,title,text,query
<dbpedia:Convention_(norm)>,Convention (norm),"A convention is a set of agreed, stipulated, or generally accepted standards, norms, social norms, or criteria, often taking the form of a custom.Certain types of rules or customs may become law and regulatory legislation may be introduced to formalize or enforce the convention (for example, laws that define on which side of the road vehicles must be driven).",define convention
<dbpedia:Duopoly>,Duopoly,"A true duopoly (from Greek duo δύο (two) + polein πωλεῖν (to sell)) is a specific type of   oligopoly where only two producers exist in one market. In reality, this definition is generally used where only two firms have dominant control over a market. In the field of industrial organization, it is the most commonly studied form of oligopoly due to its simplicity.",what is a duopoly
<dbpedia:C._L._Moore>,C. L. Moore,"Catherine Lucille Moore (January 24, 1911 – April 4, 1987) was an American science fiction and fantasy writer, who most often used the pen name C. L. Moore. She was among the first women to write in either genre (though earlier woman writers in these genres include Sophie Wenzel Ellis, Clare Winger Harris, Lilith Lorraine, Greye La Spina, Francis F. Stevens, Leslie F. Stone, and Everil Worrell). Moore's work paved the way for many other female speculative fiction writers.",who wrote lily la spina
<dbpedia:Chomsky_normal_form>,Chomsky normal form,"In formal language theory, a context-free grammar G is said to be in Chomsky normal form (discovered by Noam Chomsky) if all of its production rules are of the form: A → BC,   or A → a,   or S → ε,where A, B, and C are nonterminal symbols, a is a terminal symbol (a symbol that represents a constant value), S is the start symbol, and ε denotes the empty string.",what is the normal form of chomsky
<dbpedia:Cyril_M._Kornbluth>,Cyril M. Kornbluth,"Cyril M. Kornbluth (July 2, 1923 – March 21, 1958) was an American science fiction author and a notable member of the Futurians. He used a variety of pen-names, including Cecil Corwin, S. D. Gottesman, Edward J. Bellin, Kenneth Falconer, Walter C. Davies, Simon Eisner, Jordan Park, Arthur Cooke, Paul Dennis Lavond and Scott Mariner.",what is cyril kornbluth known for
<dbpedia:Dune>,Dune,"In physical geography, a dune is a hill of sand built by either wind or water flow. Dunes occur in different shapes and sizes, formed by interaction with the flow of air or water. Most kinds of dunes are longer on the windward side where the sand is pushed up the dune and have a shorter ""slip face"" in the lee of the wind. The valley or trough between dunes is called a slack. A ""dune field"" is an area covered by extensive sand dunes.",what is a dune
<dbpedia:Caddy>,Caddy,"In golf, a caddy (or caddie) is the person who carries a player's bag and clubs, and gives insightful advice and moral support. A good caddy is aware of the challenges and obstacles of the golf course being played, along with the best strategy in playing it. This includes knowing overall yardage, pin placements and club selection. A caddy is not usually an employee of a private club or resort.",what do caddies do
<dbpedia:Cahiers_du_cinéma>,Cahiers du cinéma,"Cahiers du Cinéma (French pronunciation: ​[kaje dy sinema], Notebooks on Cinema) is a French language film magazine founded in 1951 by André Bazin, Jacques Doniol-Valcroze and Joseph-Marie Lo Duca. It developed from the earlier magazine Revue du Cinéma (Review of the Cinema) involving members of two Paris film clubs—Objectif 49 (Objective 49) (Robert Bresson, Jean Cocteau and Alexandre Astruc, among others) and Ciné-Club du Quartier Latin (Cinema Club of the Latin Quarter).",cahier du cinéma definition
<dbpedia:Disbarment>,Disbarment,"Disbarment is the removal of a lawyer from a bar association or the practice of law, thus revoking his or her law license or admission to practice law. Disbarment is usually a punishment for unethical or criminal conduct. Procedures vary depending on the law society.",what is a disbarment in law
<dbpedia:Captain_America>,Captain America,"Captain America is a fictional superhero appearing in American comic books published by Marvel Comics. Created by cartoonists Joe Simon and Jack Kirby, the character first appeared in Captain America Comics #1 (cover dated March 1941) from Timely Comics, a predecessor of Marvel Comics. Captain America was designed as a patriotic supersoldier who often fought the Axis powers of World War II and was Timely Comics' most popular character during the wartime period.",what superhero is captain america
<dbpedia:Corona>,Corona,"A corona (Latin, 'crown') is an aura of plasma that surrounds the sun and other celestial bodies. The Sun's corona extends millions of kilometres into space and is most easily seen during a total solar eclipse, but it is also observable with a coronagraph.",what is the corona
<dbpedia:Compaq>,Compaq,"Compaq Computer Corporation was a company founded in 1982 that developed, sold, and supported computers and related products and services. Compaq produced some of the first IBM PC compatible computers, being the first company to legally reverse engineer the IBM Personal Computer. It rose to become the largest supplier of PC systems during the 1990s before being overtaken by HP in 2001. Struggling in the aftermath of the dot-com bubble bust, Compaq was acquired for US$25 billion by HP in 2002.",what company manufactures ibm computers
<dbpedia:Covenant-breaker>,Covenant-breaker,"A Covenant-breaker or the act of Covenant-breaking is a term used by Bahá'ís to refer to a particular form of what some might call ""heresy"".Actually it refers to disunity: ""The specific mission of Bahá'u'lláh relates to world unity.",define covenant breaker
<dbpedia:Central_Pacific_Railroad>,Central Pacific Railroad,"The Central Pacific Railroad (CPRR) is the former name of the railroad network built between California and Utah, US, that built eastwards from the West Coast in the 1860s, to complete the western part of the ""First Transcontinental Railroad"" in North America. It is now part of the Union Pacific Railroad.Many 19th century national proposals to build a transcontinental railroad failed because of the energy consumed by political disputes over slavery.",what did the central pacific railroad connect to
<dbpedia:Challenger_Deep>,Challenger Deep,"The Challenger Deep is the deepest known point in the Earth's seabed hydrosphere, with a depth of 10,898 to 10,916 m (35,755 to 35,814 ft) by direct measurement from submersibles, and slightly more by sonar bathymetry (see below). It is in the Pacific Ocean, at the southern end of the Mariana Trench near the Mariana Islands group.",challenger deep depth
<dbpedia:Chet_Atkins>,Chet Atkins,"Chester Burton ""Chet"" Atkins (June 20, 1924 – June 30, 2001) was an American guitarist, occasional vocalist and record producer who, along with Owen Bradley, created the smoother country music style known as the Nashville sound, which expanded country's appeal to adult pop music fans as well.Atkins' signature picking style was inspired by Merle Travis. Other major guitar influences were Django Reinhardt, George Barnes, Les Paul and later Jerry Reed.",what style of music is chet atkins
<dbpedia:Disruption>,Disruption,"In the context of Business continuity management, Disruption is an event which causes an ""unplanned, negative deviation from the expected delivery ... according to the organization’s objectives"".",what is disrupt?
<dbpedia:Chief_of_Naval_Operations>,Chief of Naval Operations,"The Chief of Naval Operations (CNO) is a statutory office (10 U.S.C. § 5033) held by a four-star admiral in the United States Navy, and is the most senior naval officer assigned to serve in the Department of the Navy. The office is a military adviser and deputy to the Secretary of the Navy. In a separate capacity as a member of the Joint Chiefs of Staff (10 U.S.C.",cno definition
<dbpedia:Clairvoyance>,Clairvoyance,"The term clairvoyance (from French clair meaning ""clear"" and voyance meaning ""vision"") is used to refer to the ability to gain information about an object, person, location or physical event through means other than the known senses, i.e., a form of extrasensory perception.",meaning of the word clairvoyance
<dbpedia:Circuit_Park_Zandvoort>,Circuit Park Zandvoort,"Circuit Park Zandvoort is a motorsport race track located in the dunes north of Zandvoort, Netherlands, near the North Sea coast line.",what are circuits
<dbpedia:Creaky_voice>,Creaky voice,"In linguistics, creaky voice (sometimes called laryngealisation, pulse phonation, vocal fry, or glottal fry) is a special kind of phonation in which the arytenoid cartilages in the larynx are drawn together; as a result, the vocal folds are compressed rather tightly, becoming relatively slack and compact. They vibrate irregularly at 20–50 pulses per second, about two octaves below the frequency of normal voicing, and the airflow through the glottis is very slow.",define creaky voice
<dbpedia:RDX>,RDX,"RDX, an initialism for Research Department explosive, is an explosive nitroamine widely used in military and industrial applications. It was developed as an explosive which was more powerful than TNT, and it saw wide use in World War II. RDX is also known as Research Department Formula X, cyclonite, hexogen (particularly in German and German-influenced languages), and T4.",what is rdx used for
<dbpedia:Professor_X>,Professor X,"Professor Charles Francis Xavier (also known as Professor X) is a fictional character appearing in American comic books published by Marvel Comics and is the founder and leader of the X-Men. Created by writer Stan Lee and artist Jack Kirby, the character first appeared in The X-Men #1 (September 1963).Xavier is a member of a subspecies of humans known as mutants who are born with superhuman abilities.",what is professor x?
<dbpedia:Double-barreled_shotgun>,Double-barreled shotgun,"A double-barreled shotgun ""\double"" in context) is a shotgun with two parallel barrels, allowing two shots to be fired in quick succession.",double barreled shotgun definition
<dbpedia:Dictionary>,Dictionary,"A dictionary is a collection of words in one or more specific languages, often listed alphabetically (or by radical and stroke for ideographic languages), with usage of information, definitions, etymologies, phonetics, pronunciations, translation, and other information; or a book of words in one language with their equivalents in another, also known as a lexicon.",definition of dictionary
<dbpedia:Chiropractic>,Chiropractic,"Chiropractic is a form of alternative medicine that focuses on diagnosis and treatment of mechanical disorders of the musculoskeletal system, especially the spine, under the belief that these disorders affect general health via the nervous system. It is the largest alternative medical profession, and although chiropractors have many similarities to primary care providers, they are more similar to a medical specialty like dentistry or podiatry.",what is chiropractor
<dbpedia:Drum>,Drum,"The drum is a member of the percussion group of musical instruments. In the Hornbostel-Sachs classification system, it is a membranophone. Drums consist of at least one membrane, called a drumhead or drum skin, that is stretched over a shell and struck, either directly with the player's hands, or with a drum stick, to produce sound. There is usually a resonance head on the underside of the drum, typically tuned to a slightly lower pitch than the top drumhead.",what does a drum do?
<dbpedia:Dog_tag>,Dog tag,"""Dog tags"" is the informal term for the identification tags worn by military personnel, because of their resemblance to actual dog tags.  The tags are primarily used for the identification of dead and wounded soldiers, and to convey essential basic medical information, such as blood type and history of inoculations, along with religious preference.",what is a dog tag
<dbpedia:David_Thompson_(explorer)>,David Thompson (explorer),"David Thompson (30 April 1770 – 10 February 1857) was a British-Canadian fur trader, surveyor, and map-maker, known to some native peoples as ""Koo-Koo-Sint"" or ""the Stargazer."" Over his career he mapped over 3.9 million square kilometres of North America and for this has been described as the ""greatest land geographer who ever lived.""",where did david thompson live
<dbpedia:Definition>,Definition,"A definition is a statement of the meaning of a term (a word, phrase, or other set of symbols).   Definitions can be classified into two large categories, intensional definitions (which try to give the essence of a term) and extensional definitions (which list every single object that a term describes).",define definition
<dbpedia:Dioscoreales>,Dioscoreales,Dioscoreales is a botanical name for an order of flowering plants.  Of necessity it contains the family Dioscoreaceae which includes the yam that is used as an important food source in many regions around the globe.,what is dioscoreales
<dbpedia:Double-hulled_tanker>,Double-hulled tanker,"A double-hulled tanker refers to an oil tanker which has a double hull. They reduce the likelihood of leaks occurring than in single-hulled tankers, and their ability to prevent or reduce oil spills led to double hulls being standardized for oil tankers and other types of ships including by the International Convention for the Prevention of Pollution from Ships or MARPOL Convention.",what is a double hulled tanker
<dbpedia:Dual_space>,Dual space,"In mathematics, any vector space V has a corresponding dual vector space (or just dual space for short) consisting of all linear functionals on V together with a naturally induced linear structure. Dual vector spaces for finite-dimensional vector spaces show up in tensor analysis. When applied to vector spaces of functions (which are typically infinite-dimensional), dual spaces are used to describe measures, distributions, and Hilbert spaces.",is the vector space a vector space
<dbpedia:Chrono_Cross>,Chrono Cross,"Chrono Cross (クロノ・クロス) is a role-playing video game developed and published by Square (now Square Enix) for the PlayStation video game console. It is the successor to Chrono Trigger, which was released in 1995 for the Super Nintendo Entertainment System. Chrono Cross was developed primarily by scenarist and director Masato Kato and other designers from Chrono Trigger, including art director Yasuyuki Honne and composer Yasunori Mitsuda.",what is chromato cross
<dbpedia:Clement_Attlee>,Clement Attlee,"Clement Richard Attlee, 1st Earl Attlee, KG, OM, CH, PC, FRS (3 January 1883 – 8 October 1967) was a British politician who was the Prime Minister of the United Kingdom from 1945 to 1951 and the Leader of the Labour Party from 1935 to 1955.",who is clement attlee
<dbpedia:Cowboy_Bebop>,Cowboy Bebop,"Cowboy Bebop (カウボーイビバップ, Kaubōi Bibappu) is a 1998 Japanese anime series developed by Sunrise featuring a production team led by director Shinichirō Watanabe, screenwriter Keiko Nobumoto, character designer Toshihiro Kawamoto, mechanical designer Kimitoshi Yamane, and composer Yoko Kanno. The twenty-six episodes ""\sessions"") of the series are set in the year 2071, and follow the lives of a bounty hunter crew traveling on the Bebop (their spaceship).",what is the original cowboy bebop
<dbpedia:Claude_Louis_Berthollet>,Claude Louis Berthollet,"Claude Louis Berthollet (9 December 1748 Talloires, France – 6 November 1822 Arcueil, France) was a Savoyard-French chemist who became vice president of the French Senate in 1804. He is known for his scientific contributions to theory of chemical equilibria via the mechanism of reverse chemical reactions, and for his contribution to modern chemical nomenclature.",who is Claude Berthollet
<dbpedia:Drink>,Drink,"Drinks, or beverages, are liquids intended for human consumption. In addition to basic needs, beverages form part of the culture of human society.",are beverages drinkable
<dbpedia:Caribbean_Sea>,Caribbean Sea,The Caribbean Sea (Spanish: Mar Caribe) is a sea of the Atlantic Ocean located in the tropics of the Western Hemisphere.,where is the caribbean sea located
<dbpedia:Diffie–Hellman_key_exchange>,Diffie–Hellman key exchange,Diffie–Hellman key exchange (D–H)  is a specific method of securely exchanging cryptographic keys over a public channel and was one of the first public-key protocols as originally conceptualized by Ralph Merkle. D–H is one of the earliest practical examples of public key exchange implemented within the field of cryptography. The Diffie–Hellman key exchange method allows two parties that have no prior knowledge of each other to jointly establish a shared secret key over an insecure channel.,which protocol did the diffie hellman key exchange
<dbpedia:Demographics_of_the_Democratic_Republic_of_the_Congo>,Demographics of the Democratic Republic of the Congo,"This article is about the demographic features of the population of the Democratic Republic of the Congo, including ethnicity, education level, health of the populace, economic status, religious affiliations and other aspects of the population.As many as 250 ethnic groups have been distinguished and named. The most numerous people are the Luba, Mongo, and Bakongo.",what is the population of the drc
<dbpedia:Telecommunications_in_the_Democratic_Republic_of_the_Congo>,Telecommunications in the Democratic Republic of the Congo,"Telecommunications in the Democratic Republic of the Congo include radio, television, fixed and mobile telephones, and the Internet.",the democrat republic of congo telecommunications industry
<dbpedia:Donegal_fiddle_tradition>,Donegal fiddle tradition,"The Donegal fiddle tradition is the way of playing the fiddle that is traditional in County Donegal, Ireland. It is one of the distinct fiddle traditions within Irish traditional music.The distinctness of the Donegal tradition developed due to the close relations between Donegal and Scotland, and the Donegal repertoire and style has influences from Scottish fiddle music.",what kind of instrument does the donegal family play
<dbpedia:Demographics_of_Denmark>,Demographics of Denmark,"This article is about the demographic features of the population of Denmark, including population density, ethnicity, education level, health of the populace, economic status, religious affiliations and other aspects of the population.",demographic features of denmark
<dbpedia:Charcot–Marie–Tooth_disease>,Charcot–Marie–Tooth disease,"Charcot–Marie–Tooth disease (CMT), also known as Charcot–Marie–Tooth neuropathy, hereditary motor and sensory neuropathy (HMSN) and peroneal muscular atrophy (PMA), is a genetically and clinically heterogeneous group of inherited disorders of the peripheral nervous system characterised by progressive loss of muscle tissue and touch sensation across various parts of the body.",what are msn and pma
<dbpedia:Dance>,Dance,"Dance is a performance art form consisting of purposefully selected sequences of human movement. This movement has aesthetic and symbolic value, and is acknowledged as dance by performers and observers within a particular culture.",what is dance dance
<dbpedia:Destry_Rides_Again>,Destry Rides Again,"Destry Rides Again is a 1939 western starring Marlene Dietrich and James Stewart, and directed by George Marshall. The supporting cast includes Mischa Auer, Charles Winninger, Brian Donlevy, Allen Jenkins, Irene Hervey, Billy Gilbert, Bill Cody, Jr., Lillian Yarbo, and Una Merkel.",where were the actors from dextry rides again?
<dbpedia:Data_warehouse>,Data warehouse,"In computing, a data warehouse (DW or DWH), also known as an enterprise data warehouse (EDW), is a system used for reporting and data analysis. DWs are central repositories of integrated data from one or more disparate sources. They store current and historical data and are used for creating analytical reports for knowledge workers throughout the enterprise.",what does dws stand for in enterprise
<dbpedia:Demographics_of_Djibouti>,Demographics of Djibouti,"This article is about the demographics of Djibouti, including population density, ethnicity, education level, health, economic status, religious affiliations and other aspects of the population.",demographics of djibouti
<dbpedia:Geography_of_the_Democratic_Republic_of_the_Congo>,Geography of the Democratic Republic of the Congo,"The Democratic Republic of the Congo is by the Congo River Basin, which covers an area of almost 1,000,000 square kilometres (390,000 sq mi).",how big is the congo area?
<dbpedia:DNA>,DNA,"Deoxyribonucleic acid (/diˌɒksiˌraɪbɵ.njuːˌkleɪ.ɨk ˈæsɪd/; DNA) is a molecule that carries most of the genetic instructions used in the development, functioning and reproduction of all known living organisms and many viruses. DNA is a nucleic acid; alongside proteins and carbohydrates, nucleic acids compose the three major macromolecules essential for all known forms of life. Most DNA molecules consist of two biopolymer strands coiled around each other to form a double helix.",what is dna
<dbpedia:Central_pontine_myelinolysis>,Central pontine myelinolysis,"Central pontine myelinolysis (CPM), also known as Osmotic demyelination syndrome or Central pontine demyelination, is a neurological disease caused by severe damage of the myelin sheath of nerve cells in the brainstem, more precisely in the area termed the pons, predominately of iatrogenic etiology. It is characterized by acute paralysis,  dysphagia (difficulty swallowing), and dysarthria (difficulty speaking), and other neurological symptoms.It can also occur outside the pons.",cpm what is it
<dbpedia:Derivative>,Derivative,"The derivative of a function of a real variable measures the sensitivity to change of a quantity (a function value or dependent variable) which is determined by another quantity (the independent variable).  Derivatives are a fundamental tool of calculus.  For example, the derivative of the position of a moving object with respect to time is the object's velocity: this measures how quickly the position of the object changes when time is advanced.",how to determine derivatives in a variable
<dbpedia:Transport_in_the_Democratic_Republic_of_the_Congo>,Transport in the Democratic Republic of the Congo,"Ground transport in the Democratic Republic of Congo (DRC) has always been difficult.  The terrain and climate of the Congo Basin present serious barriers to road and rail construction, and the distances are enormous across this vast country.",what is transportation in drc
<dbpedia:Dracula>,Dracula,"Dracula is an 1897 Gothic horror novel by Irish author Bram Stoker.Famous for introducing the character of the vampire Count Dracula, the novel tells the story of Dracula's attempt to move from Transylvania to England so he may find new blood and spread the undead curse, and the battle between Dracula and a small group of men and women led by Professor Abraham Van Helsing.Dracula has been assigned to many literary genres including vampire literature, horror fiction, the gothic novel and invasion literature.",what kind of author wrote the book dracuna
<dbpedia:Transport_in_Djibouti>,Transport in Djibouti,Transport in Djibouti refers to the transportation structure in Djibouti.,where is transportation located
<dbpedia:Demographics_of_Dominica>,Demographics of Dominica,"This article is about the demographic features of the population of Dominica, including population density, ethnicity, religious affiliations and other aspects of the population.",what is the population of dominica
<dbpedia:Direct_examination>,Direct examination,"The  direct examination or examination-in-chief is one stage in the process of adducing evidence from witnesses in a court of law. Direct examination is the questioning of a witness by the party who called him or her, in a trial.  Direct examination is usually performed to elicit evidence in support of facts which will satisfy a required element of a party's claim or defense.In direct examination, one is generally prohibited from asking leading questions.",what is a direct examination
<dbpedia:Politics_of_Dominica>,Politics of Dominica,"Politics of Dominica takes place in a framework of a parliamentary representative democratic republic, whereby the Prime Minister of Dominica is the head of government, and of a  multi-party system. Executive power is exercised by the government.  Legislative power is vested in both the government and the House of Assembly. The Judiciary is independent of the executive and the legislature.",where does dominican politics take place
<dbpedia:Transport_in_Denmark>,Transport in Denmark,"Transport in Denmark is developed and modern. The motorway network now covers 1,111 km while the railway network totals 2,667 km of operational track. The Great Belt Fixed Link (opened in 1997) connecting the islands of Zealand and Funen and the New Little Belt Bridge (opened in 1970) connecting Funen and Jutland have improved the traffic flow across the country on both motorways and rail.",what is the road network of denmark
<dbpedia:Data_compression>,Data compression,"In digital signal processing, data compression, source coding,or bit-rate reduction involves encoding information using fewer bits than the original representation.  Compression can be either lossy or lossless. Lossless compression reduces bits by identifying and eliminating statistical redundancy. No information is lost in lossless compression.",what does byte compression mean in a mdf
