_id,title,text,query
<dbpedia:487_BC>,487 BC,"Year 487 BC was a year of the pre-Julian Roman calendar. At the time, it was known as the Year of the Consulship of Sicinius and Aquillius (or, less frequently, year 267 Ab urbe condita). The denomination 487 BC for this year has been used since the early medieval period, when the Anno Domini calendar era became the prevalent method in Europe for naming years.",what is the year of sicinius
<dbpedia:482_BC>,482 BC,"Year 482 BC was a year of the pre-Julian Roman calendar. At the time, it was known as the Year of the Consulship of Vibulanus and Iullus (or, less frequently, year 272 Ab urbe condita). The denomination 482 BC for this year has been used since the early medieval period, when the Anno Domini calendar era became the prevalent method in Europe for naming years.",what year was 482 bc
<dbpedia:501_BC>,501 BC,"The year 501 BC was a year of the pre-Julian Roman calendar. In the Roman Empire it was known as the Year of the Consulship of Auruncus and Lartius (or, less frequently, year 253  Ab urbe condita). The denomination 501 BC for this year has been used since the early medieval period, when the Anno Domini calendar era became the prevalent method in Europe for naming years.",what is the year 501bc
<dbpedia:483_BC>,483 BC,"Year 483 BC was a year of the pre-Julian Roman calendar. At the time, it was known as the Year of the Consulship of Vibulanus and Potitus (or, less frequently, year 271 Ab urbe condita). The denomination 483 BC for this year has been used since the early medieval period, when the Anno Domini calendar era became the prevalent method in Europe for naming years.",what year is 483 c
<dbpedia:Pope_Gregory_XVI>,Pope Gregory XVI,"Pope Gregory XVI (Latin: Gregorius XVI; 18 September 1765 – 1 June 1846), born Bartolomeo Alberto Cappellari EC, reigned from 2 February 1831 to his death in 1846. He had adopted the name Mauro upon entering the religious order of the Camaldolese.Strongly conservative and traditionalist, he opposed democratic and modernising reforms in the Papal States and throughout Europe, seeing them as fronts for revolutionary leftism.",where did gregory xvi die
<dbpedia:List_of_entomologists>,List of entomologists,"The following is a list of entomologists, people who have studied insects.",what types of scientists study insects
<dbpedia:505_BC>,505 BC,"The year 505 BC was a year of the pre-Julian Roman calendar. In the Roman Empire it was known as the Year of the Consulship of Volusus and Tubertus (or, less frequently, year 249  Ab urbe condita). The denomination 505 BC for this year has been used since the early medieval period, when the Anno Domini calendar era became the prevalent method in Europe for naming years.",what years was 505 bc on
<dbpedia:Kobe>,Kobe,"Kobe (神戸市, Kōbe-shi, Japanese pronunciation: [koːꜜbe]) is the sixth-largest city in Japan and is the capital city of Hyōgo Prefecture. It is located on the southern side of the main island of Honshū, on the north shore of Osaka Bay and about 30 km (19 mi) west of Osaka.","where is kosuke, japan"
<dbpedia:504_BC>,504 BC,"The year 504 BC was a year of the pre-Julian Roman calendar. In the Roman Empire it was known as the Year of the Consulship of Poplicola and Tricipitinus (or, less frequently, year 250  Ab urbe condita). The denomination 504 BC for this year has been used since the early medieval period, when the Anno Domini calendar era became the prevalent method in Europe for naming years.",what year did the year 504 bc start
<dbpedia:502_BC>,502 BC,"The year 502 BC was a year of the pre-Julian Roman calendar. In the Roman Empire it was known as the Year of the Consulship of Tricostus and Viscellinus (or, less frequently, year 252  Ab urbe condita). The denomination 502 BC for this year has been used since the early medieval period, when the Anno Domini calendar era became the prevalent method in Europe for naming years.",how old was the year 502 bc?
<dbpedia:Mycorrhiza>,Mycorrhiza,"A mycorrhiza (Greek: μυκός, mykós, ""fungus"" and  ριζα, riza, ""roots"", pl. mycorrhizae or mycorrhizas) is a symbiotic association composed of a fungus and roots of a vascular plant. In a mycorrhizal association, the fungus colonizes the host plant's roots, either intracellularly as in arbuscular mycorrhizal fungi (AMF or AM), or extracellularly as in  ectomycorrhizal fungi. They are an important component of soil life and soil chemistry.",what are mycorrhizae
<dbpedia:503_BC>,503 BC,"The year 503 BC was a year of the pre-Julian Roman calendar. In the Roman Empire it was known as the Year of the Consulship of Lanatus and Tubertus (or, less frequently, year 251  Ab urbe condita). The denomination 503 BC for this year has been used since the early medieval period, when the Anno Domini calendar era became the prevalent method in Europe for naming years.",what is the year 503
"<dbpedia:Richard_Boyle,_3rd_Earl_of_Burlington>","Richard Boyle, 3rd Earl of Burlington","The Rt. Hon. Richard Boyle, 3rd Earl of Burlington and 4th Earl of Cork, KG, PC (25 April 1694 – 15 December 1753), born in Yorkshire, England, was the son of The 2nd Earl of Burlington and 3rd Earl of Cork and Juliana Noel (1672-1750).",who was the son of richard boyle
<dbpedia:507_BC>,507 BC,"The year 507 BC was a year of the pre-Julian Roman calendar. In the Roman Empire it was known as the Year of the Consulship of Poplicola and Pulvillus (or, less frequently, year 247  Ab urbe condita). The denomination 507 BC for this year has been used since the early medieval period, when the Anno Domini calendar era became the prevalent method in Europe for naming years.",what is a bc year
<dbpedia:Titus_Andronicus>,Titus Andronicus,"Titus Andronicus is a tragedy by William Shakespeare, believed to have been written between 1588 and 1593, probably in collaboration with George Peele.",what is the tragedy of shakespeare
<dbpedia:510_BC>,510 BC,"The year 510 BC was a year of the pre-Julian Roman calendar. In the Roman Empire, it was known as year 244  Ab urbe condita. The denomination 510 BC for this year has been used since the early medieval period, when the Anno Domini calendar era became the prevalent method in Europe for naming years.",when was year 510 bc
<dbpedia:508_BC>,508 BC,"The year 508 BC was a year of the pre-Julian Roman calendar. In the Roman Empire it was known as the Year of the Consulship of Poplicola and Tricipitinus (or, less frequently, year 246  Ab urbe condita). The denomination 508 BC for this year has been used since the early medieval period, when the Anno Domini calendar era became the prevalent method in Europe for naming years.",what year was 508 bc
<dbpedia:Ethnic_origin>,Ethnic origin,"The concept of ethnic origin is an attempt to classify people, not according to their current nationality, but according to commonalities in their social background.",defining ethnic origin
<dbpedia:Morphing>,Morphing,"Morphing is a special effect in motion pictures and animations that changes (or morphs) one image or shape into another through a seamless transition. Most often it is used to depict one person turning into another through technological means or as part of a fantasy or surreal sequence. Traditionally such a depiction would be achieved through cross-fading techniques on film. Since the early 1990s, this has been replaced by computer software to create more realistic transitions.",what is morphing
<dbpedia:506_BC>,506 BC,"The year 506 BC was a year of the pre-Julian Roman calendar. In the Roman Empire it was known as the Year of the Consulship of Rufus and Aquilinus (or, less frequently, year 248  Ab urbe condita). The denomination 506 BC for this year has been used since the early medieval period, when the Anno Domini calendar era became the prevalent method in Europe for naming years.",what is the year 506 cc bc
<dbpedia:Initial_and_terminal_objects>,Initial and terminal objects,"In category theory, an abstract branch of mathematics, an initial object of a category C is an object I in C such that for every object X in C, there exists precisely one morphism I → X.The dual notion is that of a terminal object (also called terminal element): T is terminal if for every object X in C there exists a single morphism X → T.",initial object definition
<dbpedia:Long_Island_City>,Long Island City,"Long Island City (L.I.C.) is the westernmost residential and commercial neighborhood of the New York City borough of Queens.  L.I.C. is noted for its rapid and ongoing residential growth and gentrification, its waterfront parks, and its thriving arts community.  L.I.C. has among the highest concentration of art galleries, art institutions, and studio space of any neighborhood in New York City.",what city is lic located
<dbpedia:Hydrate>,Hydrate,"In chemistry, a hydrate is a substance that contains water or its constituent elements. The chemical state of the water varies widely between different classes of hydrates, some of which were so labeled before their chemical structure was understood.",what is a hydrate
<dbpedia:Haijin>,Haijin,"The Haijin (Chinese: 海禁; pinyin: Hǎijìn; literally: ""sea ban"") order was a ban on maritime activities imposed during China's Ming dynasty and again at the time of the Qing dynasty. Intended to curb piracy, the ban proved ineffective for that purpose. Instead it imposed huge hardships on coastal communities and legitimate sea traders.",what was the haijin order
<dbpedia:Pedology_(soil_study)>,Pedology (soil study),"Pedology (from Greek: πέδον, pedon, ""soil""; and λόγος, logos, ""study"") is the study of soils in their natural environment. It is one of two main branches of soil science, the other being edaphology. Pedology deals with pedogenesis, soil morphology, and soil classification, while edaphology studies the way soils influence plants, fungi, and other living things.",what is the definition of pedology
<dbpedia:Thermal_conductivity>,Thermal conductivity,"In physics, thermal conductivity (often denoted k, λ, or κ) is the property of a material to conduct heat. It is evaluated primarily in terms of Fourier's Law for heat conduction.Heat transfer occurs at a lower rate across materials of low thermal conductivity than across materials of high thermal conductivity. Correspondingly, materials of high thermal conductivity are widely used in heat sink applications and materials of low thermal conductivity are used as thermal insulation.",what is thermal conductivity
<dbpedia:Pange_Lingua_Gloriosi_Corporis_Mysterium>,Pange Lingua Gloriosi Corporis Mysterium,"Pange Lingua Gloriosi Corporis Mysterium is a Latin hymn written by Saint Thomas Aquinas (1225–1274) for the Feast of Corpus Christi . It is also sung on Maundy Thursday, during the procession from the church to the place where the Blessed Sacrament is kept until Good Friday. The last two stanzas, called separately Tantum Ergo, are sung at Benediction of the Blessed Sacrament.",who composed the pagagloriosi corporis mythium?
<dbpedia:Surface_anatomy>,Surface anatomy,"Surface anatomy (also called superficial anatomy and visual anatomy) is the study of the external features of the body. It deals with anatomical features that can be studied by sight, without dissection. As such, it is a branch of gross anatomy, along with endoscopic and radiological anatomy. Surface anatomy is a descriptive science.",what is the difference between a visual and a surface anatomy
<dbpedia:Pope_Pius_X>,Pope Pius X,"Pope Saint Pius X (Italian: Pio X) born Giuseppe Melchiorre Sarto, (2 June 1835 – 20 August 1914), was Pope from 4 August 1903 to his death in 1914. He was canonized in 1954. Pius X is known for vigorously opposing modernist interpretations of Catholic doctrine, promoting traditional devotional practices and orthodox theology. His most important reform was to order the codification of the first Code of Canon Law, which collected the laws of the Church into one volume for the first time.",who is pius
<dbpedia:DLL_Hell>,DLL Hell,"In computing, DLL Hell is a term for the complications that arise when working with dynamic link libraries (DLLs) used with Microsoft Windows operating systems, particularly legacy 16-bit editions which all run in a single memory space.DLL Hell can manifest itself in many different ways; typically when applications do not launch or work correctly.DLL Hell is the Windows ecosystem specific form of the general concept dependency hell.",what is dll hell
<dbpedia:Nitrogen_cycle>,Nitrogen cycle,"The nitrogen cycle is the process by which nitrogen is converted between its various chemical forms. This transformation can be carried out through both biological and physical processes. Important processes in the nitrogen cycle include fixation, ammonification, nitrification, and denitrification. The majority of Earth's atmosphere (78%) is nitrogen, making it the largest pool of nitrogen.",what are some important processes in the nitrogen cycle
<dbpedia:Soil_science>,Soil science,"Soil science is the study of soil as a natural resource on the surface of the Earth including soil formation, classification and mapping; physical, chemical, biological, and fertility properties of soils; and these properties in relation to the use and management of soils.Sometimes terms which refer to branches of soil science, such as pedology (formation, chemistry, morphology and classification of soil) and edaphology (influence of soil on organisms, especially plants), are used as if synonymous with soil science.",what is the science of soils
<dbpedia:Measure_for_Measure>,Measure for Measure,"Measure for Measure is a play by William Shakespeare, believed to have been written in 1603 or 1604. Originally published in the First Folio of 1623, where it was listed as a comedy, the play's first recorded performance occurred in 1604.",when was measure for measure written
<dbpedia:Rust_(fungus)>,Rust (fungus),"Rusts are plant diseases caused by pathogenic fungi of the order Pucciniales (previously also known as Uredinales).An estimated 168 rust genera and approximately 7000 species, more than half of which belong to the genus Puccinia, are currently accepted.",what are diseases caused by fungi
<dbpedia:Tatra_Mountains>,Tatra Mountains,"The Tatra Mountains, Tatras or Tatra  (Tatry either in Polish and in Slovak - plurale tantum), are a mountain range that form a natural border between Slovakia and Poland. They are the highest mountain range in the Carpathian Mountains.",where is the tatra mountain range
"<dbpedia:Bartholomew_de_Badlesmere,_1st_Baron_Badlesmere>","Bartholomew de Badlesmere, 1st Baron Badlesmere","Bartholomew de Badlesmere, 1st Baron Badlesmere (circa 1275 - 14 April 1322), English soldier, diplomat, Member of Parliament, landowner and nobleman, was the son and heir of Gunselm de Badlesmere (died circa 1301). He fought in the English army both in France and Scotland during the later years of the reign of Edward I of England and the earlier part of the reign of Edward II of England. He was executed after participating in an unsuccessful rebellion led by the Earl of Lancaster.",what era was baron badlesmere
<dbpedia:Lumber>,Lumber,"Lumber (American English; timber in Australian English, British English, Hiberno-English, and New Zealand English) is wood that has been processed into beams and planks, a stage in the process of wood production.Lumber may be supplied either rough-sawn, or surfaced on one or more of its faces. Besides pulpwood, rough lumber is the raw material for furniture-making and other items requiring additional cutting and shaping.",what is lumber
<dbpedia:Cabaret>,Cabaret,"Cabaret is a form of entertainment featuring music, song, dance, recitation or drama. It is mainly distinguished by the performance venue, such as in a restaurant, pub or nightclub with a stage for performances. The audience, often dining or drinking, does not typically dance but usually sits at tables. Performances are usually introduced by a master of ceremonies or MC (sometimes spelled emcee in the U.S.).",what is a cabaret
<dbpedia:Preadditive_category>,Preadditive category,"In mathematics, specifically in category theory, a preadditive category is a category that is enriched over the monoidal category of abelian groups. In other words, the category C is preadditive if every hom-set Hom(A,B) in C has the structure of an abelian group, and composition of morphisms is bilinear.A preadditive category is also called an Ab-category, after the notation Ab for the category of abelian groups.",what is preadditive category
<dbpedia:Bioaccumulation>,Bioaccumulation,"Bioaccumulation refers to the accumulation of substances, such as pesticides, or other chemicals in an organism. Bioaccumulation occurs when an organism absorbs a toxic substance at a rate greater than that at which the substance is lost. Thus, the longer the biological half-life of the substance the greater the risk of chronic poisoning, even if environmental levels of the toxin are not very high. Bioaccumulation, for example in fish, can be predicted by models.",what is bioaccumulation
<dbpedia:Solubility_equilibrium>,Solubility equilibrium,"Solubility equilibrium is a type of dynamic equilibrium. It exists when a chemical compound in the solid state is in chemical equilibrium with a solution of that compound. The solid may dissolve unchanged, with dissociation or with chemical reaction with another constituent of the solvent, such as acid or alkali. Each type of equilibrium is characterized by a temperature-dependent equilibrium constant. Solubility equilibria are important in pharmaceutical, environmental and many other scenarios.",solubility definition chemistry
<dbpedia:Eiji_Tsuburaya>,Eiji Tsuburaya,"Eiji Tsuburaya (円谷 英二, Tsuburaya Eiji) (Eiichi Tsumuraya (円谷 英一, Tsumuraya Eiichi); July 7, 1901 – January 25, 1970, in Sukagawa, Fukushima) was a Japanese special effects director responsible for many Japanese science-fiction films and television series, being one of the co-creators of the Godzilla series, as well as the main creator of Ultraman.",who is eiji tsuburaya
<dbpedia:Digital_Signature_Algorithm>,Digital Signature Algorithm,"The Digital Signature Algorithm (DSA) is a Federal Information Processing Standard for digital signatures. It was proposed by the National Institute of Standards and Technology (NIST) in August 1991 for use in their Digital Signature Standard (DSS) and adopted as FIPS 186 in 1993. Four revisions to the initial specification have been released: FIPS 186-1 in 1996, FIPS 186-2 in 2000, FIPS 186-3 in 2009, and FIPS 186-4 in 2013.DSA is covered by U.S.",define digital signature algorithm
<dbpedia:Jack_Vance>,Jack Vance,"John Holbrook ""Jack"" Vance (August 28, 1916 – May 26, 2013) was an American mystery, fantasy, and science fiction writer. Though most of his work has been published under the name Jack Vance, he also wrote 11 mystery novels using his full name John Holbrook Vance, three under the pseudonym Ellery Queen, and one each using the pseudonyms Alan Wade, Peter Held, John van See, and Jay Kavanse.",who is jack vance
<dbpedia:Johannesburg>,Johannesburg,"Johannesburg (/dʒoʊˈhænɨsbɜrɡ/; Afrikaans: [joˈɦɐnəsbœrχ]) (also known as Jozi, Jo'burg, eGoli, and Joeys, and abbreviated as JHB) is the largest city in South Africa. It is the provincial capital of Gauteng, which is the wealthiest province in South Africa. The city is one of the 50 largest urban agglomerations in the world, and is also the world's largest city not situated on a river, lake, or coastline.",where is johannesburg
<dbpedia:Chalcedonian_Christianity>,Chalcedonian Christianity,Chalcedonian primarily describes a body of churches and theologians which accept the Definition of Chalcedon (451) of how the divine and human relate in the person of Jesus Christ.,what does chalcedonist mean
<dbpedia:Gemara>,Gemara,"The Gemara (also transliterated Gemora, Gemarah or, less commonly, Gemorra;  'גמרא' noun - from  Aramaic verb gamar, literally, ""study"") is the component of the Talmud comprising rabbinical analysis of and commentary on the Mishnah. After the Mishnah was published by Judah HaNasi (c. 200 CE), the work was studied exhaustively by generation after generation of rabbis in Babylonia and the Land of Israel.",what is a gemara
<dbpedia:Linear_cryptanalysis>,Linear cryptanalysis,"In cryptography, linear cryptanalysis is a general form of cryptanalysis based on finding affine approximations to the action of a cipher. Attacks have been developed for block ciphers and stream ciphers. Linear cryptanalysis is one of the two most widely used attacks on block ciphers; the other being differential cryptanalysis.The discovery is attributed to Mitsuru Matsui, who first applied the technique to the FEAL cipher (Matsui and Yamagishi, 1992).",linear cryptanalysis definition
<dbpedia:Spanish_missions_in_California>,Spanish missions in California,"The Spanish missions in Alta California comprise a series of 21 religious and military outposts; established by Catholic priests of the Franciscan order between 1769 and 1833, to spread Christianity among the local Native Americans. The missions were part of the first major effort by Europeans to colonize the Pacific Coast region, the most northern and western of Spain's North American claims.",where was the california mission
<dbpedia:Monophysitism>,Monophysitism,"Monophysitism (/məˈnɒfɨsaɪtɨzəm/ or /məˈnɒfɨsɪtɨzəm/; Greek: μονοφυσιτισμός from μόνος monos, ""only, single"" and φύσις physis, ""nature""), is the Christological position that, after the union of the divine and the human in the historical Incarnation, Jesus Christ, as the incarnation of the eternal Son or Word (Logos) of God, had only a single ""nature"" which was either divine or a synthesis of divine and human.",what is the definition of monophysitism
<dbpedia:Pea>,Pea,"The pea is most commonly the small spherical seed or the seed-pod of the pod fruit Pisum sativum. Each pod contains several peas. Pea pods are botanically fruit, since they contain seeds and developed from the ovary of a (pea) flower. The name is also used to describe other edible seeds from the Fabaceae such as the pigeon pea (Cajanus cajan), the cowpea (Vigna unguiculata), and the seeds from several species of Lathyrus.P. sativum is an annual plant, with a life cycle of one year.",what is a pea
<dbpedia:Method_acting>,Method acting,"In the dramatic arts, method acting is a group of specific techniques actors use to create in themselves the thoughts and feelings of their characters, so as to develop lifelike performances. Though not all method actors use the same approach, the ""method"" (sometimes capitalized as Method) refers to the methods used by actors, which are based on the teachings and concepts developed by Constantin Stanislavski beginning around 1911.",what is method acting?
<dbpedia:Monothelitism>,Monothelitism,"Monothelitism or monotheletism (from Greek μονοθελητισμός ""doctrine of one will"") is a particular teaching about how the divine and human relate in the person of Jesus, known as a Christological doctrine, that formally emerged in Armenia and Syria in 629. Specifically, monothelitism is the view that Jesus Christ has two natures but only one will. This is contrary to the Christology that Jesus Christ has two wills (human and divine) corresponding to his two natures (dyothelitism).",monothelitism definition
<dbpedia:Solubility>,Solubility,"Solubility is the property of a solid, liquid, or gaseous chemical substance called solute to dissolve in a solid, liquid, or gaseous solvent to form a solution of the solute in the solvent. The solubility of a substance fundamentally depends on the physical and chemical properties of the solute and solvent as well as on temperature, pressure and  the pH of the solution.",what is solubility
<dbpedia:Dial-up_Internet_access>,Dial-up Internet access,"Dial-up Internet access is an early form of Internet access that uses the facilities of the public switched telephone network (PSTN) to establish a connection to an Internet service provider (ISP) by dialing a telephone number on a conventional telephone line. The user's computer or router uses an attached modem to encode and decode information into and from audio frequency signals, respectively.",what is dial up internet
<dbpedia:List_of_United_States_federal_legislation>,List of United States federal legislation,"This is a chronological, but still incomplete, list of United States federal legislation.",what is federal law
<dbpedia:Meteorological_Service_of_Canada>,Meteorological Service of Canada,"The Meteorological Service of Canada (MSC) is a division of Environment Canada, which primarily provides public meteorological information and weather forecasts and warnings of severe weather and other environmental hazards.  MSC also monitors and conducts research on climate, atmospheric science, air quality, water quantities, ice and other environmental issues.",what is the msc
<dbpedia:Pierre_Brissaud>,Pierre Brissaud,"Pierre Brissaud (23 December 1885–1964) was a French Art Deco illustrator, painter, and engraver whose father was Docteur Edouard Brissaud, a student of Docteur Charcot. He was born in Paris and trained at  the École des Beaux-Arts and Atelier Fernand Cormon in Montmartre, Paris. His fellow Cormon students were his brother Jacques, André-Édouard Marty, Charles Martin, Georges Lepape. Students at the workshop drew, painted and designed wallpaper, furniture and posters.",who was pierre brissaud
