_id,title,text,query
<dbpedia:Henri_Matisse>,Henri Matisse,"Henri-Émile-Benoît Matisse (French: [ɑ̃ʁi emil bənwɑ matis]; 31 December 1869 – 3 November 1954) was a French artist, known for both his use of colour and his fluid and original draughtsmanship.",who is henri matisse
<dbpedia:Hidden_Treasures_(EP)>,Hidden Treasures (EP),"Hidden Treasures is an EP by American thrash metal band Megadeth, released on July 18, 1995 by Capitol Records. The album features songs that first appeared on movie soundtracks and tribute albums. Four of the tracks were released as singles, and three have received Grammy Award nominations for Best Metal Performance. Despite having garnered mediocre or negative reviews, the material on the EP has been credited with helping expand the group's MTV audience in the early 1990s.",what year did hidden treasures come out
"<dbpedia:So_Far,_So_Good..._So_What!>","So Far, So Good... So What!","So Far, So Good... So What! is the third studio album by American thrash metal band Megadeth. It was released on January 19, 1988 through Capitol Records; a remixed and remastered edition including several bonus tracks was reissued in August 2004. It is the band's only album recorded with drummer Chuck Behler and guitarist Jeff Young, both of whom were fired immediately after the subsequent tour. So Far, So Good...",when was so far so good so what
<dbpedia:La_Purisima_Mission>,La Purisima Mission,"Mission La Purisima Concepción, or La Purisima Mission (originally La Misión de La Purísima Concepción de la Santísima Virgen María, or The Mission of the Immaculate Conception of the Most Blessed Virgin Mary) is a Spanish mission in Lompoc, California. It was established on December 8, 1787 (the Feast of the Immaculate Conception, hence the mission's name) by the Franciscan order.",where is la purisima mission?
<dbpedia:Chasing_Amy>,Chasing Amy,"Chasing Amy is a 1997 American romantic comedy film written and directed by Kevin Smith. The central tension revolves around sexuality, sexual history, and evolving friendships. It is the third film in Smith's View Askewniverse series.The film was originally inspired by a brief scene from an early movie by a friend of Smith's. In Guinevere Turner's Go Fish, one of the lesbian characters imagines her friends passing judgment on her for ""selling out"" by sleeping with a man.",what is the movie chasing amy
<dbpedia:Whit>,Whit,"Whit, or, Isis amongst the unsaved is a novel by the Scottish writer Iain Banks, published in 1995. Isis Whit, a young but important member of a small, quirky cult in Scotland, narrates. The community suspects that Isis' cousin Morag is in danger, and sends Isis out to help.",who wrote isis amongst the unsaved
<dbpedia:Chandrakirti>,Chandrakirti,"Chandrakirti (IAST: Candrakīrti; traditional Chinese: 月称; pinyin: Yuèchēng; Japanese: Gesshō; Tibetan: ཟླ་བ་གྲགས་པ་, Wylie: zla ba grags pa;  c. 600 – c. 650) was a Buddhist scholar at Nalanda Mahavihara in Northern India. He was a disciple of Nagarjuna and a commentator on his works and those of his main disciple, Aryadeva. He was born into a Brahmin family in Samanta, South India.",where was chandrakirti from
<dbpedia:Self_(programming_language)>,Self (programming language),"Self is an object-oriented programming language based on the concept of prototypes. Self was a dialect of Smalltalk, being dynamically typed and using just-in-time compilation (JIT) as well as the prototype-based approach to objects: it was first used as an experimental test system for language design in the 1980s and 1990s. In 2006, Self was still being developed as part of the Klein project, which was a Self virtual machine written fully in Self.",what is a self
<dbpedia:Jean_de_La_Fontaine>,Jean de La Fontaine,"Jean de La Fontaine (IPA: [ʒɑ̃ də la fɔ̃tɛn]; 8 July 1621 – 13 April 1695) was the most famous French fabulist and one of the most widely read French poets of the 17th century. He is known above all for his Fables, which provided a model for subsequent fabulists across Europe and numerous alternative versions in France, and in French regional languages.According to Flaubert, he was the only French poet to understand and master the texture of the French language before Victor Hugo.",who is jean de la fontaine
<dbpedia:Self>,Self,"The self is the subject of one's own experience of phenomena: perception, emotions, thoughts. In phenomenology, it is conceived as what experiences, and there isn't any experiencing without an experiencer, the self. The self is therefore an ""immediate given"", an intrinsic dimension of the fact of experiencing phenomena.",definition of self
<dbpedia:Georg_Trakl>,Georg Trakl,Georg Trakl (3 February 1887 – 3 November 1914) was an Austrian poet and brother of the pianist Grete Trakl. He is considered one of the most important Austrian Expressionists.,when was georg trakl born
<dbpedia:Kim_(novel)>,Kim (novel),"Kim is a novel by Nobel Prize-winning English author Rudyard Kipling. It was first published serially in McClure's Magazine from December 1900 to October 1901 as well as in Cassell's Magazine from January to November 1901, and first published in book form by Macmillan & Co. Ltd in October 1901. The story unfolds against the backdrop of The Great Game, the political conflict between Russia and Britain in Central Asia.",when was the novel kim written
<dbpedia:IBM_8514>,IBM 8514,"IBM 8514 is an IBM graphics computer display standard supporting a display resolution of 1024x768 pixels with 256 colors at 43.5 Hz (interlaced), or 640x480 at 60 Hz (non-interlaced). 8514 usually refers to the display controller hardware (such as the 8514/A display adapter.) However, IBM sold the companion CRT monitor (for use with the 8514/A) which carries the same designation, 8514.8514 used a standardised programming interface called the ""Adapter Interface"" or AI.",what is ibm 8514
<dbpedia:Roy_Lichtenstein>,Roy Lichtenstein,"Roy Fox Lichtenstein (pronounced /ˈlɪktənˌstaɪn/; October 27, 1923 – September 29, 1997) was an American pop artist. During the 1960s, along with Andy Warhol, Jasper Johns, and James Rosenquist among others, he became a leading figure in the new art movement. His work defined the basic premise of pop art through parody. Favoring the comic strip as his main inspiration, Lichtenstein produced hard-edged, precise compositions that documented while it parodied often in a tongue-in-cheek manner.",who was roy lichtenstein
<dbpedia:Funeral_in_Berlin>,Funeral in Berlin,"Funeral in Berlin is a 1964 spy novel by Len Deighton. It was the third of four novels about an unnamed British agent. It was preceded by The IPCRESS File (1962) and Horse Under Water (1963), and followed by Billion-Dollar Brain (1966).",berlin funeral in berlin
<dbpedia:Mission_San_José_(California)>,Mission San José (California),"Mission San José is a Spanish mission located in the present-day city of Fremont, California. It was founded on June 11, 1797, by the Franciscan order and was the fourteenth Spanish mission established in California. The mission is the namesake of the Mission San José district of Fremont, which was an independent town subsumed into the city when it was incorporated in 1957.The Mission entered a long period of gradual decline after Mexican secularization act of 1833.",where is the mission of san jose located
<dbpedia:Billion-Dollar_Brain>,Billion-Dollar Brain,"Billion-Dollar Brain is a 1966 Cold War spy novel by Len Deighton. It was the fourth to feature an unnamed secret agent working for the British WOOC(P) intelligence agency. It follows The IPCRESS File (1962), Horse Under Water (1963), and Funeral in Berlin (1964). As in most of the author's novels, the plot of Billion-Dollar Brain (1967) is intricate, with many dead ends.",billion dollar brain
<dbpedia:Sea_lion>,Sea lion,"Sea lions are sea mammals characterized by external ear flaps, long foreflippers, the ability to walk on all fours, and short, thick hair. Together with the fur seals, they comprise the family Otariidae, eared seals, which contains six extant and one extinct species (the Japanese sea lion) in five genera. Their range extends from the subarctic to tropical waters of the global ocean in both the Northern and Southern Hemispheres, with the notable exception of the northern Atlantic Ocean.",what kind of species is a sea lion
<dbpedia:Internal_rate_of_return>,Internal rate of return,"The internal rate of return (IRR) or economic rate of return (ERR) is a rate of return used in capital budgeting to measure and compare the profitability of investments. It is also called the discounted cash flow rate of return (DCFROR). In the context of savings and loans, the IRR is also called the effective interest rate.  The term internal refers to the fact that its calculation does not incorporate environmental factors (e.g., the interest rate or inflation).",internal rate of return is also known as
<dbpedia:Steller_sea_lion>,Steller sea lion,"The Steller sea lion (Eumetopias jubatus) also known as the northern sea lion and Steller's sea lion, is a near threatened species of sea lions in the northern Pacific. It is the sole member of the genus Eumetopias and the largest of the eared seals (Otariidae). Among pinnipeds, it is inferior in size only to the walrus and the two elephant seals. The species is named for the naturalist Georg Wilhelm Steller, who first described them in 1741.",what are sea lions
<dbpedia:Asanga>,Asanga,"Asaṅga (Tibetan: ཐོགས་མེད།, Wylie: thogs med, traditional Chinese: 無著; ; pinyin: Wúzhuó; Romaji: Mujaku) was a major exponent of the Yogacara tradition in India, also called Vijñānavāda. Traditionally, he and his half-brother Vasubandhu are regarded as the founders of this school. The two half-brothers were also major exponents of Abhidharma teachings.",who founded vishnamharma
<dbpedia:Janet_Jackson>,Janet Jackson,"Janet Damita Jo Jackson (born May 16, 1966) is an American singer, songwriter, and actress. Known for a series of sonically innovative, socially conscious and sexually provocative records, as well as elaborate stage shows, television and film roles, she has been a prominent figure in popular culture for over 25 years.",who is jackson
<dbpedia:Dugong>,Dugong,"The dugong (/ˈduːɡɒŋ/, /ˈdjuːɡɒŋ/; Dugong dugon) is a medium-sized marine mammal. It is one of four living species of the order Sirenia, which also includes three species of manatees. It is the only living representative of the once-diverse family Dugongidae; its closest modern relative, Steller's sea cow (Hydrodamalis gigas), was hunted to extinction in the 18th century.",what is the dugong
<dbpedia:California_sea_lion>,California sea lion,"The California sea lion (Zalophus californianus) is a coastal eared seal native to western North America. It is one of five species of sea lion. Its natural habitat ranges from southeast Alaska to central Mexico, including the Gulf of California. Sea lions are sexually dimorphic, males are larger than females, and have a thicker neck and protruding crest. They mainly haul-out on sandy or rocky beaches, but they also frequent manmade environments such as marinas and wharves.",where does california sea lion live
<dbpedia:Bruce_Springsteen>,Bruce Springsteen,"Bruce Frederick Joseph Springsteen (born September 23, 1949) is an American musician, singer, songwriter and humanitarian. He is best known for his work with his E Street Band.",who was bruce springsteen
<dbpedia:Sediment>,Sediment,"For sediment in beverages, see dregs.Sediment is a naturally occurring material that is broken down by processes of weathering and erosion, and is subsequently transported by the action of wind, water, or ice, and/or by the force of gravity acting on the particles.",what is sediment
<dbpedia:Relationships_between_Jewish_religious_movements>,Relationships between Jewish religious movements,"The relationships between the various denominations of American Judaism can be conciliatory, welcoming, or even antagonistic.",what are the different religions
<dbpedia:Robert_Curthose>,Robert Curthose,"Robert Curthose (c. 1051 – 3 February 1134), sometimes styled Robert II or Robert III, was the Duke of Normandy from 1087 until 1106 and an unsuccessful claimant to the throne of the Kingdom of England.",who is robert curthose
<dbpedia:Fisting>,Fisting,"Fisting, handballing, fist-fucking, brachiovaginal, or brachioproctic insertion is a sexual activity that involves inserting a hand into the vagina or rectum. Once insertion is complete, the fingers are either clenched into a fist or kept straight. Fisting may be performed without a partner, but it is most often a partnered activity.",what is fist fist
<dbpedia:Inkwell>,Inkwell,"An inkwell is a small jar or container, often made of glass, porcelain, silver, brass, or pewter, used for holding ink in a place convenient for the person who is writing. The artist or writer dips the brush, quill, or dip pen into the inkwell as needed or uses the inkwell as the source for filling the reservoir of a fountain pen. An inkwell usually has a lid to prevent contamination, evaporation, accidental spillage, and excessive exposure to air.",what is an inkwell
<dbpedia:Matera>,Matera,"Matera (Italian pronunciation: [maˈteːra] or [maˈtɛːra]) is a city and a province in the region of Basilicata, in southern Italy. It is the capital of the province of Matera and the capital of Basilicata from 1663 to 1806.",where is matera italy?
<dbpedia:Ascaris_lumbricoides>,Ascaris lumbricoides,"Ascaris lumbricoides is the giant roundworm of humans, growing to a length of up to 35 cm (14 in). It is one of several species of Ascaris. An ascarid nematode of the phylum Nematoda, it is the largest and most common parasitic worm in humans. This organism is responsible for the disease ascariasis, a type of helminthiasis and one of the group of neglected tropical diseases. An estimated one-sixth of the human population is infected by A. lumbricoides or another roundworm.",what is ascaris
<dbpedia:The_Red_Shoes_(1948_film)>,The Red Shoes (1948 film),"The Red Shoes (1948) is a British feature film about a ballet dancer, written, directed and produced by the team of Michael Powell and Emeric Pressburger, known collectively as The Archers.  The movie employs the story within a story device, being about a young ballerina who joins an established ballet company and becomes the lead dancer in a new ballet called The Red Shoes, itself based on the fairy tale ""The Red Shoes"" by Hans Christian Andersen.",when was red shoes made
<dbpedia:Mogadishu>,Mogadishu,"Mogadishu (/ˌmɔːɡəˈdiːʃuː/; Somali: Muqdisho; Arabic: مقديشو‎ Maqadīshū), known locally as Xamar (English: Hamar), is the largest and capital city of Somalia. Located in the coastal Banaadir region on the Indian Ocean, the city has served as an important port for centuries. As of 2015, it has a population of 1,280,000 residents.Tradition and old records assert that southern Somalia, including the Mogadishu area, was historically inhabited by hunter-gatherers.",where is xamar somali
<dbpedia:Mission_San_Fernando_Rey_de_España>,Mission San Fernando Rey de España,"Mission San Fernando Rey de España is a Spanish mission in the Mission Hills district of Los Angeles, California. The mission was founded on September 8, 1797, and was the seventeenth of the twenty-one Spanish missions established in Alta California. Named for Saint Ferdinand, the mission is the namesake of the nearby city of San Fernando and the San Fernando Valley.The mission was secularized in 1834 and returned to the Catholic Church in 1861; it became a working church in 1920.",where is san fernando mission
<dbpedia:Homeobox>,Homeobox,"A homeobox is a DNA sequence, around 180 base pairs long, found within genes that are involved in the regulation of patterns of anatomical development (morphogenesis) in animals, fungi and plants. These genes encode homeodomain protein products that are transcription factors sharing a characteristic protein fold structure that binds DNA.",homeobox definition
<dbpedia:Association_of_American_Publishers>,Association of American Publishers,"The Association of American Publishers (AAP) is the national trade association of the American book publishing industry. AAP has more than 300 members, including most of the major commercial publishers in the United States, as well as smaller and non-profit publishers, university presses and scholarly societies. Former U.S.",what is the aap
<dbpedia:A0>,A0,"A0, A-0, A0, or a0 may refer to: 101 A0 and 103 A0, two versions of the German Heinkel Tourist moped A0, an international ISO 216 standard paper size (841 × 1189 mm), which results in an area of approximately 1 m² A0 highway (Zimbabwe), a highway which orbits Zimbabwe A0, the lowest A (musical note) note on a standard piano A0, a climbing grade A00, Irregular chess openings code in the Encyclopaedia of Chess Openings A-0 Geyser, a geyser in Yellowstone National Park A-0 System,  the first compiler ever developed for an electronic computer L'Avion, IATA airline designator for the French airline Characters of type A0, an older term for algebraic Hecke characters a0, the accepted mathematical symbol for the Bohr radius Haplogroup A00 and A0; see Haplogroup A (Y-DNA)",what is a0
<dbpedia:Application_binary_interface>,Application binary interface,"In computer software, an application binary interface (ABI) is the interface between two program modules, one of which is often a library or operating system, at the level of machine code.",what is an abi
<dbpedia:ABC_ALGOL>,ABC ALGOL,"ABC ALGOL is an extension of the Algol 60 programming language with arbitrary data structures and user-defined operators, targeted for symbolic mathematics. Despite its advances, it was never used as widely as Algol proper.",what does aglo do
<dbpedia:Abnormal_end>,Abnormal end,"An AbEnd (also abnormal end or abend) is an abnormal termination of software, or a program crash.This usage derives from an error message from the IBM OS/360, IBM zOS operating systems. Usually capitalized, but may appear as ""abend"". It is jocularly claimed to be derived from the German word ""Abend"" meaning ""evening"". Folklore stories from IBM also refer to the IBM language JCL being developed during the abortion debate in the United States.",abnormal end definition
<dbpedia:Abstract_interpretation>,Abstract interpretation,"In computer science, abstract interpretation is a theory of sound approximation of the semantics of computer programs, based on monotonic functions over ordered sets, especially lattices.",abstract definition in computer science
<dbpedia:Calamine_(mineral)>,Calamine (mineral),"This article is about calamine in mineralogy. For calamine used in calamine lotion, see calamine, for other uses of the word, see calamine (disambiguation).Calamine is a historic name for an ore of zinc.  The name calamine was derived from the Belgian town of Kelmis, whose French name is ""La Calamine"", which is home to a zinc mine.",what does calamine do
<dbpedia:Alternating_bit_protocol>,Alternating bit protocol,Alternating bit protocol (ABP) is a simple network protocol operating at the data link layer that retransmits lost or corrupted messages. It can be seen as a special case of the Sliding window protocol where  a simple timer restricts the order of messages to ensure receivers send messages in turn while using a  window of 1 bit.Messages are sent from transmitter A to receiver B. Assume that the channel from A to B is initialized and that there are no messages in transit.,what is abp protocol
<dbpedia:Bay_Area_Rapid_Transit>,Bay Area Rapid Transit,"Bay Area Rapid Transit (BART) is a rapid transit system serving the San Francisco Bay Area. The heavy-rail public transit and subway system connects San Francisco with cities in the East Bay and suburbs in northern San Mateo County. BART's rapid transit system operates five routes on 104 miles (167 km) of line, with 44 stations in four counties.",what is bats
<dbpedia:Abbreviated_Test_Language_for_All_Systems>,Abbreviated Test Language for All Systems,Abbreviated Test Language for All Systems (ATLAS) is a MILSPEC language for automatic testing of avionics equipment. It is a high-level computer language and can be used on any computer whose supporting software can translate it into the appropriate low-level instructions.,what is aatlas
<dbpedia:Automatic_baud_rate_detection>,Automatic baud rate detection,"Automatic baud rate detection (ABR, autobaud) refers to the process by which a receiving device (such as a modem) determines the speed, code level, and stop bits of incoming data by examining the first character, usually a preselected sign-on character (syncword). ABR allows the receiving device to accept data from a variety of transmitting devices operating at different speeds without needing to establish data rates in advance.",what is the baud rate detection
<dbpedia:A-0_System>,A-0 System,"The A-0 system (Arithmetic Language version 0), written by Grace Hopper in 1951 and 1952 for the UNIVAC I, was the first compiler ever developed for an electronic computer. The A-0 functioned more as a loader or linker than the modern notion of a compiler. A program was specified as a sequence of subroutines and arguments. The subroutines were identified by a numeric code and the arguments to the subroutines were written directly after each subroutine code.",what was the first program in the world?
<dbpedia:ARITH-MATIC>,ARITH-MATIC,"You may have been looking for arithmetic, a branch of mathematics.ARITH-MATIC is an extension of Grace Hopper's  A-2 programming language, developed around 1955. ARITH-MATIC was originally known as A-3, but was renamed by the marketing department of Remington Rand UNIVAC.",what does arithmatic mean
<dbpedia:8-bit_clean>,8-bit clean,"8-bit clean describes a computer system that correctly handles 8-bit character encodings, such as the ISO 8859 series and the UTF-8 encoding of Unicode.",what is 8 bit clean
<dbpedia:IBM_709/90_9PAC>,IBM 709/90 9PAC,"9PAC is a common abbreviation for 709 PACkage. It was a report generator for the developed in 1959 for the IBM 709 and used on its successor, the IBM 7090.",what is pac
<dbpedia:Abductive_reasoning>,Abductive reasoning,"Abductive reasoning (also called abduction, abductive inference or retroduction) is a form of logical inference which goes from an observation to a theory which accounts for the observation, ideally seeking to find the simplest and most likely explanation. In abductive reasoning, unlike in deductive reasoning, the premises do not guarantee the conclusion.",define abductive reasoning
<dbpedia:Benthos>,Benthos,"Benthos is the community of organisms which live on, in, or near the seabed, also known as the benthic zone. This community lives in or near marine sedimentary environments, from tidal pools along the foreshore, out to the continental shelf, and then down to the abyssal depths.Many organisms adapted to deep-water pressure cannot survive in the upper parts of the water column.",where is the benthic zone located
<dbpedia:Line-of-sight_propagation>,Line-of-sight propagation,Line-of-sight propagation is a characteristic of electromagnetic radiation or acoustic wave propagation. Electromagnetic transmission includes light emissions traveling in a straight line.,definition of acoustic and acoustic propagation
<dbpedia:Archie_search_engine>,Archie search engine,"Archie is a tool for indexing FTP archives, allowing people to find specific files. It is considered to be the first Internet search engine. The original implementation was written in 1990 by Alan Emtage, then a postgraduate student at McGill University in Montreal, and Bill Heelan, who studied at Concordia University in Montreal and worked at McGill University at the same time.",what is archie search
<dbpedia:Mission_Santa_Cruz>,Mission Santa Cruz,"Mission Santa Cruz was a Spanish mission founded by the Franciscan order in present-day Santa Cruz, California.",santa cruz mission
<dbpedia:Abort_(computing)>,Abort (computing),"In a computer or data transmission system, to abort means to terminate, usually in a controlled manner, a processing activity because it is impossible or undesirable for the activity to proceed.  Such an action may be accompanied by diagnostic information on the aborted process.In addition to being a verb, abort also has two noun senses.  In the most general case, the event of aborting can be referred to as an abort.",what is abort
<dbpedia:Nuclear_bunker_buster>,Nuclear bunker buster,"A nuclear bunker buster, also known as an earth-penetrating weapon (EPW), is the nuclear equivalent of the conventional bunker buster. The non-nuclear component of the weapon is designed to penetrate soil, rock, or concrete to deliver a nuclear warhead to an underground target. These weapons would be used to destroy hardened, underground military bunkers or other below-ground facilities.",what is the nuclear bunker buster
<dbpedia:Asynchronous_Balanced_Mode>,Asynchronous Balanced Mode,"Asynchronous Balanced Mode (ABM) is a communication mode of HDLC and derivative protocols, supporting peer-oriented point-to-point communications between two nodes, where either node can initiate transmission.For systems that work in the ABM (Asynchronous Balanced Mode), there is no master/slave relationship. Each station may initialize, supervise, recover from errors, and send frames at any time.",what is abm technology
