_id,title,text,query
<dbpedia:Patti_Smith>,Patti Smith,"Patricia Lee ""Patti"" Smith (born December 30, 1946) is an American singer-songwriter, poet and visual artist who became a highly influential component of the New York City punk rock movement with her 1975 debut album Horses.Called the ""punk poet laureate"", Smith fused rock and poetry in her work. Smith's most widely known song is ""Because the Night"", which was co-written with Bruce Springsteen. The song reached number 13 on the Billboard Hot 100 chart in 1978.",when did punk singer patti smith first appear
<dbpedia:Poland>,Poland,"Poland (Polish: Polska [ˈpɔlska]), officially the Republic of Poland (Polish: Rzeczpospolita Polska,  About this sound listen ), is a country in Central Europe, bordered by Germany to the west; the Czech Republic and Slovakia to the south; Ukraine and Belarus to the east; and the Baltic Sea, Kaliningrad Oblast (a Russian exclave) and Lithuania to the north.",where is poland located
<dbpedia:Philosophy_of_religion>,Philosophy of religion,"Philosophy of religion is a branch of philosophy concerned with questions regarding religion, including the nature and existence of God, the examination of religious experience, analysis of religious vocabulary and texts, and the relationship of religion and science.",religion definition philosophy
<dbpedia:Occidental_College>,Occidental College,"Occidental College is a private, co-educational liberal arts college located in the Eagle Rock, Los Angeles, California, United States. Founded in 1887 by clergy and members of the Presbyterian Church, it is one of the oldest liberal arts colleges on the West Coast. Occidental College is often referred to as ""Oxy"" for short.Occidental College is the oldest liberal arts college in Los Angeles and one of the few liberal arts colleges located in a major city. In 2014, U.S.",what is occidental college
<dbpedia:Papua_New_Guinea>,Papua New Guinea,"Papua New Guinea (PNG; /ˈpaːpuːə njuː ˈɡɪniː/; Tok Pisin: Papua Niugini; Hiri Motu: Papua Niu Gini), officially the Independent State of Papua New Guinea, is an Oceanian country that occupies the eastern half of the island of New Guinea and its offshore islands in Melanesia, a region of the southwestern Pacific Ocean north of Australia. Its capital, located along its southeastern coast, is Port Moresby.",where is papua new guinea
<dbpedia:Periodic_table>,Periodic table,"The periodic table is a tabular arrangement of the chemical elements, ordered by their atomic number (number of protons in the nucleus), electron configurations, and recurring chemical properties. The table also shows four rectangular blocks: s-, p- d- and f-block. In general, within one row (period) the elements are metals on the lefthand side, and non-metals on the righthand side.The rows of the table are called periods; the columns are called groups.",definition periodic table
<dbpedia:Oolong>,Oolong,"Oolong RP: /uːlɒŋ/, GA: /ulɑŋ/ (simplified Chinese: 乌龙; traditional Chinese: 烏龍; pinyin: wūlóng) is a traditional Chinese tea (Camellia sinensis) produced through a unique process including withering the plant under the strong sun and oxidation before curling and twisting. Most oolong teas, especially those of fine quality, involve unique tea plant cultivars that are exclusively used for particular varieties.",what are oolong teas called
<dbpedia:Octopus>,Octopus,"An octopus (/ˈɒktəpʊs/ or /ˈɒktəpəs/; plural: octopuses, octopi, or octopodes; see below) is a cephalopod mollusc of the order Octopoda. It has two eyes and four pairs of arms and, like other cephalopods, it is bilaterally symmetric. An octopus has a hard beak, with its mouth at the center point of the arms. An octopus has no internal or external skeleton (although some species have a vestigial remnant of a shell inside their mantles, allowing it to squeeze through tight places.",what do the octopus eat?
<dbpedia:Post_Office_Protocol>,Post Office Protocol,"In computing, the Post Office Protocol (POP) is an application-layer Internet standard protocol used by local e-mail clients to retrieve e-mail from a remote server over a TCP/IP connection. POP has been developed through several versions, with version 3 (POP3) being the last standard in common use before largely made obsolete by the more advanced IMAP.",what is pop
<dbpedia:Presidential_Medal_of_Freedom>,Presidential Medal of Freedom,"The Presidential Medal of Freedom is an award bestowed by the President of the United States and is—along with the comparable Congressional Gold Medal, bestowed by an act of U.S. Congress—the highest civilian award of the United States. It recognizes those individuals who have made ""an especially meritorious contribution to the security or national interests of the United States, world peace, cultural or other significant public or private endeavors"". The award is not limited to U.S.",which presidents have bestowed the medal of freedom on us citizens
<dbpedia:Politics>,Politics,"Politics (from Greek: πολιτικός politikos, definition ""of, for, or relating to citizens"") is the practice and theory of influencing other people. More narrowly, it refers to achieving and exercising positions of governance — organized control over a human community, particularly a state.",what is politics
<dbpedia:Paramount_Pictures>,Paramount Pictures,"Paramount Pictures Corporation (commonly known as Paramount Studios or simply Paramount, and formerly known as Famous Players-Lasky Corporation) is a film studio, television production company and motion picture distributor, consistently ranked as one of the ""Big Six"" film studios of Hollywood. It is a subsidiary of U.S. media conglomerate Viacom.",who is the studio of movie st lz
<dbpedia:Printer_(publishing)>,Printer (publishing),"In publishing, printers  are both companies providing printing services and individuals who directly operate printing presses.The profession of printer became established after the invention of the moveable type printing press by Johannes Gutenberg around 1450, and proliferated throughout Europe.",what is a printer
<dbpedia:Olympus_Mons>,Olympus Mons,"Olympus Mons /ɵˌlɪmpəs ˈmɒnz/ (Latin for Mount Olympus) is a very large shield volcano on the planet Mars. By one measure, it has a height of nearly 25 km (16 mi).  Olympus Monsstands almost three times as tall as Mount Everest's height above sea level. It is the youngest of the large volcanoes on Mars, having formed during Mars's Amazonian Period.",how tall is mount olympus on mars
<dbpedia:Oklahoma>,Oklahoma,"Oklahoma /ˌoʊkləˈhoʊmə/ (Cherokee: Asgaya gigageyi / ᎠᏍᎦᏯ ᎩᎦᎨᏱ; or translated ᎣᎦᎳᎰᎹ (òɡàlàhoma), Pawnee: Uukuhuúwa, Cayuga: Gahnawiyoˀgeh) is a state located in the South Central United States. Oklahoma is the 20th most extensive and the 28th most populous of the 50 United States. The state's name is derived from the Choctaw words okla and humma, meaning ""red people"".",where is ok located in the us
<dbpedia:Public_Enemy_(band)>,Public Enemy (band),"Public Enemy is an American hip hop group consisting of Chuck D, Flavor Flav, Professor Griff, The S1W group, Khari Wynn and DJ Lord. Formed on Long Island, New York in 1982, they are known for their politically charged lyrics and criticism of the American media, with an active interest in the frustrations and concerns of the African American community.",who are the members of the public enemy
<dbpedia:Polymer>,Polymer,"A polymer (/ˈpɒlɨmər/) (Greek poly-, ""many"" + -mer, ""parts"") is a large molecule, or macromolecule, composed of many repeated subunits. Because of their broad range of properties, both synthetic and natural polymers play an essential and ubiquitous role in everyday life. Polymers range from familiar synthetic plastics such as polystyrene to natural biopolymers such as DNA and proteins that are fundamental to biological structure and function.",what type of polymer is polystyrene polymer
<dbpedia:Oliver_Heaviside>,Oliver Heaviside,"Oliver Heaviside FRS (/ˈɒlɪvər ˈhɛvisaɪd/; 18 May 1850 – 3 February 1925) was a self-taught English electrical engineer, mathematician, and physicist who adapted complex numbers to the study of electrical circuits, invented mathematical techniques for the solution of differential equations (later found to be equivalent to Laplace transforms), reformulated Maxwell's field equations in terms of electric and magnetic forces and energy flux, and independently co-formulated vector analysis.",who invented laplace transform
<dbpedia:Treaty_on_Open_Skies>,Treaty on Open Skies,"The Treaty on Open Skies entered into force on January 1, 2002, and currently has 34 States Parties. It establishes a program of unarmed aerial surveillance flights over the entire territory of its participants. The treaty is designed to enhance mutual understanding and confidence by giving all participants, regardless of size, a direct role in gathering information about military forces and activities of concern to them.",where was the treaty on open skies passed?
<dbpedia:Perfect_competition>,Perfect competition,"In economic theory, perfect competition (sometimes called pure competition) describes markets such that no participants are large enough to have the market power to set the price of a homogeneous product. Because the conditions for perfect competition are strict, there are few if any perfectly competitive markets. Still, buyers and sellers in some auction-type markets, say for commodities or some financial assets, may approximate the concept.",what is the perfect competition in economics
<dbpedia:Preliminary_hearing>,Preliminary hearing,"Within some criminal justice systems, a preliminary hearing, preliminary examination, evidentiary hearing or probable cause hearing is a proceeding, after a criminal complaint has been filed by the prosecutor, to determine whether there is enough evidence to require a trial.",what is a preliminary court hearing
<dbpedia:Punch_and_Judy>,Punch and Judy,"Punch and Judy is a traditional, popular, and usually very violent puppet show featuring Mr. Punch and his wife, Judy. The performance consists of a sequence of short scenes, each depicting an interaction between two characters, most typically Mr Punch and one other character (who usually falls victim to Mr. Punch's club). It is often associated with traditional British seaside culture.",what is a judy show
<dbpedia:Political_philosophy>,Political philosophy,"Political philosophy, or political theory, is the study of topics such as politics, liberty, justice, property, rights, law, and the enforcement of a legal code by authority: what they are, why (or even if) they are needed, what, if anything, makes a government legitimate, what rights and freedoms it should protect and why, what form it should take and why, what the law is, and what duties citizens owe to a legitimate government, if any, and when it may be legitimately overthrown, if ever.In a vernacular sense, the term ""political philosophy"" often refers to a general view, or specific ethic, political belief or attitude, about politics, synonymous to the term ""political ideology"".Political philosophy is considered by some to be a sub-discipline of political science; however, the name generally attributed to this form of political enquiry is political theory, a discipline which has a closer methodology to the theoretical fields in the social sciences - like economic theory - than to philosophical argumentation - like that of moral philosophy or aesthetics.",what is political philosophy
<dbpedia:Programming_language>,Programming language,"A programming language is a formal constructed language designed to communicate instructions to a machine, particularly a computer. Programming languages can be used to create programs to control the behavior of a machine or to express algorithms.The earliest programming languages preceded the invention of the digital computer and were used to direct the behavior of machines such as Jacquard looms and player pianos.",what is program language
<dbpedia:Transport_in_Poland>,Transport in Poland,"Transport in Poland involves air traffic, waterways, roads and railroads.As a country located at the 'cross-roads' of Europe, Poland, with its highly developed economy, is a nation with a large and increasingly modern network of transport infrastructure.The country's most important waterway is the river Vistula. The largest seaports are the Port of Szczecin and Port of Gdańsk. Air travel is generally used for international travel, with many flights originating at Warsaw Chopin Airport.",what does poland transport
<dbpedia:Omri>,Omri,"Omri (Hebrew: עמרי, Modern Omri, Tiberian ʻOmrî) (fl. 9th century BC) was the sixth king of Israel after Jeroboam, a successful military campaigner, and the founder of the House of Omri, an Israelite royal house which included other monarchs such as Ahab, Ahaziah, Joram, and Athaliah.",who was omori
<dbpedia:Precedent>,Precedent,"In common law legal systems, a precedent or authority is a principle or rule established in a previous legal case that is either binding on or persuasive for a court or other tribunal when deciding subsequent cases with similar issues or facts. Common law legal systems place great value on deciding cases according to consistent principled rules so that similar facts will yield similar and predictable outcomes, and observance of precedent is the mechanism by which that goal is attained.",what is precedent in judicial doctrine
<dbpedia:Poker>,Poker,"Poker is a family of gambling card games involving betting and individual play, whereby the winner is determined by the ranks and combinations of players' cards, some of which remain hidden until the end of the game. Poker games vary in the number of cards dealt, the number of shared or ""community"" cards, and the number of cards that remain hidden.",poker definition
<dbpedia:Physics>,Physics,"Physics (from Ancient Greek: φυσική (ἐπιστήμη) phusikḗ (epistḗmē) ""knowledge of nature"", from φύσις phúsis ""nature"") is the natural science that involves the study of matter and its motion through space and time, along with related concepts such as energy and force. More broadly, it is the general analysis of nature, conducted in order to understand how the universe behaves.Physics is one of the oldest academic disciplines, perhaps the oldest through its inclusion of astronomy.",what does physics mean
<dbpedia:Event_(probability_theory)>,Event (probability theory),"In probability theory, an event is a set of outcomes of an experiment (a subset of the sample space) to which a probability is assigned. A single outcome may be an element of many different events, and different events in an experiment are usually not equally likely, since they may include very different groups of outcomes.",what are the main characteristics of probability theory
<dbpedia:Sample_space>,Sample space,"In probability theory, the sample space of an experiment or random trial is the set of all possible outcomes or results of that experiment. A sample space is usually denoted using set notation, and the possible outcomes are listed as elements in the set. It is common to refer to a sample space by the labels S, Ω, or U (for ""universal set"").For example, if the experiment is tossing a coin, the sample space is typically the set {head, tail}.",what is sample space
<dbpedia:Postmaster>,Postmaster,"A postmaster is the head of an individual post office. When a postmaster is responsible for an entire mail distribution organization (usually sponsored by a national government), the title of Postmaster General is commonly used.",what is a postmaster
<dbpedia:Operational_amplifier>,Operational amplifier,"An operational amplifier ""\op-amp"") is a DC-coupled high-gain electronic voltage amplifier with a differential input and, usually, a single-ended output.",what is a operational amplifier
<dbpedia:Telecommunications_in_Poland>,Telecommunications in Poland,"Telecommunications in Poland include radio, television, fixed and mobile telephones, and the Internet.",how do i know i am a poland
<dbpedia:Polynomial>,Polynomial,"In mathematics, a polynomial is an expression consisting of variables (or indeterminates) and coefficients, that involves only the operations of addition, subtraction, multiplication, and non-negative integer exponents. An example of a polynomial of a single indeterminate (or variable), x, is x2 − 4x + 7, which is a quadratic polynomial.Polynomials appear in a wide variety of areas of mathematics and science.",what is a polynomial in math
<dbpedia:Oslo>,Oslo,"Oslo  (English pronunciation: /ˈɒzloʊ/, OZ-loh, Norwegian pronunciation: [ˈuʂˈlu]  (13px listen) or, rarer [ˈusˈlu] or [ˈuʂlu]) is the capital and the most populous city in Norway. Oslo constitutes both a county and a municipality.Founded around 1000 AD, and established as a ""kaupstad"" or trading place in 1048 by King Harald III, the city was elevated to a bishopric in 1070 and a capital under Haakon V around 1300.","where is oslo, norway"
<dbpedia:Pretty_Good_Privacy>,Pretty Good Privacy,"Pretty Good Privacy (PGP) is a data encryption and decryption computer program that provides cryptographic privacy and authentication for data communication. PGP is often used for signing, encrypting, and decrypting texts, e-mails, files, directories, and whole disk partitions and to increase the security of e-mail communications. It was created by Phil Zimmermann in 1991.PGP and similar software follow the OpenPGP standard (RFC 4880) for encrypting and decrypting data.",what is pgp encryption
<dbpedia:Plotter>,Plotter,"The plotter is a computer printer for printing vector graphics.  In the past, plotters were used in applications such as computer-aided design, though they have generally been replaced with wide-format conventional printers. A plotter gives a hard copy of the output. It draws pictures on a  paper using a pen. Plotters are used to print designs of ships and machines, plans for buildings and so on.",what are plotters
<dbpedia:Nut_hand>,Nut hand,"In poker, the nut hand is the strongest possible hand in a given situation. The second-nut hand or third-nut hand (and so on) may refer to the second and third best possible hands. The term applies mostly to community card poker games where the individual holding the strongest possible hand, with the given board of community cards, is capable of knowing that they have the nut hand.",what is a nut hand
<dbpedia:Punch_(magazine)>,Punch (magazine),"Punch, or The London Charivari was a British weekly magazine of humour and satire established in 1841 by Henry Mayhew and engraver Ebenezer Landells. Historically, it was most influential in the 1840s and 1850s, when it helped to coin the term ""cartoon"" in its modern sense as a humorous illustration. After the 1940s, when its circulation peaked, it went into a long decline, closing in 1992. It was revived in 1996, but closed again in 2002.",where is the punch magazine
<dbpedia:Stripped_deck>,Stripped deck,"A stripped deck is a set of playing cards from which some cards have been removed. The removed cards are usually in the range from 2 to 9. The standard Anglo-French suited deck of 52 cards itself can be regarded as a stripped tarot deck from which the 21 numbered trumps, the fool and the 4 mounted knights have been removed. Many card games use stripped decks, and stripped decks for popular games are commercially available.",what is a stripped deck of cards
<dbpedia:Shuffling>,Shuffling,"Shuffling is a procedure used to randomize a deck of playing cards to provide an element of chance in card games. Shuffling is often followed by a cut, to help ensure that the shuffler has not manipulated the outcome.",what is a shuffling
<dbpedia:Pot_odds>,Pot odds,"In poker, pot odds are the ratio of the current size of the pot to the cost of a contemplated call. Pot odds are often compared to the probability of winning a hand with a future card in order to estimate the call's expected value.",what does pot odds mean
<dbpedia:Freeroll>,Freeroll,"In poker, a freeroll has two distinct meanings. One applies to the play of a single hand, and the other describes an entire poker tournament.",what does freeroll means
<dbpedia:Ozzie_Smith>,Ozzie Smith,"Osborne Earl ""Ozzie"" Smith (born December 26, 1954) is a retired American baseball shortstop who played in Major League Baseball (MLB) for the San Diego Padres and St. Louis Cardinals from 1978 to 1996.",who was ozzie smith
<dbpedia:Ozone>,Ozone,"Ozone /ˈoʊzoʊn/ (systematically named 1λ1,3λ1-trioxidane and catena-trioxygen), or trioxygen, is an inorganic molecule with the chemical formula O3. It is a pale blue gas with a distinctively pungent smell. It is an allotrope of oxygen that is much less stable than the diatomic allotrope O2, breaking down in the lower atmosphere to normal dioxygen.",what is trioxygen
<dbpedia:Paul_Ehrlich>,Paul Ehrlich,"About this sound Paul Ehrlich  (14 March 1854 – 20 August 1915) was a German physician and scientist who worked in the fields of hematology, immunology, and antimicrobial chemotherapy. He invented the precursor technique to Gram staining bacteria.",who was paul ehrlich
<dbpedia:Check-raise>,Check-raise,"A check-raise in poker is a common deceptive play in which a player checks early in a betting round, hoping someone else will open.  The player who checked then raises in the same round.This might be done, for example, when the first player believes that an opponent has an inferior hand and will not call a direct bet, but that they may attempt to bluff, allowing the first player to win more money than they would by betting straightforwardly.",what is a check-raise poker
<dbpedia:One_player_to_a_hand>,One player to a hand,"One player to a hand is an important poker rule designed to promote fair play that is universally applied in casino play.  It states that all game decisions about the play of each hand must be made by one player without any assistance.  This means, for example, that a player may not ask for advice from any other player or non-player during the play of the hand, nor should anyone offer such advice.",meaning of one player to a hand in poker
<dbpedia:Cards_speak>,Cards speak,"Cards speak ""\for themselves""), also known as ""cards read"" is used in two poker contexts:First, it is used to describe a high-low split game without a declaration.  That is, in a cards speak game, players all reveal their hands at the showdown, and whoever has the highest hand wins the high half of the pot and whoever has the lowest hand wins the low half.The other context is as a house rule in casino cardrooms.",what is cards speak
<dbpedia:Showdown_(poker)>,Showdown (poker),"In poker, the showdown is a situation when, if more than one player remains after the last betting round, remaining players expose and compare their hands to determine the winner or winners.To win any part of a pot if more than one player has a hand, a player must show all of his cards faceup on the table, whether they were used in the final hand played or not. Cards speak for themselves: the actual value of a player's hand prevails in the event a player mis-states the value of his hand.",what is a showdown game in poker
<dbpedia:Pseudoscience>,Pseudoscience,"Pseudoscience is a claim, belief or practice which is incorrectly presented as scientific, but does not adhere to a valid scientific method, cannot be reliably tested, or otherwise lacks scientific status.",what is pseudoscience
<dbpedia:Cut_(cards)>,Cut (cards),"After a deck of playing cards is shuffled by the dealer, it is often given to a player other than the one who performed the shuffle for a procedure called a cut. This is not to be confused with cut cards which are used in casino poker games.",what does cut mean
<dbpedia:Poseidon>,Poseidon,"Poseidon (/pɵˈsaɪdən/; Greek: Ποσειδῶν, pronounced [pose͜edɔ́͜ɔn]) is one of the twelve Olympian deities of the pantheon in Greek mythology. His main domain is the ocean, and he is called the ""God of the Sea"". Additionally, he is referred to as ""Earth-Shaker"" due to his role in causing earthquakes, and has been called the ""tamer of horses"".",what does the greek god called
<dbpedia:Physical_quantity>,Physical quantity,"A physical quantity (or ""physical magnitude"") is a physical property of a phenomenon, body, or substance, that can be quantified by measurement.",what is a physical quantity
<dbpedia:Position_(poker)>,Position (poker),"Position in poker refers to the order in which players are seated around the table and the related poker strategy implications. Players who act first are in ""early position""; players who act later are in ""late position""; players who act in between are in ""middle position"". A player ""has position"" on opponents acting before him and is ""out of position"" to opponents acting after him.",what is position in poker
<dbpedia:Peppermint>,Peppermint,"Peppermint (Mentha × piperita, also known as M. balsamea Willd.) is a hybrid mint, a cross between watermint and spearmint. The plant, indigenous to Europe and the Middle East, is now widespread in cultivation in many regions of the world.  It is found wild occasionally with its parent species.",what is a peppermint
<dbpedia:Kicker_(poker)>,Kicker (poker),"A kicker, also called a side card, is a card in a poker hand that does not itself take part in determining the rank of the hand, but that may be used to break ties between hands of the same rank. For example, the hand Q-Q-10-5-2 is ranked as a pair of queens.  The 10, 5, and 2 are kickers.  This hand would defeat any hand with no pair, or with a lower-ranking pair, and lose to any higher-ranking hand.",what is a poker kicker card
