_id,title,text,query
<dbpedia:Thealogy>,Thealogy,"Thealogy (a neologism derived from Ancient Greek θεά meaning ""Goddess"" and λόγος, -logy, meaning ""study of"") is generally understood as a discourse that reflects upon the meaning of Goddess (thea) in contrast to God (theo). As such, it is the study and reflection upon the feminine divine from a feminist perspective.Thealogy is distinguished from feminist theology, which is the study of God from a feminist perspective,  but the two fields can be seen as related and interdependent.",what is a theology
<dbpedia:Toyotomi_Hideyoshi>,Toyotomi Hideyoshi,"Toyotomi Hideyoshi (豊臣 秀吉, February 2, 1536 or March 26, 1537 – September 18, 1598) was a preeminent daimyo, warrior, general, samurai, and politician of the Sengoku period who is regarded as Japan's second ""great unifier"". He succeeded his former liege lord, Oda Nobunaga, and brought an end to the Warring States period. The period of his rule is often called the Momoyama period, named after Hideyoshi's castle.",toyotomi hideyoshi
<dbpedia:Clan_McDuck>,Clan McDuck,"The Clan McDuck is a fictional Scottish clan of cartoon ducks from which Disney character Scrooge McDuck is descended. Within the Donald Duck universe, the clan is related to the American Duck family through the marriage of Hortense McDuck and Quackmore Duck, the parents of Donald Duck.Clan McDuck was created by American comic book author Carl Barks who also created the character of Scrooge McDuck.",what is the clan mcduck
<dbpedia:Torpedo_boat>,Torpedo boat,"A torpedo boat is a relatively small and fast naval ship designed to carry torpedoes into battle. The first designs rammed enemy ships with explosive spar torpedoes, and later designs launched self-propelled Whitehead torpedoes. They were created to counter battleships and other large, slow and heavily armed ships by speed and agility.  A number of inexpensive boats attacking en masse could overwhelm a larger ship's ability to fight them off using its large, slow-firing guns.",what is a torpedo boat
<dbpedia:Thorne_Smith>,Thorne Smith,"James Thorne Smith, Jr. (March 27, 1892 – June 21, 1934) was an American writer of humorous supernatural fantasy fiction under the byline Thorne Smith. He is best known today for the two Topper novels, comic fantasy fiction involving sex, much drinking and supernatural transformations.",who is thorne smith?
<dbpedia:Turbopump>,Turbopump,"A turbopump is a propellant pump with two main components: a rotodynamic pump and a driving gas turbine, usually both mounted on the same shaft, or sometimes geared together.",what is a turbopump
<dbpedia:Taitō>,Taitō,"Taitō (台東区, Taitō-ku) is a special ward located in Tokyo Metropolis, Japan. In English, it is known as Taito City.As of May 1, 2015, the ward has an estimated population of 186,276 and a population density of 18,420 persons per km². The total area is 10.11 km². This makes Taito ward the smallest of Tokyo's wards in area, and third smallest in population.",what is taito
<dbpedia:Tod_Browning>,Tod Browning,"Tod Browning (born Charles Albert Browning, Jr.; July 12, 1880 – October 6, 1962) was an American motion picture actor, director and screenwriter. Browning's career spanned the silent and talkie eras. Best known as the director of Dracula (1931), the cult classic Freaks (1932), and classic silent film collaborations with Lon Chaney, Browning directed many movies in a wide range of genres.",who is tod browning
<dbpedia:Champion_of_the_Universe>,Champion of the Universe,"The Champion of the Universe (Tryco Slatterus) is a fictional character, appearing in Marvel Comics universe. He is not necessarily a villain but has played the role in the past through his impetuous and arrogant actions.",champion of the universe
<dbpedia:The_Life_and_Times_of_Scrooge_McDuck>,The Life and Times of Scrooge McDuck,The Life and Times of Scrooge McDuck is a serial of 12 comic book stories written and drawn by Don Rosa and first published in Uncle Scrooge #285 through #296 (1994-96). The stories chronicle the in-universe biography of Scrooge McDuck before his introduction in 1947. The stories were later collected and published together in a single volume. Rosa later published additional stories which expanded on Scrooge's biography.,who wrote the life and times of scrooge mcduck
<dbpedia:Tangent>,Tangent,"In geometry, the tangent line (or simply tangent) to a plane curve at a given point is the straight line that ""just touches"" the curve at that point. Leibniz defined it as the line through a pair of infinitely close points on the curve. More precisely, a straight line is said to be a tangent of a curve y = f (x) at a point x = c on the curve if the line passes through the point (c, f (c)) on the curve and has slope f ‍ '​(c) where f ‍ '​ is the derivative of f.",definition of tangent in geometry
<dbpedia:Trimix_(breathing_gas)>,Trimix (breathing gas),"Trimix is a breathing gas, consisting of oxygen, helium and nitrogen, and is often used in deep commercial diving, during the deep phase of dives carried out using technical diving techniques, and in advanced recreational diving.The helium is included as a substitute for some of the nitrogen, to reduce the narcotic effect of the breathing gas at depth. With a mixture of three gases it is possible to create mixes suitable for different depths or purposes by adjusting the proportions of each gas.",what is trimix
<dbpedia:Traceroute>,Traceroute,"In computing, traceroute is a computer network diagnostic tool for displaying the route (path) and measuring transit delays of packets across an Internet Protocol (IP) network. The history of the route is recorded as the round-trip times of the packets received from each successive host (remote node) in the route (path); the sum of the mean times in each hop indicates the total time spent to establish the connection.",what is traceroute
<dbpedia:Tamasay>,Tamasay,"A tamasay (or tamasai) is a bead necklace worn by Ainu women for special occasions.The necklace is called a shitoki if it has a medallion.  They are made with large glass beads the Ainu obtained through trading with Chinese merchants.  The Ainu also obtained glass beads secretly made by the Matsumae Clan. The shitoki medallion often represents the white-tailed sea eagles that the Ainu hunt.  The more strands and beads a necklace has, the more valuable it is.",what is a tamasay necklace
<dbpedia:The_Book_of_the_City_of_Ladies>,The Book of the City of Ladies,"The Book of the City of Ladies or Le Livre de la Cité des Dames  (finished by 1405), is perhaps Christine de Pizan's most famous literary work, and it is her second work of lengthy prose. Pizan uses the vernacular French language to compose the book, but she often uses Latin-style syntax and conventions within her French prose. The book serves as her formal response to Jean de Meun's popular Roman de la Rose.",where did christine de pizan's work come from
<dbpedia:Twelve-step_program>,Twelve-step program,"A twelve-step program is a set of guiding principles (sometimes accepted by members as being 'spiritual principles') outlining a course of action for tackling problems including alcoholism, drug addiction and compulsion. Originally proposed by Alcoholics Anonymous (AA) as a method of recovery from alcoholism, the original Twelve Steps were first published in the 1939 book Alcoholics Anonymous: The Story of How More Than One Hundred Men Have Recovered from Alcoholism.",which group of people was originally recommended as a method of recovery from alcoholism?
<dbpedia:Tricyclic_antidepressant>,Tricyclic antidepressant,"Tricyclic antidepressants (TCAs) are chemical compounds used primarily as antidepressants. TCAs were first discovered in the early 1950s and marketed later in the decade. They are named after their chemical structure, which contains three rings of atoms.",tca definition
<dbpedia:Technical_and_further_education>,Technical and further education,"In Australia, technical and further education or TAFE (/ˈteɪf/) institutions provide a wide range of predominantly vocational tertiary education courses, mostly qualifying courses under the National Training System/Australian Qualifications Framework/Australian Quality Training Framework.",what is tafe education
<dbpedia:Torpedo>,Torpedo,"The modern torpedo is a self-propelled weapon with an explosive warhead, launched above or below the water surface, propelled underwater towards a target, and designed to detonate either on contact with its target or in proximity to it.Historically, it was called an automotive, automobile, locomotive or fish torpedo; colloquially called a fish. The term torpedo was originally employed for a variety of devices, most of which would today be called mines.",what is a torpedo
<dbpedia:Osmotic_pressure>,Osmotic pressure,Osmotic pressure is the minimum pressure which needs to be applied to a solution to prevent the inward flow of water across a semipermeable membrane. It is also defined as the measure of the tendency of a solution to take in water by osmosis.The phenomenon of osmotic pressure arises from the propensity of a pure solvent to move through a semi-permeable membrane and into a solution containing a solute to which the membrane is impermeable.,osmotic pressure definition
<dbpedia:Twin_paradox>,Twin paradox,"In physics, the twin paradox is a thought experiment in special relativity involving identical twins, one of whom makes a journey into space in a high-speed rocket and returns home to find that the twin who remained on Earth has aged more. This result appears puzzling because each twin sees the other twin as moving, and so, according to an incorrect naive application of time dilation and the principle of relativity, each should paradoxically find the other to have aged more slowly.",what is the twin paradox
<dbpedia:Theoretical_chemistry>,Theoretical chemistry,"Theoretical chemistry seeks to provide explanations to the chemical and physical observations of molecules. Theoretical chemistry includes the fundamental laws of physics Coulomb's law, Kinetic energy, Potential energy, the virial theorem, Planck's Law, Pauli exclusion principle and many others to explain and predict chemical observed phenomena. In order to explain an observation one has to choose the ""appropriate level of theory"".",what is a theoretical method in chemistry
<dbpedia:Tertiary_education>,Tertiary education,"Tertiary education, also referred to as third stage, third level, and post-secondary education, is the educational level following the completion of a school providing a secondary education.",what is tertiary education in education
<dbpedia:Thermobaric_weapon>,Thermobaric weapon,"A thermobaric weapon is a type of explosive that utilizes oxygen from the surrounding air to generate an intense, high-temperature explosion, and in practice the blast wave typically produced by such a weapon is of a significantly longer duration than a conventional condensed explosive.",what is a thermobaric weapon
<dbpedia:Great_Tribulation>,Great Tribulation,"In Christian eschatology, the great tribulation (Greek: θλίψις μεγάλη, thlipsis megalē) is a period mentioned by Jesus in the Olivet discourse as a sign that would occur in the time of the end. At Revelation 7:14, ""the great tribulation"" (Greek: τῆς θλίψεως τῆς μεγάλης, literally, ""the tribulation, the great one"") is used to indicate the period spoken of by Jesus.",what does tribulation mean
<dbpedia:Tokamak>,Tokamak,A tokamak  (Russian: токамак) is a device using a magnetic field to confine a plasma in the shape of a torus. Achieving a stable plasma equilibrium requires magnetic field lines that move around the torus in a helical shape. Such a helical field can be generated by adding a toroidal field (traveling around the torus in circles) and a poloidal field (traveling in circles orthogonal to the toroidal field).,what is a tokamak
<dbpedia:The_nature_of_God_in_Western_theology>,The nature of God in Western theology,"The nature of God in monotheistic religions is a broad topic in Western philosophy of religion and theology, with a very old and distinguished history; it was one of the central topics in medieval philosophy.The Abrahamic faiths, Judaism, Christianity, and Islam, all affirm monotheism, or belief in one God.",what does monotheism entail
<dbpedia:Trine_Hattestad>,Trine Hattestad,"Trine Hattestad (née Elsa Katrine Solberg) is a former Norwegian javelin thrower. She was born on 18 April 1966 in Lørenskog, Norway.Hattestad made her international debut at the European Junior Championships in 1981 with a fifth place. The follow year she also competed in the European Championships for seniors. At the beginning of the 1990s, Hattestad could measure with the world top.",what is trine hattestad's first name
<dbpedia:Transcription_factor>,Transcription factor,"In molecular biology and genetics, a transcription factor (sometimes called a sequence-specific DNA-binding factor) is a protein that binds to specific DNA sequences, thereby controlling the rate of transcription of genetic information from DNA to messenger RNA.",what do dna transcription factors bind to
<dbpedia:Saddam_Hussein>,Saddam Hussein,"Saddam Hussein Abd al-Majid al-Tikriti (Arabic: صدام حسين عبد المجيد التكريتي Ṣaddām Ḥusayn ʿAbd al-Maǧīd al-Tikrītī; 28 April 1937 – 30 December 2006) was the fifth President of Iraq, serving in this capacity from 16 July 1979 until 9 April 2003.",who is president of iraq
<dbpedia:Transuranium_element>,Transuranium element,The transuranium elements (also known as transuranic elements) are the chemical elements with atomic numbers greater than 92 (the atomic number of uranium). All of these elements are unstable and decay radioactively into other elements.,what is transuranic elements
<dbpedia:Wizard_of_New_Zealand>,Wizard of New Zealand,"The Wizard of New Zealand, QSM (born Ian Brackenbury Channell; 4 December 1932) is a New Zealand educator, comedian, magician and politician, who has become something of a national icon of New Zealand.",who is wizard of new zealand?
<dbpedia:Theosophy>,Theosophy,"Theosophy (from Greek θεοσοφία theosophia, which comes from the combination of words θεός theos, God + σοφία sophia, wisdom; literally ""God's wisdom"") refers to systems of esoteric philosophy concerning, or seeking direct knowledge of, presumed mysteries of being and nature, particularly concerning the nature of divinity. Theosophy is considered a part of the broader field of esotericism, referring to hidden knowledge or wisdom that offers the individual enlightenment and salvation.",what is theosophy
<dbpedia:Trigun>,Trigun,"Trigun (Japanese: トライガン, Hepburn: Toraigan) is a Japanese manga series written and illustrated by Yasuhiro Nightow. The manga was serialized in Tokuma Shoten's Shōnen Captain in 1996 with a total of 3 collected volumes when the magazine was discontinued in 1997.",who is trigun trigun?
<dbpedia:Ted_Nelson>,Ted Nelson,"Theodor Holm Nelson (born June 17, 1937) is an American pioneer of information technology, philosopher, and sociologist. He coined the terms ""hypertext"" and ""hypermedia"" in 1963, and published them in 1965. Nelson has also been credited as being the first person to use the words transclusion, virtuality, intertwingularity, and teledildonics.",what is ted nelson's real name
<dbpedia:Tongue-twister>,Tongue-twister,"A tongue-twister is a phrase that is designed to be difficult to articulate properly, and can be used as a type of spoken (or sung) word game. Some tongue-twisters produce results which are humorous (or humorously vulgar) when they are mispronounced, while others simply rely on the confusion and mistakes of the speaker for their amusement value.",what is a tongue-twister
<dbpedia:Tragedy_of_the_anticommons>,Tragedy of the anticommons,"The tragedy of the anticommons is a type of coordination breakdown, in which a single resource has numerous rightsholders who prevent others from using it, frustrating what would be a socially desirable outcome. It is a mirror-image of the older concept of tragedy of the commons, in which numerous rightsholders' combined use exceeds the capacity of a resource and depletes or destroys it.",how tragic is the anticommons
<dbpedia:TRS-80_Color_Computer>,TRS-80 Color Computer,"The Radio Shack TRS-80 Color Computer (also marketed as the Tandy Color Computer and affectionately nicknamed CoCo) is a line of home computers based on the Motorola 6809 processor. The Color Computer was launched in 1980, and lasted through three generations of hardware until being discontinued in 1991.",when did the color computer come out
<dbpedia:Tyrrhenian_Sea>,Tyrrhenian Sea,"The Tyrrhenian Sea (Corsican: Mari Tirrenu, French: Mer Tyrrhénienne, Italian: Mar Tirreno, Neapolitan: Mar Tirreno, Sardinian: Mare Tirrenu, Sicilian: Mari Tirrenu) is part of the Mediterranean Sea off the western coast of Italy. It is named for the Tyrrhenian people, identified since the 6th century BCE with the Etruscans of Italy.",where is the tyrrhenian sea in italy
<dbpedia:Triple_J>,Triple J,Triple j is a government-funded national Australian radio station intended to appeal to listeners between the ages of 18 and 24. The station places a greater emphasis on Australian music and alternative music compared to commercial stations.Triple J is government-owned and is a division of the Australian Broadcasting Corporation.,what are triple j radio
<dbpedia:Truck>,Truck,"A truck (United States, Canada, Australia, New Zealand, South Africa, called a lorry in the United Kingdom, Ireland, and Indian Subcontinent) is a motor vehicle designed to transport cargo. Trucks vary greatly in size, power, and configuration, with the smallest being mechanically similar to an automobile.",what is truck?
<dbpedia:Trillium>,Trillium,"Trillium (trillium, wakerobin, tri flower, birthroot, birthwort) is a genus of perennial flowering plants native to temperate regions of North America and Asia.It was formerly treated in the family Trilliaceae or trillium family, a part of the Liliales or lily order. The APG III system includes Trilliaceae in the family Melanthiaceae, where can be treated as the tribe Parideae.",what is trillium
<dbpedia:Tactic_(method)>,Tactic (method),"A tactic (from the Ancient Greek τακτική taktike meaning ""art of arrangement"") is a conceptual action implemented as one or more specific tasks. The term is commonly used in business, protest and military contexts, as well as in chess, sports or other competitive activities.",what is tactic
<dbpedia:Tape-out>,Tape-out,"In electronics design, tape-out or tapeout is the final result of the design cycle for integrated circuits or printed circuit boards, the point at which the artwork for the photomask of a circuit is sent for manufacture.Some sources have indicated that the roots of the term can be traced back to the time when paper tape and later magnetic tape reels were loaded with the final electronic files used to create the photomask at the factory.",what does it mean to tape out
<dbpedia:Tandy_Corporation>,Tandy Corporation,"Tandy Leather, which later grew in to the Tandy Corporation, was a family-owned leather goods company based in Fort Worth, Texas.  Tandy Leather was founded in 1919 as a leather supply store, and acquired a number of craft retail companies, including RadioShack in 1963.  In 2000, the Tandy Corporation name was dropped and entity became the RadioShack Corporation, selling The Tandy Leather name and operating assets to The Leather Factory.",who are the founders of tandy leather
<dbpedia:Hellfire_Club>,Hellfire Club,"Hellfire Club was a name for several exclusive clubs for high society rakes established in Britain and Ireland in the 18th century. The name is most commonly used to refer to Sir Francis Dashwood's Order of the Friars of St. Francis of Wycombe. Such clubs were rumoured to be the meeting places of ""persons of quality"" who wished to take part in socially perceived immoral acts, and the members were often involved in politics.",what is a hellfire club
<dbpedia:Treaty_of_Cahuenga>,Treaty of Cahuenga,"The Treaty of Cahuenga, also called the  ""Capitulation of Cahuenga,""  ended the fighting of the Mexican-American War in Alta California in 1847.  It was not a formal treaty between nations but an informal agreement between rival military forces in which the Californios gave up fighting.  The treaty was drafted in English and Spanish by José Antonio Carrillo, approved by American Lieutenant-Colonel John C.",what was the treaty of cahuenga
<dbpedia:TAT-1>,TAT-1,"TAT-1 (Transatlantic No. 1) was the first submarine transatlantic telephone cable system. It was laid between Oban, Scotland and Clarenville, Newfoundland. Two cables were laid between 1955 and 1956 with one cable for each direction. It was inaugurated on September 25, 1956. The cable was able to carry 35 simultaneous telephone calls. A 36th channel was used to carry up to 22 telegraph lines.",when did tat fl start
<dbpedia:Turkish_cuisine>,Turkish cuisine,"Turkish cuisine (Turkish: Türk mutfağı) is largely the heritage of Ottoman cuisine, which can be described as a fusion and refinement of Central Asian, Caucasian, Middle Eastern, Mediterranean and Balkan cuisines. Turkish cuisine has in turn influenced those and other neighbouring cuisines, including those of Central and Western Europe.",what is turkish
<dbpedia:Turners>,Turners,"Turners (German: Turner), are members of German-American gymnastic clubs.A German gymnastic movement was started by Turnvater ""\father of gymnastics"") Friedrich Ludwig Jahn in the early 19th century when Germany was occupied by Napoleon. The Turnvereine (""gymnastic unions"") were not only athletic, but also political, reflecting their origin in similar ""nationalistic gymnastic"" organizations in Europe.",is turner german
"<dbpedia:Toledo,_Spain>","Toledo, Spain","Toledo (Spanish: [toˈleðo]) is a municipality located in central Spain, 70 km south of Madrid. It is the capital of the province of Toledo and the autonomous community of Castile–La Mancha.",where is toledo spain
<dbpedia:The_Sentinel_(short_story)>,The Sentinel (short story),"""The Sentinel"" is a short story written by Arthur C. Clarke in 1948 and first published in 1951, which was used as a starting point for the novel and movie 2001: A Space Odyssey, where it was modified and fused with other ideas. Clarke expressed impatience with its common description as the story the novel and movie is based on.",when was the sentinel short story published
<dbpedia:Tumbarinu>,Tumbarinu,Tumbarinu are Sardinian drums made with dog or donkey skin. They are a characteristic folk instrument of Gavoi.,what is a tumbarinu
<dbpedia:State_of_the_World_(book_series)>,State of the World (book series),The State of the World (SoW) is a series of books published annually since 1984 by the Worldwatch Institute.,what is sow?
<dbpedia:The_Book_of_the_Courtier>,The Book of the Courtier,"The Book of the Courtier (Italian: Il Cortegiano [il korteˈdʒaːno]) is a courtesy book. It was written by Baldassare Castiglione over the course of many years, beginning in 1508, and published in 1528 by the Aldine Press in Venice just before his death; an English edition was published in 1561.",who wrote the courtesy book
<dbpedia:Tavolara_Island>,Tavolara Island,"Tavolara is a small island off the northeast coast of Sardinia, Italy.  The island is a limestone massif 5 km (3 mi) long and 1 km (0.6 mi) wide, with steep cliffs except at its ends. Its highest point, Monte Cannone, is 565 metres (1,854 feet) above sea level. A cove and beach can be found at each end of the island, Spalmatore di Fuori at the northeast, and Spalmatore di Terra at the southwest.",where is tavolara
<dbpedia:Clangers>,Clangers,"Clangers is a British stop-motion animated children's television series of short stories about a family of aardvark-like creatures who live on, and inside, a small moon-like planet. They speak only in whistles, and eat green soup supplied by the Soup Dragon and blue string pudding.",who is clangers
<dbpedia:Twin_cities>,Twin cities,"Twin cities are a special case of two cities or urban centres that are founded in close geographic proximity and then grow into each other over time, losing most of their mutual buffer zone.",what is a twin city
<dbpedia:Talc>,Talc,"Talc (derived from Persian: تالک‎‎ tālk; Arabic: طلق‎ ṭalq) is a mineral composed of hydrated magnesium silicate with the chemical formula H2Mg3(SiO3)4 or Mg3Si4O10(OH)2. In loose form, it is the widely used substance known as baby powder (aka talcum). It occurs as foliated to fibrous masses, and in an exceptionally rare crystal form. It has a perfect basal cleavage, and the folia are non-elastic, although slightly flexible.",what is baby powder
<dbpedia:Transverse_myelitis>,Transverse myelitis,"Transverse myelitis is a neurological condition in which the spinal cord is inflamed. The inflammation damages nerve fibers, and causes them to lose their myelin coating leading to decreased electrical conductivity in the central nervous system.  Transverse implies that the inflammation extends across the entire width of the spinal cord. Partial transverse myelitis and partial myelitis are terms used to define inflammation of the spinal cord that affects part of the width of the spinal cord.",what is transverse myelitis
