_id,title,text,query
"<dbpedia:Braidwood,_Illinois>","Braidwood, Illinois","Braidwood is a city in Will County, Illinois, United States, approximately 53 miles (85 km) southwest of Chicago and 18 miles (29 km) south of Joliet. The population was 5,203 at the 2000 census.The Braidwood Nuclear Generating Station, a nuclear power plant currently owned by Exelon Corporation, is also located in the area (although the plant's address is actually in the nearby town of Braceville).",what county is braidwood in
"<dbpedia:Frankfort_Square,_Illinois>","Frankfort Square, Illinois","Frankfort Square is a census-designated place (CDP) in Will County, Illinois, United States. The population was 9,276 at the 2010 census.",what county is frankfort square il in
"<dbpedia:Ingalls_Park,_Illinois>","Ingalls Park, Illinois","Ingalls Park is a census-designated place and subdivision of Joliet in Will County, Illinois, United States. The population was 3,314 at the 2010 census.","what county is ingalls park, il in?"
"<dbpedia:Crete,_Illinois>","Crete, Illinois","Crete is a village in Will County, Illinois, United States. The population was 7,346 at the 2000 census. Originally named Wood's Corner, it was founded in 1836 by Vermonters Dyantha and Willard Wood.",crete il is in what county
"<dbpedia:Crystal_Lawns,_Illinois>","Crystal Lawns, Illinois","Crystal Lawns is a census-designated place (CDP) in Will County, Illinois, United States. The population was estimated to be 1,905 in the 2013 American Community Survey released by the U.S. Census Bureau.",what county is crystal lawns il in
"<dbpedia:Rockdale,_Illinois>","Rockdale, Illinois","Rockdale is a village in Will County, Illinois, United States. The population was 1,976 at the 2010 census.",where is rockdale il
"<dbpedia:Crest_Hill,_Illinois>","Crest Hill, Illinois","Crest Hill is a city in Will County, Illinois, United States. The 2010 census put Crest Hill's population at 20,837.",where is crest hill il
"<dbpedia:Lakewood_Shores,_Illinois>","Lakewood Shores, Illinois","Lakewood Shores is a census-designated place (CDP) in Will County, Illinois, United States. The population was 1,347 at the 2010 census.",what county is lakewood illinois
"<dbpedia:Goodings_Grove,_Illinois>","Goodings Grove, Illinois","Goodings Grove was a census-designated place in northern Will County, Illinois, United States. The population was 17,084 at the 2000 census. It ceased to exist as an entity upon the incorporation of the village of Homer Glen, Illinois in 2001.",what county is goodings grove il
"<dbpedia:Mokena,_Illinois>","Mokena, Illinois","Mokena is a village in Will County, Illinois, United States. The population was 14,583 at the 2000 census, with a special census conducted in 2007.  The 2007 census showed that the population of the village increased to 18,669 people residing within the corporate limits. As of the 2010 Census the population was 18,740 people",what county is mokena illinois
"<dbpedia:Symerton,_Illinois>","Symerton, Illinois","Symerton is a village in Will County, Illinois, United States. The population was 106 at the 2000 census. In 2003, the estimated population was 111. By population, it is the smallest village in Will County.",population of symerton il
"<dbpedia:Plainfield,_Illinois>","Plainfield, Illinois","Plainfield is a village in Will County, Illinois, United States. The US Census Bureau estimates the population at 41,734 as of 2013.The village includes land in Plainfield and Wheatland townships. Part of Plainfield is located in Kendall County (Na-Au-Say and Oswego townships).",what county is plainfield il
"<dbpedia:New_Lenox,_Illinois>","New Lenox, Illinois","New Lenox is a village in Will County, Illinois, United States. The village population was 24,394 as of 2010.  The Chicago Metropolitan Agency for Planning forecasts New Lenox will have a population of 90,652 in 2030.",population of new lenox il
"<dbpedia:Romeoville,_Illinois>","Romeoville, Illinois","Romeoville is a village in Will County, Illinois, United States. The population was 39,680 at the 2010 census. It is located in the southwest suburban area of Chicago near the newly constructed I-355 extension south from the Stevenson Expressway (I-55) to I-80.",where is romeoville il
"<dbpedia:Herrin,_Illinois>","Herrin, Illinois","Herrin is a city in Williamson County, Illinois, United States. The population was 12,501 at the 2010 census.","what county is herrin, il"
"<dbpedia:Preston_Heights,_Illinois>","Preston Heights, Illinois","Preston Heights is a census-designated place (CDP) in Will County, Illinois, United States. As of the 2010 census, the CDP population was 2,575.","population of preston heights, il"
"<dbpedia:Crainville,_Illinois>","Crainville, Illinois","Crainville is a village in Williamson County, Illinois, United States. The population was 992 at the 2000 census.","what county is crainville, il"
"<dbpedia:Bush,_Illinois>","Bush, Illinois","Bush is a village in Williamson County, Illinois, United States. As of the 2000 census, the village population was 257.","what county is bush, il in"
"<dbpedia:Colp,_Illinois>","Colp, Illinois","Colp is a village in Williamson County, Illinois, United States. The population was 224 at the 2000 census.","what county is colp, il"
"<dbpedia:Lockport,_Illinois>","Lockport, Illinois","Lockport is a historic city in Will County, Illinois, United States, located 30 miles southwest of Chicago. Lockport was listed on the National Register of Historic Places on May 12, 1975. The city was incorporated in 1853 and is situated along the Illinois and Michigan (I&M) Canal. Recently, it was named one of the fastest-growing suburbs in America, by Forbes Magazine.","what county is lockport, il"
"<dbpedia:Hurst,_Illinois>","Hurst, Illinois","Hurst is a city in Williamson County, Illinois, United States. The population was 795 at the 2010 census.","what county is hurst, il"
"<dbpedia:Cambria,_Illinois>","Cambria, Illinois","Cambria is a village in Williamson County, Illinois, United States. The population was 1,330 at the 2000 census.","what county is cambria, illinois in"
"<dbpedia:Johnston_City,_Illinois>","Johnston City, Illinois","Johnston City is a city in Williamson County, Illinois, United States. The population was 3,543 at the 2010 census.",what county is johnston city il in
"<dbpedia:Willowbrook,_Will_County,_Illinois>","Willowbrook, Will County, Illinois","Willowbrook is an unincorporated census-designated place in Will County, Illinois,  United States.  The population was 2,076 at the 2010 census.","what county is willowbrook, il"
"<dbpedia:Whiteash,_Illinois>","Whiteash, Illinois","Whiteash is a village in Williamson County, Illinois, United States. The population was 268 at the 2000 census, and dropped to 248 in the 2010 census.","where is whiteash, il"
"<dbpedia:Creal_Springs,_Illinois>","Creal Springs, Illinois","Creal Springs is a city in Williamson County, Illinois, United States. The population was 543 at the 2010 census.",what county is creal springs il in
"<dbpedia:Pittsburg,_Illinois>","Pittsburg, Illinois","Pittsburg is a village in Williamson County, Illinois, United States. The population was 575 at the 2000 census.",population of pittsburg illinois
"<dbpedia:Energy,_Illinois>","Energy, Illinois","Energy is a village in Williamson County, Illinois, United States. The population was 1,146 at the 2010 census.",population of energy il
"<dbpedia:Carterville,_Illinois>","Carterville, Illinois","Carterville is a city in Williamson County, Illinois, United States, geographically situated between Carbondale and Marion. The city is located next to Crab Orchard National Wildlife Refuge. The Refuge's 44,000 acres (180 km2) of land and water contain a wide diversity of flora and fauna.  As of the 2010 census, the city population was 5,496. The city is part of the Carbondale-Marion combined statistical area and city has grown considerably as a residential community of Carbondale and Marion.",where is carterville il
"<dbpedia:Shorewood,_Illinois>","Shorewood, Illinois","Shorewood is a village in Troy Township, Will County, Illinois, United States. The population was 7,686 at the 2000 census, and estimated to be 15,615 as of 2010.",where is shorewood il
"<dbpedia:Spillertown,_Illinois>","Spillertown, Illinois","Spillertown is a village in Williamson County, Illinois, United States. The population was 203 at the 2010 census.",what county is spillertown illinois in?
"<dbpedia:Pecatonica,_Illinois>","Pecatonica, Illinois","Pecatonica is a village in Winnebago County, Illinois, United States. It is part of the Rockford, Illinois Metropolitan Statistical Area. The population was 2,195 at the 2010 census, up from 1,997 in 2000.",where is pecatonica illinois
<dbpedia:Macintosh_Plus>,Macintosh Plus,"The Macintosh Plus computer is the third model in the Macintosh line, introduced on January 16, 1986, two years after the original Macintosh and a little more than a year after the Macintosh 512K, with a price tag of US$2599. As an evolutionary improvement over the 512K, it shipped with 1 MB of RAM standard, expandable to 4 MB, and an external SCSI peripheral bus, among smaller improvements.",price of a mcintosh plus
"<dbpedia:Anna,_Illinois>","Anna, Illinois","Anna is a city in Union County, Illinois. Located in Southern Illinois, the population was 4,442 at the 2010 United States Census, a decline from 5,136 in 2000. The city is known for being tied to its close neighbor Jonesboro, together known as Anna-Jonesboro. Anna is well renowned for the Anna State Mental Hospital or the Choate Mental Health Care Center.","where is anna, il"
"<dbpedia:Henning,_Illinois>","Henning, Illinois","Henning is a village in South Ross Township, Vermilion County, Illinois, United States. It is part of the Danville, Illinois Metropolitan Statistical Area. The population was 241 at the 2000 census.",what county is henning il
"<dbpedia:Belgium,_Illinois>","Belgium, Illinois","Belgium is a village in Vermilion County, Illinois, United States. It is part of the Danville, Illinois Metropolitan Statistical Area. The population was 466 at the 2000 census.","what county is belgium, il in?"
"<dbpedia:New_Milford,_Illinois>","New Milford, Illinois","New Milford is a village in Winnebago County, Illinois, United States. It is part of the Rockford, Illinois Metropolitan Statistical Area. The population was 697 at the 2010 census, up from 541 in 2000.","what county is new milford, illinois in"
"<dbpedia:Cherry_Valley,_Illinois>","Cherry Valley, Illinois","The village of Cherry Valley is a community of 8.72 square miles (22.6 km2) located in the Kishwaukee River valley, which lies primarily in Winnebago County. Approximately ten percent of the village is located within Boone County. The village is within the Rockford, Illinois Metropolitan Statistical Area, and borders the southeast side of Rockford. The population is 3,162 as of the 2010 census, up from 2,191 in 2000.",what county is cherry valley il
"<dbpedia:Tilton,_Illinois>","Tilton, Illinois","Tilton is a village in Danville Township, Vermilion County, Illinois, United States. It is part of the Danville, Illinois Metropolitan Statistical Area. The population was 2,976 at the 2000 census, and 3,061 in 2009.It is named after Charles Tilton, a friend of Abraham Lincoln, who worked for the railroads. Lincoln reputedly had Thanksgiving dinner at Tilton's house in the village in the 1850s.","what county is tilton, il"
"<dbpedia:Fairmount,_Illinois>","Fairmount, Illinois","Fairmount is a village in Vance Township, Vermilion County, Illinois, United States. It is part of the Danville, Illinois Metropolitan Statistical Area. The population was 640 at the 2000 census.","what county is fairmount, il in"
"<dbpedia:Sidell,_Illinois>","Sidell, Illinois","Sidell is a village in Sidell Township, Vermilion County, Illinois, United States. It is part of the Danville, Illinois Metropolitan Statistical Area. The population was 626 at the 2000 census.",what county is sidell il in
"<dbpedia:Rockton,_Illinois>","Rockton, Illinois","Rockton is a village in Winnebago County, Illinois, USA.  It is located in the Rock River Valley and is part of the Rockford, Illinois Metropolitan Statistical Area. The population was 7,685 at the 2010 census, up from 5,296 at the 2000 census.",what county is rockton il in
"<dbpedia:Muncie,_Illinois>","Muncie, Illinois","Muncie is a village in Oakwood Township, Vermilion County, Illinois, United States. It is part of the Danville, Illinois Metropolitan Statistical Area. The population was 155 at the 2000 census.",what county is muncie il in
"<dbpedia:Indianola,_Illinois>","Indianola, Illinois","Indianola is a village in Carroll Township, Vermilion County, Illinois, United States. It is part of the Danville, Illinois Metropolitan Statistical Area. The population was 207 at the 2000 census.",what county is indianola il in
"<dbpedia:South_Beloit,_Illinois>","South Beloit, Illinois","South Beloit is a city located in Winnebago County, Illinois, United States. It is part of the Rockford, Illinois Metropolitan Statistical Area, but it is essentially a suburban extension of Beloit, WI, which is directly along the city's northern border. At the 2010 census, the city's population was 7,892, up from 5,297 in 2000.",where is south beloit
"<dbpedia:Fithian,_Illinois>","Fithian, Illinois","Fithian is a village in Oakwood Township, Vermilion County, Illinois, United States. It is part of the Danville, Illinois Metropolitan Statistical Area. The population was 506 at the 2000 census.",what county is fithian il in
"<dbpedia:Machesney_Park,_Illinois>","Machesney Park, Illinois","Machesney Park is a village located in Winnebago County, Illinois, United States. The population was 23,499 at the 2010 census, up from 20,759 in 2000. Machesney Park is a suburb of Rockford, Il and is part of the Rockford, Illinois Metropolitan Statistical Area.",what county is machesney park il
"<dbpedia:Ridge_Farm,_Illinois>","Ridge Farm, Illinois","Ridge Farm is a village in Elwood Township, Vermilion County, Illinois, United States. It is part of the Danville, Illinois Metropolitan Statistical Area. The population was 912 at the 2000 census.",where is ridge farm illinois located
"<dbpedia:Catlin,_Illinois>","Catlin, Illinois","Catlin is a village in Vermilion County, Illinois, United States. It is part of the Danville, Illinois Metropolitan Statistical Area. The population was 2,087 at the 2000 census, and 2,086 in 2009. Current resident Chad Hays represents the 104th district of Illinois.",what county is catlin il in
"<dbpedia:Bay_View_Gardens,_Illinois>","Bay View Gardens, Illinois","Bay View Garden is a village in Woodford County, Illinois, United States. The population was 378 at the 2010 census, up from 366 at the 2000 census and is part of the Peoria, Illinois Metropolitan Statistical Area.",where is bay view gardens illinois
"<dbpedia:Oakwood,_Illinois>","Oakwood, Illinois","Oakwood is a village in Oakwood Township, Vermilion County, Illinois, United States. It is part of the Danville, Illinois Metropolitan Statistical Area. The population was 1,502 at the 2000 census, and 1,427 in 2009.","what county is oakwood, il"
"<dbpedia:Durand,_Illinois>","Durand, Illinois","Durand is a village in Winnebago County, Illinois, United States. It is part of the Rockford, Illinois Metropolitan Statistical Area The population was 1,443 at the 2010 census, up from 1,081 in 2000.","where is durand, il"
"<dbpedia:Rankin,_Illinois>","Rankin, Illinois","Rankin is a village in Butler Township, Vermilion County, Illinois, United States. It is part of the Danville, Illinois Metropolitan Statistical Area. The population was 617 at the 2000 census.",where is rankin il located
"<dbpedia:Roscoe,_Illinois>","Roscoe, Illinois","Roscoe  is a village in Winnebago County, Illinois, a suburb of Rockford. The village is in a suburban area along the Rock River. It is part of the Rockford, Illinois Metropolitan Statistical Area. As of the 2010 census, the village population was 10,785, up from 6,244 at the 2000 census. The area has been undergoing a period of rapid growth.  There have been numerous border disputes with its neighbor to the west, Rockton, Illinois and development and annexations continue by both villages.",what county is roscoe illinois
"<dbpedia:Rossville,_Illinois>","Rossville, Illinois","Rossville is a village in Ross Township, Vermilion County, Illinois, United States.  As of the 2010 census, the city population was 1,331.   It is part of the Danville, Illinois Metropolitan Statistical Area.",where is rossville illinois
"<dbpedia:Benson,_Illinois>","Benson, Illinois","Benson is a village in Woodford County, Illinois, United States. The population was 423 at the 2010 census, up from 408 at the 2000 census. It is part of the Peoria, Illinois Metropolitan Statistical Area.The village was established in 1874 with the construction of the Chicago, Pekin and Southwestern Railroad.  The town was named after S.H. Benson of Streator, Illinois, the railroad's general freight manager.",what county is benson il in
"<dbpedia:Westville,_Illinois>","Westville, Illinois","Westville is a village in Georgetown Township, Vermilion County, Illinois, United States. It is part of the Danville, Illinois Metropolitan Statistical Area. The population was 3,175 at the 2000 census, and 2,972 in 2009.",what county is westville il in
"<dbpedia:Potomac,_Illinois>","Potomac, Illinois","Potomac is a village in Vermilion County, Illinois, United States. It is part of the Danville, Illinois Metropolitan Statistical Area. The population was 681 at the 2000 census.",what county is potomac il in
"<dbpedia:Secor,_Illinois>","Secor, Illinois","Secor is a village in Woodford County, Illinois, United States. The population was 373 at the 2010 census. It is part of the Peoria, Illinois Metropolitan Statistical Area. Secor is located just off U.S. Route 24 between El Paso and Eureka.",what county is secor illinois in
"<dbpedia:Congerville,_Illinois>","Congerville, Illinois","Congerville is a village in Woodford County, Illinois, United States. The population was 474 as of the 2010 census, up from 466 at the 2000 census. Congerville is part of the Peoria, Illinois Metropolitan Statistical Area.",population of congerville il
"<dbpedia:Kappa,_Illinois>","Kappa, Illinois","Kappa is a village in Woodford County, Illinois, United States. The population was 227 at the 2010 census, up from 170 at the 2000 census. It is part of the Peoria, Illinois Metropolitan Statistical Area.In 1833 Thomas Dixon became the first settler in the Kappa area. Over the next few years, other settlers moved in around the area, and eventually a railroad was built through the area. On May 23, 1853, rail service began, and postal service began.",what county is kappa il in
"<dbpedia:Hoopeston,_Illinois>","Hoopeston, Illinois","Hoopeston is a city in Grant Township, Vermilion County, Illinois, United States.  As of the 2010 census, the city population was 5,351.  It is part of the Danville, Illinois, Metropolitan Statistical Area.",what county is hoopeston il in
"<dbpedia:Winnebago,_Illinois>","Winnebago, Illinois","Winnebago is a village in Winnebago County, Illinois. It is part of the Rockford-Winnebago Metropolitan Statistical Area. The population was 3,101 at the 2010 census, up from 2,958 in 2000.","where is winnebago, il"
"<dbpedia:Roseville,_Illinois>","Roseville, Illinois","Roseville is a village in Warren County, Illinois, United States. The population was 1,083 at the 2000 census. It is part of the Galesburg Micropolitan Statistical Area.",what county is roseville il in?
"<dbpedia:Eureka,_Illinois>","Eureka, Illinois","Eureka is a city in Olio Township, Woodford County, Illinois, United States. The population was 5,295 at the 2010 census. It is the county seat of Woodford County. Eureka is part of the Peoria, Illinois Metropolitan Statistical Area.Eureka is a small community centered on the intersection of what is now U.S. 24 and Illinois 117. It is also one of the towns along the Ronald Reagan Trail, a series of roads that connect towns in northern Illinois that were of importance to Reagan's early life.",what county is eureka il in
"<dbpedia:Minonk,_Illinois>","Minonk, Illinois","Minonk is a city in Minonk Township, Woodford County, Illinois, United States. The population was 2,078 at the 2010 census, down from 2,168 at the 2000 census. It is part of the Peoria, Illinois Metropolitan Statistical Area.The name ""Minonk"" is an Objibwa word meaning ""good place"".","what county is minonk, il"
"<dbpedia:Roanoke,_Illinois>","Roanoke, Illinois","Roanoke is a village in Roanoke Township, Woodford County, Illinois, United States. The population was 2,065 at the 2010 census, up from 1,994 at the 2000 census. It is part of the Peoria, Illinois Metropolitan Statistical Area.","population of roanoke, il"
"<dbpedia:Metamora,_Illinois>","Metamora, Illinois","Metamora is a village in Metamora Township, Woodford County, Illinois, United States. The population was 3,636 at the 2010 census. Metamora is a growing suburb of Peoria and is part of the Peoria, Illinois Metropolitan Statistical Area.",what county is metamora il
"<dbpedia:Georgetown,_Illinois>","Georgetown, Illinois","Georgetown is a city in Vermilion County, Illinois, United States.  As of the 2010 census, the city population was 3,474.  It is part of the Danville, Illinois Metropolitan Statistical Area.",where is georgetown il
"<dbpedia:Spring_Bay,_Illinois>","Spring Bay, Illinois","Spring Bay is a village in Woodford County, Illinois,  United States. As of the 2010 United States census, the village population was 452, up from 436 at the 2000 census and is part of the Peoria, Illinois Metropolitan Statistical Area.",what county is spring bay il in
"<dbpedia:Panola,_Illinois>","Panola, Illinois","Panola is a village in Woodford County, Illinois, United States. The population was 45 at the 2010 census. It is part of the Peoria, Illinois Metropolitan Statistical Area.Panola is one of the smallest communities in Illinois today. It is located about 2 miles (3.2 km) north of El Paso, along Illinois Route 251 (next to U.S. 51).",where is panola
"<dbpedia:Rockford,_Illinois>","Rockford, Illinois","Rockford is the third largest city in the U.S. state of Illinois, the 164th most populous city in the United States, and the 148th most populous region in the United States. It is the county seat of Winnebago County and is located on both banks of the Rock River in far northern Illinois.",where is rockford illinois
"<dbpedia:Germantown_Hills,_Illinois>","Germantown Hills, Illinois","Germantown Hills is a village in Woodford County, Illinois, approximately 8 miles (13 km) northeast of Peoria. Germantown Hills is the only incorporated community in Worth Township.  As of the 2010 census, the village had a total population of 3,438. Largely an agricultural community until its incorporation in 1954, Germantown Hills is now a growing bedroom community in the Peoria Metropolitan Area.",what county is germantown hills in
"<dbpedia:Wilmington,_Will_County,_Illinois>","Wilmington, Will County, Illinois","Wilmington is a city in Will County, Illinois, United States. The population was 5,134 at the 2000 census.",where is wilmington il
"<dbpedia:Marion,_Illinois>","Marion, Illinois","Marion is a city in and the county seat of Williamson County, Illinois, United States.  The population was 17,193 at the 2010 census.  It is part of a dispersed urban area that developed out of the early 20th Century coal fields.Today Marion serves as the largest retail trade center in Southern Illinois with its central location along Interstate 57 and Illinois Route 13 (colloquially known as Southern Illinois' ""Main Street"").",where is marion il located
"<dbpedia:Geneva,_Indiana>","Geneva, Indiana","Geneva is a town in Wabash Township, Adams County, Indiana, United States. The population was 1,293 at the 2010 census. Geneva is the location of the Limberlost Cabin, the home of writer and naturalist Gene Stratton Porter.",what county is geneva indiana in
"<dbpedia:Monroe,_Adams_County,_Indiana>","Monroe, Adams County, Indiana","Monroe is a town in Washington and Monroe townships, Adams County, Indiana, United States. The population was 842 at the 2010 census. Adams Central Community Schools is located in Monroe.",what county is monroe indiana in
"<dbpedia:Woodburn,_Indiana>","Woodburn, Indiana","Woodburn is a city in Maumee Township, Allen County, Indiana, United States.  The population was 1,579 at the 2000 census, making it the second smallest city in the state, after Cannelton. The population was 1,520 at the 2010 census, making it the smallest in state as Cannelton had a population of 1,563 in the 2010 Census.",what county is woodburn indiana in
"<dbpedia:Huntertown,_Indiana>","Huntertown, Indiana","Huntertown is a town in Allen County, Indiana, United States. The population was 4,810 at the 2010 census, making it one of the fastest-growing areas in northeastern Indiana, with a population increase of 172 percent since 2000.",what county is huntertown indiana in
"<dbpedia:Berne,_Indiana>","Berne, Indiana","Berne is a city in Monroe and Wabash townships, Adams County, Indiana, United States, 35 mi (56 km) south of Fort Wayne. The population was 3,999 at the 2010 census. Berne and the surrounding area have become known for their large Amish population, who speaks Bernese German which is a Swiss German dialect.",where is bernes indiana
"<dbpedia:Grabill,_Indiana>","Grabill, Indiana","Grabill is a town in Cedar Creek Township, Allen County, Indiana, United States. The population was 1,053 at the 2010 census. Today it is known for the presence of antique stores and Amish farms. An incorporated town, Grabill has two community parks within the corporate limits.",what county is grabill indiana
