_id,title,text,query
<dbpedia:Searchlight>,Searchlight,"A searchlight (or spotlight) is an apparatus that combines an extremely luminous source (traditionally a carbon arc lamp) with a mirrored parabolic reflector to project a powerful beam of light of approximately parallel rays in a particular direction, usually constructed so that it can be swiveled about.",what is searchlight?
<dbpedia:Darryl_Kile>,Darryl Kile,"Darryl Andrew Kile (December 2, 1968 – June 22, 2002) was an American Major League Baseball starting pitcher. He pitched from 1991 to 2002 for three different teams in his career. In his first season for the Cardinals, he won 20 games in 2000 as the team reached the postseason for the first time in four years. They advanced to the playoffs in the next two seasons. Kile was known for his sharp, big-breaking curveball.",what team did darryl keile start for?
<dbpedia:Delilah_and_the_Space_Rigger>,Delilah and the Space Rigger,"""Delilah and the Space Rigger"", a science fiction short story by Robert A. Heinlein, is one of his most explicitly feminist-themed short stories. One of his Future History stories, it originally appeared in Blue Book in December 1949 and was reprinted in his collection, The Green Hills of Earth (and subsequently The Past Through Tomorrow).",what year was delilah and the space rigger published
<dbpedia:Mission_San_Diego_de_Alcalá>,Mission San Diego de Alcalá,"Mission Basilica San Diego de Alcalá was the first Franciscan mission in the Las Californias Province of the Viceroyalty of New Spain. Located in present-day San Diego, California, it was founded on July 16, 1769 by Spanish friar Junípero Serra in an area long inhabited by the Kumeyaay Indians.  The mission and the surrounding area were named for the Catholic Saint Didacus, a Spaniard more commonly known as San Diego. The mission was the site of the first Christian burial in Alta California.",where is san diego mission
<dbpedia:The_Roads_Must_Roll>,The Roads Must Roll,"""The Roads Must Roll"" is a 1940 science fiction short story by Robert A. Heinlein.",who wrote the road must roll
<dbpedia:The_Long_Watch>,The Long Watch,"The Long Watch is a science fiction short story by Robert A. Heinlein. It is about a military officer who faces a coup d'état by a would-be dictator.Originally named ""Rebellion on the Moon"", the story appeared in the December 1949 American Legion Magazine. It appears in Heinlein's short story collections, The Green Hills of Earth and The Past Through Tomorrow.",how was the long watch written
<dbpedia:Life-Line>,Life-Line,"""Life-Line"" is  a short story by American author Robert A. Heinlein.  Published in the August 1939 edition of Astounding , it was Heinlein's first published short story.The protagonist, Professor Pinero, builds a machine that will predict how long a person will live.  It does this by sending a signal along the world line of a person and detecting the echo from the far end.",what is a life line
<dbpedia:It's_Great_to_Be_Back!>,It's Great to Be Back!,"""It's Great to Be Back!"" is a science fiction short story by Robert A. Heinlein. One of his Future History stories, it was first published in The Saturday Evening Post in the July 26, 1947 issue and later reprinted in The Green Hills of Earth (and subsequently The Past Through Tomorrow)..",when did it's great to be back come out
<dbpedia:Blowups_Happen>,Blowups Happen,"""Blowups Happen"" is a science fiction short story by Robert A. Heinlein.  It is one of two stories in which Heinlein, using only public knowledge of nuclear fission, anticipated the actual development of nuclear technology a few years later.",who wrote blowups happen
<dbpedia:The_Man_Who_Sold_the_Moon>,The Man Who Sold the Moon,"The Man Who Sold the Moon is a science fiction novella by Robert A. Heinlein written in 1949 and published in 1951. A part of his Future History and prequel to ""Requiem"", it covers events around a fictional first Moon landing, in 1978, and the schemes of Delos D. Harriman, a businessman who is determined to personally reach and control the Moon.",who wrote the man who sold the moon
<dbpedia:Coventry_(short_story)>,Coventry (short story),Coventry is a science fiction short story by Robert A. Heinlein and part of his Future History series.  It was collected into the book Revolt in 2100.,who is coventry
<dbpedia:Correspondence_principle>,Correspondence principle,"This article discusses quantum theory and relativity.  For other uses, see Correspondence principle (disambiguation).In physics, the correspondence principle states that the behavior of systems described by the theory of quantum mechanics (or by the old quantum theory) reproduces classical physics in the limit of large quantum numbers.",why is the correspondence principle important
<dbpedia:Experiment>,Experiment,"An experiment is an orderly procedure carried out with the goal of verifying, refuting, or establishing the validity of a hypothesis. Experiments provide insight into cause-and-effect by demonstrating what outcome occurs when a particular factor is manipulated. Experiments vary greatly in their goal and scale, but always rely on repeatable procedure and logical analysis of the results.",what does the term experiment mean?
<dbpedia:The_Green_Hills_of_Earth>,The Green Hills of Earth,"""The Green Hills of Earth"" is a science fiction short story by Robert A. Heinlein, and the title of a song, ""The Green Hills of Earth"", mentioned in several of his novels.  One of his Future History stories, the short story originally appeared in The Saturday Evening Post (February 8, 1947), and it was collected in The Green Hills of Earth (and subsequently in The Past Through Tomorrow).",what is a green hill of earth
<dbpedia:Messina>,Messina,"Messina (/məˈsiːnə/; Italian pronunciation: [mesˈsiːna], Sicilian: Missina; Latin: Messana, Greek: Μεσσήνα) is the capital of the Italian province of Messina. It is the 3rd largest city on the island of Sicily, and the 13th largest city in Italy, with a population of more than 252,000 inhabitants in the city proper and about 650,000 in the province.",what is sicily's largest town
<dbpedia:The_Robert_Heinlein_Omnibus>,The Robert Heinlein Omnibus,The Robert Heinlein Omnibus is an anthology of science fiction short stories by Robert A. Heinlein published in 1958.,when was the robert heinlein omnibus published
<dbpedia:Interpreter_(computing)>,Interpreter (computing),"In computer science, an interpreter is a computer program that directly executes, i.e. performs, instructions written in a programming or scripting language, without previously compiling them into a machine language program.",interpreters definition
<dbpedia:Girona>,Girona,"Girona (English /dʒiˈroʊnə/, Catalan: [ʒiˈɾonə], Spanish: Gerona [xeˈɾona]) is a city in the northeast of the Autonomous Community of Catalonia in Spain, at the confluence of the rivers Ter, Onyar, Galligants, and Güell and has an official population of 96,722 as of January 2011. It is the capital of the province of the same name and of the comarca of the Gironès. It is located 99 km (62 mi) northeast of Barcelona. Girona is one of the major Catalan cities.",girona spain population
<dbpedia:Searchlight_(short_story)>,Searchlight (short story),"""Searchlight"" is a very short science fiction story by Robert A. Heinlein about a little blind girl whose spaceship crashes on the Moon. The search for her takes advantage of her prodigious musical ability to locate her.It was originally written in 1962 as part of an advertisement for Hoffman Electronics.  Heinlein says that because it was so short it was much harder to write than writing novels.",who wrote the short story searchlight
<dbpedia:Charleston_(dance)>,Charleston (dance),"The Charleston is a dance named for the harbor city of Charleston, South Carolina. The rhythm was popularized in mainstream dance music in the United States by a 1923 tune called ""The Charleston"" by composer/pianist James P. Johnson which originated in the Broadway show Runnin' Wild and became one of the most popular hits of the decade. Runnin' Wild ran from 29 October 1923 through 28 June 1924. The peak year for the Charleston as a dance by the public was mid-1926 to 1927.",what dance city is charleston
<dbpedia:Economy_of_the_Netherlands>,Economy of the Netherlands,"According to the World Bank and the International Monetary Fund, the Netherlands was the 18th largest economy of the world in 2012. This for a country that has about 17 million inhabitants.  (see: List of countries by GDP (nominal)). GDP per capita is roughly $43,404 which makes it one of richest nations in the world (see: List of countries by GDP (PPP) per capita). Between 1996 and 2000 annual economic growth (GDP) averaged over 4%, well above the European average.",what is the gdp of the netherlands
<dbpedia:Ordeal_in_Space>,Ordeal in Space,"""Ordeal in Space"" is a science fiction short story by Robert A. Heinlein, originally published in Town & Country, May 1948. It is one of Heinlein's Future History stories and appears in his collection, The Green Hills of Earth.A spaceship's crewman is called to repair an antenna while his ship is still under spin. He is unable to hold on, despite supreme effort; he drifts away from the ship and has far too much time to ponder things.",what is the ordeal
<dbpedia:Murcia>,Murcia,"Murcia (/ˈmʊərsiə/ or /ˈmɜrʃⁱə/, Spanish: [ˈmuɾθja]) is  a city in south-eastern Spain, the capital and most populous city of the Autonomous Community of the Region of Murcia, and the seventh largest city in the country, with a population of 442,573 inhabitants in 2009 (about one third of the total population of the Region).",where is murcia spain
<dbpedia:Escape_Velocity_(video_game)>,Escape Velocity (video game),"Escape Velocity is a single-player role-playing space trading and combat video game series first introduced in 1996 by Ambrosia Software for the Apple Macintosh. Two other similar games based on the original, EV Override and EV Nova, followed in 1998 and 2002 respectively, the latter of which is also available on Microsoft Windows.",when did escape velocity come out
<dbpedia:If_This_Goes_On—>,If This Goes On—,"""If This Goes On—"" is a science fiction short novel by Robert A. Heinlein, first serialized in 1940 in Astounding Science-Fiction and revised and expanded for inclusion in the 1953 collection Revolt in 2100. The novel shows what might happen to Christianity in the United States given mass communications, applied psychology, and a hysterical populace. The novel is part of Heinlein's Future History series.",when was if this goes on written
<dbpedia:Derek_Parfit>,Derek Parfit,"Derek Parfit (/ˈpɑrfɪt/; born 11 December 1942) is a British philosopher who specialises in problems of personal identity, rationality, ethics, and the relations among them.His 1984 book Reasons and Persons (described by Alan Ryan in The Sunday Times as ""something close to a work of genius"") has been very influential.",deere parfit
<dbpedia:By_His_Bootstraps>,By His Bootstraps,"""By His Bootstraps"" is a science fiction short story by Robert A. Heinlein that plays with some of the inherent paradoxes that would be caused by time travel.The story was originally published in the October 1941 issue of Astounding Science Fiction under the pen name Anson MacDonald. It was reprinted in Heinlein's 1959 collection, The Menace From Earth and in several subsequent anthologies, and is now available in at least two audio editions.",who is the writer of by his bootstraps
<dbpedia:Retroreflector>,Retroreflector,A retroreflector (sometimes called a retroflector or cataphote) is a device or surface that reflects light back to its source with a minimum of scattering. In a retroreflector an electromagnetic wavefront is reflected back along a vector that is parallel to but opposite in direction from the wave's source.,define retroreflector
<dbpedia:Misfit_(short_story)>,Misfit (short story),"""Misfit"" is a science fiction short story by Robert A. Heinlein. It was originally titled Cosmic Construction Corps before being renamed by the editor John W. Campbell. The short was first published in the November 1939 issue of Astounding Science Fiction. One of the earliest of his Future History stories, it was later included in the collections Revolt in 2100 and The Past Through Tomorrow.",when was misfit created
<dbpedia:Tarragona>,Tarragona,"Tarragona (English /ˌtɑrəˈɡoʊnə/, Catalan: [tərəˈɣonə], Spanish: [taraˈɣona]; Phoenician: טַרְקוֹן, Tarqon; Latin: Tarraco) is a port city located in the north-east of Spain on the Mediterranean Sea. It is the capital of the Tarragona province, and part of the Tarragonès county and Catalonia region. Geographically, it is bordered on the north by the province of Barcelona and the province of Lleida. The city has a population of 132 199 (2014).",where is tarragona spain
<dbpedia:The_Menace_from_Earth>,The Menace from Earth,"The Menace From Earth is a science fiction short story by Robert A. Heinlein, first published in 1957.",when was the menace from earth written
<dbpedia:Red_Planet_(novel)>,Red Planet (novel),"Red Planet is a 1949 science fiction novel by Robert A. Heinlein about students at boarding school on the planet Mars. It represents the first appearance of Heinlein's idealized Martian elder race (see also Stranger in a Strange Land). The version published in 1949 featured a number of changes forced on Heinlein by Scribner's, since it was published as part of the Heinlein juveniles. After Heinlein's death, the book was reissued by Del Rey Books as the author originally intended.",when was the first book by robert heinlein released?ld
<dbpedia:—We_Also_Walk_Dogs>,—We Also Walk Dogs,"""—We Also Walk Dogs"" is a science fiction short story by Robert A. Heinlein. One of his Future History stories, it was first published in Astounding Science Fiction (July 1941 as by Anson MacDonald) and collected in The Green Hills of Earth (and subsequently The Past Through Tomorrow).It could be argued that ""We Also Walk Dogs"" was the core idea of the business model that Amazon has taken, brokering a multitude of services through their online brokerage.",which year was we also walk dogs book written
<dbpedia:United_States_Naval_Academy>,United States Naval Academy,"The United States Naval Academy (also known as USNA, Annapolis, or Navy) is a four-year coeducational federal service academy located in Annapolis, Maryland, United States. Established in 1845 under Secretary of the Navy George Bancroft, it is the second-oldest of the United States' five service academies, and educates officers for commissioning primarily into the United States Navy and United States Marine Corps.",where is the naval academy located?
<dbpedia:Kiel>,Kiel,"Kiel (German: [ˈkiːl]) is the capital and most populous city in the northern German state of Schleswig-Holstein, with a population of 240,832 (June 2014).Kiel lies approximately 90 kilometres (56 mi) north of Hamburg. Due to its geographic location in the north of Germany, the southeast of the Jutland peninsula, and the southwestern shore of the Baltic Sea, Kiel has become one of the major maritime centres of Germany.",where is kiel germany
<dbpedia:Program_counter>,Program counter,"The program counter (PC), commonly called the instruction pointer (IP) in Intel x86 and Itanium microprocessors, and sometimes called the instruction address register (IAR), the instruction counter, or just part of the instruction sequencer, is a processor register that indicates where a computer is in its program sequence.In most processors, the PC is incremented after fetching an instruction, and holds the memory address of ""\points to"") the next instruction that would be executed.",what is a computer program counter
<dbpedia:Assignment_in_Eternity>,Assignment in Eternity,"Assignment in Eternity, is a collection of four mixed science fiction and fantasy novellas by Robert A. Heinlein, first published in hardcover by Fantasy Press in 1953, with some of the stories somewhat revised from their original magazine publications, as follows: Gulf (written and published in 1949 in Astounding Science Fiction, October–November 1949).",when was assignment in eternity published
<dbpedia:List_of_highest-grossing_films>,List of highest-grossing films,"Films generate income from several revenue streams, including theatrical exhibition, home video, television broadcast rights and merchandising. However, theatrical box office earnings are the primary metric for trade publications (such as Box Office Mojo and Variety) in assessing the success of a film, mostly because of the availability of the data compared to sales figures for home video and broadcast rights, but also because of historical practice.",what is the highest grossing film
<dbpedia:Mamo_Wolde>,Mamo Wolde,"Degaga ""\Mamo"") Wolde (Afaan Oromo: Maammo Woldee) (Amharic: ደጋጋ (""ማሞ"") ዎልደ; June 12, 1932 – May 26, 2002) was an Ethiopian long distance runner who competed in track and road running events. He was also the winner of the marathon at the 1968 Summer Olympics.Wolde was born in Diri Jille to an Oromo family.  In 1951, he moved to Addis Ababa and joined the Imperial Bodyguard.",what did mammo walde win the summer olympics
<dbpedia:The_Number_of_the_Beast_(novel)>,The Number of the Beast (novel),"The Number of the Beast is a science fiction novel by Robert A. Heinlein published in 1980. The first (paperback) edition featured a cover and interior illustrations by Richard M. Powers. Excerpts from the novel were serialized in the magazine Omni (1979 October, November).",who is the author of the number of the beast
<dbpedia:Danzig_Research_Society>,Danzig Research Society,"The Danzig Research Society (German: Naturforschende Gesellschaft in Danzig, Latin: Societas Physicae Experimentalis, Polish: Gdańskie Towarzystwo Przyrodnicze) was founded in 1743 in the city of Danzig (Gdańsk), in the Polish-Lithuanian Commonwealth, and continued in existence until 1936.",where was the dandzig research society founded
<dbpedia:ISO/IEC_7816>,ISO/IEC 7816,"ISO/IEC 7816 is an international standard related to electronic identification cards with contacts, especially smart cards, managed jointly by the International Organization for Standardization (ISO) and the International Electrotechnical Commission (IEC).It is edited by the Joint technical committee (JTC) 1 / Sub-Committee (SC) 17, Cards and personal identification.The following describes the different parts of this standard.",what is iso
<dbpedia:Pamplona>,Pamplona,"Pamplona (Spanish: [pamˈplona]; French: Pampelune; English: Pampeluna) or Iruña (Basque: [iɾuɲa], alternative spelling: Iruñea, IPA: [iɾuɲea]) is the historical capital city of Navarre, in Spain, and of the former Kingdom of Navarre.The city is famous worldwide for the running of the bulls during the San Fermín festival, which is held annually from July 6 to 14.",where is navarre
<dbpedia:The_Man_Who_Sold_the_Moon_(short_story_collection)>,The Man Who Sold the Moon (short story collection),"The Man Who Sold the Moon is the title of a 1950 collection of science fiction short stories by Robert A. Heinlein.The stories, part of Heinlein's Future History series, appear in the first edition as follows: Introduction by John W. Campbell, Jr., editor of Astounding Science Fiction Foreword by Robert A.",who wrote the man who sold the moon
<dbpedia:Blast_beat>,Blast beat,"A blast beat is a drum beat that originated in jazz, and is often associated with extreme metal and grindcore. It is utilised by many different styles of metal.",what is a blast beat
<dbpedia:The_Green_Hills_of_Earth_(short_story_collection)>,The Green Hills of Earth (short story collection),"The Green Hills of Earth is a collection of science fiction short stories by Robert A. Heinlein published in 1951, although it includes short stories published as early as 1941. The stories are part of Heinlein's Future History. The title story is the tale of an old space mariner reflecting upon his planet of birth.  According to an acknowledgement at the beginning of the book, the phrase ""the green hills of Earth"" is derived from a C. L.",what genre is the green hills of earth
<dbpedia:Vallabhbhai_Patel>,Vallabhbhai Patel,"Vallabhbhai Jhaverbhai Patel (Hindi pronunciation: [ʋəlləbˈbʱaːi pəˈʈeːl], 31 October 1875 – 15 December 1950) was an Indian barrister and statesman, one of the leaders of the Indian National Congress and one of the founding fathers of the Republic of India. He was a social leader who played a leading role in the country's struggle for independence and guided its integration into a united, independent nation.",who was vallabhbhai patel
<dbpedia:Institut_d'Estudis_Catalans>,Institut d'Estudis Catalans,"The Institut d'Estudis Catalans (Catalan pronunciation: [instiˈtud dəsˈtuðis kətəˈɫans], English: ""Institute for Catalan Studies""), also known by the acronym IEC, is an academic institution which seeks to undertake research and study into ""all elements of Catalan culture"".  The IEC is known principally for its work in standardizing the Catalan language.  The Institute's current president is Salvador Giner, elected to the office for four years in June 2005, and to a second term in 2009.",what is the institute d'estudis catalans
<dbpedia:Pheasant>,Pheasant,"Pheasants (/ˈfɛzənt/) are birds of several genera within the subfamily Phasianinae, of the family Phasianidae in the order Galliformes.Pheasants are characterised by strong sexual dimorphism, males being highly ornate with bright colours and adornments such as wattles and long tails. Males are usually larger than females and have longer tails. Males play a part in rearing the young.",where do pheasants live
<dbpedia:Erysimum>,Erysimum,"Erysimum (wallflower) is a genus of flowering plants in the botanical family Brassicaceae, that includes about 180 species, both popular garden plants and many wild forms. The genus Cheiranthus is sometimes included here in whole or in part. Erysimum has recently been ascribed to a monogeneric cruciferous tribe, Erysimeae. This tribe is characterized by sessile, stellate and/or malpighiaceousTemplate:What? trichomes, yellow to orange flowers and multiseeded siliques.",erysimum meaning
<dbpedia:Revolt_in_2100>,Revolt in 2100,Revolt in 2100 is a 1953 collection by Robert A.,what is the revolt in 2100 collection
<dbpedia:Northumberland>,Northumberland,"Northumberland (RP pronunciation /nɔːˈθʌmbələnd/ local /nɔːˈθʊmbələnd/) is a county in North East England. The northernmost county of England, it borders Cumbria to the west, County Durham to the south and Scotland to the north. To the east is the North Sea coastline with a 64-mile (103 km) long distance path. The county town is Alnwick although the county council is located in Morpeth (for the moment, as there are plans to move it to nearby Ashington).",what is northumberland
<dbpedia:Trojan_Horse>,Trojan Horse,"The Trojan Horse is a tale from the Trojan War about the subterfuge that the Greeks used to enter the city of Troy and win the war. In the canonical version, after a fruitless 10-year siege, the Greeks constructed a huge wooden horse, and hid a select force of men inside. The Greeks pretended to sail away, and the Trojans pulled the horse into their city as a victory trophy.",what was the trojan horse
<dbpedia:1938_FIFA_World_Cup>,1938 FIFA World Cup,"The 1938 FIFA World Cup was the third staging of the World Cup, and was held in France from 4 to 19 June 1938. Italy retained the championship (and thus became the only team to have won two FIFA World Cups under the same coach, or Vittorio Pozzo), beating Hungary 4–2 in the final.",when did italy play in the world cup
<dbpedia:Vedea_River>,Vedea River,"The Vedea River (Romanian pronunciation: [ˈvede̯a]) in southern Romania flows from the Cotmeana Plateau and runs into the Danube, having a total length of 224 km, of which 33 km is regulated.It flows in Argeș, Olt and Teleorman counties. The towns Alexandria and Roşiori de Vede lie in the vicinity of the river.The name of the river is Dacian in origin, from Indo-European *wed, \water\"".""",where does the vedea river run
<dbpedia:Senufo_people>,Senufo people,"The Senufo (the francophone spelling Senoufo is commonly used) are an ethnolinguistic group composed of diverse subgroups of Gur-speaking people living in an area spanning from southern Mali and the extreme western corner of Burkina Faso to Katiola in Côte d'Ivoire. One group, the Nafana, is found in north-western Ghana. The Senufo number somewhere between 1.5 and 2.7 million and speak the various Senufo languages.",where are the senufo people from
<dbpedia:Van_Allen_radiation_belt>,Van Allen radiation belt,"A radiation belt is a layer of energetic charged particles that is held in place around a magnetized planet, such as the Earth, by the planet's magnetic field. The Earth has two such belts and sometimes others may be temporarily created. The discovery of the belts is credited to James Van Allen and as a result the Earth's belts bear his name. The main belts extend from an altitude of about 1,000 to 60,000 kilometers above the surface in which region radiation levels vary.",what are the two radiation belts of earth?
<dbpedia:Erysimum_'Chelsea_Jacket'>,Erysimum 'Chelsea Jacket',"Small and short-lived, Erysimum 'Chelsea Jacket' is a perennial cultivar of Erysimum cheiri usually grown for its long-lasting and brightly coloured flowers. It is closely related to Cheiranthus. This plant has been given an RHS Award of Garden Merit. Normal height is about 30 cm, prostrate habit.The plant flourishes in full sun and well-drained soil and is fairly hardy. It flowers continually from late spring to late summer.",is erysimum jacket a cheiri
