_id,title,text,query
<dbpedia:Mao_Dun>,Mao Dun,"Mao Dun (4 July 1896 - 27 March 1981) was the pen name of Shen Dehong (Shen Yanbing), a 20th-century Chinese novelist, cultural critic, and journalist. He was also the Minister of Culture of China from 1949 to 1965. He is renowned as one of the best realist novelists in the history of modern China. His most famous works are Ziye, a grand novel depicting life in cosmopolitan Shanghai, and Spring Silkworms.",who wrote spring silkworms
<dbpedia:Hever_Castle>,Hever Castle,"Hever Castle is located in the village of Hever, Kent, near  Edenbridge, 30 miles (48 km) south-east of London, England. It began as a country house, built in the 13th century. From 1462 to 1539 it was the seat of the Boleyn, originally 'Bullen', family.Anne Boleyn, the second queen consort of King Henry VIII of England, spent her early youth there, after her father, Thomas Boleyn had inherited it in 1505.",where is hever castle kent
<dbpedia:Sitar>,Sitar,"The sitar English pronunciation: /ˈsɪtɑr/ or /sɪˈtɑr/ is a plucked stringed instrument used mainly in Hindustani music and Indian classical music. The instrument is believed to have been derived from the veena, an ancient Indian instrument, which was modified by a Mughal court musician to conform with the tastes of his Mughal patrons and named after a Persian instrument called the setar (meaning three strings).",what is sitar used for
<dbpedia:James_Abbott_McNeill_Whistler>,James Abbott McNeill Whistler,"James Abbott McNeill Whistler (ˈdʒeɪmz ˈæbət məkˈniːl ˈwɪslɚ) (July 10, 1834 – July 17, 1903) was an American-born, British-based artist active during the American Gilded Age. He was averse to sentimentality and moral allusion in painting, and was a leading proponent of the credo ""art for art's sake"". His famous signature for his paintings was in the shape of a stylized butterfly possessing a long stinger for a tail.",who is abbott whisker
<dbpedia:Ulmus_americana>,Ulmus americana,"Ulmus americana, generally known as the  American elm  or, less commonly, as the white elm or water elm, is a species native to eastern North America, occurring from Nova Scotia west to Alberta and Montana, and south to Florida and central Texas. The American elm is an extremely hardy tree that can withstand winter temperatures as low as −42 °C (−44 °F). Trees in areas unaffected by Dutch elm disease can live for several hundred years.",where do white elm trees grow
<dbpedia:Irene_of_Athens>,Irene of Athens,"Irene of Athens or Irene the Athenian (Greek: Εἰρήνη ἡ Ἀθηναία; c. 752 – 9 August 803) is the commonly known name of Irene Sarantapechaina (Greek: Εἰρήνη Σαρανταπήχαινα),  Byzantine empress regnant from 797 to 802. Prior to becoming empress regnant, Irene was empress consort from 775 to 780, and empress dowager and regent from 780 to 797.",who is irene of athens
<dbpedia:John_II_Komnenos>,John II Komnenos,"John II Komnenos or Comnenus (Greek: Ίωάννης Βʹ Κομνηνός, Iōannēs II Komnēnos; September 13, 1087 – April 8, 1143) was Byzantine Emperor from 1118 to 1143. Also known as ""John the Beautiful"" or ""John the Good"" (Kaloïōannēs), he was the eldest son of Emperor Alexios I Komnenos and Irene Doukaina and the second emperor to rule during the Komnenian restoration of the Byzantine Empire.",who was komnenos
<dbpedia:M31>,M31,M31 may refer to:,what is m31
<dbpedia:Theophilos_(emperor)>,Theophilos (emperor),"Theophilos (Greek: Θεόφιλος; 813 – 20 January 842) was the Byzantine Emperor from 829 until his death in 842. He was the second emperor of the Amorian dynasty and the last emperor to support iconoclasm. Theophilos personally led the armies in his lifelong war against the Arabs, beginning in 831.",who was theophilos
<dbpedia:Natural_History_(Pliny)>,Natural History (Pliny),"The Natural History (Latin: Naturalis Historia) is an early encyclopedia in Latin by Pliny the Elder, who died in 79 AD.It is one of the largest single works to have survived from the Roman Empire to the modern day and purports to cover all ancient knowledge. The work's subject area is thus not limited to what is today understood by natural history; Pliny himself defines his scope as ""the natural world, or life"".The work is divided into 37 books, organised into ten volumes.",define natural history
<dbpedia:Real_World_Studios>,Real World Studios,"Real World Studios is a residential recording facility in Box, Wiltshire, England associated with the Real World Records record label founded by rock musician Peter Gabriel.",what city is the real world studios in
<dbpedia:Andromeda_(TV_series)>,Andromeda (TV series),"Andromeda (formally titled Gene Roddenberry's Andromeda) is a Canadian/American science fiction television series, based on unused material by the late Star Trek creator Gene Roddenberry, developed by Robert Hewitt Wolfe, and produced by Roddenberry's widow, Majel Barrett. It starred Kevin Sorbo as High Guard Captain Dylan Hunt.",who wrote andromeda
<dbpedia:Theodora_(11th_century)>,Theodora (11th century),"Theodora (Greek: Θεοδώρα, Theodōra; 980 – late August/early September 1056) was a Byzantine Empress born into the Macedonian dynasty that had ruled the Byzantine Empire for almost two hundred years. She was co-empress with her sister Zoe for two months in 1042 and sole empress regnant from 11 January 1055 to 31 August 1056. She was the last of the Macedonian line, and upon her death the empire entered a period of decline that lasted until the accession of Alexios I Komnenos in 1081.",who was theodora?
<dbpedia:Theodore_II_Laskaris>,Theodore II Laskaris,"Theodore II Doukas Laskaris or Ducas Lascaris (Greek: Θεόδωρος Β΄ Δούκας Λάσκαρις, Theodōros II Doukas Laskaris) (1221/1222 – August 16, 1258) was Emperor of Nicaea from 1254 to 1258.",when was theodore laskaris born
<dbpedia:Theodore_I_Laskaris>,Theodore I Laskaris,"Theodoros I Komnenos Laskaris (Greek: Θεόδωρος Α' Λάσκαρις, Theodōros I Laskaris; c. 1174/5 – 1221/August 1222) was the first Emperor of Nicaea (reigned 1204–1221 or 1205–1222).",who was laskaris
<dbpedia:Second_Variety>,Second Variety,"""Second Variety"" is a short story by Philip K. Dick first published in Space Science Fiction magazine, in May 1953. A nuclear war between the Soviet Union and the West has reduced much of the world to a barren wasteland. The war continues however among the scattered remains of humanity. The Western forces have developed ""claws"", which are autonomous self-replicating robots to fight on their side.",second variety book
<dbpedia:Poutine>,Poutine,"Poutine (/puːˈtiːn/; French: [putin], Quebec French:[put͡sɪn]) is a Canadian dish, originating in the province of Quebec, made with french fries and cheese curds topped with a light brown gravy-like sauce.  This fast-food dish is typically found across Canada and in some places in the northern United States, less often elsewhere.",what is poutine
"<dbpedia:Joan_of_Navarre,_Queen_of_England>","Joan of Navarre, Queen of England",Joan of Navarre (c. 1370 – 10 June 1437) was a Duchess consort of Brittany and a Queen consort of England. She was the regent of Brittany from 1399 until 1403 during the minority of her son. She was a daughter of King Charles II of Navarre and Joan of France. She was the Duchess consort of Brittany through marriage with John V of Brittany and later the Queen consort of England through marriage with King Henry IV of England.,who was joan of avanarre
<dbpedia:John_VIII_Palaiologos>,John VIII Palaiologos,"John VIII Palaiologos or Palaeologus (Greek: Ίωάννης Η' Παλαιολόγος, Iōannēs Ē' Palaiologos; 18 December 1392 – 31 October 1448), was the penultimate reigning Byzantine Emperor, ruling from 1425 to 1448.",who is palaiologos?
<dbpedia:Principle_of_relativity>,Principle of relativity,"In physics, the principle of relativity is the requirement that the equations describing the laws of physics have the same form in all admissible frames of reference.For example, in the framework of special relativity the Maxwell equations have the same form in all inertial frames of reference.",principles of relativity definition physics
<dbpedia:Exponent_(linguistics)>,Exponent (linguistics),"An exponent is a phonological manifestation of a morphosyntactic property.  In non-technical language, it is the expression of one or more grammatical properties by sound. There are several kinds of exponents:IdentityAffixationReduplicationInternal modificationSubtraction",exponent definition
<dbpedia:The_Canadas>,The Canadas,"The Canadas is the collective name for Upper Canada and Lower Canada, two British historical colonies in present-day Canada. They were both created by the Constitutional Act of 1791 and abolished in 1841 with the union of Upper and Lower Canada.Their names reflected their positions relative to the headwaters of the St.",where are the canadas located
<dbpedia:Picinae>,Picinae,"Woodpeckers are near passerine birds of the order Piciformes. They are one subfamily in the family Picidae, which also includes the piculets and wrynecks.  They are found worldwide and include about 180 species.Woodpeckers gained their English name because of the habit of some species of tapping and pecking noisily on tree trunks with their beaks and heads.",what type of bird is picinae
<dbpedia:John_VII_Palaiologos>,John VII Palaiologos,"John VII Palaiologos or Palaeologus (Greek: Ιωάννης Ζ' Παλαιολόγος, Iōannēs Z' Palaiologos; 1370 – 22 September 1408) was Byzantine Emperor for five months in 1390. While he was Emperor, there is evidence showing he used the name Andronikos, after his father, although when he was regent during his brother's absence in the West, he governed in his birth name.",what was palaiologos last name
<dbpedia:Wismar>,Wismar,"Wismar (German pronunciation: [ˈvɪsmaʁ]) is a port and hanseatic city in Northern Germany on the Baltic Sea, in the state of Mecklenburg-Vorpommern. It is located about 45 km (28 mi) east of Lübeck, 30 km (19 mi) north of Schwerin, and is part of the Hamburg Metropolitan Region. Its natural harbour, located in the Bay of Wismar, is well-protected by a promontory. The population was 42,219 in 2013.",where is wismar germany
<dbpedia:Volkswagen_Kübelwagen>,Volkswagen Kübelwagen,"The Volkswagen Kübelwagen (literally, ""bucket car"", previously mostly used for rail, industrial or agricultural hopper cars) was a light military vehicle designed by Ferdinand Porsche and built by Volkswagen during World War II for use by the German military (both Wehrmacht and Waffen-SS).",who designed the uberwagen
<dbpedia:About_a_Boy_(novel)>,About a Boy (novel),"About a Boy is a 1998 coming of age novel written by British writer Nick Hornby which has sold over a million copies. It was adapted into a 2002 film of the same name.  And, with great departure, it was the basis for an American television series in 2014 with a pilot directed by Jon Favreau.",when was about a boy novel made?
<dbpedia:Binary_symmetric_channel>,Binary symmetric channel,"A binary symmetric channel (or BSC) is a common communications channel model used in coding theory and information theory. In this model, a transmitter wishes to send a bit (a zero or a one), and the receiver receives a bit. It is assumed that the bit is usually transmitted correctly, but that it will be ""flipped"" with a small probability (the ""crossover probability""). This channel is used frequently in information theory because it is one of the simplest channels to analyze.",what is the bsc model?
<dbpedia:Anaphylaxis>,Anaphylaxis,"Anaphylaxis is a serious allergic reaction that is rapid in onset and may cause death. It typically causes a number of symptoms including an itchy rash, throat swelling, and low blood pressure. Common causes include insect bites and stings, foods, and medications.On a mechanistic level, anaphylaxis is caused by the release of mediators from certain types of white blood cells triggered by either immunologic or non-immunologic mechanisms.",what does anaphylaxis do
<dbpedia:How_the_West_Was_Won_(film)>,How the West Was Won (film),"How the West Was Won is a 1963 American Metrocolor epic-Western film. The picture was one of the last ""old-fashioned"" epic films made by Metro-Goldwyn-Mayer to enjoy great success. Set between 1839 and 1889, it follows four generations of a family (starting as the Prescotts) as they move ever westward, from western New York state to the Pacific Ocean.",how the west was won movie
<dbpedia:Leinster>,Leinster,"Leinster (/ˈlɛnstər/ — Irish: Laighin / Cúige Laighean — pronounced [ˈl̪ˠaːjɪnʲ]) is one of the Provinces of Ireland situated in the east of Ireland. It comprises the ancient Kingdoms of Mide, Osraige and Leinster.  Following the 12th-century Norman invasion of Ireland, the historic fifths of Leinster and Mide gradually merged, mainly due to the impact of the Pale, which straddled both, thereby forming the present-day province of Leinster.",where is leinster ireland
<dbpedia:Effigy_Mounds_National_Monument>,Effigy Mounds National Monument,"Effigy Mounds National Monument preserves more than 200 prehistoric mounds built by Native Americans including numerous effigy mounds shaped like animals, including bears and birds. It is located in Allamakee County and Clayton County, Iowa in the midwestern United States.",what county is effigy mounds in
<dbpedia:Michael_V_Kalaphates>,Michael V Kalaphates,"Michael V (Greek: Μιχαήλ Ε΄, Mikhaēl V; 1015 – 24 August 1042) was Byzantine emperor for four months in 1041–1042, the nephew and successor of Michael IV and the adoptive son of his wife, the Empress Zoe. He was popularly called ""the Caulker"" (Καλαφάτης, Kalaphates) in accordance with his father's original occupation.Michael V was the son of Stephen by Maria, a sister of Emperor Michael IV.",how long did michael v stay in egypt
<dbpedia:Sainte-Chapelle>,Sainte-Chapelle,"The Sainte-Chapelle (French pronunciation: ​[sɛ̃t ʃapɛl], Holy Chapel) is a royal medieval Gothic chapel, located near the Palais de la Cité, on the Île de la Cité in the heart of Paris, France.Begun some time after 1239 and consecrated on 26 April 1248, the Sainte-Chapelle is considered among the highest achievements of the Rayonnant period of Gothic architecture.",where is sainte chapelle in france
<dbpedia:Andromeda_Galaxy>,Andromeda Galaxy,"The Andromeda Galaxy (/ænˈdrɒmɨdə/), also known as Messier 31, M31, or NGC 224, is a spiral galaxy approximately 780 kiloparsecs (2.5 million light-years) from Earth. It is the nearest major galaxy to the Milky Way and was  often referred to as the Great Andromeda Nebula in older texts. It received its name from the area of the sky in which it appears, the constellation of Andromeda, which was named after the mythological princess Andromeda.",what is the closest galaxy to the milky way?
<dbpedia:Michael_VII_Doukas>,Michael VII Doukas,"Michael VII Doukas or Dukas/Ducas (Greek: Μιχαήλ Ζ΄ Δούκας, Mikhaēl VII Doukas), nicknamed Parapinakēs (Παραπινάκης), was Byzantine emperor from 1071 to 1078.",who is ducas
"<dbpedia:Black_Hawk_County,_Iowa>","Black Hawk County, Iowa","Black Hawk County is a county located in the northeastern part of U.S. state of Iowa. As of the 2010 census, the population was 131,090, making it the fourth-most populous county in Iowa. The county seat is Waterloo.Black Hawk County is included in the Waterloo-Cedar Falls, IA Metropolitan Statistical Area.",what county is waterloo iowa
<dbpedia:Michael_IV_the_Paphlagonian>,Michael IV the Paphlagonian,"Michael IV the Paphlagonian (Greek: Μιχαὴλ (Δ´) ὁ Παφλαγών, Mikhaēl ho Paphlagōn; 1010 – 10 December 1041) was Byzantine Emperor from 11 April 1034 to his death on 10 December 1041. He owed his elevation to Empress Zoe, daughter of Emperor Constantine VIII and wife of Romanos III Argyros.",when did michael iii die
<dbpedia:Yongle_Emperor>,Yongle Emperor,"The Yongle Emperor (also romanised in Wade–Giles as Yong-lo Emperor; 2 May 1360 – 12 August 1424), personal name Zhu Di, was the third emperor of the Ming dynasty in China, reigning from 1402 to 1424.Zhu Di was the fourth son of the Hongwu Emperor, the founder of the Ming dynasty. He was originally enfeoffed as the Prince of Yan (燕王) in May 1370, with the capital of his princedom at Beiping (modern Beijing).",who was yongle
<dbpedia:Michael_VI_Bringas>,Michael VI Bringas,"Michael VI Bringas (Greek: Μιχαήλ ΣΤ΄ Βρίγγας, Mikhaēl VI Bringas), called Stratiotikos or Stratioticus ""\the Military One"", ""the Warlike"" or ""the Bellicose"") or Gerontas (""the Old""), was Byzantine emperor from 1056 to 1057.",where does michael bringas from
<dbpedia:Michael_II>,Michael II,"Michael II (Greek: Μιχαήλ Β', Mikhaēl II), surnamed the Amorian (ὁ ἐξ Ἀμορίου) or the Stammerer (ὁ Τραυλός or ὁ Ψελλός), reigned as Byzantine Emperor from December 820 to his death on 2 October 829, the first ruler of the Phrygian or Amorian dynasty.Born in Amorium, Michael was a soldier, rising to high rank along with his colleague Leo V the Armenian (r. 813–820). He helped Leo overthrow and take the place of Emperor Michael I Rangabe.",what was michael ii
"<dbpedia:John_William_Friso,_Prince_of_Orange>","John William Friso, Prince of Orange","John William Friso, Prince of Orange-Nassau (Dutch: Johan Willem Friso van Oranje-Nassau; 14 August 1687 – 14 July 1711) became the titular Prince of Orange in 1702.  He was stadtholder of Friesland until his death by drowning in the Hollands Diep in 1711. Along with his wife, Marie Louise, Friso is the ancestor of all European monarchs occupying the throne today.",who is prince john of orange
<dbpedia:Hoosiers>,Hoosiers,"Hoosiers is a 1986 sports film written by Angelo Pizzo and directed by David Anspaugh. It tells the story of a small-town Indiana high school basketball team that wins the state championship. It is loosely based on the Milan High School team that won the 1954 state championship.Gene Hackman stars as Norman Dale, a new coach with a spotty past. The film co-stars Barbara Hershey and Dennis Hopper, whose role as the basketball-loving town drunk earned him an Oscar nomination.",who wrote the hoosiers
<dbpedia:The_Hospital>,The Hospital,"The Hospital is a 1971 satirical film by Paddy Chayefsky, directed by Arthur Hiller. It stars George C. Scott as Dr. Herbert Bock.  The Hospital  was written by Paddy Chayefsky, who was awarded the 1972 Academy Award for Best Original Screenplay.  Chayefsky also narrates the film and was one of the producers; he had complete control over the casting and content of the film.",who wrote the movie the hospital
<dbpedia:Ludmilla_Tourischeva>,Ludmilla Tourischeva,"Ludmilla Ivanovna Tourischeva (Russian: Людми́ла Ива́новна Тури́щева (alternative spellings: Ludmilla Turischeva; Ludmilla Tourischcheva; Ljudmila Ivanovna Turichtchieva;), born October 7, 1952) is a former Russian gymnast and a nine-time Olympic medalist for the Soviet Union.",who is ludmilla tourischeva
<dbpedia:Constantius_Chlorus>,Constantius Chlorus,"Constantius I (Latin: Marcus Flavius Valerius Constantius Herculius Augustus; 31 March c. 250 – 25 July 306) was Roman Emperor from 293 to 306, commonly known as Constantius Chlorus (Greek: Κωνστάντιος Χλωρός, Kōnstantios Khlōrós, lit. ""Constantius the Pale""). He was the father of Constantine the Great and founder of the Constantinian dynasty.As Caesar, he defeated the usurper Allectus in Britain and campaigned extensively along the Rhine frontier, defeating the Alamanni and Franks.",who is constantius chlorus
<dbpedia:Foster_Hewitt>,Foster Hewitt,"Foster William Hewitt, OC (November 21, 1902 – April 21, 1985) was a Canadian radio broadcaster most famous for his play-by-play calls for Hockey Night in Canada. He was the son of W. A. Hewitt, and the father of Bill Hewitt.",who was hewitt
<dbpedia:Hospital_(1970_film)>,Hospital (1970 film),"Hospital is an 84-minute 1970 American documentary film directed by Frederick Wiseman, which explores the daily activities of the people at Metropolitan Hospital Center, a large-city hospital, with emphasis on its emergency ward and outpatient clinics.The film won two Emmys for Outstanding Achievement in News Documentary Programming - Individuals and Outstanding Achievement in News Documentary Programming - Programs.",what year was hospital made
<dbpedia:County_Waterford>,County Waterford,"County Waterford (Irish: Contae Phort Láirge; the English name comes from Old Norse Vedrafjörður) is a county in Ireland. It is part of the South-East Region and is also located in the province of Munster. It is named after the city of Waterford, which is derived from the Old Norse name Veðrafjǫrðr or Vedrarfjord. There is an Irish-speaking area in the south of the county. Waterford City and County Council is the local authority for the county.",where is waterford ireland
<dbpedia:Berkeley_Plantation>,Berkeley Plantation,"Berkeley Plantation, one of the first great estates in America, comprises about 1,000 acres (400 ha) on the banks of the James River on State Route 5 in Charles City County, Virginia. Berkeley Plantation was originally called Berkeley Hundred and named after the Berkeley Company of England.",berkeley plantation what county
<dbpedia:Saint-Jean-Baptiste_Day>,Saint-Jean-Baptiste Day,"Saint-Jean-Baptiste Day (French: Fête de la Saint-Jean-Baptiste), officially known in Quebec as La fête nationale, (English: National Holiday) is a holiday celebrated annually on June 24, the feast day of the Nativity of St. John the Baptist. In Quebec, it is a public holiday with festivities occurring on June 23 and 24 which are publicly financed and organized by a Comité organisateur de la fête nationale (Organizing Committee of the National Holiday).",what is la fête du st jan baptiste day
<dbpedia:John_VI_Kantakouzenos>,John VI Kantakouzenos,"John VI Kantakouzenos or Cantacuzenus (Greek: Ἰωάννης ΣΤʹ Καντακουζηνός, Iōannēs ST′ Kantakouzēnos; c. 1292 – 15 June 1383) was the Byzantine emperor from 1347 to 1354.",who is king kantakouzenus?
<dbpedia:John_V_Palaiologos>,John V Palaiologos,"John V Palaiologos or Palaeologus (Greek: Ίωάννης Ε' Παλαιολόγος, Iōannēs V Palaiologos; 18 June 1332 – 16 February 1391) was a Byzantine emperor, who succeeded his father in 1341 at age eight.",who was palaiologos
<dbpedia:Justicia_brandegeeana>,Justicia brandegeeana,"Justicia brandegeeana (Mexican shrimp plant, shrimp plant or false hop) is an evergreen shrub in the genus Justicia of the family Acanthaceae, native to Mexico, and also naturalized in Florida.It grows to 1 m tall (rarely more) with spindly limbs. The leaves are oval, green, 3-7.5 cm long.",what is justicia brandegee
"<dbpedia:William_V,_Prince_of_Orange>","William V, Prince of Orange","William V, Prince of Orange (Willem Batavus; 8 March 1748 – 9 April 1806) was the last Stadtholder of the Dutch Republic. He went into exile to London in 1795. He was the reigning Prince of Nassau-Orange until his death in 1806. In that capacity he was succeeded by his son William.",who is william v
<dbpedia:The_Magic_Roundabout>,The Magic Roundabout,"The Magic Roundabout (known in the original French as Le Manège enchanté) is a French-British animated children's television programme created in France in 1963 by Serge Danot, with the help of Ivor Wood and Wood's French wife, Josiane. The series was originally broadcast between 1964 and 1971 on ORTF, originally in black-and-white.Having originally rejected the series as \charming...""",when was magic roundabout made
<dbpedia:Pac-Man>,Pac-Man,"Pac-Man (Japanese: パックマン, Hepburn: Pakkuman) is an arcade game developed by Namco and first released in Japan on May 22, 1980. It was created by Japanese video game designer Toru Iwatani. It was licensed for distribution in the United States by Midway and released in October 1980. Immensely popular from its original release to the present day, Pac-Man is considered one of the classics of the medium, virtually synonymous with video games, and an icon of 1980s popular culture.",who created pac man
<dbpedia:Numerian>,Numerian,"Numerian (Latin: Marcus Aurelius Numerius Numerianus Augustus; died November 284) was Roman Emperor from 282 to 284 with his older brother Carinus. They were sons of Carus, a general raised to the office of praetorian prefect under Emperor Probus in 282.",who was numerian
<dbpedia:Space_Invaders>,Space Invaders,"Space Invaders (スペースインベーダー, Supēsu Inbēdā) is an arcade video game developed by Tomohiro Nishikado and released in 1978. It was originally manufactured and sold by Taito in Japan, and was later licensed for production in the United States by the Midway division of Bally. Space Invaders is one of the earliest shooting games and the aim is to defeat waves of aliens with a laser cannon to earn as many points as possible.",what year was space invaders released?
<dbpedia:Enrico_Mattei>,Enrico Mattei,"Enrico Mattei (April 29, 1906 – October 27, 1962) was an Italian public administrator.  After World War II he was given the task of dismantling the Italian Petroleum Agency Agip, a state enterprise established by the Fascist regime. Instead Mattei enlarged and reorganized it into the National Fuel Trust Ente Nazionale Idrocarburi (ENI).",what was enrico mattei role in the italian regime
