_id,title,text,query
<dbpedia:Theodor_Mommsen>,Theodor Mommsen,"Christian Matthias Theodor Mommsen (30 November 1817 – 1 November 1903) was a German classical scholar, historian, jurist, journalist, politician, archaeologist and writer generally regarded as one of the greatest classicists of the 19th century. His work regarding Roman history is still of fundamental importance for contemporary research.",who is atheodor mommsen
<dbpedia:Arnemetia>,Arnemetia,"Arnemetia was a goddess in Romano-British religion. Her shrine was at Aquae Arnemetiae ""\waters of Arnemetia""), which is now Buxton in Derbyshire, England.Arnemetia's name contains Celtic elements ""are,"" meaning ""against, beside,"" and nemeton, meaning ""sacred grove."" Her name is thus interpreted as ""she who dwells in the sacred grove,"" suggesting Arnemetia may be a divine epithet rather than a name in its own right.",where is arnemetia
<dbpedia:Artio>,Artio,"Artio (Dea Artio in the Gallo-Roman religion) was a Celtic bear goddess. Evidence of her worship has notably been found at Bern. Her name is derived from the Celtic word for ""bear"", artos.",what is the dea aria god
<dbpedia:Portunus>,Portunus,"Portunus is a genus of crab which includes several important species for fisheries, such as the blue swimming crab, Portunus pelagicus and the Gazami crab, P. trituberculatus. Other species, such as the three-spotted crab (P.",what is portunus
<dbpedia:Rhodri_the_Great>,Rhodri the Great,"Rhodri ap Merfyn (c. 820–878), later known as Rhodri the Great (Welsh: Rhodri Mawr), succeeded his father, Merfyn Frych, as  King of Gwynedd in 844. Rhodri annexed Powys c. 856 and Seisyllwg c. 871. He is called ""King of the Britons"" by the Annals of Ulster. In some later histories, he is referred to as ""King of Wales"", although the title is anachronistic and his realm did not include southern Wales.",what did rhodri mean
<dbpedia:Ambisagrus>,Ambisagrus,"In Gallo-Roman religion, Ambisagrus was a Gaulish god worshipped at Aquileia in Cisalpine Gaul, where he was identified with Jupiter Optimus Maximus.The name may be composed of the Proto-Celtic prefix *ambi- ('around') and root *sagro-.John T. Koch has suggested that this Jovian epithet may originally have applied to Taranis, with allusion to the tendency of thunder near an observer to seem all-surrounding.",where was the name Ambisagrus from
<dbpedia:Diarmuid_Ua_Duibhne>,Diarmuid Ua Duibhne,"Diarmuid Ua Duibhne (Irish pronunciation: [ˈdʲiəɾˠmˠədʲ uə ˈd̪ˠʊvʲnʲə]) or Diarmid O'Dyna (also known as Diarmuid of the Love Spot), son of Donn and one of the Fianna in the Fenian Cycle of Irish mythology (traditionally set in the 2nd to 4th century). He is most famous as the lover of Gráinne, the intended wife of Fianna leader Fionn mac Cumhaill in the legend The Pursuit of Diarmuid and Gráinne.",who was the irish diarmuid
<dbpedia:Procas>,Procas,Procas or Proca (said to have reigned 817-794 BC) was one of the Latin kings of Alba Longa in the mythic tradition of the founding of Rome. He was the father of Amulius and Numitor.,who was proca
<dbpedia:Vallon-Pont-d'Arc>,Vallon-Pont-d'Arc,"Vallon-Pont-d'Arc (occitan: Valon) is a commune in the Ardèche department in southern France.Vallon-Pont-d'Arc is a capital of prehistoric and cultural tourism. This small village, peaceful in wintertime, sees its population expand ten-fold in summer. Its tourist importance largely comes from the fact that it is the departure point for the descent of the gorge of the Ardèche river (from Pont d'Arc to Saint-Martin-d'Ardeche).",what is valon french
<dbpedia:Arvernus>,Arvernus,"In Gallo-Roman religion, Arvernus was an epithet of the Gaulish Mercury. Although the name refers to the Arverni, in whose territory Mercury had at important sanctuary at the Puy-de-Dôme, all of the inscriptions to Mercury Arvernus are found farther away along the Rhenish frontier. The name is also recorded once as Mercury Arvernorix, 'king of the Arverni'. Compare also the title Mercury Dumiatis ('of the Puy-de-Dôme'), found in the territory of the Arverni.",where was the name arvernus from
<dbpedia:Andarta>,Andarta,"In Celtic polytheism, Andarta was a warrior goddess worshipped in southern Gaul. Inscriptions to her have been found in southern France and in Bern, Switzerland. She may be related to the goddess Andate, identified with Victory in Britain according to Roman historian Cassius Dio. Like the similar goddess Artio, she may have been associated with the bear.",andarta meaning
<dbpedia:Andraste>,Andraste,"Andraste, also known as Andrasta or Andred, was, according to the Roman historian Dio Cassius, an Icenic war goddess invoked by Boudica in her fight against the Roman occupation of Britain in AD 60. She may be the same as Andate, mentioned later by the same source, and described as ""their name for Victory"": i.e., the goddess Victoria. Thayer asserts that she may be related to Andarta also.",what is andrasta
<dbpedia:Badb>,Badb,"In Irish mythology, the Badb (Old Irish, pronounced [ˈbaðβ]) or Badhbh (Modern Irish, pronounced [ˈbəiv])—meaning ""crow""—is a war goddess who takes the form of a crow, and is thus sometimes known as Badb Catha (""battle crow"").  She is known to cause fear and confusion among soldiers to move the tide of battle to her favoured side. Badb may also appear prior to a battle to foreshadow the extent of the carnage to come, or to predict the death of a notable person.",where is badb?
<dbpedia:PSOS_(real-time_operating_system)>,PSOS (real-time operating system),"pSOS (Portable Software On Silicon) is a real time operating system (RTOS), created in about 1982 by Alfred Chao, and developed/marketed for the first part of its life by his company Software Components Group (SCG). In the 1980s pSOS rapidly became the RTOS of choice for all embedded systems based on the Motorola 68000 family architecture, because it was written in 68000 assembler and was highly optimised from the start.",what is psos software
<dbpedia:Arawn>,Arawn,"In Welsh mythology, Arawn was the king of the otherworld realm of Annwn, appearing prominently in the first branch, and alluded to in the fourth. In later tradition, the role of king of Annwn was largely attributed to the Welsh psychopomp, Gwyn ap Nudd.",what is an arawn
<dbpedia:Afallach>,Afallach,"Afallach (Old Welsh Aballac) is man's name found in several medieval Welsh genealogies, where he is made the son of Beli Mawr. According to a medieval Welsh triad, Afallach was the father of the goddess Modron.",what is afallach
<dbpedia:Anextiomarus>,Anextiomarus,"Anextiomarus is a Celtic epithet of the sun-god Apollo recorded in a Romano-British inscription from South Shields, England. The form is a variant of Anextlomarus 'Great protector', a divine style or name attested in a fragmentary Gallo-Roman dedication from Le Mans, France. Anextlomarus is also attested as a Gaulish man's father's name at Langres, and a feminine divine form, Anextlomara, appears in two other Gallo-Roman dedications from Avenches, Switzerland.",what does anextiomarus mean
"<dbpedia:Aubusson,_Creuse>","Aubusson, Creuse","Aubusson (French pronunciation: ​[o.by.sɔ̃]; Occitan: Lo Buçon, formerly Aubuçon) is a commune in the Creuse department in the Limousin region in central France.",what is aubusson limouxin
<dbpedia:Julia_Margaret_Cameron>,Julia Margaret Cameron,"Julia Margaret Cameron (née Pattle; 11 June 1815 in Calcutta – 26 January 1879) was a British photographer. She became known for her portraits of celebrities of the time, and for photographs with Arthurian and other legendary or heroic themes.Cameron's photographic career was short, spanning eleven years of her life (1864–1875).",what was julia cameron famous for
<dbpedia:Prepared_piano>,Prepared piano,A prepared piano is a piano that has had its sound altered by placing objects (called preparations) on or between the strings.,define prepared piano
<dbpedia:New_England_Confederation>,New England Confederation,"The United Colonies of New England, commonly known as the New England Confederation, was a short-lived military alliance of the English colonies of Massachusetts Bay, Plymouth, Connecticut, and New Haven. Its primary purpose was to unite the Puritan colonies in support of the church, and for defense against the Native Americans and the Dutch colonies of New Netherland.  It was established as a direct result of a war that started between the Mohegan and Narragansetts.",what were the colonial states that were united
<dbpedia:Gates_of_Cairo>,Gates of Cairo,"The Gates of Cairo were gates at portals in the city walls of medieval Islamic Cairo, within the present day city of Cairo, Egypt.The city of Cairo was founded in 969 CE by  Gawhar al-Siqilli, as the royal city of the Fatimid Caliphate, with a defensive wall.  In 1092, Al-Afdal Shahanshah—Badr al-Jamali built a second wall around Cairo. The double walled city had a significant number of fortified gates at the portals protecting both the inner and outer city areas.",where is cairo egypt now
<dbpedia:Pwyll>,Pwyll,"Pwyll Pen Annwn is a prominent figure in Welsh mythology and literature, the lord of Dyfed, husband of Rhiannon and father of the hero Pryderi. He is the eponymous hero of Pwyll Pendefig Dyfed, the first branch of the Four Branches of the Mabinogi, and also appears briefly as a member of Arthur's court in the medieval tale Culhwch ac Olwen. Pwyll, Prince of Dyfed also carries many similarities to the Mabinogi Branwen.",who was pwyll pen
<dbpedia:Binoculars>,Binoculars,"Binoculars, field glasses or binocular telescopes are a pair of identical or mirror-symmetrical telescopes mounted side-by-side and aligned to point accurately in the same direction, allowing the viewer to use both eyes (binocular vision) when viewing distant objects.",what is a binocular telescope
<dbpedia:Aengus>,Aengus,"In Irish mythology, Aengus (Old Irish: Oíngus, Óengus) is a member of the Tuatha Dé Danann and probably a god of love, youth and poetic inspiration. He is traditionally described as having singing birds circling his head.",who is aengus
<dbpedia:Ancamna>,Ancamna,"In Gallo-Roman religion, Ancamna was a goddess worshipped particularly in the valley of the Moselle River. She was commemorated at Trier and Ripsdorf as the consort of Lenus Mars, and at Möhn as the consort of Mars Smertulitanus. At Trier, altars were set up in honour of Lenus Mars, Ancamna and the genii of various pagi of the Treveri, giving the impression of Lenus Mars and Ancamna as tribal protectors honoured in an officially organized cult.",definition ancamna
<dbpedia:Milton_S._Hershey>,Milton S. Hershey,"Milton Snavely Hershey (September 13, 1857 – October 13, 1945) was an American confectioner, philanthropist, and founder of The Hershey Chocolate Company and the ""company town"" of Hershey, Pennsylvania.He was honored by the United States Postal Service with the issue on September 13, 1995 of a 32¢ Great Americans series (1980–2000)  definitive postage stamp (Scott #2933).",where was meryl hershey born
<dbpedia:Fulton_Opera_House>,Fulton Opera House,"The Fulton Opera House, also known as the Fulton Theatre or simply The Fulton, is a League of Regional Theatres class C regional theater located in historic downtown Lancaster, Pennsylvania.",what city is the fulton theatre in
<dbpedia:Modron>,Modron,"Modron ""\mother"") is a figure in Welsh tradition, known as the mother of the hero Mabon ap Modron. Both characters may have derived from earlier divine figures, in her case the Gaulish goddess Matrona. She may have been a prototype for Morgan le Fay from the Arthurian legend.",who is modron
<dbpedia:Gwawl>,Gwawl,"In Welsh mythology, Gwawl (Gwawl fab Clud) was the son of Clud, and tricks Pwyll into promising him Rhiannon. She decides to marry Pwyll instead. Gwawl is only mentioned in the First Branch of the Mabinogi. Nothing is known of his father Clud.",who was gwawl
<dbpedia:Casimir_Pulaski>,Casimir Pulaski,"Kazimierz Michał Władysław Wiktor Pułaski of Ślepowron coat of arms (Polish pronunciation: [kaˈʑimʲɛʂ puˈwaskʲi]; English: Casimir Pulaski; March 6, 1745 –  October 11, 1779) was a Polish nobleman, soldier and military commander who has been called with his fellow Hungarian friend Michael Kovats de Fabriczy ""the fathers of the American cavalry"".Born in Warsaw and following in his father's footsteps he became interested in politics at an early age and soon became involved in the military and the revolutionary affairs in Poland (the Polish–Lithuanian Commonwealth). @en <http://en.wikipedia.org/wiki/Casimir_Pulaski?oldid=683800749> .
<http://dbpedia.org/resource/Balor> <http://www.w3.org/2000/01/rdf-schema#comment> In Irish mythology, Balor (modern spelling: Balar) was king of the Fomorians, a group of supernatural beings. He is often described as a giant with a large eye in his forehead that wreaks destruction when opened. He has been interpreted as a god or personification of drought and blight.",what is casimir pulaski known for
<dbpedia:Burying_beetle>,Burying beetle,Burying beetles or sexton beetles (genus Nicrophorus) are the best-known members of the family Silphidae (carrion beetles). Most of these beetles are black with red markings on the elytra (forewings). Burying beetles are true to their name—they bury the carcasses of small vertebrates such as birds and rodents as a food source for their larvae.,types of beetles
<dbpedia:Longsword>,Longsword,"A longsword (also spelled as long sword or long-sword) is a type of European sword characterized as having a cruciform hilt with a grip for two-handed use (around 16 to 28 cm (6 to 11 in)) and a straight double-edged blade of around 85 to 110 cm (33 to 43 in),The ""longsword"" type exists in a morphological continuum with the medieval knightly sword and the Renaissance-era Zweihänder.",what is longsword
<dbpedia:Crime_fiction>,Crime fiction,"Crime fiction is the literary genre that fictionalises crimes, their detection, criminals, and their motives. It is usually distinguished from mainstream fiction and other genres such as historical fiction or science fiction, but the boundaries are indistinct.",what is crime fiction
<dbpedia:Branwen>,Branwen,"Branwen is also the name of a character in some versions of Tristan and Iseult.Branwen, Daughter of Llŷr is a major character in the Second Branch of the Mabinogi, which is sometimes called the Mabinogi of Branwen after her. Branwen is a daughter of Llŷr and Penarddun. She is married to the King of Ireland, but the marriage does not bring peace.",what is branwen
<dbpedia:Winding_number>,Winding number,"The term winding number may also refer to the rotation number of an iterated map.In mathematics, the winding number of a closed curve in the plane around a given point is an integer representing the total number of times that curve travels counterclockwise around the point.",what is winding number
<dbpedia:Penarddun>,Penarddun,"Penarddun is a figure in Welsh mythology, the wife of Llŷr. The Second Branch of the Mabinogi names Bran, Branwen, and Manawydan as her children by Llŷr, and ascribes to her two additional sons by Euroswydd: Nisien, a good man, and Efnysien, a conniving troublemaker. The Welsh Triads call Llŷr one of the Three Exalted Prisoners of Britain for his captivity at Euroswydd's hands; this likely refers to a lost tradition of the birth of Penarddun's younger sons.",what is penarddun
<dbpedia:Euroswydd>,Euroswydd,"Euroswydd is a figure in Welsh mythology, the father of Nisien and Efnysien by Penarddun, daughter of Beli Mawr. In the Second Branch of the Mabinogi Penarddun is the wife of Llŷr, by whom her children are Brân, Branwen, and Manawydan. The circumstances of Nisien and Efnysien's conception are not described, but one of the Welsh Triads mentions that Euroswydd had held Llŷr captive as one of the Three Exalted Prisoners of the Island of Britain; it is likely the traditions are connected.",who is Euroswydd
<dbpedia:Aveta>,Aveta,"In Gallo-Roman religion, Dea Aveta was a mother goddess, also associated with the fresh-water spring at Trier in what is now Germany. Aveta is known mainly from clay figurines found at Toulon-sur-Allier in France and at Trier. These figurines show the goddess with infants at the breast, small lap-dogs, or baskets of fruit. There was a temple dedicated to Aveta in the Altbachtal complex at Trier.Her name is also known from inscriptions found in Switzerland, and the Côte-d'Or (France).",where did aveta come from
<dbpedia:Rhiannon>,Rhiannon,"Rhiannon is a major and classic figure in the earliest prose literature and mythology of Britain, the Mabinogi. This is a set of tales classified as Celtic or British mythology, Welsh literature, Welsh mythology. This earliest prose literature of Britain was compiled c. 1100 in mediaeval Wales from earlier oral traditions. It is culturally prominent in literary, mythological or Welsh circles today, known worldwide in English translations.The Mabinogi is made up of Four Branches, or nodes.",who is rhinannon
<dbpedia:Hefeydd>,Hefeydd,"In Welsh mythology, Hefeydd the Old was the father of Rhiannon.- Hen, according to legend, he was first king of Dyfed and tried to force her to marry against her will to Gwawl. She met Pwyll of Dyfed and fell in love, planning to marry in one year and one day at his court on his estate. In accordance with the plan, they tried to marry but were thwarted by Clud and his son Gwawl. They put the wedding off for a further year.",what does hen name mean
<dbpedia:Efnysien>,Efnysien,"Efnysien fab Euroswydd (also spelled Efnissien or Efnisien) is a sadistic anti-hero in Welsh mythology, appearing prominently in the tale of Branwen ferch Llŷr, the second branch of the Mabinogi. Described by Will Parker as ""a study in the psychopathic personality"" and an ""embodiment of the forces of anti-social disruption,"" he is the catalyst of the tale's ultimate tragedy, and is largely responsible for the destruction of both Ireland and the Island of the Mighty.",who is efnissien
<dbpedia:Ériu>,Ériu,"In Irish mythology, Ériu (Irish pronunciation: [ˈeːrʲu]; modern Irish Éire), also called Eri, daughter of Ernmas of the Tuatha Dé Danann, was the eponymous matron goddess of Ireland.The English name for Ireland comes from the name Ériu and the Germanic (Old Norse or Old English) word land.Since Ériu is represented as goddess of Ireland, she is often interpreted as a modern-day personification of Ireland, although since the name ""Ériu"" is the older Irish form of the word Ireland, her modern name is often modified to ""Éire"" or ""Erin"" to suit a modern form.",what is the name ériu in irish mythology
<dbpedia:Calais>,Calais,"Calais (/ˈkæleɪ/ CAL-ay, traditionally /ˈkælɨs/; French pronunciation: ​[kaˈlɛ]; Picard: Calés; Dutch: Kales) is a town and major ferry port in northern France in the department of Pas-de-Calais, of which it is a sub-prefecture. Although Calais is by far the largest city in Pas-de-Calais, the department's prefecture is its third-largest city of Arras. The population of the metropolitan area at the 2010 census was 126,395.",where is calais
<dbpedia:Chayanne>,Chayanne,"Elmer Figueroa Arce (born June 28, 1968), better known under the stage name Chayanne, is a Puerto Rican Latin pop singer, actor and composer. As a solo artist, Chayanne has released 21 solo albums and sold over 30 million albums worldwide.",who is chayanne
<dbpedia:Beag>,Beag,"In Irish mythology, Bec (modern Irish Beag, meaning ""small"") was one of the Tuatha Dé Danann. She was known for having a magic well, guarded by her three daughters. When Fionn mac Cumhaill approached the well to ask for a drink, her daughters tried to prevent him from getting the water; ""one of them threw water over him to scare him away and some of it went into his mouth. From the water he gained wisdom.""",irish beag meaning
<dbpedia:Banba>,Banba,"In Irish mythology, Banba (modern spelling: Banbha, pronounced [ˈbˠanˠəvˠə]), daughter of Ernmas of the Tuatha Dé Danann, is a patron goddess of Ireland. She was part of an important triumvirate of patron goddesses, with her sisters, Ériu and Fódla. According to Seathrún Céitinn she worshipped Macha, who is also sometimes named as a daughter of Ernmas. The two goddesses may therefore be seen as equivalent.",what does banba mean
<dbpedia:Bride>,Bride,"A bride is a woman about to be married or newlywed. Nowadays, bride can be used as an interjection in a complete sentence with the definition of ""before"" or ""pre"". In Western culture, a bride may be attended by one or more bridesmaids",define bride
<dbpedia:Fiacha_mac_Delbaíth>,Fiacha mac Delbaíth,"In Irish mythology, Fiacha (Irish pronunciation: [ˈfʲiːəxə], sometimes Fiachu, Fiachra or Fiachna), son of Delbáeth, of the Tuatha Dé Danann, was a legendary High King of Ireland. According to the Lebor Gabála Érenn, he took the throne after his father was overthrown by Caicher son of Nama, brother of Nechtan. The Annals of the Four Masters and Geoffrey Keating say he overthrew his father himself. His mother was Ernmas. He had three daughters, Banba, Fódla, and Ériu, by his own mother.",what is fiacha
<dbpedia:Borvo>,Borvo,"In Lusitanian and Celtic polytheism, Borvo (also Bormo, Bormanus, Bormanicus, Borbanus, Boruoboendua, Vabusoa, Labbonus or Borus) was a healing deity associated with bubbling spring water.",what is borvo
<dbpedia:Annwn>,Annwn,"Annwn, Annwfn, or Annwfyn (in Middle Welsh Annwvn, Annwyn, Annwyfn, Annwvyn, or Annwfyn) was the Otherworld in Welsh mythology. Ruled by Arawn (or, in Arthurian literature, by Gwyn ap Nudd), it was essentially a world of delights and eternal youth where disease was absent and food was ever-abundant. It became identified with the Christian afterlife in paradise (or heaven).",wyna wynan annwfyn
<dbpedia:Belenus>,Belenus,"Belenus (also  Belenos, Belinus, Bel, Beli Mawr) is a Sun God from Celtic Mythology and, in the third century, the patron deity of the Italian city of Aquileia. Called the ""Fair Shining One,"" (or The Shining God) he was one of the most ancient and most widely worshiped Celtic deities and is associated with the ancient fire festival and modern Sabbat Beltane.",who is belenus
<dbpedia:Gwern>,Gwern,"Gwern; ""Alder,"" is a minor figure in Welsh tradition, the son of Matholwch king of Ireland, and Branwen, sister to the king of Britain. He appears in the tale of Branwen, daughter of Llŷr, in which he is murdered by his sadistic uncle Efnysien which sparks a mutually destructive battle between Britain and Ireland.",who is gwern
<dbpedia:Art_mac_Cuinn>,Art mac Cuinn,"Art mac Cuinn ""\son of Conn""), also known as Art Óenfer (literally ""one man"", used in the sense of ""lone"", ""solitary"", or ""only son""), was, according to medieval Irish legend and historical tradition, a High King of Ireland.According to legend, he was not Conn's only son: he had a brother called Connla, who fell in love with a fairy woman, and went with her to Mag Mell, never to be seen again.",what was art mac cuinn's first name
<dbpedia:Belatucadros>,Belatucadros,"In Celtic mythology, Belatucadros or Belatucadrus, was a deity worshipped in northern Britain, particularly in Cumberland and Westmorland. He may be related to Belenus and Cernunnos, and was equated in the Roman period with Mars. He appears to have been worshipped by lower-ranked Roman soldiers as well as by Britons.Belatucadros is known from approximately 28 inscriptions in the vicinity of Hadrian's Wall, England.",what is belatucadros
<dbpedia:1928_Summer_Olympics>,1928 Summer Olympics,"The 1928 Summer Olympics (Dutch: Olympische Zomerspelen 1928), officially known as the Games of the IX Olympiad, was an international multi-sport event which was celebrated in 1928 in Amsterdam, Netherlands. Amsterdam had bid for the 1920 and 1924 Olympic Games, but had to give way to wartorn Antwerp, Belgium, and Pierre de Coubertin's Paris, respectively.",what is the term for the olympic summer sports
<dbpedia:Edwin_Rosario>,Edwin Rosario,"Edwin ""El Chapo"" Rosario (Spanish pronunciation: [ˈeðwin roˈsaɾjo]; March 15, 1963 – December 1, 1997) was a Puerto Rican boxer. He won the lightweight championship three times, as the WBC lightweight champion (1983–84), and the WBA champion (1986–87) and (1989–90). After moving up to the junior welterweight class, he won the WBA championship, holding the title from 1991 to 1992.",when was el apo boxer inducted
<dbpedia:Seine-Maritime>,Seine-Maritime,"Seine-Maritime (French pronunciation: ​[sɛn.ma.ʁi.tim]) is a department of France in the Upper Normandy region of northern France. It is situated on the northern coast of France, at the mouth of the Seine, and includes the cities of Rouen and Le Havre. Until 1955 it was named Seine-Inférieure.","what region is seine, france"
<dbpedia:Suspense_(radio_drama)>,Suspense (radio drama),Suspense is a radio drama series broadcast on CBS Radio from 1942 through 1962.,what year did suspense air
<dbpedia:Brân_the_Blessed>,Brân the Blessed,"Brân the Blessed (Welsh: Bendigeidfran or Brân Fendigaidd, literally ""Blessed Crow"") is a giant and king of Britain in Welsh mythology. He appears in several of the Welsh Triads, but his most significant role is in the Second Branch of the Mabinogi, Branwen ferch Llŷr. He is a son of Llŷr and Penarddun, and the brother of Brânwen, Manawydan, Nisien and Efnysien. The name ""Brân"" in Welsh is usually translated as crow or raven.",brân the sacro
