_id,title,text,query
<dbpedia:Zutphen>,Zutphen,"Zutphen (Dutch pronunciation: [ˈzʏtfə(n)]) is a town in the province of Gelderland in the Netherlands. It lies some 30 km north-east of Arnhem, on the Eastern bank of the river IJssel at the point where it is joined by the Berkel. The name Zutphen (first mentioned in the eleventh century) appears to mean 'zuid-veen', or in English, south-fen.In 2005, the municipality of Zutphen was merged with the municipality of Warnsveld, retaining its name.",where is zutphen in the netherlands
<dbpedia:Gödel's_incompleteness_theorems>,Gödel's incompleteness theorems,"Gödel's incompleteness theorems are two theorems of mathematical logic that establish inherent limitations of all but the most trivial axiomatic systems capable of doing arithmetic.  The theorems, proven by Kurt Gödel in 1931, are important both in mathematical logic and in the philosophy of mathematics.",what is gidel incompleteness theorem?
<dbpedia:Molasses>,Molasses,"Molasses, or black treacle (British, for human consumption; known as molasses otherwise), is a viscous by-product of the refining of sugarcane or sugar beets into sugar. The word comes from the Proto-Indo-European ""mélid\. Cognates include Ancient Greek μέλι (méli) (honey), Latin mel, Portuguese melaço. Molasses varies by amount of sugar and method of extraction, and age of plant.Sweet sorghum syrup may be colloquially called ""sorghum molasses"" in the American South.",what is molasses
<dbpedia:Zwolle>,Zwolle,"Zwolle (Dutch: [ˈzʋɔlə]) is a municipality and the capital city of the province of Overijssel, Netherlands. It has a population around 125,000.",where is zwolle
<dbpedia:Market_capitalization>,Market capitalization,"Market capitalization or market cap is the total money market value of the shares outstanding of a publicly traded company; it is equal to the share price times the number of shares outstanding. As outstanding stock is bought and sold in public markets, capitalization could be used as a proxy for the public opinion of a company's net worth and is a determining factor in some forms of stock valuation.",what is market capitalization in finance
<dbpedia:Direct_sum_of_modules>,Direct sum of modules,"In abstract algebra, the direct sum is a construction which combines several modules into a new, larger module. The direct sum of modules is the smallest module which contains the given modules as submodules with no ""unnecessary"" constraints, making it an example of a coproduct.",what does direct sum mean in algebra
<dbpedia:Gender_studies>,Gender studies,"Gender studies is a field for interdisciplinary study devoted to gender identity and gendered representation as central categories of analysis. This field includes women's studies (concerning women, feminism, gender, and politics), men's studies and LGBT studies. Sometimes, gender studies is offered together with study of sexuality.",what is gender studies
<dbpedia:Resin>,Resin,"In polymer chemistry and materials science, resin is a ""solid or highly viscous substance, usually containing prepolymers with reactive groups.""  Such viscous substances can be plant derived or synthetic.",define polymers
<dbpedia:Margaret_I_of_Denmark>,Margaret I of Denmark,"Margaret I (Danish: Margrete Valdemarsdatter, Norwegian: Margrete Valdemarsdatter, Swedish: Margareta Valdemarsdotter, Icelandic: Margrét Valdimarsdóttir), (March 1353 – 28 October 1412), was Queen of Denmark, Norway and Sweden and founder of the Kalmar Union, which united the Scandinavian countries for over a century. She acted as queen regnant of Denmark, although in those days it was not the Danish custom for a woman to reign.",who was margaret
<dbpedia:Cedrus>,Cedrus,"Cedrus (common name Cedar) is a genus of coniferous trees in the plant family Pinaceae.  They are native to the mountains of the western Himalayas and the Mediterranean region, occurring at altitudes of 1,500–3,200 m in the Himalayas and 1,000–2,200 m in the Mediterranean.",what are cedar trees
<dbpedia:Naboo>,Naboo,"Naboo is a planet in the fictional Star Wars universe with a mostly green terrain and which is the homeworld of two societies: the Gungans who dwell in underwater cities and the humans who live in colonies on the surface. Humans of Naboo have an electoral monarchy and maintain a peaceful culture that defends education, the arts, environmental protection and scientific achievements.",what is the world of naboo naboo?
<dbpedia:Eragrostis_tef>,Eragrostis tef,"Eragrostis tef, teff, Williams lovegrass, annual bunch grass, taf (Amharic: ጤፍ? ṭēff; Tigrinya: ጣፍ? ṭaff), or xaafii (Oromo), is an annual grass, a species of lovegrass native to Ethiopia. The word ""teff"" is connected by folk etymology to the Ethio-Semitic root ""ṭff"", which means ""lost"" (because of the small size of the grain).",what is teff
<dbpedia:Zosterops>,Zosterops,"Zosterops is a genus of birds containing the typical white-eyes. They are traditionally placed in the white-eye family, Zosteropidae, which, however, is now considered part of the Timaliidae ().This genus has the highest number of species among the white-eyes by far. They occur in the Afrotropic ecoregion, the Indomalaya zone, and the Australasia ecozone. Typical white-eyes can reach a length between 8 and 15 cm.",what does zostreops mean
<dbpedia:Serpent_(symbolism)>,Serpent (symbolism),"The serpent, or snake, is one of the oldest and most widespread mythological symbols. The word is derived from Latin serpens, a crawling animal or snake.",what do the serpent mean
<dbpedia:Liquid_hydrogen>,Liquid hydrogen,"Liquid hydrogen (LH2 or LH2) is the liquid state of the element hydrogen. Hydrogen is found naturally in the molecular H2 form.To exist as a liquid, H2 must be cooled below hydrogen's critical point of 33 K. However, for hydrogen to be in a full liquid state without boiling at atmospheric pressure, it needs to be cooled to 20.28 K (−423.17 °F/−252.87°C). One common method of obtaining liquid hydrogen involves a compressor resembling a jet engine in both appearance and principle.",what is a liquid hydrogen
<dbpedia:Presbyterian_polity>,Presbyterian polity,"Presbyterian (or presbyteral) polity is a method of church governance typified by the rule of assemblies of presbyters, or elders. Each local church is governed by a body of elected elders usually called the session or consistory, though other terms, such as church board, may apply.",what is presbytery
<dbpedia:Natural_disaster>,Natural disaster,"A natural disaster is a major adverse event resulting from natural processes of the Earth; examples include floods, volcanic eruptions, earthquakes, tsunamis, and other geologic processes.",what are natural disasters
<dbpedia:List_of_notifiable_diseases>,List of notifiable diseases,The following is a list of notifiable diseases arranged by country.,what are notifiable diseases
<dbpedia:Gymnosporangium>,Gymnosporangium,"Gymnosporangium is a genus of heteroecious plant-pathogenic fungi which alternately infect members of the family Cupressaceae, primarily species in the genus Juniperus (junipers), and members of the family Rosaceae in the subfamily Maloideae (apples, pears, quinces, shadbush, hawthorns, rowans and their relatives).",what is gymnosporangium
<dbpedia:Unmanned_aerial_vehicle>,Unmanned aerial vehicle,"An unmanned aerial vehicle (UAV), commonly known as a drone and also referred to as a remotely piloted aircraft (RPA) by the International Civil Aviation Organization (ICAO), is an aircraft without a human pilot aboard. Its flight is controlled either autonomously by onboard computers or by the remote control of a pilot on the ground or in another vehicle.",what is a drones
"<dbpedia:Timeline_of_telescopes,_observatories,_and_observing_technology>","Timeline of telescopes, observatories, and observing technology","Timeline of telescopes, observatories, and observing technology.",what is the main feature of the tv
<dbpedia:Adultery>,Adultery,"Adultery (anglicised from Latin adulterium) is extramarital sex that is considered objectionable on social, religious, moral or legal grounds. Though what sexual activities constitute adultery varies, as well as the social, religious and legal consequences, the concept exists in many cultures and is similar in Islam, Christianity and Judaism.Historically, many cultures have considered adultery a very serious crime.",a definition of adultery
<dbpedia:Timeline_of_Solar_System_astronomy>,Timeline of Solar System astronomy,Timeline of Solar System astronomy,solar system astronomy definition
<dbpedia:Timeline_of_solar_astronomy>,Timeline of solar astronomy,Timeline of solar astronomy,what is the timeline of solar astronomy?
<dbpedia:Default_(finance)>,Default (finance),"In finance, default is failure to meet the legal obligations (or conditions) of a loan, for example when a home buyer fails to make a mortgage payment, or when a corporation or government fails to pay a bond which has reached maturity.",default definition
<dbpedia:Robotic_spacecraft>,Robotic spacecraft,"A robotic spacecraft is an unmanned spacecraft, usually under telerobotic control. A robotic spacecraft designed to make scientific research measurements is often called a space probe. Many space missions are more suited to telerobotic rather than crewed operation, due to lower cost and lower risk factors.  In addition, some planetary destinations such as Venus or the vicinity of Jupiter are too hostile for human survival, given current technology.",what is space probe robotic
<dbpedia:Worcester>,Worcester,"Worcester (/ˈwʊstər/ WUUS-tər) is a city and the county town of Worcestershire in the West Midlands of England. Worcester is situated some 17 miles (27 km) southwest of the southern suburbs of Birmingham and 23 miles (37 km) north of Gloucester, and has an approximate population of 100,000 people.The River Severn flanks the western side of the city centre, overlooked by the 12th-century Worcester Cathedral.",worcester is where
<dbpedia:Timeline_of_medicine_and_medical_technology>,Timeline of medicine and medical technology,Timeline of the history of medicine and medical technology.,how was the history of medical technology
<dbpedia:260_BC>,260 BC,"Year 260 BC was a year of the pre-Julian Roman calendar. At the time it was known as the Year of the Consulship of Asina and Duilius (or, less frequently, year 494 Ab urbe condita). The denomination 260 BC for this year has been used since the early medieval period, when the Anno Domini calendar era became the prevalent method in Europe for naming years.",what year was 260 bc
<dbpedia:Business_administration>,Business administration,"Business administration is the process of managing a business or non-profit organization, so that it remains stable and continues to grow.The administration of a business includes the performance or management of business operations and decision making as well as the efficient organization of people and other resources to direct activities toward common goals and objectives.In general, administration refers to the broader management function, including the associated finance, personnel and MIS services.In some analyses, management is viewed as a subset of administration, specifically associated with the technical and operational aspects of an organization, distinct from executive or strategic functions.",what is business administration
<dbpedia:Witch-hunt>,Witch-hunt,"A witch-hunt is a search for people labelled ""witches"" or evidence of witchcraft, often involving moral panic or  mass hysteria. The classical period of witchhunts in Early Modern Europe and Colonial North America falls into the Early Modern period or about 1450 to 1750, spanning the upheavals of the Reformation and the Thirty Years' War, resulting in an estimated 35,000 to 100,000 executions.The last executions of people convicted as witches in Europe took place in the 18th century.",what is the witch hunt
<dbpedia:Reed_(mouthpiece)>,Reed (mouthpiece),"A reed is a thin strip of material which vibrates to produce a sound on a musical instrument. The reeds of most woodwind instruments are made from Arundo donax ""\Giant cane"") or synthetic material; tuned reeds (as in harmonicas and accordions) are made of metal or synthetics.",what is a reed
<dbpedia:Stratford-upon-Avon>,Stratford-upon-Avon,"Stratford-upon-Avon (/ˌstrætfərd əpɒn ˈeɪvən/) is a market town in Warwickshire, England, on the River Avon, 22 miles (35 km) south east of Birmingham and 8 miles (13 km) south west of Warwick. The estimated population in 2007 was 25,505.The town is a popular tourist destination owing to its status as birthplace of English playwright and poet William Shakespeare, and receives an estimated 4.9 million visitors a year. The Royal Shakespeare Company resides in Stratford's Royal Shakespeare Theatre.","what county is stratford, england"
<dbpedia:Timeline_of_knowledge_about_the_interstellar_and_intergalactic_medium>,Timeline of knowledge about the interstellar and intergalactic medium,Timeline of knowledge about the interstellar medium and intergalactic medium 1848 — Lord Rosse studies M1 and names it the Crab Nebula 1864 — William Huggins studies the spectrum of the Orion Nebula and shows that it is a cloud of gas 1927 — Ira Bowen explains unidentified spectral lines from space as forbidden transition lines 1930 — Robert Trumpler discovers absorption by interstellar dust by comparing the angular sizes and brightnesses of globular clusters 1944 — Hendrik van de Hulst predicts the 21 cm hyperfine line of neutral interstellar hydrogen 1951 — Harold I.,how was the interstellar medium formed?
<dbpedia:Timeline_of_stellar_astronomy>,Timeline of stellar astronomy,Timeline of stellar astronomy 2300 BC — First great period of star naming in China.,what was the initials of the period of star discovery
<dbpedia:Concertina>,Concertina,"A concertina is a free-reed musical instrument, like the various accordions and the harmonica. It has a bellows, and buttons typically on both ends of it. When pressed, the buttons travel in the same direction as the bellows, unlike accordion buttons, which travel perpendicularly to the bellows.The concertina was developed in England and Germany, most likely independently.",define concertina
<dbpedia:Galaxy_cluster>,Galaxy cluster,A galaxy cluster or cluster of galaxies is a structure that consists of anywhere from hundreds to thousands of galaxies bound together by gravity. They are the largest known gravitationally bound structures in the universe and were the largest known structures in the universe until the 1980s when superclusters were discovered. One of the key features of clusters is the intracluster medium or ICM. The ICM consists of heated gas between the galaxies and has a temperature on the order of 7-9 keV.,what are the galaxies clusters
<dbpedia:Timeline_of_geology>,Timeline of geology,Timeline of geology,timeline geology
<dbpedia:Maclura_pomifera>,Maclura pomifera,"Maclura pomifera, commonly called Osage orange, hedge apple, horse apple, monkey ball, bois d'arc, bodark, or bodock is a small deciduous tree or large shrub, typically growing to 8–15 metres (26–49 ft) tall. It is dioecious, with male and female flowers on different plants. The fruit, from a multiple fruit family, is roughly spherical, but bumpy, and 7.6–15.2 centimetres (3–6 in) in diameter. It is filled with a sticky white latex. In fall, its color turns a bright yellow-green.",what is a bodark tree called
<dbpedia:Timeline_of_biology_and_organic_chemistry>,Timeline of biology and organic chemistry,Significant events in biology and organic chemistry:,what are the major events in biology and organic chemistry
<dbpedia:Federico_Zuccari>,Federico Zuccari,"Federico Zuccari, also known as Federico Zuccaro (c. 1540/1541 – August 6, 1609), was an Italian Mannerist painter and architect, active both in Italy and abroad.",who was federico zuccari
<dbpedia:Timeline_of_artificial_satellites_and_space_probes>,Timeline of artificial satellites and space probes,"This timeline of artificial satellites and space probes includes unmanned spacecraft including technology demonstrators, observatories, lunar probes, and interplanetary probes. First satellites from each country are included. Not included are most earth science satellites, commercial satellites or manned missions.Key: Year – Origin – Target – Status – Description",what kind of space probes are manned
<dbpedia:José_Zorrilla>,José Zorrilla,José Zorrilla y Moral (Spanish pronunciation: [xoˈse θoˈriʎa]; 21 February 1817 – 23 January 1893) was a Spanish Romantic poet and dramatist.He was born in Valladolid to a magistrate in whom Ferdinand VII placed special confidence.,who was jose zorrilla y moral
<dbpedia:Wall_Street_(1987_film)>,Wall Street (1987 film),"Wall Street is a 1987 American drama film, directed and co-written by Oliver Stone, which stars Michael Douglas, Charlie Sheen, Daryl Hannah and Martin Sheen. The film tells the story of Bud Fox (Sheen), a young stockbroker who becomes involved with Gordon Gekko (Douglas), a wealthy, unscrupulous corporate raider.Stone made the film as a tribute to his father, Lou Stone, a stockbroker during the Great Depression.",was wall street a movie
<dbpedia:Rock_and_Roll_Hall_of_Fame>,Rock and Roll Hall of Fame,"The Rock and Roll Hall of Fame and Museum is a museum located on the shore of Lake Erie in downtown Cleveland, Ohio, United States. It is dedicated to archiving the history of some of the best-known and most influential artists, producers, engineers and others who have, in some major way, influenced the music industry. It is part of the city's redeveloped North Coast Harbor.",where is rock and roll hall of fame located
<dbpedia:Ruud_Gullit>,Ruud Gullit,"Ruud Gullit OON (Dutch pronunciation: [ˈryt ˈxʏlɪt]; born Rudi Dil, 1 September 1962) is a Dutch football manager and former footballer who played professionally in the 1980s and 1990s as a midfielder. He was the captain of the Netherlands national team that was victorious at Euro 88 and was also a member of the squad for the 1990 World Cup and Euro 92.At club level, in 1987 he moved from PSV Eindhoven to A.C. Milan for a world record transfer fee.",who is rutud gullit
<dbpedia:Music_of_Latin_America>,Music of Latin America,"The music of Latin America refers to music originating from Latin America, namely the Romance-speaking countries and territories of the Americas and the Caribbean south of the United States. Latin American music also incorporates African music from slaves who were transported to the Americas by European settlers as well as music from the indigenous peoples of the Americas.",where did latin music originate from
<dbpedia:Austronesian_languages>,Austronesian languages,"The Austronesian languages is a language family that is widely dispersed throughout Maritime Southeast Asia, Madagascar and the islands of the Pacific Ocean, with a few members on continental Asia. Austronesian languages are spoken by about 386 million people, making it the fifth-largest language family by number of speakers, behind only the Indo-European languages, the Sino-Tibetan languages, the Niger-Congo languages, and the Afroasiatic languages.",where are austronesian languages spoken
"<dbpedia:Timeline_of_astronomical_maps,_catalogs,_and_surveys>","Timeline of astronomical maps, catalogs, and surveys","Timeline of astronomical maps, catalogs and surveys ca. 1800 BC — Babylonian star catalog ca. 350 BC — Shi Shen's star catalog has almost 800 entries ca. 300 BC — star catalog of Timocharis of Alexandria ca. 134 BC — Hipparchus makes a detailed star map ca. 140 — Ptolemy completes his Almagest, which contains a catalog of stars, observations of planetary motions, and treatises on geometry and cosmology ca. 705 — Dunhuang Star Chart, a manuscript star chart from the Mogao Caves at Dunhuang ca.",what is the history of map
<dbpedia:Observatory>,Observatory,"An observatory is a location used for observing terrestrial or celestial events. Astronomy, climatology/meteorology, geology, oceanography and volcanology are examples of disciplines for which observatories have been constructed. Historically, observatories were as simple as containing an astronomical sextant (for measuring the distance between stars) or Stonehenge (which has some alignments on astronomical phenomena).",what are observatory
<dbpedia:Lake_Zug>,Lake Zug,"Lake Zug (German: Zugersee) is a lake in Central Switzerland, situated between Lake Lucerne and Lake Zurich. It stretches for 14 km between Arth and the Cham-Zug bay. The Lorze as the main feeder river empties its waters into the lake at its northern extremity, but 1 km (0.6 mi) further west issues from the lake to pursue its course towards the Reuss.",where is zug lake
<dbpedia:List_of_genetic_disorders>,List of genetic disorders,"The following is a list of genetic disorders and if known, type of mutation and the chromosome involved. The list of human genes includes genes not listed here, which also affect predisposition toward certain diseases.",what are the disorders of the human chromosome
<dbpedia:An_Inspector_Calls>,An Inspector Calls,"An Inspector Calls is a play written by English dramatist J. B. Priestley, first performed in 1945 in the Soviet Union and in 1946 in the UK. It is one of Priestley's best known works for the stage and considered to be one of the classics of mid-20th century English theatre.",what year was the an inspector calls
<dbpedia:Alan_Shearer>,Alan Shearer,"Alan Shearer OBE, DL (/ˈʃɪərər/; born 13 August 1970) is an English retired footballer. He played as a striker in the top level of English league football for Southampton, Blackburn Rovers, Newcastle United and for the England national team. He was widely regarded as one of the world's best strikers, being both Newcastle's and the Premier League's record goalscorer. Since retiring as a player in 2006, Shearer has worked as a television pundit for the BBC.",what national team is alan shearer in
<dbpedia:Timeline_of_cosmological_theories>,Timeline of cosmological theories,This timeline of cosmological theories and discoveries is a chronological record of the development of humanity's understanding of the cosmos over the last two-plus millennia. Modern cosmological ideas follow the development of the scientific discipline of physical cosmology.,timeline of cosmological theories
<dbpedia:Oscar-class_submarine>,Oscar-class submarine,"Project 949 (Granit) and Project 949A (Antey) are Soviet Navy/Russian Navy cruise missile submarines (NATO reporting names: Oscar-I and Oscar-II respectively).Project 949 submarines were the largest cruise missile submarines in service, until the Ohio-class SSGN cruise missile submarine converted from SSBN and returned to service on October 15, 2007.  They are the fourth largest class of submarines in terms of displacement and length.",largest russian submarines in world
<dbpedia:Malayo-Polynesian_languages>,Malayo-Polynesian languages,"The Malayo-Polynesian languages are a subgroup of the Austronesian languages, with approximately 385.5 million speakers. The Malayo-Polynesian languages are spoken by the Austronesian people of the island nations of Southeast Asia and the Pacific Ocean, with a smaller number in continental Asia. Cambodia, Laos, and Vietnam serve as the northeast geographic outlier, going well into the Malay peninsula.",what language does australian people speak
<dbpedia:Metro-Goldwyn-Mayer>,Metro-Goldwyn-Mayer,"Metro-Goldwyn-Mayer Studios, Inc. (abbreviated MGM, also known as Metro-Goldwyn-Mayer Pictures, Metro-Goldwyn-Mayer, or simply Metro) is an American media company, involved primarily in the production and distribution of feature films and television programs.Once the largest, most glamorous, and most revered film studio, MGM was founded in 1924 when the entertainment entrepreneur Marcus Loew gained control of Metro Pictures, Goldwyn Pictures and Louis B. Mayer Pictures.",who is mgm?
"<dbpedia:Timeline_of_knowledge_about_galaxies,_clusters_of_galaxies,_and_large-scale_structure>","Timeline of knowledge about galaxies, clusters of galaxies, and large-scale structure","Timeline of galaxies, clusters of galaxies, and large-scale structure of the universe","what does the structure of galaxies, clusters of galaxies and clusters of galaxies indicate"
<dbpedia:Melodica>,Melodica,"The melodica, also known as the pianica, blow-organ, key-flute or key-ute, is a free-reed instrument similar to the melodion and harmonica. It has a musical keyboard on top, and is played by blowing air through a mouthpiece that fits into a hole in the side of the instrument. Pressing a key opens a hole, allowing air to flow through a reed. The keyboard is usually two or three octaves long. Melodicas are small, light, and portable.",what is the melody of a guitar?
<dbpedia:Ender's_Game>,Ender's Game,"Ender's Game is a 1985 military science fiction novel by American author Orson Scott Card. Set in Earth's future, the novel presents an imperiled mankind after two conflicts with the ""buggers"", an insectoid alien species.",who is ender's game
<dbpedia:Staffordshire>,Staffordshire,Staffordshire (/ˈstæfədʃɪər/ or /ˈstæfədʃə/; abbreviated Staffs) is a landlocked county in the West Midlands of England. Part of the National Forest lies within its borders.,where is staffs england
