_id,title,text,query
<dbpedia:Common_chimpanzee>,Common chimpanzee,"The common chimpanzee (Pan troglodytes), also known as the robust chimpanzee, is a species of great ape. Colloquially, the common chimpanzee is often called the chimpanzee (or ""chimp""), though this term can be used to refer to both species in the genus Pan: the common chimpanzee and the closely related bonobo, formerly called the pygmy chimpanzee.",what is the chimpanzees
<dbpedia:Dative_case>,Dative case,"The dative case (abbreviated dat, or sometimes d when it is a core argument) is a grammatical case generally used to indicate the noun to which something is given, as in ""Maria gave Jakob a drink"". Here, Jakob is an indirect dative.In general, the dative marks the indirect object of a verb, although in some instances, the dative is used for the direct object of a verb pertaining directly to an act of giving something.",what is a dative
<dbpedia:Decision_problem>,Decision problem,"In computability theory and computational complexity theory, a decision problem is a question in some formal system with a yes-or-no answer, depending on the values of some input parameters.",what is decision problem
<dbpedia:Difference_engine>,Difference engine,"A difference engine is an automatic mechanical calculator designed to tabulate polynomial functions. The name derives from the method of divided differences, a way to interpolate or tabulate functions by using a small set of polynomial coefficients.",difference engine definition math
<dbpedia:Delaware>,Delaware,"Delaware (/ˈdɛləwɛər/) is a state located in the Northeast megalopolis region and the Northeastern region of the United States.  It is bordered to the south and west by Maryland, to the northeast by New Jersey, and to the north by Pennsylvania.",where is delaware located
<dbpedia:Draupnir>,Draupnir,"In Norse mythology, Draupnir (Old Norse ""the dripper"") is a gold ring possessed by the god Odin with the ability to multiply itself: Every ninth night eight new rings 'drip' from Draupnir, each one of the same size and weight as the original.Draupnir was forged by the dwarven brothers Brokkr and Eitri (or Sindri). Brokkr and Eitri made this ring as one of a set of three gifts which included Mjöllnir and Gullinbursti.",what is drachnir
<dbpedia:David_Angell>,David Angell,"David Lawrence Angell (April 10, 1946 – September 11, 2001) was an American producer of sitcoms. Angell won multiple Emmy Awards as the creator and executive producer, along with Peter Casey and David Lee, of the comedy series Frasier. Angell and his wife Lynn both died aboard American Airlines Flight 11, the first plane to hit the World Trade Center, during the September 11 attacks.",who is david angel
<dbpedia:Dave_Barry>,Dave Barry,"David McAlister ""Dave"" Barry (born July 3, 1947) is a Pulitzer Prize winning American author and columnist, who wrote a nationally syndicated humor column for The Miami Herald from 1983 to 2005. He has also written numerous books of humor and parody, as well as comedic novels.",dave barry author
<dbpedia:Divinity>,Divinity,"In religious terms, divinity or godhead is the state of things that come from a supernatural power or deity, such as a god, supreme being, Creator-God or spirits, and are therefore regarded as sacred and holy.Such things are regarded as ""divine"" due to their transcendental origins, and/or because their attributes or qualities are superior or supreme relative to things of the Earth.",divinity definition
<dbpedia:Diamagnetism>,Diamagnetism,"Diamagnetic materials create an induced magnetic field in a direction opposite to an externally applied magnetic field, and are repelled by the applied magnetic field. In contrast, the opposite behavior is exhibited by paramagnetic materials.  Diamagnetism is a quantum mechanical effect that occurs in all materials; when it is the only contribution to the magnetism the material is called a diamagnet. Unlike a ferromagnet, a diamagnet is not a permanent magnet.",diamagnetic materials are what kind of material
<dbpedia:Depth_of_field>,Depth of field,"In optics, particularly as it relates to film and photography, depth of field (DOF), also called focus range or  effective focus range, is the distance between the nearest and farthest objects in a scene that appear acceptably sharp in an image.",what is the definition of depth of field
<dbpedia:Dodecahedron>,Dodecahedron,"In geometry, a dodecahedron (Greek δωδεκάεδρον, from δώδεκα dōdeka ""twelve"" + ἕδρα hédra ""base"", ""seat"" or ""face"") is any polyhedron with twelve flat faces. The most familiar dodecahedron is the regular dodecahedron, which is a Platonic solid. There are also three regular star dodecahedra, which are constructed as stellations of the convex form.",what is the geometric structure of dodecahedrons
<dbpedia:Domain_Name_System>,Domain Name System,"The Domain Name System (DNS) is a hierarchical distributed naming system for computers, services, or any resource connected to the Internet or a private network. It associates various information with domain names assigned to each of the participating entities. Most prominently, it translates domain names, which can be easily memorized by humans, to the numerical IP addresses needed for the purpose of  computer services and devices worldwide.",what is dns on the internet
<dbpedia:Duesberg_hypothesis>,Duesberg hypothesis,"The Duesberg hypothesis is the claim, associated with University of California, Berkeley professor Peter Duesberg, that various noninfectious factors such as recreational and pharmaceutical drug use are the cause of AIDS, and that HIV (human immunodeficiency virus) is merely a harmless passenger virus. The most prominent supporters of this hypothesis are Duesberg himself, biochemist and vitamin proponent David Rasnick, and journalist Celia Farber.",what causes duesberg hypothesis
<dbpedia:Demeter>,Demeter,"In ancient Greek religion and Greek mythology, Demeter (/dɨˈmiːtər/; Attic: Δημήτηρ Dēmḗtēr; Doric: Δαμάτηρ Dāmā́tēr) is the goddess of the harvest, who presided over grains and the fertility of the earth.",what did demeter mean in greek mythology
<dbpedia:December_27>,December 27,December 27 is the 361st day of the year (362nd in leap years) in the Gregorian calendar. There are four days remaining until the end of the year.,when does dc 27 day start and end
<dbpedia:Diedrich_Hermann_Westermann>,Diedrich Hermann Westermann,"Diedrich Hermann Westermann (June 24, 1875–May 31, 1956) was a German missionary, Africanist, and linguist. He substantially extended and revised the work of Carl Meinhof, his teacher, although he rejected some of Meinhof's theories only implicitly. Westermann is seen as one of the founders of modern African linguistics. He carried out extensive linguistic and anthropological research in the area ranging from Senegal eastwards to the Upper Nile.",what does diedrich westermann mean
<dbpedia:Dwight_L._Moody>,Dwight L. Moody,"Dwight Lyman Moody (February 5, 1837 – December 22, 1899), also known as D.L. Moody, was an American evangelist and publisher, who founded the Moody Church, Northfield School and Mount Hermon School in Massachusetts (now Northfield Mount Hermon School), the Moody Bible Institute, and Moody Publishers.",who is dl moody?
<dbpedia:Distillation>,Distillation,"Distillation is a process of separating the component substances from a liquid mixture by selective evaporation and condensation. Distillation may result in essentially complete separation (nearly pure components), or it may be a partial separation that increases the concentration of selected components of the mixture. In either case the process exploits differences in the volatility of mixture's components.",what is distillation
<dbpedia:Dactylic_hexameter>,Dactylic hexameter,"Dactylic hexameter (also known as ""heroic hexameter"") is a form of meter or rhythmic scheme in poetry. It is traditionally associated with the quantitative meter of classical epic poetry in both Greek and Latin and was consequently considered to be the Grand Style of classical poetry. The premier examples of its use are Homer's Iliad and Odyssey and Virgil's Aeneid.",what is dicacylic poetry
<dbpedia:Database>,Database,A database is an organized collection of data.,what is a database
<dbpedia:Greek_drachma>,Greek drachma,"Drachma (₯; Greek: δραχμή Modern Greek: [ðraxˈmi], Ancient Greek: [drakʰmέː]; pl. drachmae or drachmas) was the currency used in Greece during several periods in its history: An ancient Greek currency unit issued by many Greek city states during a period of ten centuries, from the Archaic period throughout the Classical period, the Hellenistic period up to the Roman period under Greek Imperial Coinage.",what is drachma
<dbpedia:Drag_racing>,Drag racing,"Drag racing is a type of motor racing in which automobiles or motorcycles (usually specially prepared for the purpose) compete, usually two at a time, to be first to cross a set finish line. The race follows a short, straight course from a standing start over a measured distance, most commonly ¼ mile (1,320 ft (402 m)), with a shorter 3/16 mile 10 feet (1,000 ft (305 m)) for nitromethane powered Top Fuel dragsters and funny cars, while 660 ft (201 m) (1/8 mi) is also popular in some circles.",what is drag racing
<dbpedia:David_Ricardo>,David Ricardo,"David Ricardo (18 April 1772 – 11 September 1823) was a British political economist. He was one of the most influential of the classical economists, along with Thomas Malthus, Adam Smith, and James Mill. Perhaps his most important legacy is his theory of comparative advantage, which suggests that a nation should concentrate its resources solely in industries where it is most internationally competitive and trade with other countries to obtain products no longer produced nationally.",what is the theory of comparative advantage
<dbpedia:Delphinus>,Delphinus,"Delphinus /dɛlˈfaɪnəs/ is a constellation in the northern sky, close to the celestial equator. Its name is Latin for dolphin. Delphinus was one of the 48 constellations listed by the 2nd century astronomer Ptolemy, and it remains among the 88 modern constellations recognized by the International Astronomical Union. It is one of the smaller constellations, ranked 69th in size.Delphinus' brightest stars form a distinctive asterism that can easily be recognized.",what does delphinus mean
<dbpedia:Didgeridoo>,Didgeridoo,"The didgeridoo (/ˌdɪdʒəriːˈduː/) (also known as a didjeridu) is a wind instrument developed by Indigenous Australians of northern Australia potentially within the last 1,500 years and still in widespread use today both in Australia and around the world. It is sometimes described as a natural wooden trumpet or ""drone pipe"". Musicologists classify it as a brass aerophone.There are no reliable sources stating the didgeridoo's exact age.",what is didgeridoo
<dbpedia:Diana_(mythology)>,Diana (mythology),"In Roman mythology, Diana ([djana]) was the goddess of the hunt, the moon and childbirth, being associated with wild animals and woodland, and having the power to talk to and control animals. She was equated with the Greek goddess Artemis, though she had an independent origin in Italy. Diana was worshipped in ancient Roman religion and is revered in Roman Neopaganism and Stregheria. Dianic Wicca, a largely feminist form of the practice, is named for her.",what was the diana mythology
<dbpedia:Doris_Day>,Doris Day,"Doris Day (born Doris Mary Ann Kappelhoff; April 3, 1922 or 1924) is an American actress, singer, and animal rights activist.Day began her career as a big band singer in 1939. Her popularity began to rise after her first hit recording ""Sentimental Journey"", in 1945. After leaving Les Brown & His Band of Renown to embark on a solo career, Day started her long-lasting partnership with Columbia Records, which remained her only recording label.",who was doris day
<dbpedia:Dysprosium>,Dysprosium,"Dysprosium is a chemical element with the symbol Dy and atomic number 66. It is a rare earth element with a metallic silver luster. Dysprosium is never found in nature as a free element, though it is found in various minerals, such as xenotime.",what is dysprosium
<dbpedia:Disk_operating_system>,Disk operating system,"Disk Operating System (specifically) and disk operating system (generically), most often reveal themselves in abbreviated form as DOS, refer to an operating system software used in most computers that provides the abstraction and management of secondary storage devices and the information on them (e.g., file systems for organizing files of all sorts).",definition of computer operating system
<dbpedia:Dwight_Schultz>,Dwight Schultz,"William Dwight Schultz (born November 24, 1947) is an American stage, television, film actor and voice artist. He is best known for his roles as Captain ""Howling Mad"" Murdock on the 1980s action series The A-Team, and as Reginald Barclay in Star Trek: The Next Generation, Star Trek: Voyager and the film Star Trek: First Contact. He is also well known in animation as the mad scientist Dr.",who is dwight schultz
<dbpedia:Dorado>,Dorado,"Dorado /dɒˈreɪdoʊ/ is a constellation in the southern sky. It was named in the late 16th century and is now one of the 88 modern constellations. Its name refers to the dolphinfish (Coryphaena hippurus), which is known as dorado in Portuguese, although it has also been depicted as a swordfish. Dorado is notable for containing most of the Large Magellanic Cloud, the remainder being in the constellation Mensa.",what is the dolphin dorado
<dbpedia:Dyslexia>,Dyslexia,"Dyslexia, also known as reading disorder, is a learning disability characterized by trouble with reading despite normal intelligence. Different people are affected to varying degrees. Problems may include difficulties in spelling words, reading quickly, writing words, ""sounding out"" words in the head, pronouncing words when reading aloud, and understanding what one reads. Often these difficulties are first noticed at school.",what is dyslexia?
<dbpedia:Major_depressive_disorder>,Major depressive disorder,"Major depressive disorder (MDD) (also known as clinical depression, major depression, unipolar depression, or unipolar disorder; or as recurrent depression in the case of repeated episodes) is a mental disorder characterized by a pervasive and persistent low mood that is accompanied by low self-esteem and by a loss of interest or pleasure in normally enjoyable activities. The term ""depression"" is used in a number of different ways.",what is mdd?
<dbpedia:Delroy_Lindo>,Delroy Lindo,"Delroy George Lindo (born November 18, 1952) is an English actor and theatre director. Lindo has been nominated for the Tony and Screen Actors Guild awards and has won a Satellite Award. He is perhaps best known for his roles in a trio of Spike Lee films, especially as West Indian Archie in Lee's Malcolm X (1992) and Woody Carmichael in Crooklyn (1994), Catlett in Get Shorty, Arthur Rose in The Cider House Rules, and Detective Castlebeck in Gone in 60 Seconds (2000).",who played archie in crooklyn
<dbpedia:David_Hayes_Agnew>,David Hayes Agnew,"David Hayes Agnew (November 24, 1818 – March 22, 1892) was an American surgeon.",david hayes agnew
<dbpedia:Dartmoor_Preservation_Association>,Dartmoor Preservation Association,"Dartmoor Preservation Association (DPA) is one of the oldest environmental or amenity bodies in the UK, founded in 1883. It concerns itself with Dartmoor, a National Park in Devon, south-west England. Originally there were two main areas of concern. Firstly, commoners’ rights were being eroded through army use, including the firing of live artillery shells, and piecemeal enclosure of land around the margins.",what is dpa uk
<dbpedia:Down_syndrome>,Down syndrome,"Down syndrome (DS or DNS) or Down's syndrome, also known as trisomy 21, is a genetic disorder caused by the presence of all or part of a third copy of chromosome 21. It is typically associated with physical growth delays, characteristic facial features, and mild to moderate intellectual disability.",what is down syndrome
<dbpedia:David_Letterman>,David Letterman,"David Michael Letterman (born April 12, 1947) is an American former television host, comedian, writer, producer, and actor.He hosted a late night television talk show for 33 years, beginning with the February 1, 1982, debut of Late Night with David Letterman on NBC, and ending with the May 20, 2015, broadcast of the Late Show with David Letterman on CBS.",where is david letterman from
<dbpedia:David_Hilbert>,David Hilbert,"David Hilbert  (German: [ˈdaːvɪt ˈhɪlbɐt]; 23 January 1862 –14 February 1943) was a German mathematician.He is recognized as one of the most influential and universal mathematicians of the 19th and early 20th centuries. Hilbert discovered and developed a broad range of fundamental ideas in many areas, including invariant theory and the axiomatization of geometry.",who is david hilbert
<dbpedia:Diacritic>,Diacritic,"A diacritic /daɪ.əˈkrɪtɪk/ – also diacritical mark, diacritical point, or diacritical sign – is a glyph added to a letter, or basic glyph. The term derives from the Greek διακριτικός (diakritikós, ""distinguishing""), which is composed of the ancient Greek διά (diá, through) and κρίνω (krínein or kríno, to separate). Diacritic is primarily an adjective, though sometimes used as a noun, whereas diacritical is only ever an adjective.",what is a diacritical
<dbpedia:Sideroxylon_grandiflorum>,Sideroxylon grandiflorum,"Sideroxylon grandiflorum, known as tambalacoque or dodo tree, is a long-lived tree in the family Sapotaceae, endemic to Mauritius. It is valued for its timber.The Sideroxylon grandiflorum fruit is analogous to the peach. They are both termed drupes because both have a hard endocarp, or pit, surrounding the seed, with the endocarp naturally splitting along a fracture line during germination.In 1973, it was thought that this species was dying out.",what kind of fruit is a dodo tree
<dbpedia:House_of_della_Rovere>,House of della Rovere,"The House of Della Rovere (literally ""of the Oak Tree"") was a noble family of Italy. Coming from modest beginnings in Savona, Liguria, the family rose to prominence through nepotism and ambitious marriages arranged by two Della Rovere popes, Francesco della Rovere, who ruled as Pope Sixtus IV (1471–1484) and his nephew Giuliano (Pope Julius II, 1503–1513).  Pope Sixtus IV is known for having built the Sistine Chapel, which is named for him.",who was della rovere
<dbpedia:Diving>,Diving,"Diving is the sport of jumping or falling into water from a platform or springboard, usually while performing acrobatics. Diving is an internationally recognized sport that is part of the Olympic Games.  In addition, unstructured and non-competitive diving is a recreational pastime.Diving is one of the most popular Olympic sports with spectators.",what is a diver
<dbpedia:Denaturation_(biochemistry)>,Denaturation (biochemistry),"Denaturation is a process in which proteins or nucleic acids lose the quaternary structure, tertiary structure and secondary structure which is present in their native state, by application of some external stress or compound such as a strong acid or base, a concentrated inorganic salt, an organic solvent (e.g., alcohol or chloroform), radiation or heat. If proteins in a living cell are denatured, this results in disruption of cell activity and possibly cell death.",what is denaturation of a protein
<dbpedia:Dieting>,Dieting,"Dieting is the practice of eating food in a regulated and supervised fashion to decrease, maintain, or increase body weight. Dieting is often used in combination with physical exercise to lose weight, commonly in those who are overweight or obese.  Some people, however, follow a diet to gain weight (usually in the form of muscle).",what is diet vs exercise
<dbpedia:Divergence>,Divergence,"In vector calculus, divergence is a vector operator that measures the magnitude of a vector field's source or sink at a given point, in terms of a signed scalar. More technically, the divergence represents the volume density of the outward flux of a vector field from an infinitesimal volume around a given point.For example:consider air as it is heated or cooled. The relevant vector field for this example is the velocity of the moving air at a point.",what is a divergence in calculus
"<dbpedia:Dartmouth,_Devon>","Dartmouth, Devon","Dartmouth is a town and civil parish in the English county of Devon. It is a tourist destination set on the western bank of the estuary of the River Dart, which is a long narrow tidal ria that runs inland as far as Totnes. It lies within the South Devon Area of Outstanding Natural Beauty and South Hams District, and had a population of 5,512 in 2001, reducing to 5,064 at the 2011 census There are two electoral wards in the Dartmouth area (Townstal & Kingswear).",what is the population of dartmouth tx
<dbpedia:Dartmoor_wildlife>,Dartmoor wildlife,"Dartmoor and the fact that a great deal of it is undisturbed for much of the year is an encouragement to the wildlife.The more common mammals include:  Dartmoor ponies, rabbits, foxes, otters, badgers, grey squirrels, weasels, stoats, hares and deer.",what kind of mammals live on dartmoor
<dbpedia:David_Mamet>,David Mamet,"David Alan Mamet (/ˈmæmɨt/; born November 30, 1947) is an American playwright, essayist, screenwriter, and film director. As a playwright, Mamet has won a Pulitzer Prize and received Tony nominations for Glengarry Glen Ross (1984) and  Speed-the-Plow (1988). As a screenwriter, he has received Oscar nominations for The Verdict (1982) and Wag the Dog (1997).",where was david mamet born
<dbpedia:Darwinism>,Darwinism,"Darwinism is a theory of biological evolution developed by Charles Robert Darwin and others, stating that all species of organisms arise and develop through the natural selection of small, inherited variations that increase the individual's ability to compete, survive, and reproduce.",what does darwinism do
<dbpedia:Disk_storage>,Disk storage,"Disk storage is a general category of storage mechanisms where data are recorded by various electronic, magnetic, optical, or mechanical changes to a surface layer of one or more rotating disks. A disk drive is a device implementing such a storage mechanism.",what does disk mean
<dbpedia:Draugr>,Draugr,"The draugr or draug (Old Norse: draugr, plural draugar; modern Icelandic: draugur, Faroese: dreygur and Norwegian, Swedish and Danish draugen), also called  aptrganga or aptrgangr, literally ""again-walker"" (Icelandic: afturganga) is an undead creature from Norse mythology, a subset of Germanic mythology.The Old Norse meaning of the word is a revenant.The will appears to be strong, strong enough to draw the hugr [animate will] back to one's body.",draugr meaning
<dbpedia:Developmental_biology>,Developmental biology,"Developmental biology is the study of the process by which animals and plants grow and develop, and is synonymous with ontogeny.  In animals most development occurs in embryonic life, but it is also found in regeneration, asexual reproduction and metamorphosis, and in the growth and differentiation of stem cells in the adult organism.",what is the definition of developmental biology
<dbpedia:Drexel_University>,Drexel University,"Drexel University is a private research university with three campuses in Philadelphia and one in Sacramento, California. It was founded in 1891 by Anthony J. Drexel, a noted financier and philanthropist. Drexel offers over 70 full-time undergraduate programs and accelerated degrees. At the graduate level, the university offers over 100 masters, doctoral, and professional programs, many available part-time.Drexel is best known for the cooperative education program (co-op).",when was drexel founded
<dbpedia:Disaccharide>,Disaccharide,"A disaccharide or biose is the carbohydrate which is formed when two monosaccharides (simple sugars) undergo a condensation reaction which involves the elimination of a small molecule, such as water, from the functional groups only. Like monosaccharides, disaccharides are soluble in water.",what does disaccharide do in carbohydrates
<dbpedia:Democritus>,Democritus,"Democritus (/dɪˈmɒkrɪtəs/; Greek: Δημόκριτος Dēmókritos, meaning ""chosen of the people""; c. 460 – c. 370 BC) was an influential Ancient Greek pre-Socratic philosopher primarily remembered today for his formulation of an atomic theory of the universe.Democritus was born in Abdera, Thrace around 460 BC. His exact contributions are difficult to disentangle from those of his mentor Leucippus, as they are often mentioned together in texts.",what did democritus do
<dbpedia:Duodecimal>,Duodecimal,"The duodecimal system (also known as base 12 or dozenal) is a positional notation numeral system using twelve as its base. In this system, the number ten may be written by a rotated ""2"" (2) and the number eleven by a rotated ""3"" (3). This notation was introduced by Sir Isaac Pitman. These digit forms are available as Unicode characters on computerized systems since June 2015 as ↊ (Code point 218A) and ↋ (Code point 218B), respectively.",what is duodecimal
<dbpedia:Dictator>,Dictator,A dictator is a ruler who wields absolute authority. A state ruled by a dictator is called a dictatorship.,definition of a dictator
