_id,title,text,query
"<dbpedia:Ramona,_Oklahoma>","Ramona, Oklahoma","Ramona is a town in Washington County, Oklahoma, United States. The population was 564 at the 2000 census. The town began as Bon-Ton, but changed its name to Ramona in 1899 in honor of the Helen Hunt Jackson novel of the same name. The town is one of four communities that makes up the consolidated Caney Valley School District.Ramona was an oil town and was also a stop for the Santa Fe railroad. When the oil dried up, there was no other industry to support Ramona, so the town began to die out.",what county is ramona ok in
"<dbpedia:Dewey,_Oklahoma>","Dewey, Oklahoma","Dewey is a city in Washington County, Oklahoma, United States. Founded by Jacob A. Bartles in 1899, the town was named for Admiral George Dewey. It was incorporated December 8, 1905. The population was 3,179 at the 2000 census and 3,432 at the 2010 census, an increase of 8 percent.",what county is dewey ok
"<dbpedia:Burns_Flat,_Oklahoma>","Burns Flat, Oklahoma","Burns Flat is a town in Washita County, Oklahoma, United States. The population was 2,057 at the 2010 census.",where is burns flat oklahoma
<dbpedia:Dumfries>,Dumfries,Dumfries (/dʌmˈfriːs/ dum-FREESS; possibly from Scottish Gaelic: Dùn Phris) is a market town and former royal burgh within the Dumfries and Galloway council area of Scotland. It is near the mouth of the River Nith into the Solway Firth. Dumfries was a civil parish and became the county town of the former county of Dumfriesshire. Dumfries is nicknamed Queen of the South. People from Dumfries are known colloquially as Doonhamers.,where is dumfries scotland
"<dbpedia:Canute,_Oklahoma>","Canute, Oklahoma","Canute is a town in Washita County, Oklahoma, United States. The population was 541 at the 2010 census.",where is canute oklahoma
"<dbpedia:Capron,_Oklahoma>","Capron, Oklahoma","Capron is a town in Woods County, Oklahoma, United States. The population was 23 at the 2010 census, declining by almost half from 2000 when it had 42 persons.",what county is capron ok
"<dbpedia:Freedom,_Oklahoma>","Freedom, Oklahoma","Freedom is a town in Woods County, Oklahoma, United States.  As of the 2010 census, the city population was 289.",where is freedom ok
"<dbpedia:Avard,_Oklahoma>","Avard, Oklahoma","Avard is a town in Woods County, Oklahoma, United States.  The population was 26 at the 2000 census and is sometimes considered a ghost town.  After initial growth Avard began declining in the 1930s.  Avard had a post office from June 1, 1895, until November 22, 1963. As of the 2010 census, Avard was not listed on their website or in the gazeteer. It is unclear if this is a mistake or if the town was disincorporated.",what county is avard oklahoma in
"<dbpedia:Corn,_Oklahoma>","Corn, Oklahoma","Corn is a town in Washita County, Oklahoma, United States. The population was 503 at the 2010 census.",what county is corn oklahoma
"<dbpedia:Dill_City,_Oklahoma>","Dill City, Oklahoma","Dill City is a town in Washita County, Oklahoma, United States. The population was 562 at the 2010 census.",what county is dill city oklahoma
"<dbpedia:Sentinel,_Oklahoma>","Sentinel, Oklahoma","Sentinel is a town in Washita County, Oklahoma, United States. The population was 901 at the 2010 census, an increase of 4.9 percent from 859 in 2000.","what county is sentinel, ok"
"<dbpedia:Colony,_Oklahoma>","Colony, Oklahoma","Colony is a town in northeastern Washita County, Oklahoma, United States. The population was 136 at the 2010 U.S. census, a decrease of 7.5 percent from 147 in 2000. It was named for the Seger Colony, founded in 1886, which taught modern agricultural techniques to the Arapaho and Cheyenne tribes that would be resettled in the vicinity. Colony is 16 miles (26 km) east and 4 miles (6.4 km) north of Cordell.",what county is the oklahoma colony
"<dbpedia:Foss,_Oklahoma>","Foss, Oklahoma","Foss is a town in Washita County, Oklahoma, United States.  As of the 2010 census, the town population was 151, an 18.9 percent increase from 127 at the 2000 census.",what county is foss ok in
"<dbpedia:Vera,_Oklahoma>","Vera, Oklahoma","Vera is a town in Washington County, Oklahoma, United States.  The population was 241 at the 2010  census.",where is vera oklahoma
"<dbpedia:Bessie,_Oklahoma>","Bessie, Oklahoma","Bessie is a town in Washita County, Oklahoma, United States. The population was 181 at the 2010 census, a 4.7 percent decline from 190 in 2000.",where is bessie ok
"<dbpedia:Dacoma,_Oklahoma>","Dacoma, Oklahoma","Dacoma is a town in Woods County, Oklahoma, in the United States.  The population was 107 at the 2010 census, down from 148 in 2000.  Dacoma shares a school district with the nearby town of Carmen.",what county is dacoma oklahoma in
"<dbpedia:New_Cordell,_Oklahoma>","New Cordell, Oklahoma","New Cordell is a city in Washita County, Oklahoma, United States. The town lies along U.S. Route 183. The population was 2,915 at the 2010 census. Cordell was previously located a few miles from the current spot, but was moved circa 1900, thus the name New Cordell. It was named for a U.S. Postal Service employee in Washington D. C., Wayne W. Cordell. The town is now commonly called Cordell.",what county is cordell ok in
"<dbpedia:Mooreland,_Oklahoma>","Mooreland, Oklahoma","Mooreland is a town in Woodward County, Oklahoma, United States. The population was 1,190 at the 2010 census.",mooreland is what county
"<dbpedia:Fort_Supply,_Oklahoma>","Fort Supply, Oklahoma","Fort Supply is a town in Woodward County, Oklahoma, United States. The population was 330 at the 2010 census.",what county is fort supply ok
<dbpedia:Marcus_Giamatti>,Marcus Giamatti,"Marcus Bartlett Giamatti (born October 3, 1961) is an American actor, best known for being a regular member of the cast of the CBS drama series Judging Amy.",what nationality is marcus gimatti
"<dbpedia:Rocky,_Oklahoma>","Rocky, Oklahoma","Rocky is a town in Washita County, Oklahoma, United States. The population was 162 at the 2010 United States Census, a 6.9 percent decline from 174 at the 2000 census. The town lies along U.S. Route 183.",where is rocky ok
<dbpedia:Paul_Giamatti>,Paul Giamatti,"Paul Edward Valentine Giamatti (/dʒiəˈmɑːti/; born June 6, 1967) is an American actor. He was nominated for an Academy Award for Best Supporting Actor for the film Cinderella Man, and is also known for his roles in the films  Sideways, American Splendor, The Illusionist, Cold Souls, Barney's Version, Big Fat Liar, Love & Mercy, Straight Outta Compton and Win Win, as well as the miniseries John Adams.",who is paul gitiamatti
"<dbpedia:Waynoka,_Oklahoma>","Waynoka, Oklahoma","Waynoka is a city in Woods County, Oklahoma, United States.  The population was 927 at the 2010 census.  Little Sahara State Park is 4 miles (6.4 km) south of the city.","what county is waynoka, ok in"
"<dbpedia:Huntington,_Oregon>","Huntington, Oregon","Huntington is a city in Baker County, on the eastern border of Oregon, United States. It is located on the Snake River and along Interstate 84 and U.S. Route 30. The population was 440 at the 2010 census, down from 515 in 2000.",where is huntington or
"<dbpedia:Mutual,_Oklahoma>","Mutual, Oklahoma","Mutual is a town in Woodward County, Oklahoma, United States. The population was 61 at the 2010 census. Incorporated in 1908, the town suffered under the agricultural depression after World War I and saw only minimal growth during the 1970s and 1980s.","what county is mutual, ok in?"
"<dbpedia:Sharon,_Oklahoma>","Sharon, Oklahoma","Sharon is a town in Woodward County, Oklahoma, United States. The population was 135 at the 2010 census.",what county is sharon ok in
"<dbpedia:Richland,_Oregon>","Richland, Oregon","Richland is a city in Baker County, Oregon, United States. The population was 156 at the 2010 census.",what county is richland oregon in
"<dbpedia:Halfway,_Oregon>","Halfway, Oregon","Halfway is a small town in Baker County, Oregon,  United States. This town took its name from the location of its post office, on the Alexander Stalker ranch, half way between Pine and Cornucopia. The population was 288 at the 2010 census.During the dot-com boom, Halfway agreed to rename itself as Half.com, Oregon for a year as a publicity stunt for the e-commerce company of the same name.",where is halfway oregon
"<dbpedia:Baker_City,_Oregon>","Baker City, Oregon","Baker City is a city in and the county seat of Baker County, Oregon, United States. It was named after Edward D. Baker, the only U.S. Senator ever killed in military combat. The population was 9,828 at the 2010 census.",what county is baker city or
"<dbpedia:Haines,_Oregon>","Haines, Oregon","Haines is a city in Baker County, Oregon, United States. The population was 416 at the 2010 census.",what county is haines oregon
"<dbpedia:Adair_Village,_Oregon>","Adair Village, Oregon","Adair Village is a city in Benton County, Oregon, United States. The population was 840 at the 2010 census. The city is part of the Corvallis, Oregon, Metropolitan Statistical Area.",what county is adair village oregon in
"<dbpedia:Sumpter,_Oregon>","Sumpter, Oregon","Sumpter is a city in Baker County, Oregon, United States. The population was 204 at the 2010 census.  Sumpter is named after Fort Sumter by its founders. The name was inspired by a rock as smooth and round as a cannonball, which reminded a local resident of the American Civil War and Fort Sumter.","what county is sumpter, or"
"<dbpedia:Unity,_Oregon>","Unity, Oregon","Unity is a city in Baker County, Oregon, United States, located in the Burnt River Valley. The population was 71 at the 2010 census.",where is unity oregon?
"<dbpedia:Woodward,_Oklahoma>","Woodward, Oklahoma","Woodward is a city in and the county seat of Woodward County, Oklahoma, United States.  It is the largest city in a nine-county area. The population was 12,051 at the 2010 census.The area was historically occupied by the Kiowa, Comanche, Cheyenne and Arapaho tribes.  European-American settlers established the town in 1887 after construction of the railroad to that point for shipping cattle to markets. The town was on the Great Western Cattle Trail.",what county is woodward ok
"<dbpedia:Jennings_Lodge,_Oregon>","Jennings Lodge, Oregon","Jennings Lodge is a census-designated place and unincorporated community in Clackamas County, Oregon, United States, between Milwaukie, and Gladstone. For statistical purposes, the United States Census Bureau has defined Jennings Lodge as a census-designated place (CDP). The census definition of the area may not precisely correspond to local understanding of the area with the same name.",what county is jennings lodge
"<dbpedia:Johnson_City,_Oregon>","Johnson City, Oregon","Johnson City is a city in Clackamas County, Oregon,  United States. The population was 566 at the 2010 census.",what county is johnson city oregon in
"<dbpedia:Philomath,_Oregon>","Philomath, Oregon","Philomath (/fɨˈloʊməθ/ fi-LOH-məth) is a city in Benton County, Oregon, United States. It was named for Philomath (Greek, ""love of learning"") College. The population was 4,584 at the 2010 census. It is part of the Corvallis, Oregon, Metropolitan Statistical Area.",where is philomath oregon
<dbpedia:New_Kuomintang_Alliance>,New Kuomintang Alliance,"The New Kuomintang Alliance (Chinese: 新國民黨連線; Hsin Kuomintang Lienhsien) was a faction of Kuomintang in the Republic of China on Taiwan, active late 20th century. Composed of mainly younger mainlanders, this faction was in favour of intra-party reform. It accused President Lee Teng-hui of autocratic tendencies and complained that the KMT was too corrupt. In August 1993, days before the 14th National Congress of Kuomintang, the New KMT Alliance broke away to form the Chinese New Party.",who are the kmt
"<dbpedia:Happy_Valley,_Oregon>","Happy Valley, Oregon","Happy Valley is a city in Clackamas County, Oregon, United States. The population was 13,903 at the 2010 census.",what county is happy valley oregon
"<dbpedia:Barlow,_Oregon>","Barlow, Oregon","Barlow is a city in Clackamas County, Oregon, United States.  The population was 135 at the 2010 census.",what county is barlow oregon in
"<dbpedia:Monroe,_Oregon>","Monroe, Oregon","Monroe is a city in Benton County, Oregon, United States. The population was 617 at the 2010 census. It is part of the Corvallis, Oregon Metropolitan Statistical Area. Monroe is located midway between Eugene and Corvallis along highway 99W and the city experiences a strong friendly rivalry between fans of the Oregon Ducks and the Oregon State Beavers.",where is monroe oregon located
<dbpedia:A._Bartlett_Giamatti>,A. Bartlett Giamatti,"Angelo Bartlett ""Bart"" Giamatti (/dʒiːəˈmɑːti/; April 4, 1938 – September 1, 1989) was an American professor of English Renaissance literature, the president of Yale University, and the seventh Commissioner of Major League Baseball. Giamatti negotiated the agreement terminating the Pete Rose betting scandal by permitting Rose to voluntarily withdraw from the sport to avoid further punishment.",who was peter rose
"<dbpedia:Canby,_Oregon>","Canby, Oregon","Canby is a city in Clackamas County, Oregon, United States. The population was 15,829 at the 2010 census. It is along Oregon Route 99E, 2 miles (3 km) northeast of Barlow. Recently, Canby was featured on ABC's series 20/20 (U.S. TV series), for its very own Canby Psychic being part of an ongoing investigation.",what county is canby oregon
"<dbpedia:Oatfield,_Oregon>","Oatfield, Oregon","Oatfield is an unincorporated community and census-designated place in Clackamas County, Oregon, United States. It is in the Portland metropolitan area. As of the 2010 census, the population of the CDP was 13,415.It is named after Oatfield Road, which runs between Milwaukie and Gladstone. Oatfield Road was named for the Oatfield family, well-known pioneers of the area.","where is oatfield, oregon"
"<dbpedia:Clackamas,_Oregon>","Clackamas, Oregon","Clackamas is an unincorporated community and former census-designated place (CDP) in Clackamas County, Oregon, United States. The population was 6,965 at the 2010 census. It is a suburb of Portland.Clackamas has Camp Withycombe, a military base, and a branch of the Kaiser Permanente Hospital.",where is cackamas oregon
"<dbpedia:Oak_Grove,_Oregon>","Oak Grove, Oregon","Oak Grove is an unincorporated community in Clackamas County, Oregon, United States, in the Portland metropolitan area. For statistical purposes, the United States Census Bureau has defined Oak Grove as a census-designated place (CDP). The census definition of the area may not precisely correspond to local understanding of the area with the same name. The population was 16,629 at the 2010 census.",what county is oak grove oregon in
"<dbpedia:Mount_Hood_Village,_Oregon>","Mount Hood Village, Oregon","Mount Hood Village is the name of a census-designated place (CDP) within the Mount Hood Corridor in Clackamas County, Oregon, United States. As of the 2010 census, the CDP had a population of 4,864. The Villages at Mount Hood is the name of the combined government of several of the communities encompassed by the CDP and is a separate entity.",where is mt hood oregon
"<dbpedia:Estacada,_Oregon>","Estacada, Oregon","Estacada /ˌɛstəˈkeɪdə/ is a city in Clackamas County, Oregon, United States, about 30 miles (48 km) southeast of Portland. The population was 2,695 at the 2010 census.",estacada or is in what county
"<dbpedia:Molalla,_Oregon>","Molalla, Oregon","Molalla /məˈlɑːlə/ is a city in Clackamas County, Oregon, United States. The population was 8,108 at the 2010 census.",what county is molalla oregon in
"<dbpedia:Gearhart,_Oregon>","Gearhart, Oregon","Gearhart is a city in Clatsop County, Oregon, United States. The population was 1,462 at the 2010 census.",what county is gearhart oregon in
"<dbpedia:Seaside,_Oregon>","Seaside, Oregon","Seaside is a city in Clatsop County, Oregon,  United States. The name Seaside is derived from Seaside House, a historic summer resort built in the 1870s by railroad magnate Ben Holladay. The city's population was 6,457 at the 2010 census.",where is seaside oregon
"<dbpedia:Scappoose,_Oregon>","Scappoose, Oregon","Scappoose /skæˈpuːs/ is a city in Columbia County, Oregon,  United States. It was named for a nearby stream, which drains the southern part of the county. The name ""Scappoose"" is of Native American origin, and is said to mean ""gravelly plain.""  The population was 6,592 at the 2010 census.",what county is scappoose or
"<dbpedia:Sandy,_Oregon>","Sandy, Oregon","Sandy is a city located in Clackamas County, Oregon, United States, and named after the nearby Sandy River. The city serves as the western gateway to the Mount Hood Corridor, 25 miles (40 km) from Portland. As of the 2010 census, the city had a total population of 9,570.",what county is sandy oregon in
"<dbpedia:Columbia_City,_Oregon>","Columbia City, Oregon","Columbia City is a city in Columbia County, Oregon,  United States. It was named for its location on the Columbia River. The population was 1,946 at the 2010 census.",what county is columbia city oregon
"<dbpedia:Clatskanie,_Oregon>","Clatskanie, Oregon","Clatskanie /ˈklætskɨnaɪ/ is a city in Columbia County, Oregon, United States. It was named for the Clatskanie River, which empties into the Columbia River within the city limits. The population was 1,737 at the 2010 census.","what county is clatskanie, oregon in?"
"<dbpedia:Cannon_Beach,_Oregon>","Cannon Beach, Oregon","Cannon Beach is a city in Clatsop County, Oregon, United States. The population was 1,690 at the 2010 census.","what county is cannon beach, oregon"
"<dbpedia:Rainier,_Oregon>","Rainier, Oregon","Rainier is a city in Columbia County, Oregon, United States. The population was 1,895 at the 2010 census.  Rainier is located on the south bank of the Columbia River across from Kelso and Longview, Washington",what county is rainier oregon in?
"<dbpedia:Vernonia,_Oregon>","Vernonia, Oregon","Vernonia is a city in Columbia County, Oregon,  United States. It is located on the Nehalem River, in a valley on the eastern side of the Northern Oregon Coast Range that is the heart of one of the most important timber-producing areas of the state. Logging has played a large role in the history of the city. The population was 2,151 at the 2010 census.",where is vernonia or
"<dbpedia:Warrenton,_Oregon>","Warrenton, Oregon","Warrenton is a city in Clatsop County, Oregon, United States. The city is named for D.K. (Daniel Knight) Warren, an early settler. The population was 4,989 at the 2010 census.",what county is warrenton oregon in
"<dbpedia:Bunker_Hill,_Oregon>","Bunker Hill, Oregon","Bunker Hill is a census-designated place (CDP) in Coos County, Oregon, United States. As of the 2010 census the population was 1,444.",where is bunker hill oregon
"<dbpedia:Prescott,_Oregon>","Prescott, Oregon","Prescott is a city in Columbia County, Oregon,  United States. It was named in 1905 for the owner of the local sawmill. The population was 55 at the 2010 census.",where is prescott oregon
"<dbpedia:West_Linn,_Oregon>","West Linn, Oregon","West Linn is a city in Clackamas County, Oregon, United States. Now a southern suburb within the Portland metropolitan area, West Linn has a history of early development, prompted by the opportunity to harvest energy from nearby Willamette Falls. It was named after U.S. Senator Lewis F. Linn of Ste. Genevieve, Missouri, who had advocated the American occupation of Oregon as a counterclaim to the British. As of the 2010 census, the city had a population of 25,109.",what county is west linn or
"<dbpedia:St._Helens,_Oregon>","St. Helens, Oregon","St. Helens is the county seat of Columbia County, Oregon. It was founded by Captain H. M. Knighton, a native of New England, in 1845 as ""Plymouth"". The name was changed to St. Helens in the latter part of 1850 for its view of Mount St. Helens some 39 miles (63 km) away in Washington. The population was 12,883 at the 2010 census.",what county is st helens or in
"<dbpedia:Coos_Bay,_Oregon>","Coos Bay, Oregon","Coos Bay (Coos language: Atsixiis) is a city located in Coos County, Oregon, United States, where the Coos River enters Coos Bay on the Pacific Ocean. The city borders the city of North Bend, and together they are often referred to as one entity called either Coos Bay-North Bend or the Bay Area. Coos Bay's population as of the 2010 census was 15,967 residents, making it the largest city on the Oregon Coast.",what county is coos bay in oregon
"<dbpedia:Coquille,_Oregon>","Coquille, Oregon","Coquille /koʊˈkiːl/ is a city in, and the county seat of, Coos County, Oregon, United States. The population was 3,866 at the 2010 census. The primary economic base is the timber industry. The city derives its name from the Coquille Indian tribe.",what county is coquille oregon in
"<dbpedia:Myrtle_Point,_Oregon>","Myrtle Point, Oregon","Myrtle Point is a city in Coos County, Oregon, United States. The population was 2,514 at the 2010 census.",myrtle point oregon is what county
"<dbpedia:Deschutes_River_Woods,_Oregon>","Deschutes River Woods, Oregon","Deschutes River Woods is a census-designated place (CDP) and unincorporated community in Deschutes County, Oregon, United States.  It is part of the Bend, Oregon Metropolitan Statistical Area.  The population was 4,631 at the 2000 census.",what county is deschutes river woods or
"<dbpedia:Bandon,_Oregon>","Bandon, Oregon","Bandon /ˈbændən/ is a city in Coos County, Oregon, United States, on the south side of the mouth of the Coquille River. It was named by George Bennet, an Irish peer, who settled nearby in 1873 and named the town after Bandon in Ireland, his hometown.  The population was 3,066 at the 2010 census. In 2010, Bandon was named one of the ""Coolest Small Towns in America"" by BudgetTravel.",what county is bandon oregon in
"<dbpedia:Powers,_Oregon>","Powers, Oregon","Powers is a city in Coos County, Oregon, United States. The population was 689 at the 2010 census.",what county is powers oregon in
"<dbpedia:Lakeside,_Oregon>","Lakeside, Oregon","Lakeside is a city in Coos County, Oregon, United States. The population was 1,699 at the 2010 census.",what county is lakeside oregon
"<dbpedia:North_Bend,_Oregon>","North Bend, Oregon","North Bend is a city in Coos County, Oregon, United States with a population of 9,695 as of the 2010 census. North Bend is surrounded on three sides by Coos Bay, an S-shaped water inlet and estuary where the Coos River enters Coos Bay and borders the city of Coos Bay to the south. North Bend became an incorporated city in 1903.",what county is north bend in?
"<dbpedia:Three_Rivers,_Oregon>","Three Rivers, Oregon","Three Rivers is a census-designated place (CDP) and unincorporated community in Deschutes County, Oregon, United States.  It is part of the Bend, Oregon Metropolitan Statistical Area. The population was 2,445 at the 2000 census. Three Rivers is located south of Sunriver and north of La Pine, just west of U.S. Route 97.",where is three rivers oregon
"<dbpedia:Harbor,_Oregon>","Harbor, Oregon","Harbor (Tolowa: chit ) is an unincorporated community in Curry County, Oregon, United States. It is located across the Chetco River from the city of Brookings. For statistical purposes, the United States Census Bureau has defined Harbor as a census-designated place (CDP). The census definition of the area may not precisely correspond to local understanding of the area with the same name. The population of the CDP was 2,391 at the 2010 census.",where is harbor oregon
"<dbpedia:Brookings,_Oregon>","Brookings, Oregon","Brookings is a city in Curry County, Oregon, United States. It was named after John E. Brookings, president of the Brookings Lumber and Box Company, which founded the city in 1908. As of the 2010 census the population was 6,336.",brookings or is what county in oregon
"<dbpedia:Gold_Beach,_Oregon>","Gold Beach, Oregon","Gold Beach (Tolowa: yan-shu’-chit, yan-shuu-chit’-dvn) is a city in and the county seat of Curry County, Oregon, United States, on the Oregon Coast. The population was 2,253 at the 2010 census.",where is gold beach oregon
"<dbpedia:Terrebonne,_Oregon>","Terrebonne, Oregon","Terrebonne is a census-designated place (CDP) in Deschutes County, Oregon, United States.  It is part of the Bend, Oregon Metropolitan Statistical Area. The population was 1,469 at the 2000 census.",what county is terrebonne or in
"<dbpedia:La_Pine,_Oregon>","La Pine, Oregon","La Pine is a city in Deschutes County, Oregon, United States, incorporated on December 7, 2006.La Pine is part of the Bend, Oregon Metropolitan Statistical Area. The population was 1,653 at the 2010 census. La Pine is in an isolated area of Central Oregon, consisting of a loose collection of homes and businesses along U.S. Highway 97 about 30 miles (48 km) southwest of Bend.  Most of the residential development is concealed from the highway itself.",where is la pine oregon
"<dbpedia:Sisters,_Oregon>","Sisters, Oregon","Sisters is a city in Deschutes County, Oregon, United States. It is part of the Bend, Oregon Metropolitan Statistical Area. The population was 959 at the 2000 census, but more than doubled to 2038 as of the 2010 census.",what county is sister oregon in
"<dbpedia:Bend,_Oregon>","Bend, Oregon","Bend is a city in and the county seat of Deschutes County, Oregon, United States. It is the principal city of the Bend, Oregon Metropolitan Statistical Area.  Bend is Central Oregon's largest city, and despite its modest size, is the de facto metropolis of the region, owing to the low population density of that area. Bend recorded a population of 76,693 at the time of the 2010 US Census, up from 52,029 at the 2000 census. The estimated population of the city as of 2013 is 81,236.",what county is bend oregon in
