_id,title,text,query
<dbpedia:Umpire_(cricket)>,Umpire (cricket),"In cricket, an umpire (from the Old French nompere meaning not a peer, i.e. not a member of one of the teams, impartial) is a person who has the authority to make judgements on the cricket field, according to the laws of cricket.",what is a cricket umpire?
<dbpedia:Khālid_ibn_ʿAbd_al‐Malik_al‐Marwarrūdhī>,Khālid ibn ʿAbd al‐Malik al‐Marwarrūdhī,"Khālid ibn ʿAbd al‐Malik al‐Marwarrūdhī (Arabic: خالد بن عبدالملك‎) was a Zanji slave who was taken to Persia in  the 9th century.Together with ʿAlī ibn ʿĪsā al-Asṭurlābī in 827, he measured at 35 degrees north latitude, in the valley of the Tigris, the length of a meridian arc and thus the Earth's circumference, getting a result of 40,248 km (or, according to other sources, 41,436 km).",who is khlid
<dbpedia:Miha_Remec>,Miha Remec,"Miha Remec (born August 10, 1928 in Ptuj, Kingdom of Serbs, Croats and Slovenes (now Slovenia)) is a Slovene author. He is a multiple winner of the SFERA Award.",who is miha remec
<dbpedia:List_of_time_periods>,List of time periods,"The categorization of the past into discrete, quantified named blocks of time is called periodization. This is a list of such named time periods as defined in various fields of study. Major categorization systems include cosmological (time periods in the origin and evolution of the universe), geological (time periods in the origin and evolution of earth), anthropological (time periods in the origin and evolution of humans) and historical (written history).",list of time periods
<dbpedia:Sissy>,Sissy,"Sissy (derived from sister; also sissy baby, sissy boy, sissy man, etc.) is a pejorative term for a boy or man who violates or does not meet the standard male gender role. Generally, sissy implies a lack of courage, strength, coordination, testosterone, male libido, and stoic calm, which have traditionally been important to the male role.",sissy definition
<dbpedia:Tarvos_Trigaranus>,Tarvos Trigaranus,Tarvos Trigaranus or Taruos Trigaranos is a divine figure who appears on a relief panel of the Pillar of the Boatmen as a bull with three cranes perched on his back.,who is tarvos trigaranus
<dbpedia:Pike_(weapon)>,Pike (weapon),"A pike is a pole weapon, a very long thrusting spear formerly used extensively by infantry. Unlike many similar weapons, the pike is not intended to be thrown. Pikes were used regularly in European warfare from the early Middle Ages until around 1700, and wielded by foot soldiers deployed in close quarters. The pike found extensive use with Landsknecht armies and Swiss mercenaries, who employed it as their main weapon and used it in pike square formations.",what is a pike
<dbpedia:Verbeia>,Verbeia,"In ancient Celtic polytheism, Verbeia was a goddess worshipped in Roman Britain. She is known from a single altar-stone dedicated to her at Ilkley (RIB 635). She is considered to have been a deification of the River Wharfe.An image of a woman (also from Ilkley) may represent the goddess: she is depicted with an overlarge head and schematic features; she wears a long, pleated robe and she has two large snakes, represented as geometric zig-zags, which she grasps, one in each hand.",what does verbeia mean
<dbpedia:Ali_ibn_Isa_al-Asturlabi>,Ali ibn Isa al-Asturlabi,"ʿAlī ibn ʿĪsā al-Asṭurlābī (Arabic: علي بن عيسى‎) was an Afro-Arab astronomer and geographer of the 9th century. He wrote a treatise on the astrolabe and was an opponent of astrology. During the reign of al-Ma'mun, and together with Khālid ibn ʿAbd al‐Malik al‐Marwarrūdhī, he participated in an expedition to the Plain of Sinjar to measure the length of a degree, or the circumference of the Earth.",when did ali ibn al-asturlabi write his book
<dbpedia:Vosegus>,Vosegus,"Vosegus (sometimes Vosagus or Vosacius) was a name used in the Roman Empire for a Celtic god of hunting and forestation. On rare known artefacts Vosegus is shown with a bow and shield, accompanied by a dog. The centre of area where Vosegus was worshiped was around the Donon. On top of a hill there was a temple dedicated to Vosegus.Later in Gallo-Roman religion, Vosegus was the patron god of the Vosges in eastern Gaul.",meaning of the name voigus
<dbpedia:Slane>,Slane,"Slane  (Irish: Baile Shláine, meaning Town of Sláine mac Dela) is a village in County Meath, in Ireland. The village stands on a steep hillside on the left bank of the River Boyne at the intersection of the N2 (Dublin to Monaghan road) and the N51 (Drogheda to Navan road). In 2006 Slane's population was 1,099, having grown from 823 in 2002. The population of the village and the surrounding rural area was 1,587 in 2006, up from 1,336 in 2002. The village centre dates from the 18th century.",slane ireland
<dbpedia:Segomo>,Segomo,"In Gallo-Roman religion, Segomo ""\victor, mighty one"") was a war god worshipped in Gaul. In Roman times he was equated with Mars and Hercules. He may be related to Cocidius, a similar god worshipped in Britain. He is commonly associated with the eagle or hawk. The name of the legendary High King of Ireland Nia Segamain, which translates as ""sister's son or champion of Segamon"", may be related.",what is segomo's name
<dbpedia:Tamesis>,Tamesis,"Tamesis was the ancient name for the River Thames.Sculptures titled Tamesis and Isis by Anne Seymour Damer can be found on the bridge at Henley-on-Thames, Oxfordshire. The original terracotta and plaster models were exhibited at the Royal Academy, London, in 1785. They are now on show at the River and Rowing Museum in Henley.",what is the name of the tamedesis bridge
<dbpedia:Twm_Siôn_Cati>,Twm Siôn Cati,"Twm Siôn Cati (also sometimes spelt Twm Sion Cati, Twm Shon Catti, Twm Shon Catty, and so on) is a figure in Welsh folklore, often described as the Welsh Wizard.",what is a twm
<dbpedia:Tiny_BASIC>,Tiny BASIC,"Tiny BASIC is a dialect of the BASIC programming language that can fit into as little as 2 or 3 KB of memory. This small size made it invaluable in the early days of microcomputers (the mid-1970s), when typical memory size was only 4–8 KB. The prevalence of BASIC on the first generation of home computers is an outcome of Tiny BASIC.",what is tiny basic
<dbpedia:Smertrios>,Smertrios,"In Gallo-Roman religion, Smertrios or Smertrius was a god of war worshipped in Gaul and Noricum. In Roman times he was equated with Mars. His name contains the same root as that of the goddess Rosmerta and may mean ""The Purveyor"" or ""The Provider"", a title rather than a true name. Smertulitanus may be a variant name for the same god.Smertrius is one of the Gaulish gods depicted on the Pillar of the Boatmen, discovered in Paris.",what is the meaning of the name smertrios
<dbpedia:Open_Audio_License>,Open Audio License,"The Open Audio License is a free music license, created in 2001 by the Electronic Frontier Foundation (EFF).It provides freedom and openness of use for music and other expressive works.The EFF now encourages artists to use the Creative Commons Attribution-ShareAlike license instead of the Open Audio License, and it ""designates the Creative Commons Attribution Share-Alike license as version 2.0 of the Open Audio License.""Publication of the first version of the Open Audio License spurred the creation of the original Open Music Registry to support the license and provide a directory for finding works released under the license.",what is the open audio license
<dbpedia:Taranis>,Taranis,"In Celtic mythology Taranis was the god of thunder worshipped essentially in Gaul, Gallaecia, Britain and Ireland, but also in the Rhineland and Danube regions, amongst others. Taranis, along with Esus and Toutatis as part of a sacred triad, was mentioned by the Roman poet Lucan in his epic poem Pharsalia as a Celtic deity to whom human sacrificial offerings were made.",is taranis a celtic god
<dbpedia:Jowett>,Jowett,"Jowett was a manufacturer of light cars and light commercial vehicles in Bradford, West Riding of Yorkshire, England from 1906 to 1954.",what does jowett mean
<dbpedia:Dirona>,Dirona,"Dirona is a genus of sea slugs, Pacific Ocean nudibranchs, marine, opisthobranch gastropod mollusks in the family Dironidae.Dirona is the type genus of the family Dironidae.This genus is characterized by large, broad cerata.",what is dirona
<dbpedia:Northern_pike>,Northern pike,"The northern pike (Esox lucius), known simply as a pike  in Britain, Ireland, most of Canada, and most parts of the United States, (also called jackfish or simply ""northern"" in the U.S. Upper Midwest and in Manitoba), is a species of carnivorous fish of the genus Esox (the pikes). They are typical of brackish and fresh waters of the Northern Hemisphere (i.e. holarctic in distribution). Pike grow to a relatively large size: the average length is about 70–120 cm (28–47 in).",how big is a pike
<dbpedia:Synod_of_Dort>,Synod of Dort,"Dates in this article are according to the Julian Calendar. Sources using the Old Style calendar will need to be adjusted by adding ten days.The Synod of Dort (also known as the Synod of Dordt or the Synod of Dordrecht) was an international Synod held in Dordrecht in 1618–1619, by the Dutch Reformed Church, to settle a divisive controversy initiated by the rise of Arminianism. The first meeting was on November 13,  1618, and the final meeting, the 154th, was on May 9, 1619.",what is das dort synod dates
<dbpedia:Randy_Bachman>,Randy Bachman,"Randolph Charles ""Randy"" Bachman, OC OM (/ˈbækmən/; born September 27, 1943) is a Canadian musician best known as lead guitarist, songwriter and a founding member of the 1960s and 1970s rock bands The Guess Who and Bachman–Turner Overdrive. Bachman was also a member of Brave Belt with Chad Allan, Union and Ironhorse, and has recorded numerous solo albums.He is also a national radio personality on CBC Radio, hosting the weekly music show, Vinyl Tap.",who is randy buschman
<dbpedia:Annette_von_Droste-Hülshoff>,Annette von Droste-Hülshoff,"Anna Elisabeth Franziska Adolphine Wilhelmine Louise Maria, Freiin von Droste zu Hülshoff, known as Annette von Droste-Hülshoff (German: [aˈnɛtə fɔn ˈdʁɔstəˈhʏlshɔf]; January 10 or 12 1797 – May 24, 1848), was a 19th-century German writer and composer. She was one of the most important German poets and author of the novella Die Judenbuche.",who was anna von droste?
<dbpedia:Herman_Potočnik>,Herman Potočnik,Herman Potočnik (pseudonym Hermann Noordung; 22 December 1892 – 27 August 1929) was a Slovene rocket engineer and pioneer of cosmonautics (astronautics). He is chiefly remembered for his work addressing the long-term human habitation of space.,who was herman potonik
<dbpedia:Ashmolean_Museum>,Ashmolean Museum,"The Ashmolean Museum (in full the Ashmolean Museum of Art and Archaeology) on Beaumont Street, Oxford, England, is the world's first university museum.  Its first building was erected in 1678–1683 to house the cabinet of curiosities that Elias Ashmole gave to the University of Oxford in 1677. The museum reopened in 2009 after a major redevelopment. In November 2011, new galleries focusing on Egypt and Nubia were also unveiled.",ashmolean museum where it was established
<dbpedia:FIFO_and_LIFO_accounting>,FIFO and LIFO accounting,"FIFO and LIFO methods are accounting techniques used in managing inventory and financial matters involving the amount of money a company has tied up within inventory of produced goods, raw materials, parts, components, or feed stocks. These methods are used to manage assumptions of cost flows related to inventory, stock repurchases (if purchased at different prices), and various other accounting purposes.",what is fifo accounting
<dbpedia:Gilles_Villeneuve>,Gilles Villeneuve,"Joseph Gilles Henri Villeneuve (French pronunciation: ​[ʒil vilnœv]; January 18, 1950 – May 8, 1982), known as Gilles Villeneuve, was a Canadian racing driver. Villeneuve spent six years in Grand Prix racing with Ferrari, winning six races and widespread acclaim for his performances.An enthusiast of cars and fast driving from an early age, Villeneuve started his professional career in snowmobile racing in his native province of Quebec.",who was gilles villeneuve
<dbpedia:Walter_Chrysler>,Walter Chrysler,"Walter Percy Chrysler (April 2, 1875 – August 18, 1940) was an American automotive industry executive and founder of Chrysler Corporation, now a part of Fiat Chrysler Automobiles.",who started chrysler
<dbpedia:Carcassonne>,Carcassonne,"Carcassonne (French pronunciation: ​[kaʁ.ka.sɔn]; Occitan: Carcassona, Occitan pronunciation: [kaɾ.ka.ˈsu.no]) is a fortified French town in the Aude department, of which it is the prefecture, in the Region of Languedoc-Roussillon.Occupied since the Neolithic, Carcassonne is located in the Aude plain between two great axes of circulation linking the Atlantic to the Mediterranean sea and the Massif Central to the Pyrénées.",where is carcassonne
<dbpedia:List_of_association_football_clubs>,List of association football clubs,"This is a list of lists of association football clubs from all over the world. Each of the articles linked from here lists clubs playing at the highest level in each country; for clubs playing at lower divisions, see separate linked articles.",most common club in football
<dbpedia:Languedoc-Roussillon>,Languedoc-Roussillon,"Languedoc-Roussillon (French pronunciation: ​[lɑ̃ɡdɔk ʁusijɔ̃]; Occitan: Lengadòc-Rosselhon; Catalan: Llenguadoc-Rosselló) is one of the 27 regions of France. It comprises five departments, and borders the other French regions of Provence-Alpes-Côte d'Azur, Rhône-Alpes, Auvergne, Midi-Pyrénées on the one side, and Spain, Andorra and the Mediterranean Sea on the other side.",where is the languedoc region
<dbpedia:Pike_(programming_language)>,Pike (programming language),"Pike is an interpreted, general-purpose, high-level, cross-platform, dynamic programming language, with a syntax similar to that of C.  Unlike many other dynamic languages, Pike is both statically and dynamically typed, and requires explicit type definitions.",what is pike
<dbpedia:Winona_LaDuke>,Winona LaDuke,"Winona LaDuke (born August 18, 1959) is an American activist, environmentalist, economist, and writer, known for her work on tribal land claims and preservation, as well as sustainable development.",who was winona laduke
<dbpedia:Ejnar_Hertzsprung>,Ejnar Hertzsprung,"Ejnar Hertzsprung (Danish pronunciation: [ɑjnɐ ˈhæɐ̯d̥sb̥ʁɔŋ], 8 October 1873 –  21 October 1967) was a Danish chemist and astronomer.Hertzsprung was born in Copenhagen. In the period 1911–1913, together with Henry Norris Russell, he developed the Hertzsprung–Russell diagram.In 1913 he determined the distances to several Cepheid variable stars by statistical parallax, and was thus able to calibrate the relationship discovered by Henrietta Leavitt between Cepheid period and luminosity.",who was ejnar hertzsprung
<dbpedia:LOT_Polish_Airlines>,LOT Polish Airlines,"Polskie Linie Lotnicze LOT S.A. (Polish pronunciation: [ˈlɔt], Flight), trading as LOT Polish Airlines, is the flag carrier of Poland. Based in Warsaw and established in 1929, it is one of the world's oldest airlines still in operation. With a fleet of approximately 45 aircraft, LOT operates a complex network to 60 destinations in Europe, the Middle East, North America, and Asia.",ltpoland airlines
<dbpedia:Shannon_(given_name)>,Shannon (given name),"Shannon ""\wise river"") is an Irish, Anglicised from Sionainn. Alternative spellings include Shannen, Shanon, Shannan, Seanan, and Siannon. The variant Shanna is an Anglicisation of Sionna (""possessor of wisdom"").Sionainn derives from the Irish name Abha na tSionainn for the River Shannon. Because the suffix ain indicates a diminutive in Irish, the name is sometimes mistranslated as ""little wise one"".",is shannon an irish name
<dbpedia:Great_Lakes_Waterway>,Great Lakes Waterway,"The Great Lakes Waterway is a system of natural channels and canals which enable navigation between the North American Great Lakes. Though all of the lakes are naturally connected as a chain, water travel between the lakes was impeded for centuries by obstacles such as Niagara Falls and the rapids of the St. Marys River.Its principal civil engineering works are the Welland Canal between Lakes Ontario and Erie, and the huge Soo Locks between Huron and Superior.",what is the great lakes waterway
<dbpedia:Bitterroot>,Bitterroot,"Bitterroot (Lewisia rediviva Pursh) is a small perennial herb in the Portulacaceae or purslane family. It is found in western North America from low to moderate elevations on grassland, open bushland and forest. A small species of dry rocky or gravelly soils, it bears a single pink to lavender to white flower.",where is bitterroot found
<dbpedia:Iris_(anatomy)>,Iris (anatomy),"The iris (plural: irides or irises) is a thin, circular structure in the eye, responsible for controlling the diameter and size of the pupil and thus the amount of light reaching the retina. The color of the iris gives the eye its color. In optical terms, the pupil is the eye's aperture and the iris is the diaphragm that serves as the aperture stop.",what is the function of the iris
<dbpedia:Emiliano_Zapata>,Emiliano Zapata,"Emiliano Zapata Salazar (Spanish pronunciation: [emiˈljano saˈpata]; 8 August 1879 – 10 April 1919) was a leading figure in the Mexican Revolution, the main leader of the peasant revolution in the state of Morelos, and the inspiration of the agrarian movement called Zapatismo.Zapata was born in the rural village of Anenecuilco in Morelos.",what does emiliano zapata mean
<dbpedia:Radcliffe_Camera>,Radcliffe Camera,"The Radcliffe Camera (Camera, meaning ""room"" in Latin; colloquially, ""Rad Cam"" or ""The Camera"") is a building of Oxford University, England, designed by James Gibbs in neo-classical style and built in 1737–1749 to house the Radcliffe Science Library. It is sited to the south of the Old Bodleian, north of St.",where is the radcliffe camera located
<dbpedia:Terry_Fox>,Terry Fox,"Terrance Stanley ""Terry"" Fox CC OD (July 28, 1958 –  June 28, 1981) was a Canadian athlete, humanitarian, and cancer research activist. In 1980, with one leg having been amputated, he embarked on a cross-Canada run to raise money and awareness for cancer research. Although the spread of his cancer eventually forced him to end his quest after 143 days and 5,373 kilometres (3,339 mi), and ultimately cost him his life, his efforts resulted in a lasting, worldwide legacy.",who was terry fox
<dbpedia:Clarendon_Building>,Clarendon Building,"The Clarendon Building is an early 18th-century neoclassical building of the University of Oxford. It is in Broad Street, Oxford, England, next to the Bodleian Library and the Sheldonian Theatre and near the centre of the city. It was built between 1711 and 1715 and is now a Grade I listed building",where is clarendon building
<dbpedia:Birdsville_Track>,Birdsville Track,"The Birdsville Track is a notable outback road in Australia. The 517 km track runs from Marree, a small town in northern South Australia, north across the Tirari Desert and Sturt Stony Desert, ending in Birdsville in south western Queensland.In former years the track was of a very poor quality and suitable only for high-clearance four-wheel drive vehicles, but it has been upgraded to a full-scale dirt road and is now a popular tourist route.",is birdsville a dirt road
<dbpedia:Boise_State_University>,Boise State University,"Boise State University (BSU) is a public research institution in Boise, Idaho.Founded in 1932 by the Episcopal Church, it became an independent junior college in 1934, and has been awarding baccalaureate and master's degrees since 1965.",what is a bsu
<dbpedia:September_Morn>,September Morn,"Matinée de Septembre (English: September Morn) is a controversial oil painting on canvas completed in 1911 by the French artist Paul Émile Chabas. Painted over several summers, it depicts a nude girl or young woman standing in the shallow water of a lake, prominently lit by the morning sun. She is leaning slightly forward in an ambiguous posture, which has been read variously as a straightforward portrayal of protecting her modesty, huddling against the cold, or sponge bathing.",when was the septembre morn
<dbpedia:Pulitzer_Prize_for_Music>,Pulitzer Prize for Music,"The Pulitzer Prize for Music is one of the seven American Pulitzer Prizes that are annually awarded for Letters, Drama, and Music. It was first awarded in 1943. Joseph Pulitzer did not call for such a prize in his will, but had arranged for a music scholarship to be awarded each year.",when did the pulitzer prize for music get awarded
<dbpedia:Bodleian_Library>,Bodleian Library,"The Bodleian Library (/ˈbɒdliən/, /bɒdˈliːən/), the main research library of the University of Oxford, is one of the oldest libraries in Europe, and in Britain is second in size only to the British Library with over 11 million items.",what are the oldest library
<dbpedia:Cambio_90>,Cambio 90,"Change 90 - New Majority (Spanish: Cambio 90 - Nueva Mayoría, NM) was a right-wing Peruvian political party which entered the political spectrum in early 1990, and by June 1991 was the most powerful political force in the nation.Cambio's success hinged largely on the success of its candidate for the presidency, Alberto Fujimori, an agricultural engineer and rector of the Universidad Nacional Agraria (National Agrarian University) in Lima's La Molina District from 1984 to 1989.",which party in peru has the highest political majority
<dbpedia:Adélie_penguin>,Adélie penguin,"The Adélie penguin (Pygoscelis adeliae) is a species of penguin common along the entire Antarctic coast, which is their only residence. They are among the most southerly distributed of all seabirds, along with the emperor penguin, the south polar skua, the Wilson's storm petrel, the snow petrel, and the Antarctic petrel. They are named after Adélie Land, in turn named for the wife of French explorer Jules Dumont d'Urville who discovered these penguins in 1840.",where do the adélie penguins live
<dbpedia:GE-200_series>,GE-200 series,"The GE-200 series was a family of small mainframe computers of the 1960s, built by General Electric.  GE marketing called the line Compatibles/200.The main machine in the line was the GE-225. It used a 20-bit word, of which 13 bits could be used for an address. Along with the basic CPU the system could also include a floating-point unit, or a fixed-point decimal option with three 6-bit decimal digits per word.",when did the gen machine come out
<dbpedia:Saône>,Saône,"The Saône (French pronunciation: ​[soːn]; Arpitan Sona, Latin: Arar) is a river of eastern France. It is a right tributary of the River Rhône, rising at Vioménil in the Vosges department and joining the Rhône in Lyon, just south of the Presqu'île.The name ""Saône"" derives from that of the Gallic river goddess Souconna, which has also been connected with a local Celtic tribe, the Sequanes. Monastic copyists progressively transformed ""Souconna"" to ""Saoconna"", which ultimately gave rise to ""Saône"".",what is the saône
<dbpedia:William_Chester_Minor>,William Chester Minor,"William Chester Minor, also known as W. C. Minor (June 1834 – March 26, 1920) was an American army surgeon and one of the largest contributors of quotations to the Oxford English Dictionary. He was held in a lunatic asylum at the time.",who is william chester minor
<dbpedia:Greenhouse>,Greenhouse,"A greenhouse (also called a glasshouse, or, if with additional heating, a hothouse) is a  structure with walls and roof made chiefly of transparent material, such as glass, in which plants requiring regulated climatic conditions are grown. These structures range in size from small sheds to industrial-sized buildings. A miniature greenhouse is known as a cold frame.",what is a greenhouse
<dbpedia:Journal_of_Cryptology>,Journal of Cryptology,The Journal of Cryptology (ISSN 0933-2790) is a scientific journal in the field of cryptology and cryptography. The journal is published quarterly by the International Association for Cryptologic Research. Its editor-in-chief is Ivan Damgård.,what is a cryptology journal
<dbpedia:Snake_lemma>,Snake lemma,"The snake lemma is a tool used in mathematics, particularly homological algebra, to  construct long exact sequences. The snake lemma is valid in every abelian category and is a crucial tool in homological algebra and its applications, for instance in algebraic topology. Homomorphisms constructed with its help are generally called connecting homomorphisms.",what is a snake lemma
<dbpedia:Joseph_Kittinger>,Joseph Kittinger,"Joseph William Kittinger II (born July 27, 1928) is a retired Colonel in the United States Air Force and a USAF Command Pilot. Following his initial operational assignment in fighter aircraft, he participated in Project Manhigh and Project Excelsior in 1960, setting a world record for the longest skydive from a height greater than 31 kilometres (19 mi).",longest skydive ever
<dbpedia:Furry_fandom>,Furry fandom,"The furry fandom is a subculture interested in fictional anthropomorphic animal characters with human personalities and characteristics. Examples of anthropomorphic attributes include exhibiting human intelligence and facial expressions, the ability to speak, walk on two legs, and wear clothes. Furry fandom is also used to refer to the community of people who gather on the Internet and at furry conventions.",define furry
