_id,title,text,query
<dbpedia:Plea_bargain>,Plea bargain,"A plea bargain (also plea agreement, plea deal, copping a plea, or plea in mitigation) is any agreement in a criminal case between the prosecutor  and defendant whereby the defendant agrees to plead guilty to a particular charge in return for some concession from the prosecutor.",define plea bargain
<dbpedia:Foreign_relations_of_Peru>,Foreign relations of Peru,"Peru has been a member of the United Nations since 1949, and Peruvian Javier Pérez de Cuéllar served as UN Secretary General from 1981 to 1991.",what does the world known peruan government do
<dbpedia:Pianist>,Pianist,"A pianist (/ˈpiːənɨst/ PEE-ə-nist, /ˈpjænɨst/ PYAN-ist) is an individual who plays the piano. Most forms of Western music can make use of the piano. Consequently, pianists have a wide variety of repertoire and styles to choose from, including traditionally classical music, jazz, blues and all sorts of popular music, including rock music. Most pianists can, to a certain extent, play other keyboard-related instruments such as the synthesizer, harpsichord, celesta and the organ.",what are the pianos
<dbpedia:Proper_name_(philosophy)>,Proper name (philosophy),"In the philosophy of language a proper name, for example the names of persons or places, is a name which is ordinarily taken to uniquely identify its referent in the world. As such it presents particular challenges for theories of meaning and it has become a central problem in analytical philosophy.",what is proper name
<dbpedia:Philosophy_of_perception>,Philosophy of perception,"The philosophy of perception is concerned with the nature of perceptual experience and the status of perceptual data, in particular how they relate to beliefs about, or knowledge of, the world. Any explicit account of perception requires a commitment to one of a variety of ontological or metaphysical views.",what is an account of perception
<dbpedia:History_of_Peru>,History of Peru,"The history of Peru spans several millennia, extending back through several stages of cultural development in the mountain region and the coastal desert. About 15,200 years ago, groups of people are believed to have crossed the Bering Strait from Asia and survived as nomads, hunting, gathering fruits and vegetables and fishing in the sea, rivers, and lakes.",what was peru's history
<dbpedia:Pythagoras>,Pythagoras,"Pythagoras of Samos (US /pɪˈθæɡərəs/; UK /paɪˈθæɡərəs/; Greek: Πυθαγόρας ὁ Σάμιος Pythagóras ho Sámios ""Pythagoras the Samian"", or simply Πυθαγόρας; Πυθαγόρης in Ionian Greek; c. 570 – c. 495 BC) was an Ionian Greek philosopher, mathematician, and has been credited as the founder of the movement called Pythagoreanism. Most of the information about Pythagoras was written down centuries after he lived, so very little reliable information is known about him.",when did pythagoras live
<dbpedia:Polyhedron>,Polyhedron,"In elementary geometry, a polyhedron (plural polyhedra or polyhedrons) is a solid in three dimensions with flat polygonal faces, straight edges and sharp corners or vertices.",what is a polyhedron
<dbpedia:Physicalism>,Physicalism,"In philosophy, physicalism is the ontological thesis that ""everything is physical"", that there is ""nothing over and above"" the physical, or that everything supervenes on the physical. Physicalism is a form of ontological monism—a ""one substance"" view of the nature of reality as opposed to a ""two-substance"" (dualism) or ""many-substance"" (pluralism) view. Both the definition of ""physical"" and the meaning of physicalism have been debated.Physicalism is closely related to materialism.",what is the definition of physicalism
<dbpedia:Paula_Abdul>,Paula Abdul,"Paula Julie Abdul (/ˈæbduːl/; born June 19, 1962) is an American singer-songwriter, dancer, choreographer, actress and television personality. She is a dual citizen of the United States and Canada. She began her career as a cheerleader for the Los Angeles Lakers at the age of 18  before rising to prominence in the 1980s as a highly sought-after choreographer at the height of the music video era. Abdul later scored a string of pop music hits in the late 1980s and early 1990s.",what nationality is julie abdul
<dbpedia:Papua_New_Guinea_Defence_Force>,Papua New Guinea Defence Force,"The Papua New Guinea Defence Force (PNGDF) is the unified armed forces of Papua New Guinea. It originated from the Australian Army land forces of the territory of Papua New Guinea before independence, coming into being in January 1973 and having its antecedents in the Pacific Islands Regiment. At independence it numbered 3,750 all ranks, while another 465 Australian personnel augmented the force to assist in training and technical support.",what is the defence force of papua new guinea
<dbpedia:Paul_Allen>,Paul Allen,"Paul Gardner Allen (born January 21, 1953) is an American philanthropist, investor, singer, and innovator, best known as the co-founder of Microsoft alongside Bill Gates. As of July 2015, he was estimated to be the 51st richest person in the world, with an estimated wealth of $17.5 billion.Allen is the founder and chairman of Vulcan Inc., which manages his various business and philanthropic efforts.",what is paul allen famous for
<dbpedia:Politics_of_Puerto_Rico>,Politics of Puerto Rico,"The politics of Puerto Rico take place in the framework of a republican democratic form of government that is under the jurisdiction and sovereignty of the United States as an organized unincorporated territory.As a republican form of government, the government of the Commonwealth of Puerto Rico is divided into three branches: executive, legislative and judicial, as established by the Constitution of Puerto Rico.",what kind of government does puerto rico have
<dbpedia:Philipp_Franz_von_Siebold>,Philipp Franz von Siebold,"Philipp Franz Balthasar von Siebold (17 February 1796 – 18 October 1866) was a German physician, botanist, and traveler. He taught some pupils Western medicine in Japan. He achieved prominence by his studies of Japanese flora and fauna and the introduction of Western medicine in Japan. He was the father of the first female Japanese doctor Kusumoto Ine.",when was philip von siebold born
<dbpedia:Military_of_Paraguay>,Military of Paraguay,"The armed forces of Paraguay consist of the Paraguayan army, navy (including naval aviation and marine corps) and air force.The constitution of Paraguay establishes the president of Paraguay as the commander-in-chief.Paraguay has compulsory military service, and all 18-year-old males and 17-year-olds in the year of their 18th birthday are liable for one year of active duty.",what is paraguay military
<dbpedia:Geography_of_Peru>,Geography of Peru,Peru is a country on the central western coast of South America facing the Pacific Ocean.,where is peru
<dbpedia:Politics_of_the_Philippines>,Politics of the Philippines,"The Politics of the Philippines take place in an organized framework of a presidential, representative, and democratic republic whereby the president is both the head of state and the head of government within a pluriform multi-party system. This system revolves around three separate and sovereign yet interdependent branches: the legislative branch, the executive branch, and the judicial branch. Executive power is exercised by the government under the leadership of the president.",what type of government do philippines have
<dbpedia:Geography_of_the_Pitcairn_Islands>,Geography of the Pitcairn Islands,"The Pitcairn Islands consist of four islands: Pitcairn Island, Oeno Island, Henderson Island and Ducie Island:Pitcairn Islands as a group of islands (25°04′00″S 130°05′00″W) Pitcairn Island (main island) (25°04′S 130°06′W) Henderson Island (24°22′01″S 128°18′57″W) Ducie Island (24°40′09″S 124°47′11″W) Oeno Island (23°55′26″S 130°44′03″W)Pitcairn Island is a volcanic high island. Henderson Island is an uplifted coral island.",where are the pitcairn islands located
<dbpedia:Protest_song>,Protest song,A protest song is a song that is associated with a movement for social change and hence part of the broader category of topical songs (or songs connected to current events).,what is a protest song
<dbpedia:Foreign_relations_of_the_Philippines>,Foreign relations of the Philippines,"Foreign relations of the Philippines are administered by the President of the Philippines and the Department of Foreign Affairs. Philippine international affairs are influenced by ties to Southeast Asian neighbors, United States, and the Middle East.The Philippines is a founding member of the United Nations; an elected member of the Security Counciland participant in the FAO, International Labor Organization (ILO), UNESCO and World Health Organization.",foreign relations in the philippines
<dbpedia:Proverb>,Proverb,"A proverb (from Latin: proverbium) is a simple and concrete saying, popularly known and repeated, that expresses a truth based on common sense or the practical experience of humanity. They are often metaphorical. A proverb that describes a basic rule of conduct may also be known as a maxim.Proverbs are often borrowed from similar languages and cultures, and sometimes come down to the present through more than one language.",what is a proverb
<dbpedia:Pan_and_scan>,Pan and scan,"Pan and scan is a method of adjusting widescreen film images so that they can be shown within the proportions of a standard definition 4:3 aspect ratio television screen, often cropping off the sides of the original widescreen image to focus on the composition's most important aspects.",what is a pan and scan
<dbpedia:Portability_(social_security)>,Portability (social security),"The portability of social security benefits is the ability of workers to preserve, maintain, and transfer acquired social security rights and social security rights in the process of being acquired  from one private, occupational, or public social security scheme to another. Social security rights refer to rights stemming from pension schemes (old age, survivor, disability), unemployment insurance, health insurance, workers' compensation, and sickness benefits.",what does the term portability mean
<dbpedia:Paraguay>,Paraguay,"Paraguay (/ˈpærəɡwaɪ/; Spanish: [paɾaˈɣwai]; Guarani: Paraguái [paɾaˈɣwaj]), officially the Republic of Paraguay (Spanish: República del Paraguay, Guarani: Tetã Paraguái), is a landlocked country in central South America, bordered by Argentina to the south and southwest, Brazil to the east and northeast, and Bolivia to the northwest. Paraguay lies on both banks of the Paraguay River, which runs through the center of the country from north to south.",what is parguay
<dbpedia:Point-to-Point_Protocol>,Point-to-Point Protocol,"In computer networking, Point-to-Point Protocol (PPP) is a data link protocol used to establish a direct connection between two nodes. It can provide connection authentication, transmission encryption (using ECP, RFC 1968), and compression.PPP is used over many types of physical networks including serial cable, phone line, trunk line, cellular telephone, specialized radio links, and fiber optic links such as SONET.",what is ppp protocol
<dbpedia:Philadelphia_Eagles>,Philadelphia Eagles,"The Philadelphia Eagles are a professional American football team based in Philadelphia, Pennsylvania. The Eagles are members of the East division of the National Football Conference (NFC) in the National Football League (NFL). The Eagles have won three NFL championships and made two Super Bowl appearances, losing both.",where are pfl
<dbpedia:Transportation_in_the_Philippines>,Transportation in the Philippines,"Transportation in the Philippines is relatively underdeveloped, partly due to the country's mountainous areas and scattered islands, and partly as a result of the government's persistent underinvestment in the nation's infrastructure.",where is transportation in philippines
<dbpedia:Patterson–Gimlin_film>,Patterson–Gimlin film,"The Patterson–Gimlin film (also known as the Patterson film or the PGF) is a famous, short motion picture of an unidentified subject the film-makers said was a ""Bigfoot"". The footage was shot in 1967, and has since been subjected to many attempts to authenticate or debunk it.",who was the film of bigfoot
<dbpedia:Geography_of_the_Philippines>,Geography of the Philippines,"The Philippines is an archipelago that consists of 7,107 islands with a total land area of 300,000 square kilometers (115,831 sq mi). The 11 largest islands contain 94% of the total land area. The largest of these islands is Luzon at about 105,000 square kilometers (40,541 sq mi). The next largest island is Mindanao at about 95,000 square kilometers (36,680 sq mi).",what islands are in the philippines
<dbpedia:History_of_Pakistan>,History of Pakistan,"The history of Pakistan (Urdu: تاريخ پاكِستان ‎) encompasses the history of the region constituting modern Pakistan.  Prior to independence in 1947, the territory of modern Pakistan was a part of the British Indian Empire. Prior to that it was ruled in different periods by local kings and numerous imperial powers. The ancient history of the region comprising present-day  Pakistan also includes some of the oldest of the names of empires of Indian Subcontinent and some of its major civilizations.",what is pakistan history
<dbpedia:Pitcairn_Islands>,Pitcairn Islands,"""Pitcairn"" redirects here. For the ship, see HMS Pitcairn (K589). For the play by Richard Bean, see Pitcairn (play).The Pitcairn Islands (/ˈpɪtkɛərn/; Pitkern: Pitkern Ailen), officially named the Pitcairn Group of Islands, are a group of four volcanic islands in the southern Pacific Ocean that form the last British Overseas Territory in the Pacific.",where were the pitcairn islands located
<dbpedia:Palestinians>,Palestinians,"The Palestinian people (Arabic: الشعب الفلسطيني‎, ash-sha‘b al-Filasṭīnī), also referred to as Palestinians (Arabic: الفلسطينيون‎, al-Filasṭīniyyūn, Hebrew: פָלַסְטִינִים), are an ethnic group representing the modern descendants of the peoples who have lived in Palestine over the centuries, and who today are largely culturally and linguistically Palestinian Arab due to Arabization of the region.",who are palestinians
<dbpedia:Political_spectrum>,Political spectrum,"A political spectrum is a system of classifying different political positions upon one or more geometric axes that symbolize independent political dimensions.Most long-standing spectra include a right wing and left wing, which originally referred to seating arrangements in the French parliament after the Revolution (1789–99).",what is political spectrum
<dbpedia:Pangenesis>,Pangenesis,"Pangenesis was Charles Darwin's hypothetical mechanism for heredity. He presented this 'provisional hypothesis' in his 1868 work The Variation of Animals and Plants under Domestication and felt that it brought 'together a multitude of facts which are at present left disconnected by any efficient cause'. The etymology of the word comes from the Greek words pan (a prefix meaning ""whole"", ""encompassing"") and genesis (""birth"") or genos (""origin"").",what is a pangenesis
<dbpedia:Peruvian_Armed_Forces>,Peruvian Armed Forces,"The Peruvian Armed Forces (Spanish: Fuerzas Armadas del Perú) are the military services of Peru, comprising independent Army, Navy and Air Force components. Their primary mission is to safeguard the country's independence, sovereignty and territorial integrity against any threat. As a secondary mission they participate in economic and social development as well as in civil defense tasks.The National Police of Peru is often classified as a part of the armed forces.",what is the armed force in peru
<dbpedia:Economy_of_Panama>,Economy of Panama,"The economy of Panama is a fully dollarized  free market economy with a history of low inflation.  It is based mainly on the services industry, heavily weighted toward banking, commerce, and tourism. The hand-over of the canal and military installations by the US has given rise to new construction projects.Panama's economy is based primarily on a well-developed services sector that accounts for nearly 80% of its GDP.",what industry is used in panama
<dbpedia:Demographics_of_the_Philippines>,Demographics of the Philippines,"Demographics of the Philippines are records of human population in the country, including its population density, ethnicity, education level, health, economic status, religious affiliations, and other aspects of the population. The Philippines has a population growth rate of 2.04%, one of the highest in Asia. According to the 2010 Census, the population of the Philippines was 92,337,852. The population of the Philippines was first estimated in 1830 with 2.5 million people.",what is the population of philippines
<dbpedia:Partially_ordered_set>,Partially ordered set,"In mathematics, especially order theory, a partially ordered set (or poset) formalizes and generalizes the intuitive concept of an ordering, sequencing, or arrangement of the elements of a set. A poset consists of a set together with a binary relation that indicates that, for certain pairs of elements in the set, one of the elements precedes the other.",what is a partially ordered set
<dbpedia:Probability_distribution>,Probability distribution,"In probability and statistics, a probability distribution assigns a probability to each measurable subset of the possible outcomes of a random experiment, survey, or procedure of statistical inference.",definition for probability distribution
<dbpedia:Parable_of_the_Pearl>,Parable of the Pearl,"The Parable of the Pearl (also called the Pearl of Great Price) is a parable of Jesus of Nazareth.  It appears in only one of the Canonical gospels of the New Testament.  According to Matthew 13:45-46 the parable illustrates the great value of the Kingdom of Heaven.It immediately follows the Parable of the Hidden Treasure, which has a similar theme and the parable has been depicted by artists such as Domenico Fetti. A version of this parable also appears in the non canonical Gospel of Thomas 76.",what is the pearl of great price
<dbpedia:Pentecostalism>,Pentecostalism,"Pentecostalism or Classical Pentecostalism is a renewal movement within Protestant Christianity that places special emphasis on a direct personal experience of God through the baptism with the Holy Spirit. The term Pentecostal is derived from Pentecost, the Greek name for the Jewish Feast of Weeks.",what is pentecostalism
<dbpedia:Probability_theory>,Probability theory,"Probability theory is the branch of mathematics concerned with probability, the analysis of random phenomena. The central objects of probability theory are random variables, stochastic processes, and events: mathematical abstractions of non-deterministic events or measured quantities that may either be single occurrences or evolve over time in an apparently random fashion. It is not possible to predict precisely results of random events.",what is probability theory based
<dbpedia:Psychological_statistics>,Psychological statistics,"Psychological statistics is the application of formulas, theorems, numbers and laws to psychology.",define psychology statistics
<dbpedia:Procopius>,Procopius,"Procopius of Caesarea (Greek: Προκόπιος ὁ Καισαρεύς, Latin: Procopius Caesarensis; c. AD 500 – c. AD 560) was a prominent late antique scholar from Palaestina Prima. Accompanying the Roman general Belisarius in the wars of the Emperor Justinian, he became the principal historian of the 6th century, writing the Wars of Justinian, the Buildings of Justinian and the celebrated Secret History. He is commonly held to be the last major historian of the ancient Western world.",who was procopius of caesar
<dbpedia:Neville_Chamberlain>,Neville Chamberlain,"Arthur Neville Chamberlain FRS (18 March 1869 – 9 November 1940) was a British Conservative politician who served as Prime Minister of the United Kingdom from May 1937 to May 1940. Chamberlain is best known for his appeasement foreign policy, and in particular for his signing of the Munich Agreement in 1938, conceding the German-speaking Sudetenland region of Czechoslovakia to Germany.",what were he slain's interests
<dbpedia:Pai_gow>,Pai gow,"Pai gow (Chinese: 牌九; pinyin: pái jiǔ; jyutping: paai4 gau2) is a Chinese gambling game, played with a set of 32 Chinese dominoes. It is played openly in major casinos in China (including Macau); the United States (including Las Vegas, Nevada; Reno, Nevada; Connecticut; Atlantic City, New Jersey; Pennsylvania; and cardrooms in California); Canada (including Edmonton, Alberta and Calgary, Alberta); Australia; and, New Zealand.",what are pai gow
<dbpedia:Paroxysmal_attack>,Paroxysmal attack,"Paroxysmal attacks or paroxysms (from Greek παροξυσμός) are a sudden recurrence or intensification of symptoms, such as a spasm or seizure. These short, frequent, and stereotyped symptoms can be observed in various clinical conditions.",define paroxysmal attacks
<dbpedia:Potato>,Potato,"The potato is a starchy, tuberous crop from the perennial nightshade Solanum tuberosum L. The word ""potato"" may refer either to the plant itself or to the edible tuber. In the Andes, where the species is indigenous, there are some other closely related cultivated potato species. Potatoes were introduced outside the Andes region approximately four centuries ago, and have since become an integral part of much of the world's food supply.",is potato edible
<dbpedia:Pakistan_Armed_Forces>,Pakistan Armed Forces,"The Pakistan Armed Forces (Urdu: پاک مُسَلّح افواج‎, Musallah Afwaj-e-Pakistan) are the military forces of Pakistan. They are the seventh largest in the world in terms of active military personnel. The armed forces comprise three main inter–services branches: Army, Navy, Air Force, and Marines, together with the number of paramilitary forces and the Strategic Plans Division forces.",what are the armed forces of pakistan
<dbpedia:Primary_mirror>,Primary mirror,A primary mirror (or primary) is the principal light-gathering surface (the objective) of a reflecting telescope.,what is the primary optical system
<dbpedia:Photoelectric_effect>,Photoelectric effect,"The photoelectric effect is the observation that many metals emit electrons when light shines upon them. Electrons emitted in this manner can be called photoelectrons. The phenomenon is commonly studied in electronic physics, as well as in fields of chemistry, such as quantum chemistry or electrochemistry.According to classical electromagnetic theory, this effect can be attributed to the transfer of energy from the light to an electron in the metal.",what type of radiation can electrons be emitted from many metallic particles
<dbpedia:DECSYSTEM-20>,DECSYSTEM-20,The DECSYSTEM-20 was a 36-bit Digital Equipment Corporation PDP-10 mainframe computer running the TOPS-20 operating system (products introduced in 1977).PDP-10 computers running the TOPS-10 operating system were labeled DECsystem-10 as a way of differentiating them from the PDP-11.,what operating system does tops run on
<dbpedia:Pump>,Pump,"A pump is a device that moves fluids (liquids or gases), or sometimes slurries, by mechanical action. Pumps can be classified into three major groups according to the method they use to move the fluid: direct lift, displacement, and gravity pumps.Pumps operate by some mechanism (typically reciprocating or rotary), and consume energy to perform mechanical work by moving the fluid.",what is a pump
<dbpedia:Postmodern_music>,Postmodern music,"Postmodern music is either simply music of the postmodern era, or music that follows aesthetical and philosophical trends of postmodernism. As the name suggests, the postmodernist movement formed partly in reaction to modernism. Even so, postmodern music still does not primarily define itself in opposition to modernist music; this label is applied instead by critics and theorists.Postmodern music is not a distinct musical style, but rather refers to music of the postmodern era.",what is postmodern music
<dbpedia:Asimina>,Asimina,"Asimina is a genus of small trees or shrubs described as a genus in 1763.Asimina has large simple leaves and large fruit. It is native to eastern North America and collectively referred to as Pawpaw. The genus includes the widespread common pawpaw Asimina triloba, which bears the largest edible fruit indigenous to the continent. Pawpaws are native to 26 states of the U.S. and to Ontario in Canada.",what is an asimina
<dbpedia:Potassium>,Potassium,"Potassium is a chemical element with symbol K (derived from Neo-Latin kalium) and atomic number 19. It was first isolated from potash, the ashes of plants, from which its name is derived. In the Periodic table, potassium is one of seven elements in column (group) 1 (alkali metals): they all have a single electron in their outer electron shell, which they readily give up to create an atom with a positive charge - a cation, and combine with anions to form salts.",is potassium alkali
<dbpedia:Photography>,Photography,"Photography is the science, art and practice of creating durable images by recording light or other electromagnetic radiation, either electronically by means of an image sensor, or chemically by means of a light-sensitive material such as photographic film.Typically, a lens is used to focus the light reflected or emitted from objects into a real image on the light-sensitive surface inside a camera during a timed exposure.",definition of photography
