_id,title,text,query
<dbpedia:Barton_Turf>,Barton Turf,"Barton Turf is a village and civil parish in the English county of Norfolk. The village is situated some 20 km north-east of the city of Norwich, on the northwestern edge of Barton Broad, the second largest broad of the Norfolk Broads  For the purposes of local government, the parish falls within the district of North Norfolk.The civil parish, which includes the whole of Barton Broad and the smaller village of Irstead at its southern end, has an area of 10.86 km2.",where is barton turf
<dbpedia:Separate_Tables>,Separate Tables,"Separate Tables is the collective name of two one-act plays by Terence Rattigan, both taking place in the Beauregard Private Hotel, Bournemouth, a town on the south seacoast of England. The first play, entitled Table by the Window, focuses on the troubled relationship between a disgraced Labour politician and his ex-wife.",what is separate tables terence rattigan
<dbpedia:Glaðsheimr>,Glaðsheimr,"In Norse mythology, Glaðsheimr (Old Norse ""bright home"") is a realm in Asgard where Odin's hall of Valhalla is located according to Grímnismál.Snorri states in Gylfaginning that Glaðsheimr is a meeting hall containing thirteen high seats where the male Asgardians hold council, located in Iðavöllr in Asgard, near the hall of Vingólf where the Asgardian goddesses gathered.",where is glaisheimr
<dbpedia:Challenger_expedition>,Challenger expedition,"The Challenger expedition of 1872–76 was a scientific exercise that made many discoveries to lay the foundation of oceanography. The expedition was named after the mother vessel, HMS Challenger.Prompted by Charles Wyville Thomson—of the University of Edinburgh and Merchiston Castle School—the Royal Society of London obtained the use of Challenger from the Royal Navy and in 1872 modified the ship for scientific work, equipping her with separate laboratories for natural history and chemistry.",what was the challenger expedition
<dbpedia:Geirröd>,Geirröd,"In Norse mythology, Geirröd was a jötunn and the father of the giantesses Gjálp and Greip.The story of Geirröd is told in Þórsdrápa.  Loki, while flying as a hawk, was captured by Geirröd. Because he hated Thor, Geirröd demanded that Loki bring his enemy to Geirröd's castle without his magic belt and hammer.  Loki agreed to lead Thor to the trap. On the way to Geirröd's castle, Loki and Thor stopped at the home of Grid, a giantess.",what is geirröd
<dbpedia:Gerðr>,Gerðr,"In Norse mythology, Gerðr (Old Norse ""fenced-in"") is a jötunn, goddess, and the wife of the god Freyr. Gerðr is attested in the Poetic Edda, compiled in the 13th century from earlier traditional sources; the Prose Edda and Heimskringla, written in the 13th century by Snorri Sturluson; and in the poetry of skalds.",what is gerr
<dbpedia:Splashdown>,Splashdown,"Splashdown is the method of landing a spacecraft by parachute in a body of water. It was used by American manned spacecraft prior to the Space Shuttle program, and is planned for use by the upcoming Orion Multipurpose Crew Vehicle. It is also possible for the Russian Soyuz spacecraft to land in water, though this is only a contingency.",what does splashdown mean
<dbpedia:Mundilfari>,Mundilfari,"In Norse mythology Mundilfari or Mundilfäri (Old Norse, possibly ""the one moving according to particular times"") is the father of Sól, goddess associated with the Sun, and Máni, associated with the Moon. Mundilfari is attested in the Poetic Edda poem Vafþrúðnismál stanza 23, and in chapter 11 of the Prose Edda book Gylfaginning. Mundilfari, a natural satellite of the planet Saturn, is named after the figure.",who is mundilfari
<dbpedia:Hati_Hróðvitnisson>,Hati Hróðvitnisson,"In Norse mythology, Hati Hróðvitnisson (first name meaning ""He Who Hates, Enemy"") is a warg , wolf that according to Gylfaginning chases the Moon across the night sky, just as the wolf Sköll chases the Sun during the day, until the time of Ragnarök when they will swallow these heavenly bodies, after which Fenrir will break free from his bonds and kill Odin.",hati harvietnisson definition
<dbpedia:Gjálp_and_Greip>,Gjálp and Greip,"For the moon of Saturn named after Greip, see Greip (moon). For the Gjalp fissure eruption see Bardarbunga. In Norse mythology, Gjálp and Greip are two giantesses.",what are gjálp and greip
<dbpedia:Shankill_Butchers>,Shankill Butchers,"The Shankill Butchers was an Ulster loyalist gang—many of whom were members of the Ulster Volunteer Force (UVF)—that was active between 1975 and 1982 in Belfast, Northern Ireland. It was based in the Shankill area and was responsible for the deaths of at least 23 people, most of whom were killed in sectarian attacks. The gang was notorious for kidnapping and murdering random Irish Catholic civilians; each was beaten ferociously and had his throat hacked with a butcher's knife.",what shankill butchers were
"<dbpedia:St._Mary's_University,_Texas>","St. Mary's University, Texas","St. Mary's University is a Catholic and Marianist liberal arts institution located on 135 acres (0.55 km2) northwest of Downtown San Antonio, Texas, United States. St. Mary’s is a nationally recognized master’s level school ranked among the top colleges in the west for best value and academic reputation by U.S. News and World Report. In 2010, St.",where is saint mary's university
<dbpedia:Lists_of_towns>,Lists of towns,This is a list of lists of towns and villages by country.,what is the list of towns by country
<dbpedia:Gullveig>,Gullveig,"In Norse mythology, Gullveig is a being who was speared by the Æsir, burnt three times, and yet thrice reborn. Upon her third rebirth, Gullveig's name becomes Heiðr and she is described as a knowledgeable and skillful völva. Gullveig/Heiðr is solely attested in the Poetic Edda, compiled in the 13th century from earlier traditional material.",what is gulfveig
"<dbpedia:Hubert_de_Burgh,_1st_Earl_of_Kent>","Hubert de Burgh, 1st Earl of Kent","Hubert de Burgh, 1st Earl of Kent (c. 1160 – before 5 May 1243) was Justiciar of England and Ireland and one of the most influential men in England during the reigns of King John (1199–1216) and of his infant son and successor King Henry III (1216–1272).",who is de burgh
<dbpedia:Camille_Claudel>,Camille Claudel,Camille Claudel (French: [kamij klɔdɛl]; 8 December 1864 – 19 October 1943) was a French sculptor and graphic artist. She was the elder sister of the poet and diplomat Paul Claudel.,who is camille
<dbpedia:Prostate_cancer>,Prostate cancer,"Prostate cancer, also known as carcinoma of the prostate, is the development of cancer in the prostate, a gland in the male reproductive system. Most prostate cancers are slow growing; however, some grow relatively quickly. The cancer cells may spread from the prostate to other parts of the body, particularly the bones and lymph nodes. It may initially cause no symptoms. In later stages it can lead to difficulty urinating, blood in the urine, or pain in the pelvis, back or when urinating.",causes of pain in the urine from prostate
<dbpedia:Glen>,Glen,"A glen is a valley, typically one that is long, deep, and often glacially U-shaped, or one with a watercourse running through it. Whittow defines it as a ""Scottish term for a deep valley in the Highlands"" that is ""narrower than a strath.""The word is Goidelic: gleann in Scottish and Irish Gaelic, glion in Manx. In Manx, glan is also to be found meaning glen. It is cognate with Welsh glyn.",glen meaning
<dbpedia:UEFA_Cup_Winners'_Cup>,UEFA Cup Winners' Cup,The UEFA Cup Winners' Cup  (abbreviated as CWC) was a football club competition contested annually by the most recent winners of all European domestic cup competitions.  The cup is one of the many inter-European club competitions that have been organised by UEFA. The first competition was held in the 1960–61 season — but not recognised by the governing body of European football until two years later.,which of the following is the cwc
<dbpedia:Jonathan_Frakes>,Jonathan Frakes,"Jonathan Scott Frakes (born August 19, 1952) is an American actor, author, and director. Frakes is best known for his portrayal of Commander William T. Riker in the television series Star Trek: The Next Generation and subsequent films. Frakes also hosted the television series Beyond Belief: Fact or Fiction, challenging viewers to discern his stories of fact-based phenomena and fabricated tales. In June 2011, Frakes narrated the History Channel documentary Lee and Grant.",who is jonathan frakes
<dbpedia:Mille_Bornes>,Mille Bornes,"Mille Bornes (/ˌmɪl ˈbɔrn/; French for a thousand milestones, referring to the stone distance markers on many French roads) is a French card game.  Mille Bornes is listed in the GAMES Magazine Hall of Fame.",what is mille bornes
<dbpedia:Tuvok>,Tuvok,"Tuvok /ˈtuːvɒk/ is one of the main characters on the television series Star Trek: Voyager. Tuvok is a member of the fictional  Vulcan species who serves as the ship's Chief of Security and Chief Tactical Officer. Tim Russ portrayed Tuvok throughout the show's run, from 1995 to 2001.",what is tuvok
<dbpedia:Tell_(poker)>,Tell (poker),"A tell in poker is a change in a player's behavior or demeanor that is claimed by some to give clues to that player's assessment of their hand. A player gains an advantage if they observe and understand the meaning of another player's tell, particularly if the tell is unconscious and reliable. Sometimes a player may fake a tell, hoping to induce their opponents to make poor judgments in response to the false tell.",what does tell mean in poker
<dbpedia:Joseph_Fiennes>,Joseph Fiennes,"Joseph Alberic Twisleton-Wykeham-Fiennes (/ˈfaɪnz/; b. 27 May 1970) is an English film and stage actor.He is known for his portrayals of William Shakespeare in Shakespeare in Love, Sir Robert Dudley in Elizabeth, Commisar Danilov in Enemy at the Gates, and for starring as Monsignor Timothy Howard in the second season of the TV series American Horror Story.",who plays timothy howard in american horror story
<dbpedia:L0pht>,L0pht,"L0pht Heavy Industries (pronounced ""loft"") was a hacker collective active between 1992 and 2000 and located in the Boston, Massachusetts area. The L0pht was one of the first viable hackerspaces in the US.",what was loft
<dbpedia:Sköll>,Sköll,"In Norse mythology, Sköll (Old Norse ""Treachery"") is a warg that chases the horses Árvakr and Alsviðr, that drag the chariot which contains the sun (Sól) through the sky every day, trying to eat her. Sköll has a brother, Hati, who chases Máni, the moon. At Ragnarök, both Sköll and Hati will succeed in their quests.Sköll, in certain circumstances, is used as a heiti to refer indirectly to the father (Fenrir) and not the son.",what is sköll
<dbpedia:Thomas_Johann_Seebeck>,Thomas Johann Seebeck,"Thomas Johann Seebeck (German: [ˈtoːmas ˈjoːhan ˈzeːbɛk]; 9 April 1770 – 10 December 1831) was a physicist who in 1821 discovered the thermoelectric effect.Seebeck was born in Reval (today Tallinn, Estonia) to a wealthy Baltic German merchant family. He received a medical degree in 1802 from the University of Göttingen, but preferred to study physics.",who was the physicist who discovered the thermoelectric effect
<dbpedia:Little_Cumbrae>,Little Cumbrae,"Little Cumbrae (Scots: Wee Cumbrae, Scottish Gaelic: Cumaradh Beag) is an island in the Firth of Clyde, in North Ayrshire, Scotland. The island is known locally as Wee Cumbrae.",where is little cumbrae
<dbpedia:Hendrik_Lorentz>,Hendrik Lorentz,Hendrik Antoon Lorentz (18 July 1853 – 4 February 1928) was a Dutch physicist who shared the 1902 Nobel Prize in Physics with Pieter Zeeman for the discovery and theoretical explanation of the Zeeman effect. He also derived the transformation equations subsequently used by Albert Einstein to describe space and time.,who discovered the zeeman effect
<dbpedia:Counted-thread_embroidery>,Counted-thread embroidery,"Counted-thread embroidery is any embroidery in which the fabric threads are counted by the embroiderer before inserting the needle into the fabric. Evenweave fabric is usually used; it produces a symmetrical image as both warp and weft fabric threads are evenly spaced.The opposite of counted-thread embroidery is free embroidery.Among the counted-thread embroidery techniques are:AssisiBargello, or Florentine workBlackworkCanvas workCross-stitchHardangerNeedlepointDrawn thread work",counted thread embroidery definition
<dbpedia:Benign_prostatic_hyperplasia>,Benign prostatic hyperplasia,"Benign prostatic hyperplasia (BPH), also called benign enlargement of the prostate (BEP or BPE), adenofibromyomatous hyperplasia and benign prostatic hypertrophy (technically incorrect usage), is a benign increase in size of the prostate.BPH involves hyperplasia of prostatic stromal and epithelial cells, resulting in the formation of large, fairly discrete nodules in the transition zone of the prostate.",what is bpe on prostate
<dbpedia:Galvanism>,Galvanism,"In biology, galvanism is the contraction of a muscle that is stimulated by an electric current.  In physics and chemistry, it is the induction of electrical current from a chemical reaction, typically between two chemicals with differing electronegativities.",what is the definition of galvanic contraction in biology
<dbpedia:Great_Cumbrae>,Great Cumbrae,"Great Cumbrae (Scottish Gaelic, Cumaradh Mòr; also known as Cumbrae or the Isle of Cumbrae) is the larger of the two islands known as The Cumbraes in the lower Firth of Clyde in western Scotland. Home to the National Watersports Centre, the Cathedral of the Isles and the University Marine Biological Station, Millport, the holiday island has an 18-hole golf course which sweeps almost to the summit, and a round-island road much favoured for family cycle runs.",where is great cumbrae
<dbpedia:Folkestone>,Folkestone,"Folkestone /ˈfoʊkstən/ is a port town located on the English Channel, in Kent, south-east England. The town lies on the southern edge of the North Downs at a valley between two cliffs. It was an important harbour and shipping port for most of the 19th and 20th century.There has been a settlement in this location since the Mesolithic era and was inhabited during Roman Britain.",where is folkestone kent
<dbpedia:Odds_BK>,Odds BK,"Odds Ballklubb, commonly known as Odd, is a Norwegian football club from Skien. Originally the football section of a multi-sports club, founded in 1894 nine years after the club's founding. All other sports than football were discontinued and the club became dedicated to football only. Odd plays in the Norwegian top division, Tippeligaen, and holds the record winning the Norwegian Football Cup the most times, the last coming in 2000. The club was known as Odd Grenland between 1994 and 2012.",what nationality is the club odds
<dbpedia:Obfuscation>,Obfuscation,"Obfuscation is the obscuring of intended meaning in communication, making the message confusing, willfully ambiguous, or harder to understand. It may be intentional or unintentional (although the former is usually connoted) and may result from circumlocution (yielding wordiness) or from use of jargon or even argot (yielding economy of words but excluding outsiders from the communicative value).",what is obfuscation
<dbpedia:Crucifix_(band)>,Crucifix (band),"Crucifix was an American hardcore punk band from Berkeley, California, active from 1980 to 1984. They were among the most popular acts of the San Francisco punk scene of the early 1980s. Crucifix was founded and fronted by Cambodian-born singer Sothira Pheng, whose family had fled the country when the Khmer Rouge seized power.They were distinct among American underground bands for their strong D-beat musical characteristics and anarchist content.",where is the crucifix band in ca
<dbpedia:Athame>,Athame,"An Athame or Athamé (/əˈθɒm/, /ˈæθəmeɪ/ or /əˈθeɪmiː/) is a ceremonial blade, generally with a black handle. It is the main ritual implement or magical tool among several used in the religion of Wicca, and is also used in various other neopagan witchcraft traditions.",what is hame
<dbpedia:Helheim_(band)>,Helheim (band),"Helheim is a Viking black metal band from Bergen, Norway.",what is a helheim
<dbpedia:Chatham_University>,Chatham University,"Chatham University is an American university that has coeducational academic programs through the doctoral level, with its main campus located in the Shadyside neighborhood of Pittsburgh, Pennsylvania, United States. Chatham University maintains its Eastside Campus at the corner of Shadyside and the East Liberty neighborhood of Pittsburgh. This campus serves the Health Sciences and Architecture programs.",where is chatham university located?
<dbpedia:Joe_Cocker>,Joe Cocker,"John Robert ""Joe"" Cocker, OBE (20 May 1944 – 22 December 2014) was an English singer and musician. He was known for his gritty voice, spasmodic body movement in performance, and definitive versions of popular songs.Cocker's cover of the Beatles' ""With a Little Help from My Friends"" reached number one in the UK in 1968. He performed the song live at Woodstock in 1969, and at the Party at the Palace concert for the Golden Jubilee of Elizabeth II in 2002.",what was joe cocker famous for
<dbpedia:List_of_counties_in_Hawaii>,List of counties in Hawaii,The five counties of Hawaii on the Hawaiian Islands enjoy somewhat greater status than many counties on the United States mainland. Counties in Hawaii are the only legally constituted government bodies below that of the state. No formal level of government (such as city governments) exists below that of the county in Hawaii.,which county is hawaii located
<dbpedia:County_(United_States)>,County (United States),"In the United States, a county is a political and geographic subdivision of a state, usually assigned some governmental authority. The term ""county"" is used in 48 of the 50 U.S. states. The exceptions are Louisiana and Alaska, where the functionally equivalent subdivisions are called, respectively, parishes and boroughs. Numerous consolidated city–counties exist throughout the U.S.",what is the definition of a county
<dbpedia:Battle_of_Valcour_Island>,Battle of Valcour Island,"The naval Battle of Valcour Island, also known as the Battle of Valcour Bay, took place on October 11, 1776, on Lake Champlain.  The main action took place in Valcour Bay, a narrow strait between the New York mainland and Valcour Island.  The battle is generally regarded as one of the first naval battles of the American Revolutionary War, and one of the first fought by the United States Navy.",what is the battle of valcour island
<dbpedia:Diane_de_Poitiers>,Diane de Poitiers,"Diane de Poitiers (3 September 1499 – 25 April 1566) was a French noblewoman and a prominent courtier at the courts of kings Francis I and his son, Henry II of France. She became notorious as the latter's favourite.",who was diane poitiers
<dbpedia:List_of_counties_in_Maryland>,List of counties in Maryland,"There are twenty-four counties and county-equivalents in the U.S. state of Maryland. Though an independent city rather than a county, the City of Baltimore is considered the equal of a county for most purposes and is a county-equivalent. Many of the counties in Maryland were named for relatives of the Barons Baltimore who were the proprietors of the Maryland colony from its founding in 1634 through 1771.",number of counties in maryland
<dbpedia:Ganglot>,Ganglot,"In Norse mythology, Ganglot ""\tardy"") was Hel's maidservant in the Norse underworld. She was also the partner of Ganglati, Hel's manservant.",who was ganglot
<dbpedia:Luigi_Galvani>,Luigi Galvani,"Luigi Aloisio Galvani (Latin: Aloysius Galvani; September 9, 1737 – December 4, 1798) was an Italian physician, physicist, biologist and philosopher, who discovered animal electricity. He is also recognized as the pioneer of bioelectromagnetics. In 1780, he discovered that the muscles of dead frogs' legs twitched when struck by an electrical spark.",when did luigi galvani discovered frogs' legs
<dbpedia:Lattice_C>,Lattice C,The Lattice C Compiler was released in June 1982 by Lifeboat Associates and was the first C compiler for the IBM Personal Computer. The compiler sold for $500 and would run on PC DOS or MS-DOS. The hardware requirements were 96KB of RAM and two floppy drives.,ttice c compiler
<dbpedia:Aqua_Teen_Hunger_Force>,Aqua Teen Hunger Force,"Aqua Teen Hunger Force (also known by various alternative titles) is an American animated television series created by Dave Willis and Matt Maiellaro for Cartoon Network's late night programming block, Adult Swim.",who is teen hunger force
<dbpedia:Carl_Yastrzemski>,Carl Yastrzemski,"Carl Michael Yastrzemski (/jəˈstrɛmski/; nicknamed ""Yaz""; born August 22, 1939) is an American former Major League Baseball player. He was elected to the Baseball Hall of Fame in 1989. Yastrzemski played his entire 23-year baseball career with the Boston Red Sox (1961–1983). He was primarily a left fielder, but also played 33 games as a third baseman and mostly was a first baseman and designated hitter later in his career.",yastrzemski how many games for boston red sox
"<dbpedia:Flint,_Michigan>","Flint, Michigan","Flint is the largest city and county seat of Genesee County in the State of Michigan. It is located along the Flint River, 66 miles (106 km) northwest of Detroit.Flint is the largest city in the Flint/Tri-Cities region of Michigan. According to the 2010 census, Flint has a population of 102,434, making it the seventh largest city in Michigan.",where is flint michigan located
<dbpedia:John_Lott>,John Lott,"John Richard Lott, Jr. (born May 8, 1958) is an American  economist, political commentator, and gun rights advocate.  Lott was formerly employed at various academic institutions including the University of Chicago, Yale University, the Wharton School of the University of Pennsylvania, and the University of Maryland, College Park, and at the American Enterprise Institute conservative think tank. He is also currently a columnist for FoxNews.com. Lott holds a Ph.D.",who is john lott
<dbpedia:Shadow_Puppets>,Shadow Puppets,"Shadow Puppets is a science fiction novel by American author Orson Scott Card, published in 2002. It is the sequel to Shadow of the Hegemon and the third book in the Ender's Shadow series (often called the Bean Quartet). It was originally to be called Shadow of Death.",who wrote the book shadow puppets
<dbpedia:Þökk>,Þökk,"Þökk (Old Norse ""Thanks"") is a Jötunn in Norse mythology, presumed to be Loki in disguise, who refuses to weep for the slain Baldr, thus forcing him to stay in Hel.",who is tökk
<dbpedia:Wendy_Hiller>,Wendy Hiller,"Dame Wendy Margaret Hiller DBE (15 August 1912 – 14 May 2003) was an English film and stage actress, who enjoyed a varied acting career that spanned nearly sixty years. The writer Joel Hirschorn, in his 1984 compilation Rating the Movie Stars, described her as ""a no-nonsense actress who literally took command of the screen whenever she appeared on film"". Despite many notable film performances, she chose to remain primarily a stage actress.",what kind of actress is wendy hiller
<dbpedia:Showtunes>,Showtunes,"Showtunes is the result of collaboration between Stephin Merritt with Chen Shi-zheng on three pieces of musical theatre; Orphan of Zhao (2003), Peach Blossom Fan (2004), and My Life as a Fairy Tale (2005). Select tracks from these are featured on this album.  It was released on Nonesuch Records on March 16, 2006 but was available from peer-to-peer networks from February 20, 2006. The remainder of songs from the shows were released exclusively through online music stores.",when was show tunes made
<dbpedia:Edward_Gorey>,Edward Gorey,"Edward St. John Gorey (February 22, 1925 – April 15, 2000) was an American writer and artist noted for his illustrated books. His characteristic pen-and-ink drawings often depict vaguely unsettling narrative scenes in Victorian and Edwardian settings.",who is edward gorey
<dbpedia:Ferris_Bueller's_Day_Off>,Ferris Bueller's Day Off,"Ferris Bueller's Day Off is a 1986 American comedy film written, produced and directed by John Hughes.The film follows high school senior Ferris Bueller (Matthew Broderick), who skips school and spends the day in downtown Chicago along with his girlfriend Sloane Peterson (Mia Sara) and best friend Cameron Frye (Alan Ruck). He creatively avoids his school's dean of students Edward Rooney (Jeffrey Jones), his resentful sister Jeannie (Jennifer Grey), and his parents.",who is the actor who plays ferry bueller in film
<dbpedia:Deutsche_Mark>,Deutsche Mark,"The About this sound Deutsche Mark  (German pronunciation: [ˈdɔʏtʃə ˈmaʁk], German mark, abbreviated ""DM"") was the official currency of West Germany (1948–1990) and unified Germany (1990–2002) until the adoption of the euro in 2002. It is commonly called the ""Deutschmark"" in English but not in German. Germans often say About this sound ""Mark""  or About this sound ""D-Mark"" .",what does dmark mean?
<dbpedia:Golden_eagle>,Golden eagle,"The golden eagle (Aquila chrysaetos) is one of the best-known birds of prey in the Northern Hemisphere. It is the most widely distributed species of eagle. Like all eagles, it belongs to the family Accipitridae. These birds are dark brown, with lighter golden-brown plumage on their napes. Immature eagles of this species typically have white on the tail and often have white markings on the wings.",what is a golden eagle
