_id,title,text,query
<dbpedia:Dual_Alliance_(1879)>,Dual Alliance (1879),"The Dual Alliance was a defensive alliance between Germany and Austria-Hungary, which was created by treaty on 7 October 1879 as part of Bismarck's system of alliances to prevent/limit war. In it, Germany and Austria-Hungary pledged to aid one another in case of an attack by Russia.",why did the dual alliance exist?
<dbpedia:Dia_(software)>,Dia (software),"Dia /ˈdiːə/is free and open source general-purpose diagramming software, developed originally by Alexander Larsson. Dia uses a controlled single document interface (SDI) similar to GIMP and Inkscape.",what is dia?
<dbpedia:Denver>,Denver,"The City and County of Denver (/ˈdɛnvər/; Arapaho: Niinéniiniicíihéhe') is the capital and most populous municipality of the U.S. state of Colorado. As of 2014, Denver is also the most populous county in Colorado. Denver is located in the South Platte River Valley on the western edge of the High Plains just east of the Front Range of the Rocky Mountains.",what county is denver colorado in
<dbpedia:Deconstruction>,Deconstruction,"Deconstruction (French: déconstruction) is a critical outlook concerned with the relationship between text and meaning.  Jacque Derrida’s 1967 work Of Grammatology introduced the majority of ideas influential within deconstruction.  According to Derrida and taking inspiration from the work of Ferdinand de Saussure, language is a system of signs and words only have meaning because of the contrast between these signs.",define deconstruction
<dbpedia:DDT>,DDT,"DDT (dichlorodiphenyltrichloroethane) is a colorless, crystalline, tasteless and almost odorless organochloride known for its insecticidal properties.",what is ddt
<dbpedia:Distance_education>,Distance education,"Distance education is a generic term used to define the field of distance learning. Distance learning is a mode of delivering education and instruction, often on an individual basis, to students who are not physically present in a traditional setting such as a classroom.",what are distance education
<dbpedia:Diplomatic_mission>,Diplomatic mission,"A diplomatic mission is a group of people from one state or an international inter-governmental organisation (such as the United Nations) present in another state to represent the sending state/organisation officially in the receiving state. In practice, a diplomatic mission usually denotes the resident mission, namely the office of a country's diplomatic representatives in the capital city of another country.",what is a diplomatic mission
<dbpedia:Design_Science_License>,Design Science License,"Design Science License (DSL) is a copyleft license for free content such as text, images, music and other content but not for documentation or source code. The DSL was written by Michael Stutz.",what is design science
<dbpedia:DNA_replication>,DNA replication,"DNA replication is the process of producing two identical replicas from one original DNA molecule. This biological process occurs in all living organisms and is the basis for biological inheritance. DNA is made up of two strands and each strand of the original DNA molecule serves as a template for the production of the complementary strand, a process referred to as semiconservative replication.",how is dna replication formed in a human
<dbpedia:Division_ring>,Division ring,"In abstract algebra, a division ring, also called a skew field, is a ring in which division is possible. Specifically, it is a nonzero ring in which every nonzero element a has a multiplicative inverse, i.e., an element x with a·x = x·a = 1. Stated differently, a ring is a division ring if and only if the group of units equals the set of all nonzero elements.Division rings differ from fields only in that their multiplication is not required to be commutative.",skew ring definition
<dbpedia:Doctor_V64>,Doctor V64,"The Doctor V64 (also referred to simply as the V64) is a development and backup device made by Bung Enterprises Ltd that is used in conjunction with the Nintendo 64. The Doctor V64 also had the ability to play Video CDs, audio CDs and had an option for applying stereo 3D effects to the audio.",who makes the doctor v64
<dbpedia:Debit_card>,Debit card,"A debit card (also known as a bank card or check card) is a plastic payment card that provides the cardholder electronic access to their bank account(s) at a financial institution. Some cards may bear a stored value with which a payment is made, while most relay a message to the cardholder's bank to withdraw funds from a payer's designated bank account. The card, where accepted, can be used instead of cash when making purchases.",debit cards definition
<dbpedia:Dave_Thomas_(businessman)>,Dave Thomas (businessman),"Rex David ""Dave"" Thomas (July 2, 1932 – January 8, 2002) was an American businessperson and philanthropist. Thomas was the founder and chief executive officer of Wendy's, a fast-food restaurant chain specializing in hamburgers. He is also known for appearing in more than 800 commercial advertisements for the chain from 1989 to 2002, more than any other company founder in television history.",who is dave thomas
<dbpedia:Developmental_psychology>,Developmental psychology,"Developmental psychology is the scientific study of how and why human beings change over the course of their life. Originally concerned with infants and children, the field has expanded to include adolescence, adult development, aging, and the entire lifespan.",developmental psychology definition
<dbpedia:Dynamic_HTML>,Dynamic HTML,"Dynamic HTML, or DHTML, is an umbrella term for a collection of technologies used together to create interactive and animated web sites by using a combination of a static markup language (such as HTML), a client-side scripting language (such as JavaScript), a presentation definition language (such as CSS), and the Document Object Model.",what is dynamic html
<dbpedia:Dimona>,Dimona,"Dimona (Hebrew: דִּימוֹנָה) is an Israeli city in the Negev desert, 36 kilometres (22 mi) to the south of Beersheba and 35 kilometres (22 mi) west of the Dead Sea above the Arava valley in the Southern District of Israel. Its population at the end of 2007 was 33,600.",where is dimona
<dbpedia:Denis_Leary>,Denis Leary,"Denis Colin Leary (born August 18, 1957) is an American actor, writer, producer, singer, and comedian. He was the star and co-creator of Rescue Me, which ended its seventh and final season on September 7, 2011. Leary has starred in many motion pictures, most recently as Captain George Stacy in Marc Webb's 2012 film The Amazing Spider-Man, Cleveland Browns Head Coach Vince Penn in Ivan Reitman's 2014 film Draft Day, and the voice of Diego in the Ice Age franchise.",who is denis leary
<dbpedia:Dean_Koontz>,Dean Koontz,"Dean Ray Koontz (born July 9, 1945) is an American author. His novels are broadly described as suspense thrillers, but also frequently incorporate elements of horror, fantasy, science fiction, mystery, and satire. Several of his books have appeared on the New York Times Bestseller List, with 14 hardcovers and 14 paperbacks reaching the number one position.",who is dean koontz?
<dbpedia:Dot-com_bubble>,Dot-com bubble,"The dot-com bubble (also referred to as the dot-com boom, the Internet bubble, the dot-com collapse, and the information technology bubble) was a historic speculative bubble covering roughly 1997–2000 (with a climax on March 10, 2000, with the NASDAQ peaking at 5,132.52 in intraday trading before closing at 5,048.62) during which stock markets in industrialized nations saw their equity value rise rapidly from growth in the Internet sector and related fields.",what year did nasdaq peak at a record high
<dbpedia:Defense_Distinguished_Service_Medal>,Defense Distinguished Service Medal,"The Defense Distinguished Service Medal is a United States military award which is presented for exceptionally distinguished performance of duty contributing to National security or defense of the United States. The medal was created on July 9, 1970 by President Richard Nixon in Executive Order 11545.",why is the military distinguished service award important
<dbpedia:Discounted_cash_flow>,Discounted cash flow,"In finance, discounted cash flow (DCF) analysis is a method of valuing a project, company, or asset using the concepts of the time value of money. All future cash flows are estimated and discounted by using cost of capital to give their present values (PVs).",discount cash flow definition
<dbpedia:Catan:_Seafarers>,Catan: Seafarers,"Catan: Seafarers, or Seafarers of Catan in older editions, (German: Die Seefahrer von Catan) is an expansion of the board game The Settlers of Catan for three to four players (five-to-six-player play is also possible with both of the respective five-to-six-player extensions).  The main feature of this expansion is the addition of ships, gold rivers, and the pirate to the game, allowing play between multiple islands.",how many players in catan
<dbpedia:Dr._Seuss>,Dr. Seuss,"Theodor Seuss Geisel (/ˈsɔɪs/ /ˈɡaɪ.zəl/; March 2, 1904 – September 24, 1991) was an American writer and illustrator best known for authoring popular children's books under the pen name Dr. Seuss (/suːs/). His work includes several of the most popular children's books of all time, selling over 600 million copies and being translated into more than 20 languages by the time of his death.Geisel adopted his \Dr.""",when did dr. seuss die
<dbpedia:Dementia_praecox>,Dementia praecox,"Dementia praecox (a ""premature dementia"" or ""precocious madness"") is a chronic, deteriorating psychotic disorder characterized by rapid cognitive disintegration, usually beginning in the late teens or early adulthood. The term was first used in 1891 by Arnold Pick (1851–1924), a professor of psychiatry at Charles University in Prague. His brief clinical report described the case of a person with a psychotic disorder resembling hebephrenia.",what is dementia praecox
<dbpedia:Don_Tennant>,Don Tennant,"Donald G. Tennant (November 23, 1922 – December 8, 2001) was an American advertising agency executive.He worked at the Leo Burnett agency in Chicago, Illinois. The agency placed anthropomorphic faces of 'critters' on packaged goods. He was the first to draw Tony the Tiger for the Kellogg's Sugar Frosted Flakes advertising campaign in 1952. Tennant was also in charge of the Marlboro account and invented the Marlboro Man.",who started killogg sugar frosted flakes
"<dbpedia:Davis,_California>","Davis, California","Davis is a city in the U.S. state of California and the most populous city in Yolo County. It had a population of 65,622 in 2010, not including the on-campus population of the University of California, Davis, which was 5,786. Davis is included in the Sacramento–Arden-Arcade–Roseville Metropolitan Statistical Area.",what county is davis california
<dbpedia:Dynamical_system>,Dynamical system,"In mathematics, a dynamical system is a set of relationships among two or more measurable quantities, in which a fixed rule describes how the quantities evolve over time in response to their own values.",dynamical definition math
<dbpedia:Dictatorship>,Dictatorship,"Dictatorship is a form of government where political authority is  monopolized by a person (dictator) or political entity, and exercised through various mechanisms to ensure the entity's power remains strong.A dictatorship is a type of authoritarianism, in which politicians regulate nearly every aspect of the public and private behavior of normal people.",a dictatorship definition politics
<dbpedia:David_Bowie>,David Bowie,"David Bowie (/ˈboʊ.i/; born David Robert Jones, 8 January 1947) is an English singer, songwriter, multi-instrumentalist, record producer, arranger, painter, and actor. Bowie has been an influential figure in popular music for over four decades, and is renowned as an innovator, particularly for his work in the 1970s. He is known for his distinctive baritone voice as well as the eclecticism and intellectual ambition of his work.",who is david bowie
<dbpedia:Dale_Chihuly>,Dale Chihuly,"Dale Chihuly (born September 20, 1941), is an American glass sculptor and entrepreneur.  His works are considered unique to the field of blown glass, ""moving it into the realm of large-scale sculpture"".  The technical difficulties of working with glass forms are considerable,  yet Chihuly uses it as the primary medium for installations and environmental artwork.",who is delle chihuly
<dbpedia:Don_Rosa>,Don Rosa,"Keno Don Hugo Rosa, known simply as Don Rosa (/ˈdɑːn ˈroʊzə/; born June 29, 1951), is an American comic book author and illustrator known for his stories about Scrooge McDuck, Donald Duck and other Disney characters. Many of his stories are built on characters and locations created by Carl Barks, including the story that brought him to fame as a modern Disney artist – the Harvey Award-nominated comic, The Son of the Sun.Rosa created about 90 stories between 1987 and 2006.",who is don rosa
<dbpedia:Dean_Kamen>,Dean Kamen,"Dean L. Kamen (born April 5, 1951) is an American entrepreneur and inventor from New Hampshire.Born on Long Island, New York, he attended Worcester Polytechnic Institute, but dropped out before graduating after five years of private advanced research for the drug infusion pump AutoSyringe.  He is the son of Jack Kamen, an illustrator for Mad, Weird Science and other EC Comics publications.",what is dean kamen
<dbpedia:Duck_Hunt>,Duck Hunt,"Duck Hunt (Japanese: ダックハント, Hepburn: Dakku Hanto) is a light gun shooter video game developed and published by Nintendo for the Nintendo Entertainment System (NES) video game console. First released in Japan on April 21, 1984, it was later released on October 18, 1985 in North America as a launch game for the NES, and on August 15, 1987 in Europe.",when did duck hunt come out
<dbpedia:Dolores_Fuller>,Dolores Fuller,"Dolores Agnes Fuller (née Eble; March 10, 1923 – May 9, 2011) was an American actress and songwriter best known as the one-time girlfriend of the low-budget film director Ed Wood. She played the protagonist's girlfriend in Glen or Glenda, co-starred in Wood's Jail Bait, and had a minor role in his Bride of the Monster. Later, Elvis Presley recorded a number of her songs written for his films.",who was dolores fuller
<dbpedia:Book_of_Deuteronomy>,Book of Deuteronomy,"The Book of Deuteronomy (from Greek Δευτερονόμιον, Deuteronomion, ""second law""; Hebrew: דְּבָרִים‎, Devarim, ""[spoken] words"") is the fifth book of the Hebrew Bible, and of the Jewish Torah.",what book are deuteronomy
<dbpedia:Derek_Walcott>,Derek Walcott,"Derek Alton Walcott, OBE OCC (born 23 January 1930) is a Saint Lucian poet and playwright. He received the 1992 Nobel Prize in Literature. He is currently Professor of Poetry at the University of Essex.",who is derek walcott
<dbpedia:Dunstan>,Dunstan,"Dunstan (909 – 19 May 988) was an Abbot of Glastonbury Abbey, a Bishop of Worcester, a Bishop of London, and an Archbishop of Canterbury, later canonised as a saint. His work restored monastic life in England and reformed the English Church.",who is dunstan
<dbpedia:Donald_Campbell>,Donald Campbell,Donald Malcolm Campbell CBE (23 March 1921 – 4 January 1967) was a British speed record breaker who broke eight absolute world speed records on water and on land in the 1950s and 1960s. He remains the only person to set both world land and water speed records in the same year (1964).,how many times did donald campbell hold the world record for the worlds fastest speed
<dbpedia:De_Havilland_Mosquito>,De Havilland Mosquito,"The de Havilland DH.98 Mosquito was a British multi-role combat aircraft with a two-man crew that served during and after the Second World War. It was one of few operational front-line aircraft of the era constructed almost entirely of wood and was nicknamed ""The Wooden Wonder"".  The Mosquito was also known affectionately as the ""Mossie"" to its crews.",what was de havilland mosquito
<dbpedia:David_Huffman>,David Huffman,"David Oliver Huffman (May 10, 1945 – February 27, 1985) was an American stage, television and film actor.",what was david huffman
<dbpedia:Detroit_River>,Detroit River,"The Detroit River is a 24-nautical-mile-long (44 km; 28 mi) river that is a strait in the Great Lakes system. The river divides the metropolitan areas of Detroit, Michigan and Windsor, Ontario an area referred to as Detroit–Windsor. The two are connected by the Ambassador Bridge and the Detroit–Windsor Tunnel.The river's name comes from the French Rivière du Détroit, meaning River of the Strait.",what is the name of the river that detroit flows through
<dbpedia:E>,E,"E (named e /ˈiː/, plural ees) is the 5th letter and the second vowel in the modern English alphabet and the ISO basic Latin alphabet. It is the most commonly used letter in many languages, including: Czech, Danish, Dutch, English, French, German, Hungarian, Latin, Norwegian, Spanish, and Swedish.",where is ee on the alphabet
<dbpedia:Daily_Planet>,Daily Planet,"The Daily Planet is a fictional broadsheet newspaper appearing in American comic books published by DC Comics, commonly in association with Superman.",what is the daily planet
<dbpedia:DNA_ligase>,DNA ligase,"In molecular biology, DNA ligase is a specific type of enzyme, a ligase, (EC 6.5.1.1) that facilitates the joining of DNA strands together by catalyzing the formation of a phosphodiester bond. It plays a role in repairing single-strand breaks in duplex DNA in living organisms, but some forms (such as DNA ligase IV) may specifically repair double-strand breaks (i.e. a break in both complementary strands of DNA).",what is a dna ligase molecule
<dbpedia:Dacoity>,Dacoity,"Dacoity is a term used for ""banditry"" in Hindi, Kannada and Urdu. The spelling is the anglicized version of the Hindustani word and as a colloquial Anglo-Indian word with this meaning, it appears in the Glossary of Colloquial Anglo-Indian Words and Phrases (1903). Banditry is criminal activity involving robbery by groups of armed bandits.",dcoity definition
<dbpedia:Drum_kit>,Drum kit,"A drum kit, drum set, trap set, or just drums  is a collection of drums and other percussion instruments set up to be played/struck by a single player.The traditional drum kit consists of a mix of drums (classified as  classically as membranophones, Hornbostel-Sachs high-level classification 2) and idiophones (Hornbostel-Sachs high-level classification 1, most significantly cymbals but also including the woodblock and cowbell for example).",what is the drum kit
<dbpedia:DARPA>,DARPA,"The Defense Advanced Research Projects Agency (DARPA) is an agency of the U.S. Department of Defense responsible for the development of emerging technologies for use by the military.DARPA was created in 1958 as the Advanced Research Projects Agency (ARPA) by President Dwight D. Eisenhower. Its purpose was to formulate and execute research and development projects to expand the frontiers of technology and science, with the aim to reach beyond immediate military requirements.",what is darpa
<dbpedia:Diophantus>,Diophantus,"Diophantus of Alexandria (Ancient Greek: Διόφαντος ὁ Ἀλεξανδρεύς; born probably sometime between AD 201 and 215; died aged 84, probably sometime between AD 285 and 299), sometimes called ""the father of algebra"", was an Alexandrian Greek mathematician and the author of a series of books called Arithmetica,  many of which are now lost. These texts deal with solving algebraic equations.",when was diophantus o ghoa a greece
<dbpedia:Dispute_resolution>,Dispute resolution,Dispute resolution is the process of resolving disputes between parties.,what does dispute resolution mean
<dbpedia:Euglenozoa>,Euglenozoa,"The Euglenozoa are a large group of flagellate protozoa. They include a variety of common free-living species, as well as a few important parasites, some of which infect humans.  There are two main subgroups, the euglenids and kinetoplastids.  Euglenozoa are unicellular, mostly around 15-40 µm in size, although some euglenids get up to 500 µm long.",what is an euglenozoa
<dbpedia:Dance_Dance_Revolution>,Dance Dance Revolution,"Dance Dance Revolution (ダンスダンスレボリューション, Dansu Dansu Reboryūshon), abbreviated DDR and also known as Dancing Stage (ダンシングステージ, Danshingu Sutēji) in earlier games in Europe and Australasia, and some other games in Japan, is a music video game series produced by Konami. Introduced in Japan in 1998 as part of the Bemani series, and released in North America and Europe in 1999, Dance Dance Revolution is the pioneering series of the rhythm and dance genre in video games.",what is ddr video
<dbpedia:D._B._Cooper>,D. B. Cooper,"D. B. Cooper is a media epithet popularly used to refer to an unidentified man who hijacked a Boeing 727 aircraft in the airspace between Portland, Oregon, and Seattle, Washington, on November 24, 1971, extorted $200,000 in ransom (equivalent to $1,160,000 in 2015), and parachuted to an uncertain fate. Despite an extensive manhunt and an ongoing FBI investigation, the perpetrator has never been located or positively identified.",who is d cooper?
<dbpedia:Das_Boot>,Das Boot,"Das Boot (German pronunciation: [das ˈboːt], German meaning ""The Boat"") is a 1981 German epic war film written and directed by Wolfgang Petersen, produced by Günter Rohrbach, and starring Jürgen Prochnow, Herbert Grönemeyer and Klaus Wennemann. It has been exhibited both as a theatrical release and as a TV miniseries, and in several different home video versions of various running times.Das Boot is an adaptation of the 1973 German novel of the same name by Lothar-Günther Buchheim.",what is the original dasboot movie
<dbpedia:DEC_Alpha>,DEC Alpha,"Alpha, originally known as Alpha AXP, is a 64-bit reduced instruction set computing (RISC) instruction set developed by Digital Equipment Corporation (DEC), designed to replace their 32-bit VAX complex instruction set computer (CISC) instruction set. Alpha was implemented in microprocessors originally developed and fabricated by DEC.",what is dec
<dbpedia:Device_driver>,Device driver,"In computing, a  device driver (commonly referred to as a driver) is a computer program that operates or controls a particular type of device that is attached to a computer.",what is the device driver
<dbpedia:Dolphin>,Dolphin,"Dolphins are a widely distributed and diverse group of fully aquatic marine mammals. They are an informal grouping within the order Cetacea, excluding whales and porpoises, so to zoologists the grouping is paraphyletic. The dolphins comprise the extant families Delphinidae (the oceanic dolphins), Platanistidae (the Indian river dolphins), Iniidae (the new world river dolphins), and Pontoporiidae (the brackish dolphins). There are 40 extant species of dolphins.",what is a dolphin
<dbpedia:Derivative_(finance)>,Derivative (finance),"In finance, a derivative is a contract that derives its value from the performance of an underlying entity. This underlying entity can be an asset, index, or interest rate, and is often called the \underlying\"".""",definition derivative
<dbpedia:Detroit>,Detroit,"Detroit (/dɨˈtrɔɪt/) is the most populous city in the U.S. state of Michigan and the largest city on the United States–Canada border. It is the seat of Wayne County, the most populous county in the state. Detroit's metropolitan area, known as Metro Detroit, is home to 5.3 million people, making it the fourteenth-most populous metropolitan area in the United States and the second-largest in the Midwestern United States (behind Chicago).",what county is detroit mi in
<dbpedia:Directed_set>,Directed set,"In mathematics, a directed set (or a directed preorder or a filtered set) is a nonempty set A together with a reflexive and transitive binary relation ≤ (that is, a preorder), with the additional property that every pair of elements has an upper bound. In other words, for any a and b in A there must exist a c in A with a ≤ c and b ≤ c.The notion defined above is sometimes called an upward directed set.",what is a directed set in math
<dbpedia:Dziga_Vertov>,Dziga Vertov,"David Abelevich Kaufman (Russian:  Дави́д А́белевич Ка́уфман) (2 January 1896 – 12 February 1954) — also known as Denis Kaufman or his pseudonym Dziga Vertov or Vertof (Ukrainian: Дзи́га Ве́ртов, ""spinning top"") — was a Soviet pioneer documentary film, newsreel director and cinema theorist.",dziga vertov movie
<dbpedia:Equivalence_relation>,Equivalence relation,"In mathematics, an equivalence relation is the relation that holds between two elements if and only if they are members of the same cell within a set that has been partitioned into cells such that every element of the set is a member of one and only one cell of the partition. The intersection of any two different cells is empty; the union of all the cells equals the original set. These cells are formally called equivalence classes.",definition of equivalence
<dbpedia:Electronic_paper>,Electronic paper,"Electronic paper, e-paper and electronic ink are display technologies that mimic the appearance of ordinary ink on paper. Unlike conventional backlit flat panel displays that emit light, electronic paper displays reflect light like paper. This may make them more comfortable to read, and provide a wider viewing angle than most light-emitting displays. The contrast ratio in electronic displays available as of 2008 approaches newspaper, and newly developed displays are slightly better.",what is electronic paper
