_id,title,text,query
<dbpedia:Pilus>,Pilus,"A pilus (Latin for 'hair'; plural : pili) is a hairlike appendage found on the surface of many bacteria.  The terms pilus and fimbria (Latin for 'fringe'; plural: fimbriae) can be used interchangeably, although some researchers reserve the term pilus for the appendage required for bacterial conjugation.  All pili are primarily composed of oligomeric pilin proteins.Dozens of these structures can exist on the bacteria.",define pilus
<dbpedia:Pope_Alexander_VI>,Pope Alexander VI,"Pope Alexander VI, born Roderic Llançol i de Borja (Valencian pronunciation: [roðeˈɾiɡ ʎanˈsɔɫ i ðe ˈβɔɾdʒa], Spanish: Rodrigo Lanzol y de Borja [roˈðɾiɣo lanˈθol i ðe ˈβorxa]; 1 January 1431 – 18 August 1503), was Pope from 11 August 1492 until his death. He is one of the most controversial of the Renaissance popes, partly because he acknowledged fathering several children by his mistresses.",when did alexander vii die
<dbpedia:Phanerozoic>,Phanerozoic,"The Phanerozoic /ˌfænərɵˈzoʊɪk/ (British English Phanærozoic) is the current geologic eon in the geologic time scale, and the one during which abundant animal and plant life has existed. It covers 541.0 ± 1.0 million years and goes back to the period when diverse hard-shelled animals first appeared. Its name derives from the Ancient Greek words φανερός (fanerós) and ζωή (zo̱í̱), meaning visible life, since it was once believed that life began in the Cambrian, the first period of this eon.",phanerozoic eon definition
<dbpedia:Palace>,Palace,"A palace is a grand residence, especially a royal residence or the home of a head of state or some other high-ranking dignitary, such as a bishop or archbishop.The word itself is derived from the Latin name Palātium, for Palatine Hill, the hill which housed the Imperial residences in Rome. In many parts of Europe, the term is also applied to ambitious private mansions of the aristocracy. Many historic palaces are now put to other uses such as parliaments, museums, hotels or office buildings.",what is a palace palace
<dbpedia:Phenetics>,Phenetics,"Phenetics should not be confused with phonetics, the study of speech sounds, despite the similarity in pronunciation.In biology, phenetics /fɨˈnɛtɪks/, also known as taximetrics, is an attempt to classify organisms based on overall similarity, usually in morphology or other observable traits, regardless of their phylogeny or evolutionary relation. It is closely related to numerical taxonomy which is concerned with the use of numerical methods for taxonomic classification.",what is phenetics in biology
<dbpedia:Princetown>,Princetown,"Princetown is a village situated in the Dartmoor national park in the English county of Devon. It is the principal settlement of the civil parish of Dartmoor Forest.The village has its origins in 1785, when Sir Thomas Tyrwhitt, Secretary to the Prince of Wales, leased a large area of moorland from the Duchy of Cornwall estate, hoping to convert it into good farmland. He encouraged people to live in the area and suggested that a prison be built there.",where is princetown in devon
<dbpedia:Paulinus_of_Nola>,Paulinus of Nola,"Paulinus of Nola (also known as Paolino di Nola; full name, Pontius Meropius Anicius Paulinus) (ca. 354 Bordeaux – 22 June 431 Nola) was a Latin poet and letter-writer, and a convert to the Christian faith. His renunciation of wealth and a senatorial career in favour of a Christian ascetic and philanthropic life was held up as an example by many of his contemporaries, including Augustine, Jerome, Martin of Tours, and Ambrose.",when did paulinus of nola die
<dbpedia:Pope-elect_Stephen>,Pope-elect Stephen,"Pope-elect Stephen II was a Roman priest elected pope in March 752 to succeed Zachary; he died of a stroke a few days later, before being ordained a bishop.",who is steven ii
<dbpedia:Plasmid>,Plasmid,"A plasmid is a small  DNA molecule within a cell that is physically separated from a chromosomal DNA and can replicate independently. They are most commonly found in bacteria as small, circular, double-stranded DNA molecules; however, plasmids are sometimes present in archaea and eukaryotic organisms. In nature, plasmids often carry genes that may benefit the survival of the organism, for example antibiotic resistance.",what is a plasmid
<dbpedia:Pulley>,Pulley,"A pulley is a wheel on an axle or shaft that is designed to support movement and change of direction of a cable or belt along its circumference.  Pulleys are used in a variety of ways to lift loads, apply forces, and to transmit power. In nautical contexts, the assembly of wheel, axle, and supporting shell is referred to as a ""block.""A pulley may also be called a sheave or drum and may have a groove between two flanges around its circumference.",what is a pulley
<dbpedia:Polysaccharide>,Polysaccharide,Polysaccharides are polymeric carbohydrate molecule composed of long chains of monosaccharide units bound together by glycosidic linkages and on hydrolysis give the constituent monosaccharides or oligosaccharides. They range in structure from linear to highly branched.,which group of monosaccharides is a polysaccharide
<dbpedia:Plant_cell>,Plant cell,"Plant cells are eukaryotic cells that differ in several key aspects from the cells of other eukaryotic organisms. Their distinctive features include: A large central vacuole, a water-filled volume enclosed by a membrane known as the tonoplast that maintains the cell's turgor, controls movement of molecules between the cytosol and sap, stores useful material and digests waste proteins and organelles.",which organelle processes cytosol
<dbpedia:Party>,Party,"A party is a gathering of people who have been invited by a host for the purposes of socializing, conversation, recreation, or as part of a festival or other commemoration of a special occasion. A party will typically feature food and beverages, and often music and dancing or other forms of entertainment.",what is a party
<dbpedia:Prospero_Alpini>,Prospero Alpini,"Prospero Alpini (also known as Prosper Alpinus, Prospero Alpinio and Prosper Alpin) (23 November 1553 – 6 February 1617), was an Italian physician and botanist from the Republic of Venice.Born at Marostica, a town near Vicenza, in his youth he served for a time in the Milanese army, but in 1574 he went to study medicine at Padua.  After taking his doctor's degree in 1578, he settled as a physician in Campo San Pietro, a small town in the Paduan territory.",who was prospero alpini
<dbpedia:Parallelepiped>,Parallelepiped,"In geometry, a parallelepiped is a three-dimensional figure formed by six parallelograms (the term rhomboid is also sometimes used with this meaning). By analogy, it relates to a parallelogram just as a cube relates to a square or as a cuboid to a rectangle. In Euclidean geometry, its definition encompasses all four concepts (i.e., parallelepiped, parallelogram, cube, and  square).",what is a parallelepiped
<dbpedia:Phoenix_(TV_series)>,Phoenix (TV series),"Phoenix is an Australian police drama television series. Phoenix screened as two thirteen-part series on Australian Broadcasting Corporation in 1992 and 1993.The first series of Phoenix in 1992 recounted the investigation of the bombing of the Victorian state police headquarters, loosely based on a real case in the mid-1980s, the Russell Street Bombing.",when was phoenix on tv
<dbpedia:Petabyte>,Petabyte,"The petabyte is a multiple of the unit byte for digital information. The prefix peta indicates the fifth power of 1000 and means 1015 in the International System of Units (SI), and therefore 1 petabyte is one quadrillion (short scale) bytes, or 1 billiard (long scale) bytes.",what is a petabyte
<dbpedia:Pope_Stephen_II>,Pope Stephen II,"In sources prior to the 1960s, this Pope is sometimes called Stephen III and Pope-elect Stephen is sometimes called Stephen II. See Pope-elect Stephen for a detailed explanation.Pope Stephen II (Latin: Stephanus II (or III); 715[citation needed] – 26 April 757) was Pope from 26 March 752 to his death in 757. He succeeded Pope Zachary following the death of Pope-elect Stephen (sometimes called Stephen II).",what are the two names of stephen
<dbpedia:Pope_Benedict_I>,Pope Benedict I,Benedict I redirects here. It can also refer to Benedict I of Jerusalem.Pope Benedict I (Latin: Benedictus I; died 30 July 579) was Pope from 2 June 575 to his death in 579.,when was benedict i of jerusalem born
<dbpedia:Parasitic_computing>,Parasitic computing,"Parasitic computing is programming technique where a program in normal authorized interactions with another program manages to get the other program to perform computations of a complex nature. It is, in a sense, a security exploit in that the program implementing the parasitic computing has no authority to consume resources made available to the other program.It was first proposed by Albert-Laszlo Barabasi, Vincent W. Freeh, Hawoong Jeong & Jay B.",parasitic computing definition
<dbpedia:Pope_Anastasius_III>,Pope Anastasius III,"Pope Anastasius III (died June 913) was Pope from April 911 to his death in 913. He was a Roman by birth. A Roman nobleman, Lucian, is sometimes recognized as his father, although other sources assert that he was the illegitimate son of his predecessor Pope Sergius III (904–911).",what were the last names of anastasius' fathers
<dbpedia:Pope_Benedict_V>,Pope Benedict V,"Pope Benedict V (Latin: Benedictus V; died 4 July 965) was Pope from 22 May to 23 June 964, in opposition to Pope Leo VIII. He was overthrown by emperor Otto I. His pontificate occurred at the end of a period known as the Saeculum obscurum.",when did benedict die
<dbpedia:Psycho_(1960_film)>,Psycho (1960 film),"Psycho is a 1960 American psychological thriller-horror film directed by Alfred Hitchcock starring Anthony Perkins, Vera Miles, John Gavin, and Janet Leigh. The screenplay by Joseph Stefano was based on the 1959 novel of the same name by Robert Bloch.The film centers on the encounter between a secretary, Marion Crane (Leigh), who ends up at a secluded motel after embezzling money from her employer, and the motel's disturbed owner-manager, Norman Bates (Perkins), and its aftermath.",what is the original name for psycho film
<dbpedia:Pasta>,Pasta,"Pasta (Italian pronunciation: [ˈpasta]) is a staple food of traditional Italian cuisine, with the first reference dating to 1154 in Sicily. It is also commonly used to refer to the variety of pasta dishes. Typically, pasta is a noodle made from an unleavened dough of a durum wheat flour mixed with water and formed into sheets or various shapes, then cooked and served in any number of dishes. It can be made with flour from other cereals or grains, and eggs may be used instead of water.",pasta definition
<dbpedia:Plymouth_Argyle_F.C.>,Plymouth Argyle F.C.,"Plymouth Argyle Football Club is an English professional football club, based in Plymouth, Devon, that plays in Football League Two.Since becoming professional in 1903, the club has won five Football League titles (one Division Two and two Division Three), five Southern League titles and one Western League title. The 2009–10 season was the club's 42nd in the second tier of English football.",where does plymouth argyle football club play
<dbpedia:Pope_Benedict_VIII>,Pope Benedict VIII,"Pope Benedict VIII (Latin: Benedictus VIII; ca. 980 – 9 April 1024) reigned from 18 May 1012 to his death in 1024. He was born Theophylactus to the noble family of the counts of Tusculum (son of Gregory, Count of Tusculum, and brother of future Pope John XIX), descended from Theophylact, Count of Tusculum, just as was his predecessor Pope Benedict VI (973–974).",what was ben benedict born in
<dbpedia:Pope_Benedict_IX>,Pope Benedict IX,"Pope Benedict IX (Latin: Benedictus IX; c. 1012 – c. 1056), born Theophylactus of Tusculum in Rome, was Pope on three occasions between October 1032 and July 1048. Aged approximately 20 at his first election, he is one of the youngest popes in history. He is the only man to have been Pope on more than one occasion and the only man ever to have sold the papacy.",what is benedict's first name?
<dbpedia:Pope_Benedict_VI>,Pope Benedict VI,"Pope Benedict VI (Latin: Benedictus VI; died June 974) was Pope from 19 January 973 to his death in 974. His brief pontificate occurred in the political context of the establishment of the Holy Roman Empire, during the transition between the reigns of German emperors Otto I and Otto II, incorporating the struggle for power of Roman aristocratic families such as the Crescentii and Tusculani.",when did benedict die
<dbpedia:Pope_Benedict_XI>,Pope Benedict XI,"Pope Benedict XI (Latin: Benedictus XI; 1240 – 7 July 1304), born Nicola Boccasini, was Pope from 22 October 1303 to his death in 1304. He was also a member of the Order of Preachers. Among the events of his brief pontificate was his reversion of his predecessor's papal bull, Unam Sanctam, on papal supremacy.He was beatified with his cultus confirmed by Pope Clement XII in 1736. He is a patron of Treviso.",was benedict xi a priest
<dbpedia:Patanjali>,Patanjali,"Patañjali  is a proper Indian name.  Several important Sanskrit works are ascribed to one or more authors of this name, and a great deal of scholarship has been devoted over the last century or so to the issue of disambiguation.Amongst the more important authors called Patañjali are: The author of the Mahābhāṣya, an advanced treatise on Sanskrit grammar and linguistics framed as a commentary on Kātyāyana's vārttikas (short comments) on Pāṇini's Aṣṭādhyāyī.",what is the name patajali
<dbpedia:Pope_Benedict_XII>,Pope Benedict XII,"Pope Benedict XII (Latin: Benedictus XII; died 25 April 1342), born Jacques Fournier, was Pope from 20 December 1334 to his death in 1342. He was the third Avignon Pope.",what year did benjamin die
<dbpedia:Peace_of_Westphalia>,Peace of Westphalia,The Peace of Westphalia (German: Westfälischer Friede) was a series of peace treaties signed between May and October 1648 in Osnabrück and Münster.,when was the peace of westphalia made
<dbpedia:Pope_Honorius_I>,Pope Honorius I,"Pope Honorius I (died 12 October 638) reigned from 27 October 625 to his death in 638.Honorius, according to the Liber Pontificalis, came from Campania and was the son of the consul Petronius. He became pope two days after the death of his predecessor, Boniface V. The festival of the Elevation of the Cross is said to have been instituted during the pontificate of Honorius, which was marked also by considerable missionary enterprise. Much of this was centered on England, especially Wessex.",what is honorius
<dbpedia:Palestinian_Christians>,Palestinian Christians,"Palestinian Christians number approximately 38,000 in the State of Palestine, and belong to one of a number of Christian denominations, including Eastern Orthodoxy, Oriental Orthodoxy, Catholicism (Eastern and Western rites), Anglicanism, Protestantism and others. The concept ""Palestinian Christians"" is also often appliedTemplate:By whom? to Christians with a Palestine refugee status and to Christians with Palestinian ancestry.",how many palestinians are christians
<dbpedia:Pope_John_II>,Pope John II,"Pope John II (Latin: Ioannes II; 470 – 8 May 535) was Pope from 2 January 533 to his death in 535.Born Mercurius in Rome in 470, the son of a certain Projectus, he became a priest of the Basilica di San Clemente on the Caelian Hill. He was made pope on 2 January 533.  The basilica of St. Clement still retains several memorials of ""Johannes surnamed Mercurius"".",where is john the pope from?
<dbpedia:PHP-Nuke>,PHP-Nuke,PHP-Nuke is a web-based automated news publishing and content management system based on PHP and MySQL originally written by Francisco Burzi. The system is controlled using a web-based user interface. PHP-Nuke was originally a fork of the Thatware news portal system.PHP-Nuke was originally released under the GNU General Public License as free software. Versions after 7.5 required a license fee; from version 8.3 it became free again.,what is nuke
<dbpedia:Proteome>,Proteome,"The proteome is the entire set of proteins expressed by a genome, cell, tissue or organism at a certain time. More specifically, it is the set of expressed proteins in a given type of cell or organism, at a given time, under defined conditions. The term is a blend of proteins and genome. Proteomics is the study of the proteome.",which term describes the set of proteins that are expressed by a genome?
<dbpedia:Percival_Lowell>,Percival Lowell,"Percival Lawrence Lowell (March 13, 1855 – November 12, 1916) was an American businessman, author, mathematician, and astronomer who fueled speculation that there were canals on Mars. He founded the Lowell Observatory in Flagstaff, Arizona, and formed the beginning of the effort that led to the discovery of Pluto 14 years after his death.",who discovered pluto
<dbpedia:Poznań>,Poznań,"Poznań ([ˈpɔznaɲ]; known also by other historical names) is a city on the Warta river in west-central Poland, in the region called Wielkopolska (Greater Poland). It is best known for its renaissance old town, destroyed during World War II and then rebuilt, and Ostrów Tumski cathedral. After the second partition of Poland Poznań was administrated by Prussia, and then, with the unification of Germany after the Franco-Prussian War of 1871, the province of Posen became part of the German Empire.",where is pienia
<dbpedia:Pseudo-Dionysius_the_Areopagite>,Pseudo-Dionysius the Areopagite,"Pseudo-Dionysius the Areopagite (Greek: Διονύσιος ὁ Ἀρεοπαγίτης), also known as Pseudo-Denys, was a Christian theologian and philosopher of the late 5th to early 6th century (writing before 532), probably Syrian, the author of the set of works commonly referred to as the Corpus Areopagiticum or Corpus Dionysiacum. The author pseudonymously identifies himself in the corpus as ""Dionysios"", portraying himself as the figure of Dionysius the Areopagite, the Athenian convert of St.",who is pseudo denys
<dbpedia:Passenger_pigeon>,Passenger pigeon,"The passenger pigeon or wild pigeon (Ectopistes migratorius) is an extinct North American bird. Named after the French word passager for ""passing by"", it was once the most abundant bird in North America, and possibly the world. It accounted for more than a quarter of all birds in North America. The species lived in enormous migratory flocks until the early 20th century, when hunting and habitat destruction led to its demise.",what are passenger birds
<dbpedia:Phase_(waves)>,Phase (waves),"Phase in sinusoidal functions or in waves has two different, but closely related, meanings.  One is the initial angle of a sinusoidal function at its origin and is sometimes called phase offset or phase difference.  Another usage is the fraction of the wave cycle that has elapsed relative to the origin.",phase definition sinusoidal
<dbpedia:Pope_Marinus_II>,Pope Marinus II,"Pope Marinus II (or Martin III; died May 946), was Pope from 30 October 942 to his death in 946.",how did martinus iii die
<dbpedia:Propane>,Propane,"Propane (/ˈproʊpeɪn/) is a three-carbon alkane with the molecular formula C3H8, a gas at standard temperature and pressure, but compressible to a transportable liquid. A by-product of natural gas processing and petroleum refining, it is commonly used as a fuel for engines, oxy-gas torches, portable stoves, and residential central heating. Propane is one of a group of liquefied petroleum gases (LP gases).",what is a propane
<dbpedia:Pope_Anastasius_IV>,Pope Anastasius IV,"Pope Anastasius IV (c. 1073 – 3 December 1154), born Corrado Demetri della Suburra, was Pope from 8 July 1153 to his death in 1154.",what age was anastasius iii born
<dbpedia:Phylogenetics>,Phylogenetics,"Phylogenetics /faɪlɵdʒɪˈnɛtɪks/ (greek: φυλή, φῦλον - phylé, phylon = tribe, clan, race + γενετικός - genetikós = origin, source, birth)  – in biology –  is the study of phylogenesis, or the evolutionary history, development and relationships among groups of organisms (e.g. species, or  populations). These are discovered mainly through molecular data matrices, based on nucleic acids sequences and protein structures.",what is the study of phylogenetics
<dbpedia:Peter_F._Hamilton>,Peter F. Hamilton,"Peter F. Hamilton (born 2 March 1960) is a British author. He is best known for writing space opera. As of the publication of his tenth novel in 2004, his works had sold over two million copies worldwide.",who is peter hamilton
<dbpedia:Party-list_proportional_representation>,Party-list proportional representation,"Party-list proportional representation systems are a family of voting systems emphasizing proportional representation (PR) in elections in which multiple candidates are elected (e.g. elections to parliament) through allocations to an electoral list. They can also be used as part of mixed additional member systems.In these systems, parties make lists of candidates to be elected, and seats get allocated to each party in proportion to the number of votes the party receives.",what is a proportional representation system
<dbpedia:Pope_John_XXIII>,Pope John XXIII,"Pope Saint John XXIII (Latin: Ioannes XXIII; Italian: Giovanni XXIII) born Angelo Giuseppe Roncalli, Italian pronunciation: [ˈandʒelo dʒuˈzɛppe roŋˈkalli]; 25 November 1881 – 3 June 1963) reigned from 28 October 1958 to his death in 1963 and was canonized on 27 April 2014. Angelo Giuseppe Roncalli was the fourth of fourteen children born to a family of sharecroppers who lived in a village in Lombardy.",who is saint john
<dbpedia:Pope_Boniface_I>,Pope Boniface I,"Pope Boniface I (Latin: Bonifatius I; died 4 September 422) was Pope from 28 December 418 to his death in 422. He was a contemporary of Saint Augustine of Hippo, who dedicated to him some of his works.",who was pope bonifatius ii
<dbpedia:List_of_political_parties_by_region>,List of political parties by region,"This page is a directory to various pages that will list political parties, from around the world, according to their respective regions.",what is the name of the party that is the largest?
<dbpedia:Pope_Boniface_IV>,Pope Boniface IV,Pope Boniface IV (Latin: Bonifatius IV; c. 550 – 25 May 615) was Pope from 25 September 608 to his death in 615. He is venerated as a saint in the Roman Catholic Church with a universal feast falling annually on 25 May.,who is papist bonifatius
<dbpedia:Pope_Boniface_III>,Pope Boniface III,Pope Boniface III (Latin: Bonifatius III; died 12 November 607) was the Pope from 19 February to his death in 607. Despite his short time as Pope he made a significant contribution to the organization of the Catholic Church.,when did papist boniface die
<dbpedia:Political_party>,Political party,"A political party is an organization of people which seeks to achieve goals common to its members through the acquisition and exercise of political power.While there is some international commonality in the way political parties are recognized, and in how they operate, there are often many differences, and some are significant. Many political parties have an ideological core, but some do not, and many represent very different ideologies than they did when first founded.",what is a political party
<dbpedia:Python_(programming_language)>,Python (programming language),"Python is a widely used general-purpose, high-level programming language. Its design philosophy emphasizes code readability, and its syntax allows programmers to express concepts in fewer lines of code than would be possible in languages such as C++ or Java. The language provides constructs intended to enable clear programs on both a small and large scale.Python supports multiple programming paradigms, including object-oriented, imperative and functional programming or procedural styles.",what is python and its application
<dbpedia:Particle_in_a_box>,Particle in a box,"In quantum mechanics, the particle in a box model (also known as the infinite potential well or the infinite square well) describes a particle free to move in a small space surrounded by impenetrable barriers.  The model is mainly used as a hypothetical example to illustrate the differences between classical and quantum systems.",what is the mathematical term for the infinite potential well
<dbpedia:Pope_Anastasius_I>,Pope Anastasius I,Pope Anastasius I (died 19 December 401) served as Pope from 27 November 399 to his death in 401.,when did anastasius die
<dbpedia:Pope_Pius_I>,Pope Pius I,"Pope Saint Pius I (died c. 155) was the Bishop of Rome from c. 140 to his death c. 154, according to the Annuario Pontificio. His dates are listed as 142 or 146 to 157 or 161, respectively.",when did pius idie
<dbpedia:Population_inversion>,Population inversion,"In science, specifically statistical mechanics, a population inversion occurs while a system (such as a group of atoms or molecules) exists in a state with more members in an excited state than in lower energy states. It is called an ""inversion"" because in many familiar and commonly encountered physical systems, this is not possible. The concept is of fundamental importance in laser science because the production of a population inversion is a necessary step in the workings of a standard laser.",what is a population inversion in science
