_id,title,text,query
"<dbpedia:Venice,_Illinois>","Venice, Illinois","Venice is a city in Madison County, Illinois, United States. The population was 1,890 at the 2010 census.The Venice Power Station, a combustion turbine generator (CTG)-type Ameren power plant, is located in Venice.",what county is venice il in
"<dbpedia:Mount_Olive,_Illinois>","Mount Olive, Illinois","Mount Olive is a city in Macoupin County, Illinois, United States. The population was 2,150 at the 2000 census.",what county is mount olive illinois in
"<dbpedia:Niantic,_Illinois>","Niantic, Illinois","Niantic is a village in Macon County, Illinois, United States whose population was 699 at the 2012 census.It is included in the Decatur, Illinois Metropolitan Statistical Area.","what county is niantic, il in"
"<dbpedia:Pontoon_Beach,_Illinois>","Pontoon Beach, Illinois","Pontoon Beach is a village in Madison County, Illinois, United States. The population was 5,836 at the 2010 census.",what county is pontoon beach in
"<dbpedia:Bunker_Hill,_Illinois>","Bunker Hill, Illinois","Bunker Hill is a city in Macoupin County, Illinois, United States. The population was 1,801 at the 2000 census.",where is bunker hill illinois
"<dbpedia:East_Gillespie,_Illinois>","East Gillespie, Illinois","East Gillespie is a village in Macoupin County, Illinois,  United States. As of the 2010 census, the village had a total population of 270, up from 234 in 2000.",what county is gillespie illinois
"<dbpedia:Godfrey,_Illinois>","Godfrey, Illinois","Godfrey is a village in Madison County, Illinois, United States. The population was 17,982 at the 2010 census. Godfrey is located within the Greater St. Louis metropolitan area.","what county is godfrey, il"
"<dbpedia:Glen_Carbon,_Illinois>","Glen Carbon, Illinois","Glen Carbon is a village in Madison County, Illinois, United States, 19 miles (31 km) northeast of St. Louis. The population was 12,934 at the 2010 census.",where is glen carbon il
"<dbpedia:South_Roxana,_Illinois>","South Roxana, Illinois","South Roxana is a village in Madison County, Illinois, United States. The population was 2,053 at the 2010 census.",what county is south roxana illinois in
"<dbpedia:Hamel,_Illinois>","Hamel, Illinois","Hamel is a village in Madison County, Illinois, United States. The population was 816 at the 2010 census. It is a part of the Illinois Metro East portion of the Greater St. Louis metropolitan area.",where is hamel illinois
"<dbpedia:Alton,_Illinois>","Alton, Illinois","Alton is a city on the Mississippi River in Madison County, Illinois, United States, about 15 miles (24 km) north of St. Louis, Missouri. The population was 27,865 at the 2010 census. It is a part of the Metro-East region of the Greater St. Louis metropolitan area in Southern Illinois.",what county is alton il
"<dbpedia:Carlinville,_Illinois>","Carlinville, Illinois","Carlinville is a city in Macoupin County, Illinois, United States. As of the 2000 Census, the population was 5,685, and 5,912 at a 2009 estimate. It is the county seat of Macoupin County, and is an outlying part of the Metro-East region of the Greater St. Louis metropolitan area.Carlinville is also the home of Blackburn College, a small college affiliated with the Presbyterian church, and Prairie Farms Dairy.","what county is carlinville, il"
"<dbpedia:Marine,_Illinois>","Marine, Illinois","Marine is a village in Madison County, Illinois, United States. The population was 960 at the 2010 census.",marine is in what county
"<dbpedia:Nilwood,_Illinois>","Nilwood, Illinois","Nilwood is an incorporated town in Macoupin County, Illinois, United States. The population was 284 at the 2000 census.","what county is nilwood, il"
"<dbpedia:Livingston,_Illinois>","Livingston, Illinois","Livingston is a village in Madison County, Illinois, United States. The population was 858 at the 2010 census.",what county is livingston illinois in
"<dbpedia:Fairmont_City,_Illinois>","Fairmont City, Illinois","Fairmont City is a village in St. Clair and Madison counties, Illinois, United States. The population was 2,635 at the 2010 census.  In the 1990s Fairmont City's Hispanic population doubled, and it now has the highest percentage of Hispanics in the entire St. Louis Metropolitan area, with over 71% of the population of Hispanic descent.",population of fairmont city
"<dbpedia:Benld,_Illinois>","Benld, Illinois","Benld /bəˈnɛld/ is a city in Macoupin County, Illinois, United States. The population was 1,541 at the 2000 census. The name derives from founder Benjamin L. Dorsey (d.June 19, 1895).Dorsey was responsible for gaining the land on which the town was built and coal mining rights. When it came time to name the village, he took the combination of his first name and his middle and last initial.",what county is beld il in
"<dbpedia:Roxana,_Illinois>","Roxana, Illinois","Roxana is a village in Madison County, Illinois, United States. The population was 1,542 at the 2010 census.A majority of the land in Roxana is taken up by the Wood River ConocoPhillips oil refinery; the refinery was built and originally owned by Shell Oil.  As of December 2005, the refinery refines 306,000 barrels (48,700 m3) of oil per day to produce gasoline, jet fuel, diesel, asphalt, propane, and other products, and supplies part of the St.",what county is roxana il in
"<dbpedia:Mundelein,_Illinois>","Mundelein, Illinois","Mundelein is a village in Lake County, Illinois, United States and a northern suburb of Chicago. As of the 2010 census, the village population was 31,064. It is approximately thirty-five miles northwest of Chicago.",what county is mundelein illinois in
<dbpedia:David_Andrade>,David Andrade,"David Andrade (1859 – 1928) was an Australian anarchist.In May 1886, David Andrade, his brother Will and half a dozen others formed the Melbourne Anarchist Club (MAC), the first anarchist organisation in Australia. Andrade became the MAC secretary and one of its main propagandists. The MAC produced the journal Honesty. In a news agency at Brunswick, now an inner suburb of Melbourne, and later in Liberty Hall, Russell St.",who was david andrade
"<dbpedia:Edwardsville,_Illinois>","Edwardsville, Illinois","Edwardsville is a city in Madison County, Illinois, United States. As of the 2010 census, the city population was 24,293.  It is the county seat of Madison County and is the third oldest city in the State of Illinois. The city was named in honor of Ninian Edwards, then Governor of the Illinois Territory.Southern Illinois University Edwardsville, the Edwardsville Arts Center, the Edwardsville Journal, the Madison County Record, and the Edwardsville Intelligencer are located here.",where is edwardsville illinois
"<dbpedia:Long_Grove,_Illinois>","Long Grove, Illinois","Long Grove is a village in Lake County, Illinois, United States, approximately 35 miles (56 km) northwest of Chicago. As of the 2010 census, the village had a population of 8,043. The village has strict building ordinances to preserve its ""country atmosphere"".",what county is long grove il
"<dbpedia:Waukegan,_Illinois>","Waukegan, Illinois","Waukegan /wɔːˈkiːɡən/ is a city and the county seat of Lake County, Illinois, United States. As of the 2013 census estimate, the city had a population of 88,826. It is the ninth-largest city in Illinois by population. It is the fifth-largest city on the western shore of Lake Michigan, after Chicago, Milwaukee, Green Bay, and Kenosha.",what county is waukegan illinois in
"<dbpedia:Wood_River,_Illinois>","Wood River, Illinois","Wood River is a city in Madison County, Illinois, United States. The population is 10,424 according to the 2013 census estimate.",what county is wood river il in
"<dbpedia:Central_City,_Illinois>","Central City, Illinois","Central City is a village in Marion County, Illinois, United States. The population was 1,371 at the 2000 census.",what county is central city in
"<dbpedia:Patoka,_Illinois>","Patoka, Illinois","Patoka is a village in Marion County, Illinois, United States. The population was 633 at the 2000 census.",what county is patoka il in
"<dbpedia:Williamson,_Illinois>","Williamson, Illinois","Williamson is a village in Madison County, Illinois, United States. The population was 230 at the 2010 census.",where is williamson il
<dbpedia:Wonder_Woman>,Wonder Woman,"Wonder Woman is a fictional superhero appearing in American comic books published by DC Comics. The character is a warrior princess of the Amazons (based on the Amazons of Greek mythology) and is known in her homeland as Princess Diana of Themyscira. When outside her homeland, she is sometimes known by the secret identity Diana Prince. She is gifted with a wide range of superhuman powers and superior combat and battle skills.",what is wonder woman
"<dbpedia:Iuka,_Illinois>","Iuka, Illinois","Iuka is a village in Marion County, Illinois, United States. The population was 489 at the 2010 census, down from 598 in 2000.","what county is iuka, il in"
"<dbpedia:Alma,_Illinois>","Alma, Illinois","Alma (formerly Mound City, Rantoul) is a village incorporated in 1854 in Marion County, Illinois, United States. The population was 386 at the 2000 census.",what county is alma il
"<dbpedia:Vernon,_Illinois>","Vernon, Illinois","Vernon is a village in Marion County, Illinois, United States. The population was 178 at the 2000 census.","where is vernon, il"
"<dbpedia:Sandoval,_Illinois>","Sandoval, Illinois","Sandoval /sænˈdoʊvəl/ is a village in Marion County, Illinois, United States. The population was 1,434 at the 2000 census.",what county is sandoval il in
"<dbpedia:Kell,_Illinois>","Kell, Illinois","Kell is a village in Marion County, Illinois, United States. The population was 231 at the 2000 census.",kell illinois is in what county
"<dbpedia:Walnut_Hill,_Illinois>","Walnut Hill, Illinois","Walnut Hill is a village in Marion County, Illinois, United States. The population was 109 at the 2000 census.",what county is walnut hill il in
"<dbpedia:Henry,_Illinois>","Henry, Illinois","Henry is a city in Marshall County, Illinois, United States. The population was 2,464 at the 2010 census. It is part of the Peoria, Illinois Metropolitan Statistical Area.",population of henry il
"<dbpedia:Mason_City,_Illinois>","Mason City, Illinois","Mason City is a city in Mason County, Illinois, United States. The population was 2,558 at the 2000 census, and 2,324 at a 2009 estimate.  Mason City was established in 1857.",what county is mason city illinois in
"<dbpedia:La_Rose,_Illinois>","La Rose, Illinois","La Rose is a village in Bell Plain Township, Marshall County, Illinois, United States. The population was 144 at the 2010 census, down from 159 at the 2000 census. It is part of the Peoria, Illinois Metropolitan Statistical Area.",what county is la rose il in
"<dbpedia:Junction_City,_Illinois>","Junction City, Illinois","Junction City is a village in Marion County, Illinois, United States. The population was 559 at the 2000 census.","what county is junction city, il in"
"<dbpedia:Worden,_Illinois>","Worden, Illinois","Worden is a village in Madison County, Illinois, United States. The population was 1,044 at the 2010 census.",what county is worden il in?
"<dbpedia:Bardolph,_Illinois>","Bardolph, Illinois","Bardolph is a village in McDonough County, Illinois, United States. The population was 253 at the 2000 census.",population bardolph il
"<dbpedia:Wenona,_Illinois>","Wenona, Illinois","Wenona is a city in Marshall and LaSalle counties in the U.S. state of Illinois. The population was 1,056 at the 2010 census, down from 1,065 at the 2000 census.The Marshall County portion of Wenona is part of the Peoria Metropolitan Statistical Area, while the small portion that lies in LaSalle County is part of the Ottawa–Streator Micropolitan Statistical Area.",where is wenona il
"<dbpedia:Hopewell,_Illinois>","Hopewell, Illinois","For the township, see Hopewell Township, Marshall County, Illinois.Hopewell is a village in Marshall County, Illinois, United States. The population was 410 at the 2010 census, up from 396 at the 2000 census. It is part of the Peoria, Illinois Metropolitan Statistical Area.",where is hopewell il
"<dbpedia:Sparland,_Illinois>","Sparland, Illinois","Sparland is a village in Marshall County, Illinois, United States. The population was 406 at the 2010 census, down from 504 at the 2000 census. It is part of the Peoria, Illinois Metropolitan Statistical Area.",what county is sparland il
"<dbpedia:Decatur,_Illinois>","Decatur, Illinois","Decatur /dəˈkeɪtər/ is the largest city and the county seat of Macon County in the U.S. state of Illinois. The city was founded in 1829 and is located along the Sangamon River and Lake Decatur in Central Illinois. In 2013 the city population was 74,710.The city is home of private Millikin University and public Richland Community College.","what county is decatur, il"
"<dbpedia:Joppa,_Illinois>","Joppa, Illinois","Joppa is a village in Massac County, Illinois, along the Ohio River. The population was 409 at the 2000 census. It is part of the Paducah, KY-IL Micropolitan Statistical Area.",what county is joppa illinois
"<dbpedia:Forest_City,_Illinois>","Forest City, Illinois","Forest City is a village in Mason County, Illinois, United States. The population was 287 at the 2000 census.",where is forest city illinois
"<dbpedia:Washburn,_Illinois>","Washburn, Illinois","Washburn is a village mostly in Woodford County, with a small northerly portion in  Marshall County, both in the U.S. state of Illinois. The population was 1,158 at the 2010 census, up from 1,147 at the 2000 census. It is part of the Peoria, Illinois Metropolitan Statistical Area.Washburn is an agricultural community located in north-central Illinois. Illinois Route 89 forms the main north-south road through Washburn as Jefferson Street.","where is washburn, il"
"<dbpedia:Kinmundy,_Illinois>","Kinmundy, Illinois","Kinmundy is a city in Marion County, Illinois, United States. The population was 892 at the 2000 census.Kinmundy is believed to be named after a place in Scotland.",what county is kinmundy il in
"<dbpedia:Kilbourne,_Illinois>","Kilbourne, Illinois","Kilbourne is a village in Mason County, Illinois, United States. The population was 375 at the 2000 census.",where is kilbourne illinois
"<dbpedia:Prairie_City,_Illinois>","Prairie City, Illinois","Prairie City is a village in McDonough County, Illinois, United States. The population was 461 at the 2000 census.","what county is prairie city, il"
"<dbpedia:Colchester,_Illinois>","Colchester, Illinois","Colchester is a city in McDonough County, Illinois, United States. The population was 1,493 at the 2000 census. The city is named after the town of Colchester, England.",what county is colchester il in
"<dbpedia:Bushnell,_Illinois>","Bushnell, Illinois","Bushnell is a city in McDonough County, Illinois, United States. The population was 3,221 at the 2000 census.",what county is bushnell il in
"<dbpedia:Tennessee,_Illinois>","Tennessee, Illinois","Tennessee is a village in McDonough County, Illinois, United States. The population was 144 at the 2000 census.",where is tennessee illinois
"<dbpedia:Varna,_Illinois>","Varna, Illinois","Varna is a village in Marshall County, Illinois, United States. The population was 384 at the 2010 census, down from 436 at the 2000 census. It is part of the Peoria, Illinois Metropolitan Statistical Area. Included in the Postal Zone of Varna is the nearby community of Lake Wildwood that serves as a vacation spot.",where is varna il
"<dbpedia:Brookport,_Illinois>","Brookport, Illinois","Brookport is a city in Massac County, Illinois, United States. The population was 1,054 at the 2000 census. It is part of the Paducah, KY-IL Micropolitan Statistical Area.","what county is brookport, il in"
"<dbpedia:Industry,_Illinois>","Industry, Illinois","Industry is a village in McDonough County, Illinois,  United States. As of the 2000 census, the village population was 540.",what county is industry illinois in
"<dbpedia:Manito,_Illinois>","Manito, Illinois","Manito is a village in Mason County, Illinois, United States. The population was 1,733 at the 2000 census, and 1,595 at a 2009 estimate.","what county is manito, il"
"<dbpedia:Bath,_Illinois>","Bath, Illinois","Bath is a village in Mason County, Illinois, United States. The population was 310 at the 2000 census.",what county is bath il
"<dbpedia:Lacon,_Illinois>","Lacon, Illinois","Lacon is a city in, and the county seat of, Marshall County, Illinois, United States. It is part of the Peoria, Illinois Metropolitan Statistical Area. The population was 1,937 at the 2010 census, down from 1,979 at the 2000 census.Lacon was named after Laconia, a region of Greece.",lacon illinois is in what county
"<dbpedia:Greenwood,_Illinois>","Greenwood, Illinois","Greenwood is a village in McHenry County, Illinois,  United States. It was incorporated as a village on 4 April 1995. The population was 244 at the 2000 census.",where is greenwood illinois
"<dbpedia:Easton,_Illinois>","Easton, Illinois","Easton is a village in Mason County, Illinois, United States. As of the 2010 census, the village population was 321, down from 373 in 2000.",where is easton il located
"<dbpedia:Blandinsville,_Illinois>","Blandinsville, Illinois","Blandinsville is a village in McDonough County, Illinois, United States. The population was 777 at the 2000 census.The town is named for Joseph L. Blandin, owner of the first general store.  In 1842, the town was platted on a tract known as Job's Settlement, named after early settlers William and Ira Job.  A post office was established in 1843.  The Frank Hicks House in Blandinsville was constructed by architect George Franklin Barber in 1895.",where is blandinsville
"<dbpedia:Odin,_Illinois>","Odin, Illinois","Odin is a village in Marion County, Illinois, United States. The population was 1,122 at the 2000 census. The village was named after Odin, a god in Germanic mythology.",population of odin il
"<dbpedia:Good_Hope,_Illinois>","Good Hope, Illinois","Good Hope is a village in McDonough County, Illinois,  United States. The population was 415 according to the 2000 census.","what county is good hope, il in"
"<dbpedia:Holiday_Hills,_Illinois>","Holiday Hills, Illinois","Holiday Hills is a village in McHenry County, Illinois, United States. The population was 831 at the 2000 census.","what county is holiday hills, illinois in?"
"<dbpedia:Topeka,_Illinois>","Topeka, Illinois","Topeka is an incorporated town in Mason County, Illinois, United States. The population was 90 at the 2000 census.",population of topeka illinois
"<dbpedia:Havana,_Illinois>","Havana, Illinois","Havana is a city in Mason County, Illinois, United States. The population was 3,577 at the 2000 census, and 3,260 at a 2009 estimate. It is the county seat of Mason County.",where is havana il
"<dbpedia:Metropolis,_Illinois>","Metropolis, Illinois","Metropolis is a city located along the Ohio River in Massac County, Illinois, United States. It has a population of 6,465 according to the 2013 estimate of the United States Census Bureau. Metropolis is the county seat of Massac County and is part of the Paducah, KY-IL Micropolitan Statistical Area in Southern Illinois.",what is the population of mossac illinois
"<dbpedia:Johnsburg,_Illinois>","Johnsburg, Illinois","Johnsburg is a northwest suburban Chicago village in McHenry County, Illinois, United States. The population was 6,337 at the 2010 census.","what county is johnsburg, il"
"<dbpedia:Hebron,_Illinois>","Hebron, Illinois","Hebron is a village in McHenry County, Illinois, United States. As of the 2010 census the village population was 1,216, up from 1,038 in 2000.",what county is hebron il
"<dbpedia:Granite_City,_Illinois>","Granite City, Illinois","Granite City is a city in Madison County, Illinois, United States, within the Greater St. Louis metropolitan area.  The population was 29,849 at the 2010 census, making it the second largest city in the Metro East and Southern Illinois regions, behind Belleville. Officially founded in 1896, Granite City was named by the Niedringhaus brothers, William and Frederick, who established it as a steel making company town for the manufacture of kitchen utensils made to resemble granite.",what county is granite city il
"<dbpedia:McCullom_Lake,_Illinois>","McCullom Lake, Illinois","McCullom Lake is a village in McHenry County, Illinois, United States. The population was 1,038 at the 2000 census.",what county is mccullom lake illinois in
"<dbpedia:Marengo,_Illinois>","Marengo, Illinois","Marengo is a city in McHenry County, Illinois, United States. The population was 7,648 at the 2010 census.","what county is marengo, il in?"
"<dbpedia:Lakewood,_Illinois>","Lakewood, Illinois","Lakewood is a village in McHenry County, Illinois, United States. It was incorporated as a village on July 10, 1933. The population was 3,811 at the 2010 census.","what county is lakewood, il"
"<dbpedia:Harvard,_Illinois>","Harvard, Illinois","Harvard is a city located in McHenry County in the northeastern corner of the U.S. state of Illinois, approximately 7 miles (11 km) south of the Illinois/Wisconsin border. The population was 9,447 at the 2010 census. The city is 63 miles (101 km) from the Chicago Loop, and it is the last stop on the Union Pacific/Northwest Line.",what county is harvard il in
"<dbpedia:Bull_Valley,_Illinois>","Bull Valley, Illinois","Bull Valley is an affluent village in McHenry County, Illinois, United States. The population was 726 at the 2000 census. However, at the 2010 census, the population was at 1,077. Surrounded by the urban sprawl of Crystal Lake, Woodstock, and McHenry, the village prides itself in its rural, low-density character.",what county is bull valley il in
"<dbpedia:Sciota,_Illinois>","Sciota, Illinois","Sciota /saɪˈoʊdə/ is a village in McDonough County, Illinois, United States. The population was 61 at the 2010 census.",what county is sciaota il
"<dbpedia:Cary,_Illinois>","Cary, Illinois","Cary is a village located in Algonquin Township, McHenry County, Illinois, United States. The population was 18,271 at the 2011 census.",what county is ary il
"<dbpedia:Oakwood_Hills,_Illinois>","Oakwood Hills, Illinois","Oakwood Hills is a village in McHenry County, Illinois, United States. The population was 2,194 at the 2000 census. As of 2010, the population dropped to 2,083.",what county is oakwood hills illinois in
"<dbpedia:Pistakee_Highlands,_Illinois>","Pistakee Highlands, Illinois","Pistakee Highlands is a census-designated place (CDP) in McHenry County, Illinois, United States. It consists primarily of an unincorporated area of McHenry County adjoining Pistakee Bay, within the McHenry post office, and is located just northeast of Johnsburg. The population was 3,454 at the 2010 census.",what county is pistakee highlands in
"<dbpedia:Richmond,_Illinois>","Richmond, Illinois","Richmond is a village in McHenry County, Illinois, United States, 44 miles south-southwest of Milwaukee, Wisconsin and 55 miles northwest of Chicago. The population was 1,901 at the 2010 census.",where is richmond illinois
"<dbpedia:Prairie_Grove,_Illinois>","Prairie Grove, Illinois","Prairie Grove is a village in McHenry County, Illinois, United States, first incorporated in 1973. The population was 1,904 at the 2010 census. Prairie Grove's schools and main social and economic life are shared with the city of Crystal Lake.",what county is prairie grove illinois in
"<dbpedia:Ringwood,_Illinois>","Ringwood, Illinois","Ringwood is a village in McHenry County, Illinois, United states. The population was 836 at the 2010 census.",where is ringwood il
"<dbpedia:McHenry,_Illinois>","McHenry, Illinois","McHenry is a city in McHenry County, Illinois, United States.  The 2010 U.S. census reported its population at 26,992. McHenry was at one time the county seat of McHenry County, which once included adjoining Lake County to the east.",what county is mchenry illinois in
"<dbpedia:Trout_Valley,_Illinois>","Trout Valley, Illinois","Trout Valley is a village in McHenry County, Illinois, United States. It was incorporated as a village on 19 March 1996. At the 2010 census, the population was at 537.","what county is trout valley, il"
"<dbpedia:Crystal_Lake,_Illinois>","Crystal Lake, Illinois","Crystal Lake is located in southeastern McHenry County in the northeastern part of the US state of Illinois. It is named after Crystal Lake, a lake located 1.6 miles (2.6 km) west-southwest of downtown Crystal Lake.  Crystal Lake is about 45 miles northwest of Chicago. The population was 38,000 at the 2000 census, but in 2010 the population was 40,743. Crystal Lake is the largest city in McHenry County, part of the Chicago metropolitan area.",where is crystal lake illinois
"<dbpedia:Union,_Illinois>","Union, Illinois","Union is a village in McHenry County, Illinois, United States. The population was 580 at the 2010 census, up from 576 in 2000.",what county is union il in
"<dbpedia:Anchor,_Illinois>","Anchor, Illinois","Anchor is a village in McLean County, Illinois, United States. The population was 146 at the 2010 census. It is part of the Bloomington–Normal Metropolitan Statistical Area.","what county is anchor, illinois in"
"<dbpedia:Spring_Grove,_Illinois>","Spring Grove, Illinois","Spring Grove is a village in McHenry County, Illinois, United States. The population was 5,778 according to the 2010 census, up from 5,303 in 2005 and 3,880 in 2000. It is also home to Chain O'Lakes State Park.The current village president is Mark Eisenberg.The first tower grain silo was built in Spring Grove in 1873.",what county is spring grove il in
"<dbpedia:Carlock,_Illinois>","Carlock, Illinois","Carlock is a village in McLean County, Illinois, United States. The population was 552 at the 2010 census. It is part of the Bloomington–Normal Metropolitan Statistical Area.",where is carlock
