_id,title,text,query
<dbpedia:Tours>,Tours,"Tours (French pronunciation: ​[tuʁ]) is a city in central France, the capital of the Indre-et-Loire department.It stands on the lower reaches of the river Loire, between Orléans and the Atlantic coast. Touraine, the region around Tours, is known for its wines, the alleged perfection (as perceived by some speakers) of its local spoken French, and the Battle of Tours in 732. It is also the site of the Paris–Tours road bicycle race.","where is tour, france"
<dbpedia:Ullr>,Ullr,"In early Germanic paganism,  *Wulþuz ""\glory""; Old Norse Ullr) appears to have been a major god, or an  epithet of an important god, in prehistoric times.The term wolþu- ""glory"", possibly in reference to the god, is attested on the 3rd century Thorsberg chape (as owlþu-), and there are many placenames in Ullr and a related name, Ullinn, but medieval Icelandic sources have only sparse material on the god Ullr. The medieval Norse word was Latinized as Ollerus. The Modern Icelandic form is Ullur.",who is ullr
<dbpedia:University_of_Washington>,University of Washington,"The University of Washington, commonly referred to as Washington or informally U-Dub, or locally as UW is a public flagship research university in Seattle, Washington, United States. Founded in 1861, UW is one of the oldest universities on the West Coast and features one of the most highly regarded medical schools in the world.The university has three campuses: the primary and largest in the University District of Seattle and two others in Tacoma and Bothell.",where is university of washington located
<dbpedia:Universalism>,Universalism,"Universalism is a religious, theological, and philosophical concept with universal application or applicability. Universalist doctrines consider all people in their formation.In terms of religion, in a broad sense, universalism claims that religion is a universal human quality. This can be contrasted with non-universalist religions.",definition of universalism
<dbpedia:Foreign_relations_of_Uzbekistan>,Foreign relations of Uzbekistan,"Uzbekistan joined the Commonwealth of Independent States in December 1991. However, it is opposed to reintegration and withdrew from the CIS collective security arrangement in 1999. Since that time, Uzbekistan has participated in the CIS peacekeeping force in Tajikistan and in United Nations-organized groups to help resolve the Tajik and Afghan conflicts, both of which it sees as posing threats to its own stability. Uzbekistan is an active supporter of U.S.",when did uzbekistan join the cais
<dbpedia:User_Datagram_Protocol>,User Datagram Protocol,"The User Datagram Protocol (UDP) is one of the core members of the Internet protocol suite. The protocol was designed by David P. Reed in 1980 and formally defined in RFC 768.UDP uses a simple connectionless transmission model with a minimum of protocol mechanism. It has no handshaking dialogues, and thus exposes any unreliability of the underlying network protocol to the user's program. There is no guarantee of delivery, ordering, or duplicate protection.",what is udp udp
<dbpedia:Uruguay>,Uruguay,"Uruguay (/ˈjʊərəɡwaɪ/; Spanish: [uɾuˈɣwai]), officially the Eastern Republic of Uruguay (Spanish: República Oriental del Uruguay), is a country in the southeastern region of South America. It is bordered by Argentina to its west and Brazil to its north and east, with the Atlantic Ocean to the south and southeast. Uruguay is home to 3.3 million people, of whom 1.8 million live in the metropolitan area of its capital and largest city, Montevideo.",where is uruguay located
<dbpedia:Útgarðar>,Útgarðar,"In Norse mythology, Útgarðar (literal meaning:  ""Outyards""; plural of Útgarðr; the word can be anglicized to Utgard, Utgardar and in other ways) surrounded a stronghold of the giants.  They are associated with Útgarða-Loki, a great and devious giant featured in one of the myths concerning Thor and the other Loki who compete in rigged competitions held in the Outyards.",what is the utgarar
<dbpedia:University_of_Oslo>,University of Oslo,"The University of Oslo (Norwegian: Universitetet i Oslo), until 1939 named the Royal Frederick University (Norwegian: Det Kongelige Frederiks Universitet), is the oldest, largest and most prestigious university in Norway, located in the Norwegian capital of Oslo. The university is recognized as one of Northern Europe's most prestigious universities.",largest university in norway
<dbpedia:Umeå_University>,Umeå University,"Umeå University (Swedish: Umeå universitet) is a university in Umeå in the mid-northern region of Sweden. The university was founded in 1965 and is the fifth oldest within Sweden's present borders.As of 2013, Umeå University has over 32,000 registered students (approximately 16,000 full-time students), including those at the postgraduate and doctoral level.",where is ume
<dbpedia:United_Nations>,United Nations,"The United Nations (UN) is an intergovernmental organization to promote international co-operation. A replacement for the ineffective League of Nations, the organization was  established on 24 October 1945 after World War II in order to prevent another such conflict. At its founding, the UN had 51 member states; there are now 193. The headquarters of the United Nations is in Manhattan, New York City, and experiences extraterritoriality.",the number of united nations members
<dbpedia:United_States_Congress>,United States Congress,"The United States Congress is the bicameral legislature of the federal government of the United States consisting of two houses: the Senate and the House of Representatives. The Congress meets in the Capitol in Washington, D.C. Both senators and representatives are chosen through direct election, though vacancies in the Senate may be filled by a gubernatorial appointment.",what are the two main houses of the united states congress?
<dbpedia:Geography_of_the_United_States>,Geography of the United States,"The term ""United States"", when used in the geographical sense,is the contiguous United States, the state of Alaska, the island state of Hawaii, the five insular territories of Puerto Rico, Northern Mariana Islands, U.S. Virgin Islands, Guam, and American Samoa, and minor outlying possessions. The United States shares land borders with Canada and Mexico and maritime (water) borders with Russia, Cuba, and the Bahamas in addition to Canada and Mexico.",where are the us mainland islands
<dbpedia:Military_of_Uruguay>,Military of Uruguay,"The Armed Forces of Uruguay (Fuerzas armadas del Uruguay or FF.AA. del Uruguay) consist of an army, navy, and air force. These three branches are constitutionally subordinate to the president through the Minister of Defense. By offering early retirement incentives, the government has trimmed the armed forces to about 16.800 for the army; 6.000 for the navy; and 3.000 for the air force. As of February 2003, Uruguay has more than 2.500 soldiers deployed on 12 UN Peacekeeping missions.",what armed forces do they have uruguay
<dbpedia:Tel_Aviv>,Tel Aviv,"Tel Aviv (Hebrew: תל־אביב‎, Arabic: تل أبيب‎) or Tel Aviv-Yafo (Hebrew: תל אביב-יפו,‎) is the second most populous city in Israel after Jerusalem. The city has a population of 426,138 and a land area of 52 square kilometres (20 sq mi). Tel Aviv forms part of the Tel Aviv Metropolitan Area, also known as Gush Dan, which constitutes Israel's largest metropolitan area and has 3,464,100 residents, 42% of the country's population.",who is the tel aviv
<dbpedia:Unitarian_Universalist_Association>,Unitarian Universalist Association,"Unitarian Universalist Association (UUA) is a liberal religious association of Unitarian Universalist congregations formed by the consolidation in 1961 of the American Unitarian Association and the Universalist Church of America. Both of these predecessor organizations began as Christian denominations of the Unitarian and Universalist varieties respectively. However, modern Unitarian Universalists see themselves as a separate religion with its own beliefs and affinities.",what is uaa
<dbpedia:Communications_in_the_United_States>,Communications in the United States,The primary regulator of communications in the United States is the Federal Communications Commission.  It closely regulates all of the industries mentioned below with the exception of newspapers and the Internet service provider industry.,is there a federal communication commission
<dbpedia:Undead>,Undead,"An undead is a being in mythology, legend or fiction that is deceased but behaves as if alive. A common example is a corpse re-animated by supernatural forces by the application of the deceased's own life force or that of another being (such as a demon). Undead may be incorporeal like ghosts, or corporeal like vampires and zombies.",who is an undead
<dbpedia:Transportation_in_the_United_States>,Transportation in the United States,"Transportation in the United States is facilitated by road, air, rail, and waterways (via boats).  The vast majority of passenger travel occurs by automobile for shorter distances, and airplane or railroad for some people, for longer distances. In descending order, most cargoes travel by railroad, truck, pipeline, or boat; air shipping is typically used only for perishables and premium express shipments.",what is transportation in the united states?
<dbpedia:Standard_of_living_in_the_United_States>,Standard of living in the United States,"The standard of living in the United States is one of the top 20 in the world by the standards economists use as measures of standards of living. Per capita income is high but also less evenly distributed than in most other developed countries; as a result, the United States fares particularly well in measures of average material well being that do not place weight on equality aspects.",what's the average cost per capita
<dbpedia:Germanic_umlaut>,Germanic umlaut,"Germanic umlaut (also i-umlaut or i-mutation) is a type of linguistic umlaut in which a back vowel changes to the associated front vowel (fronting) or a front vowel becomes closer to /i/ (raising) when the following syllable contains /i/, /iː/, or /j/. This process took place separately in the various Germanic languages starting around 450 or 500 AD, and affected all of the early languages except for Gothic.",what is an umlaut
<dbpedia:Uppsala_University>,Uppsala University,"Uppsala University (Swedish: Uppsala universitet) is a research university in Uppsala, Sweden, and is the oldest university in Sweden and all of the Nordic countries, founded in 1477. It ranks among the best universities in Northern Europe and in international rankings. The university uses ""Gratiae veritas naturae"" as motto and embraces natural sciences.",where is uppsala university
<dbpedia:Armed_Forces_of_the_Republic_of_Uzbekistan>,Armed Forces of the Republic of Uzbekistan,"The Armed Forces of the Republic of Uzbekistan (Uzbek: Oʻzbekiston Respublikasi Qurolli Kuchlari), is the name of the unified armed forces of Uzbekistan, consisting of a Ground force, Air and Air Defense forces, National guard  and a Frontier service. They are reported to be the largest in Central Asia.",what is the armed forces of uzbekistan
<dbpedia:Economy_of_Uzbekistan>,Economy of Uzbekistan,"Since gaining independence, the Government of Uzbekistan has stated that it is committed to a gradual transition to a market-based economy. The progress with economic policy reforms has been a cautious one, but cumulatively Uzbekistan has shown respectable achievements. The government is yet to eliminate the gap between the black market and official exchange rates by successfully introducing convertibility of the national currency.",why is uzbekistan in a market economy
<dbpedia:Tartu>,Tartu,"Tartu (Estonian pronunciation: [ˈtɑrtˑˈtu]) is the second largest city of Estonia, following Estonia's political and financial capital Tallinn, Tartu is often considered the intellectual centre of the country, especially since it is home to the nation's oldest and most renowned university, the University of Tartu. The city also houses the Supreme Court of Estonia and the Ministry of Education and Research.",where is tartu estonia
<dbpedia:List_of_metro_systems>,List of metro systems,"This list of metro systems includes electrified rapid transit train systems worldwide. In some cases, metro systems are referred to as subways, U-Bahns or undergrounds. As of October 2014, 148 cities in 55 countries around the world host the approximately 160 metro systems that are listed here.",how many subway stations are there
<dbpedia:Universal_Declaration_of_Human_Rights>,Universal Declaration of Human Rights,"The Universal Declaration of Human Rights (UDHR) is a declaration adopted by the United Nations General Assembly on 10 December 1948 at the Palais de Chaillot, Paris. The Declaration arose directly from the experience of the Second World War and represents the first global expression of rights to which all human beings are inherently entitled.",universal declaration of human rights definition
<dbpedia:United_States_Declaration_of_Independence>,United States Declaration of Independence,"The Declaration of Independence is the statement adopted by the Continental Congress meeting at Philadelphia, Pennsylvania on July 4, 1776, which announced that the thirteen American colonies, then at war with Great Britain, regarded themselves as thirteen newly independent sovereign states, and no longer a part of the British Empire. Instead they formed a new nation—the United States of America. John Adams was a leader in pushing for independence, which was unanimously approved on July 2.",what was the declaration of independence
<dbpedia:Hainish_Cycle>,Hainish Cycle,"The Hainish Cycle consists of a number of science fiction novels and stories by Ursula K. Le Guin.  It is set in an alternate history/future history in which civilizations of human beings on a number of nearby stars, including Terra (Earth), are contacting each other for the first time and establishing diplomatic relations, setting up a confederacy under the guidance of the oldest of the human worlds, peaceful Hain.",what is the hainish cycle
<dbpedia:Member_states_of_the_United_Nations>,Member states of the United Nations,"There are 193 United Nations (UN) member states, and each of them is a member of the United Nations General Assembly.The criteria for admission of new members are set out in the United Nations Charter, Chapter II, Article 4: Membership in the United Nations is open to all other peace-loving states which accept the obligations contained in the present Charter and, in the judgment of the Organization, are able and willing to carry out these obligations.",how many members of the united nations is there
<dbpedia:Ty_Cobb>,Ty Cobb,"Tyrus Raymond ""Ty"" Cobb (December 18, 1886 – July 17, 1961), nicknamed ""The Georgia Peach,"" was an American Major League Baseball (MLB) outfielder. He was born in rural Narrows, Georgia. Cobb spent 22 seasons with the Detroit Tigers, the last six as the team's player-manager, and finished his career with the Philadelphia Athletics. In 1936 Cobb received the most votes of any player on the inaugural Baseball Hall of Fame ballot, receiving 222 out of a possible 226 votes.",where was ty cobb born
<dbpedia:Uzbekistan>,Uzbekistan,"Uzbekistan (US /ʊz.ˈbɛk.ɪ.ˌstæn/, UK /ʊz.ˌbɛk.ɪ.ˈstɑːn/), officially the Republic of Uzbekistan (Uzbek: Oʻzbekiston Respublikasi/Ўзбекистон Республикаси), is a doubly landlocked country in Central Asia. It is a unitary, constitutional, presidential republic, comprising 12 provinces, 1 autonomous republic, and 1 capital city.",where is uzbekistan?
<dbpedia:List_of_political_parties_in_the_United_States>,List of political parties in the United States,"This is a list of political parties in the United States, both past and present.",list of political parties
<dbpedia:United_Kingdom>,United Kingdom,"The United Kingdom of Great Britain and Northern Ireland, commonly known as the United Kingdom (UK) or Britain, is a sovereign state in Europe. Lying off the north-western coast of the European mainland, the country includes the island of Great Britain—a term also applied loosely to refer to the whole country—the north-eastern part of the island of Ireland and many smaller islands.",what is the uk called
<dbpedia:Union_for_Europe_of_the_Nations>,Union for Europe of the Nations,Union for Europe of the Nations (UEN) was a national–conservativeand Eurosceptic political group of the European Parliament active between 1999 and 2009.,what is en
<dbpedia:Ugo_Nespolo>,Ugo Nespolo,"Ugo Nespolo (born 29 August 1941 in Mosso, Biella) is an Italian painter and sculptor, particularly known for his experimental films, his applied arts works and his artistic collaborations in advertising, theatre and literature.",who is ugo nespolo?
<dbpedia:Urea_cycle>,Urea cycle,"The urea cycle (also known as the ornithine cycle) is a cycle of biochemical reactions occurring in many animals that produces urea ((NH2)2CO) from ammonia (NH3). This cycle was the first metabolic cycle discovered (Hans Krebs and Kurt Henseleit, 1932), five years before the discovery of the TCA cycle. In mammals, the urea cycle takes place primarily in the liver, and to a lesser extent in the kidney.",what is urea in humans
<dbpedia:United_Nations_Framework_Convention_on_Climate_Change>,United Nations Framework Convention on Climate Change,"The United Nations Framework Convention on Climate Change (UNFCCC) is an international environmental treaty (currently the only international climate policy venue with broad legitimacy, due in part to its virtually universal membership) negotiated at the United Nations Conference on Environment and Development (UNCED), informally known as the Earth Summit, held in Rio de Janeiro from 3 to 14 June 1992.",where does unccc come from
<dbpedia:USS_Indianapolis_(CA-35)>,USS Indianapolis (CA-35),"USS Indianapolis (CA-35) was a Portland class heavy cruiser of the United States Navy. She was named for the city of Indianapolis, Indiana.She was flagship for Admiral Raymond Spruance while he commanded the Fifth Fleet in battles across the Central Pacific. Her sinking led to the greatest single loss of life at sea in the history of the U.S. Navy.",uss indianapolis ship name
<dbpedia:University_of_Oxford>,University of Oxford,"The University of Oxford (informally Oxford University or simply Oxford) is a collegiate research university located in Oxford, England. While having no known date of foundation, there is evidence of teaching as far back as 1096, making it the oldest university in the English-speaking world and the world's second-oldest surviving university. It grew rapidly from 1167 when Henry II banned English students from attending the University of Paris.",where is oxford located
<dbpedia:USS_John_C._Stennis>,USS John C. Stennis,"USS John C. Stennis (CVN-74) is the seventh Nimitz-class nuclear-powered supercarrier in the United States Navy, named for Senator John C. Stennis of Mississippi. She was commissioned on 9 December 1995. Her home port is Bremerton, Washington.",what is the uss john c. stennis
<dbpedia:Thomas_Mifflin>,Thomas Mifflin,"Thomas Mifflin (January 10, 1744 – January 20, 1800) was an American merchant and politician from Philadelphia, Pennsylvania. He was a major general in the Continental Army and the 1st and 3rd Quartermaster General during the American Revolution, a member of the Pennsylvania Provincial Assembly, a Continental Congressman from Pennsylvania, President of the Continental Congress, and a delegate to the Constitutional Convention of 1787.",who was thomas mifflin
<dbpedia:Uterus>,Uterus,"The uterus (from Latin ""uterus"", plural uteri) or womb is a major female hormone-responsive reproductive sex organ of most mammals, including humans. One end, the cervix, opens into the vagina, while the other is connected to one or both fallopian tubes, depending on the species. It is within the uterus that the fetus develops during gestation, usually developing completely in placental mammals such as humans and partially in marsupials such as kangaroos and opossums.",what are reproductive organs of mammals called
<dbpedia:Unix_shell>,Unix shell,"A Unix shell is a command-line interpreter or shell that provides a traditional user interface for the Unix operating system and for Unix-like systems. Users direct the operation of the computer by entering commands as text for a command line interpreter to execute, or by creating text scripts of one or more such commands.",what is a x86 shell
<dbpedia:University_of_Pennsylvania>,University of Pennsylvania,"The University of Pennsylvania (commonly referred to as Penn or UPenn) is a private, Ivy League, research university located in Philadelphia. Incorporated as The Trustees of the University of Pennsylvania, Penn is one of 14 founding members of the Association of American Universities and one of the nine original Colonial Colleges.",where is penn university
<dbpedia:Economy_of_the_United_Kingdom>,Economy of the United Kingdom,"The United Kingdom has the fifth-largest national economy (and second-largest in Europe) measured by nominal GDP and tenth-largest in the world (and third-largest in Europe) measured by purchasing power parity (PPP). In 2014 the UK was the ninth-largest exporter in the world and the fifth-largest importer, and had the second largest stock of inward foreign direct investment and the second-largest stock of outward foreign direct investment. The UK is one of the world's most globalised economies.",what is the uk economy
<dbpedia:Economy_of_Uruguay>,Economy of Uruguay,"The economy of Uruguay is characterized by an export-oriented agricultural sector and a well-educated work force, along with high levels of social spending. After averaging growth of 5% annually during 1996–98, in 1999–2002 the economy suffered a major downturn, stemming largely from the spillover effects of the economic problems of its large neighbors, Argentina and Brazil.",what is the economic situation in uruguay
<dbpedia:Unicode_and_HTML>,Unicode and HTML,Web pages authored using hypertext markup language (HTML) may contain multilingual text represented with the Unicode universal character set.,what is a html page and html
<dbpedia:Ultraviolet>,Ultraviolet,"Ultraviolet (UV) light is an electromagnetic radiation with a wavelength from 400 nm to 100 nm, shorter than that of visible light but longer than X-rays. Though usually invisible, under some conditions children and young adults can see ultraviolet down to wavelengths of about 310 nm, and people with aphakia (missing lens) can also see some UV wavelengths.",what is uv light wavelength
<dbpedia:Economy_of_the_United_Arab_Emirates>,Economy of the United Arab Emirates,"The economy of the United Arab Emirates is the second largest in the Arab world (after Saudi Arabia), with a gross domestic product (GDP) of $570 billion (AED2.1 trillion) in 2014. The United Arab Emirates has been successfully diversifying its economy. 71% of UAE's total GDP comes from non-oil sectors.Although UAE has the most diversified economy in the GCC, the UAE's economy remains extremely reliant on oil. With the exception of Dubai, most of the UAE is dependent on oil revenues.",what is emirate economy
<dbpedia:Urea>,Urea,"Urea or carbamide is an organic compound with the chemical formula CO(NH2)2. The molecule has two —NH2 groups joined by a carbonyl (C=O) functional group.Urea serves an important role in the metabolism of nitrogen-containing compounds by animals, and is the main nitrogen-containing substance in the urine of mammals. It is colorless, odorless solid, highly soluble in water, and practically non-toxic (LD50 is 15 g/kg for rats).  Dissolved in water, it is neither acidic nor alkaline.",what is urea
<dbpedia:Uyghurs>,Uyghurs,"The Uyghurs /ˈwiːɡər/ (Uyghur: ئۇيغۇر‎, ULY: Uyghur ; [ʔʊjˈʁʊː]; Old Turkic: 10px10px10px10px; Chinese: 维吾尔族; pinyin: Wéiwúěr zú) are a Turkic ethnic group living in Eastern and Central Asia. Today, Uyghurs live primarily in the Xinjiang Uyghur Autonomous Region in China, where they are one of 55 officially recognized ethnic minorities.An estimated 80% of Xinjiang's Uyghurs live in the southwestern portion of the region, the Tarim Basin.",what ethnicity are the uyghurs
<dbpedia:Ucayali_River>,Ucayali River,"The Ucayali River (Spanish: Río Ucayali, IPA: [ˈri.o ukaˈʝali]) arises about 110 km (68 mi) north of Lake Titicaca, in the Arequipa region of Peru. The Amazon River takes its name close to Nauta city (100 km upstream/south of Iquitos), at the confluence of the Marañón and Ucayali rivers. The Ucayali becomes a major tributary of the Amazon River. Navigation was blocked by lengthy sections of rapids.",where is the ucayali river located
<dbpedia:Universe>,Universe,"The Universe is all of time and space and its contents. The Universe includes planets, stars, galaxies, the contents of intergalactic space, the smallest subatomic particles, and all matter and energy.  The observable universe is about 28 billion parsecs (91 billion light-years) in diameter at the present time. The size of the whole Universe is not known and may be infinite.",what is the universe
<dbpedia:Economy_of_Ukraine>,Economy of Ukraine,"The economy of Ukraine is an emerging free market, with a gross domestic product that fell sharply for the first 10 years of its independence from the Soviet Union, then experienced rapid growth from 2000 until 2008.  A deep recession during the 1990s included hyperinflation and a fall in economic output to less than half of that achieved before independence.  GDP growth was first registered in 2000, and continued for eight years.",how is ukraine's economy
