_id,title,text,query
<dbpedia:Creature_of_statute>,Creature of statute,"Creatures of statute (also known as creatures of the state) are legal entities, such as corporations, created by statute. Creatures of statute may include municipalities and other artificial legal entities or relationships.",what is the definition of creatures of statute
<dbpedia:Causantín_mac_Cináeda>,Causantín mac Cináeda,"Causantín or Constantín mac Cináeda (in Modern Gaelic, Còiseam mac Choinnich; died 877) was a king of the Picts. He is often known as Constantine I, in reference to his place in modern lists of kings of Scots, though contemporary sources described Causantín only as a Pictish king. A son of Cináed mac Ailpín ""\Kenneth MacAlpin""), he succeeded his uncle Domnall mac Ailpín as Pictish king following the latter's death on 13 April 862.",who was causantin
"<dbpedia:Chapter_11,_Title_11,_United_States_Code>","Chapter 11, Title 11, United States Code","Chapter 11 is a chapter of Title 11 of the United States Bankruptcy Code, which permits reorganization under the bankruptcy laws of the United States. Chapter 11 bankruptcy is available to every business, whether organized as a corporation, partnership or sole proprietorship, and to individuals, although it is most prominently used by corporate entities.",chapter 11 meaning
<dbpedia:General_Conference_on_Weights_and_Measures>,General Conference on Weights and Measures,The General Conference on Weights and Measures (French: Conférence générale des poids et mesures - CGPM) is the senior of the three Inter-governmental organizations established in 1875 under the terms of the Metre Convention (French: Convention du Mètre) to represent the interests of member states.,gcpm definition
<dbpedia:Caste>,Caste,"Caste is a form of social stratification characterized by endogamy, non-commensality and hereditary occupations. According to Human Rights Watch and UNICEF, caste discrimination affects an estimated 250 million people worldwide.A paradigmatic, ethnographic example is the division of Indian society into social groups. Historically, the caste system in India has consisted of thousands of endogamous groups called Jatis or Quoms and Biradaris (among Muslims).",what is caste discrimination
<dbpedia:Hypothetical_types_of_biochemistry>,Hypothetical types of biochemistry,"Hypothetical types of biochemistry are forms of biochemistry speculated to be scientifically viable but not proven to exist at this time. The kinds of living beings currently known on Earth all use carbon compounds for basic structural and metabolic functions, water as a solvent and DNA or RNA to define and control their form.",hypothetical biochemistry definition
<dbpedia:Cookie>,Cookie,"In the United States and Canada a cookie is a small, flat, sweet baked treat, usually containing flour, eggs, sugar, and either butter, cooking oil or another oil or fat, and often including ingredients such as raisins, oats, chocolate chips or nuts. Cookies may be mass-produced, made in small bakeries or home-made. Cookie variants include using two thin cookies with a creme filling (e.g., Oreos) and dipping the cookie in chocolate or another sweet coating.",what is a cookie
<dbpedia:Centimetre–gram–second_system_of_units>,Centimetre–gram–second system of units,"The centimetre–gram–second system of units (abbreviated CGS or cgs) is a variant of the metric system based on the centimetre as the unit of length, the gram as the unit of mass, and the second as the unit of time.",what is the cgs
<dbpedia:Christopher_Guest>,Christopher Guest,"Christopher Haden-Guest, 5th Baron Haden-Guest (born February 5, 1948), better known as Christopher Guest, is an English-American screenwriter, composer, musician, director, actor, and comedian who holds dual British and American citizenship. He is most widely known in Hollywood for having written, directed and starred in several improvisational ""mockumentary"" films featuring an ensemble cast.",when was christopher guest born
<dbpedia:Complementary_DNA>,Complementary DNA,"In genetics, complementary DNA (cDNA) is double-stranded DNA synthesized from a messenger RNA (mRNA) template in a reaction catalysed by the enzyme reverse transcriptase. cDNA is often used to clone eukaryotic genes in prokaryotes.  When scientists want to express a specific protein in a cell that does not normally express that protein (i.e., heterologous expression), they will transfer the cDNA that codes for the protein to the recipient cell.",what is cdna used for
<dbpedia:Carol_Kane>,Carol Kane,"Carolyn Laurie ""Carol"" Kane (born June 18, 1952) is an American stage, screen and television actress. She became known in the 1970s in films such as Hester Street (for which she received an Academy Award nomination) and Annie Hall. She appeared on the television series Taxi in the early 1980s, as the wife of Latka, the character played by Andy Kaufman, winning two Emmy Awards for her work.",who played latka in the movie taxi
<dbpedia:Comet_Hale–Bopp>,Comet Hale–Bopp,"Comet Hale–Bopp (formally designated C/1995 O1) was perhaps the most widely observed comet of the 20th century and one of the brightest seen for many decades. It was visible to the naked eye for a record 18 months, twice as long as the previous record holder, the Great Comet of 1811.Hale–Bopp was discovered on July 23, 1995, at a great distance from the Sun, raising expectations that the comet would brighten considerably by the time it passed close to Earth.",when was the first comet in the world?
<dbpedia:Chris_Sarandon>,Chris Sarandon,"Christopher ""Chris"" Sarandon, Jr. (/səˈrændən/; born July 24, 1942) is an American actor and voice actor who is best known for playing Prince Humperdinck in the film The Princess Bride, the vampire Jerry Dandrige in Fright Night and Detective Mike Norris in the first entry of the Child's Play series, and for providing the speaking voice of Jack Skellington from The Nightmare Before Christmas.",who sings j mellington's voice in the princess bride?
<dbpedia:Constantine_II_of_Scotland>,Constantine II of Scotland,"Constantine, son of Áed (Medieval Gaelic: Constantín mac Áeda; Modern Gaelic: Còiseam mac Aoidh, known in most modern regnal lists as Constantine II; before 879 – 952) was an early King of Scotland, known then by the Gaelic name Alba. The Kingdom of Alba, a name which first appears in Constantine's lifetime, was in northern Great Britain. The core of the kingdom was formed by the lands around the River Tay.",where is konstantin ii from
<dbpedia:Cardiology_diagnostic_tests_and_procedures>,Cardiology diagnostic tests and procedures,"The diagnostic tests in cardiology are methods of identifying heart conditions associated with healthy vs. unhealthy, pathologic, heart function.",dtc labs
<dbpedia:Creation_myth>,Creation myth,"A creation myth is a symbolic narrative of how the world began and how people first came to inhabit it. While in popular usage the term myth often refers to false or fanciful stories, formally, it does not imply falsehood. Cultures generally regard their creation myths as true. In the society in which it is told, a creation myth is usually regarded as conveying profound truths, metaphorically, symbolically and sometimes in a historical or literal sense.",a myth created by how people first lived
<dbpedia:Carlo_Collodi>,Carlo Collodi,"Carlo Lorenzini, better known by the pen name Carlo Collodi (Italian pronunciation: [ˈkarlo kolˈlɔːdi]; 24 November 1826 – 26 October 1890), was an  Italian children's writer known for the world-renowned fairy tale novel The Adventures of Pinocchio.",who is carlos colodi
<dbpedia:Conventional_warfare>,Conventional warfare,"Conventional warfare is a form of warfare conducted by using conventional weapons and battlefield tactics between two or more states in open confrontation. The forces on each side are well-defined, and fight using weapons that primarily target the opponent's military.",what is a conventional military
<dbpedia:Chicago>,Chicago,"Chicago (/ʃɨˈkɑːɡoʊ/ or /ʃɨˈkɔːɡoʊ/) is the third most populous city in the United States. With over 2.7 million residents, it is the most populous city in the state of Illinois and the Midwest. The Chicago metropolitan area, often referred to as Chicagoland, is home to nearly 10 million people and is the third-largest in the U.S.",how many people live in chicago
<dbpedia:Churnsike_Lodge>,Churnsike Lodge,"Churnsike Lodge (grid reference NY664771) was an early Victorian hunting lodge situated in the parish of Greystead,  West Northumberland, England. It was built in 1850 as a shooting lodge and was part of the Hesleyside estate (Hesleyside house is situated in the North Tyne valley near Bellingham). When the estate was sold in 1889, Churnsike Lodge was purchased by the Chesters Estate (near Hexham, Northumberland).",where is churnsike lodge
<dbpedia:Commonwealth_Heads_of_Government_Meeting>,Commonwealth Heads of Government Meeting,"The Commonwealth Heads of Government Meeting  (CHOGM; /ˈtʃɒɡᵊm/ or /ˈtʃoʊm/) is a biennial summit meeting of the heads of government from all Commonwealth nations.  Every two years the meeting is held in a different member state, and is chaired by that nation's respective Prime Minister or President, who becomes the Commonwealth Chairman-in-Office.",chogm definition
<dbpedia:Cricket_World_Cup>,Cricket World Cup,"The ICC Cricket World Cup is the international championship of One Day International (ODI) cricket. The event is organised by the sport's governing body, the International Cricket Council (ICC), with preliminary qualification rounds leading up to a finals tournament held every four years.",what is a world cup
<dbpedia:Complaint>,Complaint,"In legal terminology, a complaint is any formal legal document that sets out the facts and legal reasons (see: cause of action) that the filing party or parties (the plaintiff(s)) believes are sufficient to support a claim against the party or parties against whom the claim is brought (the defendant(s)) that entitles the plaintiff(s) to a remedy (either money damages or injunctive relief).",what is a complaint
<dbpedia:Circumcision_and_law>,Circumcision and law,"There exist laws restricting or regulating circumcision, some dating back to ancient times.  In a number of modern states, circumcision is presumed to be legal, but under certain circumstances, more general laws, such as laws about assault or child custody, may sometimes be interpreted as applying to situations involving circumcision.  Some countries have placed restrictions on circumcision.",what are circumcision and laws
<dbpedia:Context_menu>,Context menu,"A context menu (also called contextual, shortcut, and popup or pop-up menu) is a menu in a graphical user interface (GUI) that appears upon user interaction, such as a right-click mouse operation. A context menu offers a limited set of choices that are available in the current state, or context, of the operating system or application. Usually the available choices are actions related to the selected object. From a technical point of view, such a context menu is a graphical control element.",define context menu
<dbpedia:Complexity>,Complexity,"There is no absolute definition of what complexity means; the only consensus among researchers is that there is no agreement about the specific definition of complexity. However, a characterization of what is complex is possible. Complexity is generally used to characterize something with many parts where those parts interact with each other in multiple ways.",what is a complex
<dbpedia:Cogito_ergo_sum>,Cogito ergo sum,"Cogito ergo sum is a Latin philosophical proposition by René Descartes usually translated into English as ""I think, therefore I am"". The phrase originally appeared in French as je pense, donc je suis in his Discourse on the Method, so as to reach a wider audience than Latin would have allowed. It appeared in Latin in his later Principles of Philosophy.",cogito ergo sum definition
<dbpedia:Cyberspace>,Cyberspace,"Cyberspace is ""the notional environment in which communication over computer networks occurs."" The word became popular in the 1990s when the uses of the Internet, networking, and digital communication were all growing dramatically and the term ""cyberspace"" was able to represent the many new ideas and phenomena that were emerging.The parent term of cyberspace is ""cybernetics"", derived from the Ancient Greek κυβερνήτης (kybernētēs, steersman, governor, pilot, or rudder), a word introduced by Norbert Wiener for his pioneering work in electronic communication and control science.As a social experience, individuals can interact, exchange ideas, share information, provide social support, conduct business, direct actions, create artistic media, play games, engage in political discussion, and so on, using this global network. @en <http://en.wikipedia.org/wiki/Cyberspace?oldid=679407961> .
<http://dbpedia.org/resource/Chemotaxis> <http://www.w3.org/2000/01/rdf-schema#comment> Chemotaxis (from chemo- + taxis) is the movement of an organism in response to a chemical stimulus. Somatic cells, bacteria, and other single-cell or multicellular organisms direct their movements according to certain chemicals in their environment. This is important for bacteria to find food (e.g., glucose) by swimming toward the highest concentration of food molecules, or to flee from poisons (e.g., phenol).",what is chemospace
<dbpedia:Class_(computer_programming)>,Class (computer programming),"In object-oriented programming, a class is an extensible program-code-template for creating objects, providing initial values for state (member variables) and implementations of behavior (member functions or methods).",what is a class based application
<dbpedia:Chauvinism>,Chauvinism,"Chauvinism, in its original meaning, is an exaggerated patriotism and a belligerent belief in national superiority and glory.According to legend, French soldier Nicolas Chauvin was badly wounded in the Napoleonic wars. He received a pension for his injuries but it was not enough to live on. After Napoleon abdicated, Chauvin was a fanatical Bonapartist despite the unpopularity of this view in Bourbon Restoration France.",chauvinism definition
<dbpedia:Coal_tar>,Coal tar,"Coal tar is a brown or black liquid of extremely high viscosity. Coal tar is among the by-products when coal is carbonized to make coke or gasified to make coal gas. Coal tars are complex and variable mixtures of phenols, polycyclic aromatic hydrocarbons (PAHs), and heterocyclic compounds.",is coal a chemical
<dbpedia:Cushitic_languages>,Cushitic languages,"The Cushitic languages are a branch of the Afro-Asiatic language family spoken primarily in the Horn of Africa (Somalia, Eritrea, Djibouti, and Ethiopia), as well as the Nile Valley (Sudan and Egypt), and parts of the African Great Lakes region (Tanzania and Kenya).",what are cushitic languages
<dbpedia:County_town>,County town,"A county town is a county's current or former administrative centre in the United Kingdom, Ireland, or Jamaica.  County towns are usually the location of administrative or judicial functions, or established over time as the de facto main town of a county.  The concept of a county town eventually became detached from its original meaning of where the county administration or county hall is based. In fact, many county towns are no longer part of ""their"" administrative county.",what is a county town
<dbpedia:CuteFTP>,CuteFTP,"CuteFTP is a series of FTP (file transfer) client applications Distributed and Supported by GlobalSCAPE since 1996, who later bought the rights to the software. Both a Windows-based or Mac-based interface were made for both home and professional use.CuteFTP is used to transfer files between computers and File Transfer Protocol (FTP) servers to publish web pages, download digital images, music, multi-media files and software, and transfer files of any size or type between home and office.",what is ftp server
<dbpedia:Christology>,Christology,"Christology (from Greek Χριστός Khristós and -λογία, -logia) is the field of study within Christian theology which is primarily concerned with the nature and person of Jesus as recorded in the canonical Gospels and the epistles of the New Testament. Primary considerations include the relationship of Jesus' nature and person with the nature and person of God the Father.",christology definition
<dbpedia:Crochet>,Crochet,"Crochet (English pronunciation: /kroʊˈʃeɪ/; French: [kʁɔʃɛ]) is a process of creating fabric by interlocking loops of yarn, thread, or strands of other materials using a crochet hook. The name is taken from the French word ""crochet"", meaning small hook. These are made of materials such as metal, wood, or plastic and are manufactured commercially and produced in artisan workshops.",definition of crochet
<dbpedia:Carme_(moon)>,Carme (moon),"Carme (/ˈkɑrmiː/ KAR-mee; Greek: Κάρμη) is a retrograde irregular satellite of Jupiter. It was discovered by Seth Barnes Nicholson at Mount Wilson Observatory in California in July 1938. It is named after the mythological Carme, mother by Zeus of Britomartis, a Cretan goddess.Carme did not receive its present name until 1975; before then, it was simply known as Jupiter XI.",who discovered the moon carme
<dbpedia:Computer_security>,Computer security,"Computer security, also known as cybersecurity or IT security, is the protection of information systems from theft or damage to the hardware, the software, and to the information on them, as well as from disruption or misdirection of the services they provide.",what is computer security
<dbpedia:Chaparral>,Chaparral,"Chaparral is a shrubland or heathland plant community found primarily in the U.S. state of California and in the northern portion of the Baja California Peninsula, Mexico. It is shaped by a Mediterranean climate (mild, wet winters and hot dry summers) and wildfire, featuring summer-drought-tolerant plants with hard sclerophyllous evergreen leaves, as contrasted with the associated soft-leaved, drought-deciduous, scrub community of coastal sage scrub, found below the chaparral biome.",is chaparral shrubland
<dbpedia:Called_to_Common_Mission>,Called to Common Mission,"Called to Common Mission is an agreement between The Episcopal Church and the Evangelical Lutheran Church in America (ELCA), establishing full communion between them. It was ratified by the ELCA in 1999, the ECUSA in 2000, after the narrow failure of a previous agreement. Its principal author on the Episcopal side was the Rev. Canon J. Robert Wright.  Under the agreement, they recognize the validity of each other's baptisms and ordinations.",what is called to common mission called to common mission
<dbpedia:Clipper>,Clipper,"A clipper was a very fast sailing ship of the middle third of the 19th century. They were fast, yachtlike vessels, with three masts and a square rig. They were generally narrow for their length, could carry limited bulk freight, small by later 19th century standards, and had a large total sail area. Clipper ships were mostly constructed in British and American shipyards, though France, Brazil, the Netherlands and other nations also produced some.",what is a clipper
<dbpedia:Electromagnetic_coil>,Electromagnetic coil,"An electromagnetic coil is an electrical conductor such as a wire in the shape of a coil, spiral or helix.  Electromagnetic coils are used in electrical engineering, in applications where electric currents interact with magnetic fields, in devices such as inductors, electromagnets, transformers, and sensor coils.",what is the magnetic coil
<dbpedia:Christian_mythology>,Christian mythology,Christian mythology is the body of myths associated with Christianity.,what is the christian mythology?
<dbpedia:Centillion>,Centillion,"One centillion is a number, which is equal to either 10303 or 10600, depending on the system used.",how many points are in a centillion?
<dbpedia:ColecoVision>,ColecoVision,"The ColecoVision is Coleco Industries' second-generation home video-game console which was released in August 1982. The ColecoVision offered near-arcade-quality graphics and gaming style along with the means to expand the system's basic hardware. Released with a catalog of 12 launch titles, with an additional 10 games announced for 1982, approximately 145 titles in total were published as ROM cartridges for the system between 1982 and 1984.",when was colecovision s
<dbpedia:Civil_Rights_Act>,Civil Rights Act,"Civil Rights Act may refer to several acts in the history of civil rights in the United States, including:",what is civil rights act
<dbpedia:Concentration>,Concentration,"In chemistry, concentration is the abundance of a constituent divided by the total volume of a mixture. Several types of mathematical description can be distinguished: mass concentration, molar concentration, number concentration, and volume concentration. The term concentration can be applied to any kind of chemical mixture, but most frequently it refers to solutes and solvents in solutions. The molar (amount) concentration has variants such as normal concentration and osmotic concentration.",what is the concentration in chemistry
<dbpedia:Chymotrypsin>,Chymotrypsin,"Chymotrypsin (EC 3.4.21.1, chymotrypsins A and B, alpha-chymar ophth, avazyme, chymar, chymotest, enzeon, quimar, quimotrase, alpha-chymar, alpha-chymotrypsin A, alpha-chymotrypsin) is a digestive enzyme component of pancreatic juice acting in the duodenum where it performs proteolysis, the breakdown of proteins and polypeptides.",what is chymotrypsin and what does it do
<dbpedia:The_Maritimes>,The Maritimes,"The Maritime provinces, also called the Maritimes or the Canadian Maritimes, is a region of Eastern Canada consisting of three provinces: New Brunswick, Nova Scotia, and Prince Edward Island. On the Atlantic coast, the Maritimes is often mentioned in conjunction with the northeastern province of Newfoundland and Labrador; together they represent Atlantic Canada.",what is a Maritime province
<dbpedia:Central_nervous_system>,Central nervous system,"The central nervous system (CNS) is the part of the nervous system consisting of the brain and spinal cord. The central nervous system is so named because it integrates information it receives from, and coordinates and influences the activity of, all parts of the bodies of bilaterally symmetric animals — that is, all multicellular animals except sponges and radially symmetric animals such as jellyfish — and it contains the majority of the nervous system.",what does the nervous system include
<dbpedia:CANDU_reactor>,CANDU reactor,"The CANDU (short for CANada Deuterium Uranium) reactor is a Canadian-invented, pressurized heavy water reactor used for generating electric power. The acronym refers to its deuterium-oxide (heavy water) moderator and its use of (originally, natural) uranium fuel.",what is candu nuclear power
<dbpedia:Constitution_of_Canada>,Constitution of Canada,"The Constitution of Canada  is the supreme law in Canada; the country's constitution is an amalgamation of codified acts and uncodified traditions and conventions. It is  one of the oldest working constitutions in the world, with a basis in the Magna Carta. The constitution outlines Canada's system of government, as well as the civil rights of all Canadian citizens and those in Canada.",canadian constitution what is it
<dbpedia:Cutter_Expansive_Classification>,Cutter Expansive Classification,The Cutter Expansive Classification system is a library classification system devised by Charles Ammi Cutter. The system was the basis for the top categories of the Library of Congress Classification.,who is cutter exponent
<dbpedia:Capability_Maturity_Model>,Capability Maturity Model,"The Capability Maturity Model (CMM) is a development model created after study of data collected from organizations that contracted with the U.S. Department of Defense, who funded the research.",what is cmm
<dbpedia:Cross_section_(physics)>,Cross section (physics),"The cross section is an effective area that quantifies the intrinsic likelihood of a scattering event when an incident beam strikes a target object, made of discrete particles. The cross section of a particle is the same as the cross section of a hard object, if the probabilities of hitting them with a ray are the same. It is typically denoted σ and measured in units of area.In scattering experiments, one is often interested in knowing how likely a given event occurs.",what is a cross section in physics
<dbpedia:Cem_Karaca>,Cem Karaca,"Muhtar Cem Karaca (April 5, 1945 – February 8, 2004), also called Cem Baba (Daddy Cem or Father Cem), was a prominent Turkish rock musician and one of the most important figures in the Anatolian rock movement. He is a graduate of Robert College.",who is cem
<dbpedia:Calista_Flockhart>,Calista Flockhart,"Calista Kay Flockhart (born November 11, 1964) is an American actress, known for playing the title role in the Fox television comedy-drama series Ally McBeal and for playing Kitty Walker McCallister on the ABC drama Brothers & Sisters. During her career she has received a Golden Globe Award, a Screen Actors Guild Award and three Emmy Award nominations.",who is caldista flockhart
