_id,title,text,query
<dbpedia:Metro_Manila>,Metro Manila,"Metropolitan Manila (Filipino: Kalakhang Maynila, Kamaynilaan), commonly known as Metro Manila, the National Capital Region (NCR) of the Philippines, is the seat of government and the most populous region of the country which is composed of Manila, the capital city of the country, Quezon City, the country's most populous city, the Municipality of Pateros, and the cities of Caloocan, Las Piñas, Makati, Malabon, Mandaluyong, Marikina, Muntinlupa, Navotas, Parañaque, Pasay, Pasig, San Juan, Taguig, and Valenzuela.The National Capital Region has a population of 7007118559750000000♠11,855,975, making it the most populous region in the Philippines, as well as the 7th most populous metropolitan area in Asia.",what region is manila
<dbpedia:List_of_waterfalls>,List of waterfalls,"This is a list of waterfalls of the world by continent. See also List of waterfalls by height, List of waterfalls by flow rate and List of waterfalls by type.",is a waterfall a continent
<dbpedia:Earth_Summit_2002>,Earth Summit 2002,"The World Summit on Sustainable Development, WSSD or ONG Earth Summit 2002 took place in Johannesburg, South Africa, from 26 August to 4 September 2002. It was convened to discuss sustainable development by the United Nations. WSSD gathered a number of leaders from  business and non-governmental organizations, 10 years after the first Earth Summit in Rio de Janeiro. (It was therefore also informally nicknamed \Rio+10\"".)""",what was the purpose of the world summit for sustainable development
<dbpedia:Lupang_Hinirang>,Lupang Hinirang,"Lupang Hinirang (Tagalog, “Chosen Land”) is the national anthem of the Philippines. Its music was composed in 1898 by Julian Felipe, and the lyrics were adapted from the Spanish poem Filipinas, written by José Palma in 1899.",who wrote the song lupang hinirang
<dbpedia:Commensalism>,Commensalism,"In ecology, commensalism is a class of relationships between two organisms where one organism benefits from the other without affecting it.",definition of commensalism
<dbpedia:Lew_Allen>,Lew Allen,"Lew Allen, Jr. (September 30, 1925 –  January 4, 2010) was a United States Air Force four-star General who served as the tenth Chief of Staff of the U.S. Air Force. As the Chief-of-Staff, Allen served as the senior uniformed Air Force officer, who was responsible for the organization, training, and equipping of 750,000 active duty Air Force, Air National Guard, Air Force Reserve, and civilian personal serving in the United States and overseas.",who is lew allen
<dbpedia:Thrust_fault>,Thrust fault,"A thrust fault is a type of fault, or break in the Earth's crust across which there has been relative movement, in which rocks of lower stratigraphic position are pushed up and over higher strata. They are often recognized because they place older rocks above younger. Thrust faults are the result of compressional forces.",what is thrust fault
<dbpedia:Peta->,Peta-,"Peta /ˈpɛ.tə/ is a decimal unit prefix in the metric system denoting multiplication by 1015 (1000000000000000). It was adopted as an SI prefix in the International System of Units in 1975, and has the symbol P.Peta is derived from the Greek πέντε, meaning ""five"". It denotes the fifth power of 1000 (10005).",what is a peta
<dbpedia:Peking_University>,Peking University,"Peking University  (abbreviated PKU and colloquially known by the Chinese as Běidà 北大; Chinese: 北京大学, pinyin: Běijīng Dàxué), is a major Chinese research university located in Beijing and a member of the C9 League. It is the first modern national university established in China, founded as the ""Imperial University of Peking"" in 1898 as a replacement of the ancient Taixue or Guozijian, or Imperial Academy.",where is peking university located
<dbpedia:Alexander_Alekhine>,Alexander Alekhine,"Alexander Aleksandrovich Alekhine (Russian: Алекса́ндр Алекса́ндрович Але́хин, pronounced [ɐlʲɪkˈsandr ɐlʲɪkˈsandrəvʲɪtɕ ɐˈlʲexʲɪn]; October 31 [O.S. October 19] 1892 – March 24, 1946) was a Russian chess grandmaster and the fourth World Chess Champion. He is widely considered one of the greatest chess players ever.By the age of 22, Alekhine was already among the strongest chess players in the world. During the 1920s, he won most of the tournaments in which he played.",who is alekhine
<dbpedia:Ted_Taylor_(physicist)>,Ted Taylor (physicist),"Theodore Brewster Taylor (July 11, 1925 – October 28, 2004) was a Mexican-born, American theoretical physicist and prominent nuclear weapon designer who later in life became a nuclear disarmament advocate.",when did ted taylor die
<dbpedia:Bureau_of_Labor_Statistics>,Bureau of Labor Statistics,"The Bureau of Labor Statistics (BLS) is a unit of the United States Department of Labor. It is the principal fact-finding agency for the U.S. government in the broad field of  labor economics and statistics and serves as a principal agency of the U.S. Federal Statistical System.  The BLS is a governmental statistical agency that collects, processes, analyzes, and disseminates essential statistical data to the American public, the U.S.",what is bls?
<dbpedia:Deventer>,Deventer,"Deventer (Dutch pronunciation: [ˈdeːvəntər]) is a municipality and city in the Salland region of the Dutch province of Overijssel. Deventer is largely situated on the east bank of the river IJssel, but also has a small part of its territory on the west bank. In 2005 the municipality of Bathmen (pop. 5,000) was merged with Deventer as part of a national effort to reduce bureaucracy in the country.",where is deventer
<dbpedia:Hari_River_(Afghanistan)>,Hari River (Afghanistan),"The Hari River or Herat River (Persian هری رود Harī Rūd, i.e. ""Herat River"") is a river flowing 1,100 kilometres (680 mi) from the mountains of central Afghanistan to Turkmenistan, where it disappears in the Kara-Kum desert. Rud means ""river"" in Persian.In Turkmenistan it is known as the Tejen or Tedzhen river and passes close to the city of Tedzhen.To the Ancient Greeks it was known as the Arius. In Latin, it was known as the Tarius.",where is the hari river
<dbpedia:Jean_Giraudoux>,Jean Giraudoux,"Hippolyte Jean Giraudoux (French: [ʒiʁodu]; 29 October 1882 – 31 January 1944) was a French novelist, essayist, diplomat and playwright. He is considered among the most important French dramatists of the period between World War I and World War II.  His work is noted for its stylistic elegance and poetic fantasy. Giraudoux's dominant theme is the relationship between man and woman—or in some cases, between man and some unattainable ideal.",who is jean giraudoux
<dbpedia:Out-of-place_artifact>,Out-of-place artifact,Out-of-place artifact  (OOPArt) is a term coined by American naturalist and cryptozoologist Ivan T.,who coined out of place artifact
<dbpedia:Categorization>,Categorization,"Categorization is the process in which ideas and objects are recognized, differentiated, and understood. Categorization implies that objects are grouped into categories, usually for some specific purpose. Ideally, a category illuminates a relationship between the subjects and objects of knowledge. Categorization is fundamental in language, prediction, inference, decision making and in all kinds of environmental interaction.",the process of categorizing is known as the
<dbpedia:Euphorbia_mellifera>,Euphorbia mellifera,"Euphorbia mellifera (honey spurge, canary spurge syn. Tithymalus melliferus Moench)) is a species of flowering plant in the spurge family Euphorbiaceae, native to Madeira. It is an evergreen shrub growing to 2 m (6 ft 7 in) or more, with narrow leaves up to 20 cm (8 in) long.",what is a honey spurge
<dbpedia:Prototype>,Prototype,"A prototype is an early sample, model, or release of a product built to test a concept or process or to act as a thing to be replicated or learned from. It is a term used in a variety of contexts, including semantics, design, electronics, and software programming. A prototype is designed to test and try a new design to enhance precision by system analysts and users. Prototyping serves to provide specifications for a real, working system rather than a theoretical one.",what is a prototype in a design project?
<dbpedia:Eugène_Ionesco>,Eugène Ionesco,"Eugène Ionesco (born Eugen Ionescu, Romanian: [e.uˈd͡ʒen i.oˈnesku]; 26 November 1909 – 28 March 1994) was a Romanian playwright who wrote mostly in French, and one of the foremost figures of the French Avant-garde theatre. Beyond ridiculing the most banal situations, Ionesco's plays depict the solitude and insignificance of human existence in a tangible way.",when was eugène ionesco born
<dbpedia:Annegret_Richter>,Annegret Richter,Annegret Richter (born 13 October 1950) is a German (former West German) athlete and the 1976 Olympic 100 m champion.,who is annegret scherz
<dbpedia:Arminius>,Arminius,Arminius (18/17 BC – AD 21) was a chieftain of the Germanic Cherusci who defeated a Roman army in the Battle of the Teutoburg Forest in 9 AD.,who defeated germanic cherusci
<dbpedia:Renate_Stecher>,Renate Stecher,Renate Stecher (born 12 May 1950) is a German (former East German) sprint runner and a triple Olympic champion. She held 34 world records and was the first woman to run 100 m within 11 seconds.,who is renate stecher
<dbpedia:Slave_name>,Slave name,"A slave name is the personal name given by others to an enslaved person, or a name inherited from enslaved ancestors. Modern use of the term applies mostly to Africans, African-Americans and West Indians descended from enslaved Africans who retain the name given to their ancestors by the enslavers.Changing from a slave name to a name embodying an African identity became common after emancipation by those in the African Diaspora seeking a reconnection to their cultural roots.",what is a slave name
<dbpedia:Cognitive_linguistics>,Cognitive linguistics,"Cognitive linguistics (CL) refers to the branch of linguistics that interprets language in terms of the concepts, sometimes universal, sometimes specific to a particular tongue, which underlie its forms.",what is cognitive linguistics
<dbpedia:1976_Summer_Olympics>,1976 Summer Olympics,"The 1976 Summer Olympics, officially called the Games of the XXI Olympiad (French: Les XXIes olympiques d'été), was an international multi-sport event in Montreal, Quebec, Canada, in 1976; the first Olympic Games hosted by Canada. Montreal was awarded the rights to the 1976 Games on May 12, 1970, at the 69th IOC Session in Amsterdam, over the bids of Moscow and Los Angeles. Calgary and Vancouver would later host Winter Olympic Games in Canada.",when was the summer olympics
<dbpedia:Pierre_de_Marivaux>,Pierre de Marivaux,"Pierre Carlet de Chamblain de Marivaux (4 February 1688 – 12 February 1763), commonly referred to as Marivaux, was a French novelist and dramatist.He is considered one of the most important French playwrights of the 18th century, writing numerous comedies for the Comédie-Française and the Comédie-Italienne of Paris. His most important works are Le Triomphe de l'amour, Le Jeu de l'amour et du hasard and Les Fausses Confidences.",who was marivaux
<dbpedia:Green_Revolution>,Green Revolution,"The Green Revolution refers to a series of research and development and technology transfer initiatives, occurring between the 1930s and the late 1960s (with prequels in the work of the agrarian genetist Nazareno Strampelli in the 1920s and 1930s), that increased agricultural production worldwide, particularly in the developing world, beginning most markedly in the late 1960s.",green revolution history
<dbpedia:Claw>,Claw,"A claw is a curved, pointed appendage, found at the end of a toe or finger in most amniotes (mammals, reptiles, birds). However, the word ""claw"" is also often used in reference to an invertebrate. Somewhat similar fine hooked structures are found in arthropods such as beetles and spiders, at the end of the leg or tarsus for gripping a surface as the creature walks.",what are claws in humans
<dbpedia:Rhine_Falls>,Rhine Falls,"The Rhine Falls (Rheinfall in German) is the largest plain waterfall in Europe.The falls are located on the High Rhine between the municipalities of Neuhausen am Rheinfall and Laufen-Uhwiesen, near the town of Schaffhausen in northern Switzerland, between the cantons of Schaffhausen and Zürich.  They are 150 m (450 ft) wide and 23 m (75 ft) high. In the winter months, the average water flow is 250 m³/s, while in the summer, the average water flow is 700 m³/s.",what is the name of rhine falls
<dbpedia:Croesus>,Croesus,"Croesus (/ˈkriːsəs/ KREE-səs; Ancient Greek: Κροῖσος, Kroisos; 595 BC – c. 547 BC) was the king of Lydia from 560 to 547 BC until his defeat by the Persian king Cyrus the Great Croesus was renowned for his wealth—Herodotus and Pausanias noted his gifts were preserved at Delphi. The fall of Croesus made a profound impact on the Greeks, providing a fixed point in their calendar. ""By the fifth century at least,"" J.A.S.",what did croesus do
<dbpedia:Metonymy>,Metonymy,Metonymy (/mɨˈtɒnɨmi/ mi-TONN-ə-mee) is a figure of speech in which a thing or concept is called not by its own name but rather by the name of something associated in meaning with that thing or concept.,'metonymy' definition
<dbpedia:Square_kilometre>,Square kilometre,"Square kilometre (International spelling as used by the International Bureau of Weights and Measures) or square kilometer (American spelling), symbol km2, is a multiple of the square metre, the  SI unit of area or surface area.1 km2 is equal to:  1,000,000 square metres (m2) 100 hectares (ha)It is also approximately equal to: 0.3861 square miles  247.1 acres Conversely:1 m2 = 0.000001 (10−6) km21 hectare = 0.01 (10−2) km21 square mile = 2.5899km2 1 acre = about 0.004047km2 The symbol ""km2"" means (km)2, square kilometre or kilometre squared and not k(m2), kilo–square metre. @en <http://en.wikipedia.org/wiki/Square_kilometre?oldid=676494778> .
<http://dbpedia.org/resource/Frederick_I_of_Prussia> <http://www.w3.org/2000/01/rdf-schema#comment> Frederick I (German: Friedrich I) (11 July 1657 – 25 February 1713), of the Hohenzollern dynasty, was (as Frederick III) Elector of Brandenburg (1688–1713) and Duke of Prussia in personal union (Brandenburg-Prussia). The latter function he upgraded to royalty, becoming the first King in Prussia (1701–1713). From 1707 he was in personal union the sovereign prince of the Principality of Neuchâtel (German: Fürstentum Neuenburg). He was also the paternal grandfather of Frederick the Great.",what does square kilometer means
<dbpedia:Eric_Dolphy>,Eric Dolphy,"Eric Allan Dolphy, Jr. (June 20, 1928 – June 29, 1964) was an American jazz alto saxophonist, flautist, and bass clarinetist. On a few occasions, he also played the clarinet and piccolo. Dolphy was one of several multi-instrumentalists to gain prominence in the 1960s.",who was eric dolphy
"<dbpedia:Edremit,_Balıkesir>","Edremit, Balıkesir","Edremit (Ottoman Turkish: ادرمد‎) is a district in Balıkesir Province, Turkey, as well as the central city of that district, on the west coast of Turkey, not far from the Greek island Lesbos.It is situated at the tip of the gulf with the same name (Gulf of Edremit), with its town center a few kilometers inland, and is an important center of trade, along with the other towns that are situated on the same gulf (namely Ayvalık, Gömeç, Burhaniye and Havran).",where is edremit
<dbpedia:Exocrine_gland>,Exocrine gland,"Exocrine glands are glands that produce and secrete substances onto an epithelial surface by way of a duct. Examples of exocrine glands include sweat, salivary, mammary, ceruminous, lacrimal, sebaceous, and mucous. Exocrine glands are one of two types of glands in the human body, the other being endocrine glands, which secrete their products directly into the bloodstream.",types of exocrine glands
<dbpedia:Passy_Cemetery>,Passy Cemetery,"Passy Cemetery (French: Cimetière de Passy) is a cemetery in Passy, in the 16th arrondissement of Paris, France.",what is passy cemetery
<dbpedia:Franz_Scholz>,Franz Scholz,"Franz Scholz (10 December 1909 – 1 September 1998) was a German priest and professor of theology from Breslau, Silesia. He had eight brothers and two sisters. His youngest brother Gerhard is now 86. He studied at Breslau's Catholic St.-Matthias-Gymnasium, then Caritas Science at Freiburg. He studied the Polish language at Kraków and Lublin. In 1934 he became a priest and took up a position as chaplain at Cross Church in Breslau.",how many brothers does francis scholz have
<dbpedia:Vice-Chancellor_of_Germany>,Vice-Chancellor of Germany,"The Deputy to the Federal Chancellor (German: Stellvertreter des Bundeskanzlers), widely known as the Vice-Chancellor (German: Vizekanzler) of Germany is, according to protocol, the second highest position in the Cabinet of Germany. He is the equivalent of a deputy prime minister in other parliamentary systems. The current Vice-Chancellor is Sigmar Gabriel, who is the president of the Social Democratic Party of Germany (SPD) and also serves as Federal Minister for the Economy and Energy.",what is a vp
<dbpedia:Newgate_Prison>,Newgate Prison,"Newgate Prison was a prison in London, at the corner of Newgate Street and Old Bailey just inside the City of London. It was originally located at the site of Newgate, a gate in the Roman London Wall.  The gate/prison was rebuilt in the 12th century, and demolished in 1904.  The prison was extended and rebuilt many times, and remained in use for over 700 years, from 1188 to 1902.",where was newgate prison located
<dbpedia:Fudan_University>,Fudan University,"Fudan University (simplified Chinese: 复旦大学; traditional Chinese: 復旦大學; pinyin: Fùdàn Dàxué), located in Shanghai, China, is one of the most prestigious and  selective universities in China and Asia, and is a member in the C9 League and Universitas 21. Its institutional predecessor was founded in 1905, shortly before the end of China's imperial Qing dynasty. Fudan is now composed of four campuses, including Handan (邯鄲), Fenglin (楓林), Zhangjiang (張江), and Jiangwan (江灣).",fudan university definition
<dbpedia:Christian_X_of_Denmark>,Christian X of Denmark,"Christian X (Christian Carl Frederik Albert Alexander Vilhelm; 26 September 1870 – 20 April 1947) was the King of Denmark from 1912 to 1947 and the only king of Iceland (where the name was officially spelled Kristján), between 1918 and 1944.He was a member of the House of Glücksburg and the first member of his family since king Frederick VII to have actually been born into the Danish royal family; both his father and his grandfather were born as princes of a German ducal family.",who is christian x
<dbpedia:Abomey>,Abomey,Abomey is a city in the Zou Department of Benin. Abomey is also the former capital of the ancient Kingdom of Dahomey (c.,where is abomey
<dbpedia:North_Carolina_State_University>,North Carolina State University,"North Carolina State University, officially North Carolina State University at Raleigh, is a public, coeducational, research university located in Raleigh, North Carolina, United States. Commonly known as NC State or simply State, the university is part of the University of North Carolina system and is a land, sea, and space grant institution.",where is nc state
<dbpedia:Organic_farming>,Organic farming,"Organic farming is a form of agriculture that relies on techniques such as crop rotation, green manure, compost, and biological pest control.",what is a organic farm
<dbpedia:Japanese_wordplay>,Japanese wordplay,"Japanese wordplay relies on the nuances of the Japanese language and Japanese script for humorous effect.Japanese double entendres have a rich history in Japanese entertainment, because of the way that Japanese words can be read to have several different meanings and pronunciations (homographs). Also, several different spellings for any pronunciation and wildly differing meanings (homophones). Often replacing one spelling with another (homonyms) can give a new meaning to phrases.",what is japanese wordplay
<dbpedia:Christian_fundamentalism>,Christian fundamentalism,"Christian fundamentalism began in the late 19th- and early 20th-century among British and American Protestants as a reaction to theological liberalism and cultural modernism. Fundamentalists argued that 19th century modernist theologians had misinterpreted or rejected certain doctrines, especially biblical inerrancy, that they viewed as the fundamentals of Christian faith.  A few scholars regard Catholics who reject modern theology in favor of more traditional doctrines as fundamentalists.",where did christian fundamentalism originate
<dbpedia:Cauchy's_integral_formula>,Cauchy's integral formula,"In mathematics, Cauchy's integral formula, named after Augustin-Louis Cauchy, is a central statement in complex analysis. It expresses the fact that a holomorphic function defined on a disk is completely determined by its values on the boundary of the disk, and it provides integral formulas for all derivatives of a holomorphic function.",cauchy's integral formula definition
<dbpedia:Boundary_(topology)>,Boundary (topology),"In topology and mathematics in general, the boundary of a subset S of a topological space X is the set of points which can be approached both from S and from the outside of S.  More precisely, it is the set of points in the closure of S, not belonging to the interior of S.  An element of the boundary of S is called a boundary point of S.  The term boundary operation refers to finding or taking the boundary of a set.  Notations used for boundary of a set S include bd(S), fr(S), and ∂S.",definition for boundary
<dbpedia:Lyudmila_Kondratyeva>,Lyudmila Kondratyeva,"Lyudmila Andreyevna Kondratyeva (Russian: Людмила Андреевна Кондратьева; born April 11, 1958) is a Russian former track and field athlete, who competed for the Soviet Union and is the 1980 Olympic 100 m champion.Kondratyeva began athletics at age 11 at the Children and Youth Sport School in Shakhty, her first trainer being Lyudmila Mikhailovna Pavlenko.",lyudmila andreyevna
<dbpedia:William_Harvey_Carney>,William Harvey Carney,"William Harvey Carney (February 29, 1840–December 9, 1908)  was an African American soldier during the American Civil War. In 1900, he was awarded the Medal of Honor for his gallantry during the Battle of Fort Wagner in 1863.  Because his actions preceded those of other medal honorees, he is considered to be the first African American to be granted the Medal of Honor.",who won the medal of honor for his gallantry
<dbpedia:Foucault_pendulum>,Foucault pendulum,"The Foucault pendulum (English pronunciation: /fuːˈkoʊ/ foo-KOH; French pronunciation: ​[fuˈko]), or Foucault's pendulum, named after the French physicist Léon Foucault, is a simple device conceived as an experiment to demonstrate the rotation of the Earth. While it had long been known that the Earth rotates, the introduction of the Foucault pendulum in 1851 was the first simple proof of the rotation in an easy-to-see experiment.",what is the french name of boucault's pendulum
"<dbpedia:Margaret_Holland,_Duchess_of_Clarence>","Margaret Holland, Duchess of Clarence","Margaret Holland, Countess of Somerset (1385 – 31 December 1439) was the daughter of Thomas Holland, 2nd Earl of Kent, who was the son of Joan ""the Fair Maid of Kent"" (granddaughter of Edward I of England, wife of Edward the Black Prince and mother of Richard II of England).",who is margaret holland
<dbpedia:BBC_Radio_4>,BBC Radio 4,"BBC Radio 4 is a radio station owned and operated by the British Broadcasting Corporation (BBC) that broadcasts a wide variety of spoken-word programmes including news, drama, comedy, science and history. It replaced the BBC Home Service in 1967. The station controller is Gwyneth Williams; and the station is part of BBC Radio and the BBC Radio department.",who owns bbc radio
<dbpedia:Mass_murder>,Mass murder,"Mass murder (sometimes interchangeable with ""mass destruction"") is the act of murdering many people, typically simultaneously or over a relatively short period of time. The FBI defines mass murder as murdering four or more persons during an event with no ""cooling-off period"" between the murders. A mass murder typically occurs in a single location where one or more people kill several others.",mass murder definition
<dbpedia:Kristen_Nygaard>,Kristen Nygaard,"Kristen Nygaard (27 August 1926 – 10 August 2002) was a Norwegian computer scientist, programming language pioneer and politician. He was born in Oslo and died of a heart attack in 2002.",what is kristen nygaard
<dbpedia:Prosthesis>,Prosthesis,"In medicine, a prosthesis (plural: prostheses; from Ancient Greek prósthesis, ""addition, application, attachment"") is an artificial device that replaces a missing body part, which may be lost through trauma, disease, or congenital conditions. Prosthetic amputee rehabilitation is primarily coordinated by a prosthetist and an inter-disciplinary team of health care professionals including psychiatrists, surgeons, physical therapists, and occupational therapists.",what is prosthesis
<dbpedia:Gyro_Gearloose>,Gyro Gearloose,"Gyro Gearloose is a fictional character, an anthropomorphic chicken created by Carl Barks for The Walt Disney Company. He is part of the Duck universe, appearing in comic book stories as a friend of Donald Duck, Scrooge McDuck and anyone who is associated with them. He was also a frequent star of the animated DuckTales. He first appeared in the Carl Barks comic Gladstone's Terrible Secret (Walt Disney's Comics and Stories #140).",who is gyro gearloose
