_id,title,text,query
<dbpedia:Aladdin_(1992_Disney_film)>,Aladdin (1992 Disney film),"Aladdin is a 1992 American animated musical fantasy film produced by Walt Disney Feature Animation and released by Walt Disney Pictures. Aladdin is the 31st animated feature in the Walt Disney Animated Classics series, and was part of the Disney film era known as the Disney Renaissance. The film was directed by John Musker and Ron Clements, and is based on the Arab-style folktale of Aladdin and the magic lamp from One Thousand and One Nights.",when was aladdin made
<dbpedia:Demographics_of_Cuba>,Demographics of Cuba,"The demographic characteristics of the North American country of Cuba are known through census which have been conducted and analyzed by different bureaus since 1774. The National Office of Statistics of Cuba (ONE) since 1953. The most-recent census was conducted in September 2012. The population of Cuba at the 2012 census was 11.1 million. The population density is 100.7 inhabitants per square kilometer, and the overall life expectancy in Cuba is 78.0 years.",cuba population
<dbpedia:Conjunctive_normal_form>,Conjunctive normal form,"In Boolean logic, a formula is in conjunctive normal form (CNF) or clausal normal form if it is a conjunction of clauses, where a clause is a disjunction of literals; otherwise put, it is an AND of ORs. As a normal form, it is useful in automated theorem proving.",what form is a formula in
<dbpedia:Politics_of_Cuba>,Politics of Cuba,Cuba has had a democratic centralist political system since 1959.,what's the political system in cuba
<dbpedia:The_Last_Supper_(Leonardo_da_Vinci)>,The Last Supper (Leonardo da Vinci),"The Last Supper (Italian: Il Cenacolo [il tʃeˈnaːkolo] or L'Ultima Cena [ˈl ultima ˈtʃeːna]) is a late 15th-century mural painting by Leonardo da Vinci in the refectory of the Convent of Santa Maria delle Grazie, Milan. It is one of the world's most famous paintings, and one of the most studied, scrutinized, and satirized.It was important for humanism.",what is a the last dinner
<dbpedia:IBM_DisplayWrite>,IBM DisplayWrite,"DisplayWrite was a word processor software application that IBM developed and marketed for the IBM PC and PCjr. It was among the company's first internally developed, commercially sold PC software.—",what is ibm's displaywrite
<dbpedia:Battle_of_Dunkirk>,Battle of Dunkirk,"The Battle of Dunkirk was an important battle that took place in Dunkirk, France, during the Second World War between the Allies and Germany. As part of the Battle of France on the Western Front, the Battle of Dunkirk was the defence and evacuation of British and allied forces in Europe from 26 May–4 June 1940.After the Phoney War, the Battle of France began in earnest on 10 May 1940. To the east, the German Army Group B had invaded the Netherlands and advanced westward.",where did the battle of dunkirk take place
<dbpedia:Solenostemon>,Solenostemon,"Solenostemon, commonly known as Coleus is a genus of flowering plants in the family Lamiaceae. Several species formerly included have been moved to the genus Plectranthus. They are native to tropical Africa, Asia and Australia. Some species are cultivated for their highly variegated leaves.",what is solenois
"<dbpedia:United_Kingdom_general_election,_1979>","United Kingdom general election, 1979","The United Kingdom general election of 1979 was held on 3 May 1979 to elect 635 members to the British House of Commons.  The Conservative Party, led by Margaret Thatcher ousted the incumbent Labour government of James Callaghan with a parliamentary majority of 44 seats.",when was the uk election held
<dbpedia:Conradh_na_Gaeilge>,Conradh na Gaeilge,Conradh na Gaeilge (Irish pronunciation: [ˈkɔn̪ˠɾˠə nə ˈɡeːlʲɟə]; also known historically as the Gaelic League) is a non-governmental organisation that promotes the Irish language in Ireland and worldwide.,conradh na gaeilge
<dbpedia:Phineas_Quimby>,Phineas Quimby,"Phineas Parkhurst Quimby (February 16, 1802 – January 16, 1866) was an American spiritual teacher. Quimby was a philosopher, magnetizer, mesmerist, healer, and inventor, who resided in Belfast, Maine, and had an office in Portland, Maine. Quimby's work is widely recognized as leading to the New Thought movement.",who is quimby?
<dbpedia:428_BC>,428 BC,"Year 428 BC was a year of the pre-Julian Roman calendar. At the time, it was known as the Year of the Consulship of Cossus and Cincinnatus or Cincinnatus and Atratinus (or, less frequently, year 326 Ab urbe condita). The denomination 428 BC for this year has been used since the early medieval period, when the Anno Domini calendar era became the prevalent method in Europe for naming years.",what year was the year of the consul
<dbpedia:422_BC>,422 BC,"Year 422 BC was a year of the pre-Julian Roman calendar. At the time, it was known as the Year of the Tribunate of Capitolinus, Mugillanus and Merenda (or, less frequently, year 332 Ab urbe condita). The denomination 422 BC for this year has been used since the early medieval period, when the Anno Domini calendar era became the prevalent method in Europe for naming years.",when was year 422 cc
<dbpedia:J_(programming_language)>,J (programming language),"The J programming language, developed in the early 1990s by Kenneth E. Iverson and Roger Hui, is a synthesis of APL (also by Iverson) and the FP and FL function-level languages created by John Backus.To avoid repeating the APL special-character problem, J requires only the basic ASCII character set, resorting to the use of the dot and colon as ""inflections"" to form short words similar to digraphs.",what is j programming
<dbpedia:Battle_of_Benevento>,Battle of Benevento,"The Battle of Benevento was fought on February 26, 1266 near Benevento, in present-day Southern Italy. It was waged between the troops of Charles of Anjou and Manfred of Sicily. Manfred's defeat and death resulted in the capture of the Kingdom of Sicily by Charles, effectively ending Hohenstaufen rule in Italy.",when was the battle of benevento
<dbpedia:Top_10_(comics)>,Top 10 (comics),"Top 10 is a superhero comic book limited series published by the America's Best Comics imprint of Wildstorm, itself an imprint of DC Comics. Written by Alan Moore and illustrated by Gene Ha and Zander Cannon, the series details the lives and work of the police force of Neopolis, a city in which everyone, from the police and criminals to civilians, children and even pets, has super powers and colourful costumes.",who wrote top ten
<dbpedia:423_BC>,423 BC,"Year 423 BC was a year of the pre-Julian Roman calendar. At the time, it was known as the Year of the Consulship of Atratinus and Ambustus (or, less frequently, year 331 Ab urbe condita). The denomination 423 BC for this year has been used since the early medieval period, when the Anno Domini calendar era became the prevalent method in Europe for naming years.",when was year 423 bc
<dbpedia:Dan_Coats>,Dan Coats,"Daniel Ray ""Dan"" Coats (born May 16, 1943) is the senior United States Senator from Indiana and a member of the Republican Party.  He was in the United States Senate from 1989 to 1999, retired, and then returned in 2011.Born in Jackson, Michigan, Coats graduated from Wheaton College in Illinois and Indiana University Robert H. McKinney School of Law. He served in the U.S. Army from 1966 to 1968. Before serving in the U.S.",where is daniel coats from
<dbpedia:V_for_Vendetta>,V for Vendetta,"V for Vendetta is a graphic novel written by Alan Moore and illustrated by David Lloyd (with additional art by Tony Weare), published by Vertigo, an imprint of DC Comics. The story depicts a dystopian and  post-apocalyptic near-future history version of the United Kingdom in the 1990s, preceded by a nuclear war in the 1980s, which has left most of the world destroyed. The fascist Norsefire party has exterminated its opponents in concentration camps and rules the country as a police state.",when did the book v for vendetta come out
<dbpedia:Operation_Torch>,Operation Torch,Operation Torch (initially called Operation Gymnast) was the British-American invasion of French North Africa during the North African Campaign of the Second World War which started on 8 November 1942.The Soviet Union had pressed the United States and United Kingdom to start operations in Europe and open a second front to reduce the pressure of German forces on the Soviet troops.,operation torch definition
<dbpedia:The_Dark_Knight_Returns>,The Dark Knight Returns,"The Dark Knight Returns is a 1986 four-issue comic book miniseries starring Batman, written by Frank Miller, illustrated by Miller and Klaus Janson, and published by DC Comics. When the series was collected into a single volume later that year, the story title for the first issue was applied to the entire series.",what year did the dark knight return
<dbpedia:Vernation>,Vernation,"Vernation (from vernal meaning spring, since that is when leaves spring forth in temperate regions) is the formation of new leaves or fronds. In plant anatomy, it is the arrangement of leaves in a bud.In pine trees new leaves are short and encased in sheaths. Each leaf bundle consists of 2 to 5 needles. All the leaves on one section of branch grow in length together. In the cabbage, new leaves are folded over, each covered by the previous leaf.",'vernation' definition
<dbpedia:Tobacco_smoking>,Tobacco smoking,"Tobacco smoking is the practice of burning tobacco and inhaling the smoke (consisting of particle and gaseous phases). (A more broad definition may include simply taking tobacco smoke into the mouth, and then releasing it, as is done by some with tobacco pipes and cigars.) The practice was believed to begin as early as 5000–3000 BC . Tobacco was introduced to Eurasia in the late 17th century where it followed common trade routes.",tobacco smoking meaning
<dbpedia:Pioneer_Venus_project>,Pioneer Venus project,"The Pioneer Venus project was part of the Pioneer program consisting of two spacecraft, the Pioneer Venus Orbiter and the Pioneer Venus Multiprobe, launched to Venus in 1978. The program was managed by NASA's Ames Research Center.The Pioneer Venus Orbiter entered orbit around Venus on December 4, 1978, and performed observations to characterize the atmosphere and surface of Venus.",what was the pioneer venus mission
<dbpedia:Bruno_Bauer>,Bruno Bauer,"Bruno Bauer (German: [ˈbaʊɐ]; 6 September 1809 – 13 April 1882) was a German philosopher and historian.  As a student of G. W. F. Hegel, Bauer was a radical Rationalist in philosophy, politics and Biblical criticism.  Bauer investigated the sources of the New Testament and, beginning with Hegel's Hellenophile orientation, concluded that early Christianity owed more to ancient Greek philosophy (Stoicism) than to Judaism.",what ideologues did kaufman teach
<dbpedia:Scheldt>,Scheldt,"The Scheldt (/ʃɛlt/, Dutch: Schelde [ˈsxɛldə], French: Escaut [ɛsko]) is a 350-kilometre (220 mi)  long river in northern France, western Belgium and the southwestern part of the Netherlands.  Its name is derived from an adjective corresponding to Old English sceald ""shallow"", Modern English shoal, Low German schol, Frisian skol, and Swedish (obsolete) skäll ""thin"".",where is the scherde
"<dbpedia:Falmouth,_Cornwall>","Falmouth, Cornwall","Falmouth (/ˈfælməθ/; Cornish: Aberfala) is a town, civil parish and port on the River Fal on the south coast of Cornwall, England, United Kingdom. It has a total resident population of 26,767.",where is falmouth
<dbpedia:Cuban_Revolutionary_Armed_Forces>,Cuban Revolutionary Armed Forces,"The Cuban Revolutionary Armed Forces (Spanish: Fuerzas Armadas Revolucionarias—FAR) consist of ground forces, naval forces, air and air defence forces, and other paramilitary bodies including the Territorial Troops Militia (Milicias de Tropas Territoriales—MTT), Youth Labor Army (Ejército Juvenil del Trabajo—EJT), and the Defense and Production Brigades (Brigadas de Producción y Defensa—BPD).The armed forces has long been the most powerful institution in Cuba and high-ranking generals are believed to play crucial roles in all conceivable succession scenarios.",what is cuba's armed force
<dbpedia:Apple_IIe>,Apple IIe,"The Apple IIe (styled as Apple //e, or sometimes Apple ][e) is the third model in the Apple II series of personal computers produced by Apple Computer. The e in the name stands for enhanced, referring to the fact that several popular features were now built-in that were only available as upgrades and add-ons in earlier models.",what is an apple
<dbpedia:280_BC>,280 BC,"Year 280 BC was a year of the pre-Julian Roman calendar. At the time it was known as the Year of the Consulship of Laevinus and Coruncanius (or, less frequently, year 474 Ab urbe condita). The denomination 280 BC for this year has been used since the early medieval period, when the Anno Domini calendar era became the prevalent method in Europe for naming years.",when did october be the year of coruncanius
<dbpedia:Fernandel>,Fernandel,"Fernand Joseph Désiré Contandin (8 May 1903 – 26 February 1971), better known as Fernandel, was a French actor and singer. Born in Marseille, France, to Désirée Bedouin and Denis Contandin, originating in Perosa Argentina, an Occitan town located in the province of Turin. He was a comedy star who first gained popularity in French vaudeville, operettas, and music-hall revues.",where was fernand gardin from
<dbpedia:Big_business>,Big business,"Big business involves large-scale corporate-controlled financial or  business activities. As a term, it describes activities that run from ""huge transactions"" to the more general ""doing big things"". The concept first arose in a symbolic sense after 1880 in connection with the combination movement that began in American  business at that time.",big business meaning
<dbpedia:Calendula>,Calendula,"Calendula (/kəˈlɛndjuːlə/), or pot marigold, is a genus of about 15–20 species of annual and perennial herbaceous plants in the daisy family Asteraceae. They are native to southwestern Asia, western Europe, Macaronesia, and the Mediterranean.",define calendula
<dbpedia:Andrew_Fisher>,Andrew Fisher,"Andrew Fisher (29 August 1862 – 22 October 1928) was an Australian politician who served as Prime Minister on three separate occasions. Fisher's 1910–13 Labor ministry completed a vast legislative programme which made him, along with Protectionist Alfred Deakin, the founder of the statutory structure of the new nation.",what year did andrew fisher become pm
<dbpedia:Frank_Miller_(comics)>,Frank Miller (comics),"Frank Miller (born January 27, 1957) is an American writer, artist, and film director best known for his dark comic book stories and graphic novels such as Ronin, Daredevil: Born Again, The Dark Knight Returns, Sin City and 300. He also directed the film version of The Spirit, shared directing duties with Robert Rodriguez on Sin City, Sin City: A Dame to Kill For and produced the film 300.  He is also known for creating the comic book character Elektra.",who was frank miller
"<dbpedia:Zacatecas,_Zacatecas>","Zacatecas, Zacatecas","Zacatecas (Spanish pronunciation: [sakaˈtekas]) is a city and municipality in Mexico, and the capital and largest city of the state of Zacatecas.  Located in the north-central Mexico, the city had its start as a Spanish mining camp in the mid-16th century. Native Americans had already known about the area's rich deposits of silver and other minerals.",where is zacatecas in mexico
<dbpedia:Bærum>,Bærum,"Bærum (About this sound listen ) is a municipality in Akershus county, Norway.  The administrative centre of the municipality is the town of Sandvika.  Bærum was established as a municipality on 1 January 1838. A suburb of Oslo, Bærum is located on the west coast of the city.Bærum has the highest income per capita in Norway and the highest proportion of university-educated individuals.",where is sandvika norway
<dbpedia:Mitch_Kapor>,Mitch Kapor,"Mitchell David Kapor (/ˈkeɪ.pʊər/ KAY-poor), born November 1, 1950, is the founder of Lotus Development Corporation and the designer of Lotus 1-2-3. He is also a co-founder of the Electronic Frontier Foundation and was the first chair of the Mozilla Foundation.",who is mitch kapor
<dbpedia:Mercenary>,Mercenary,"A mercenary is a person who takes part in an armed conflict who is not a national or a party to the conflict and is ""motivated to take part in the hostilities by the desire for private gain"". In other words, a mercenary is a person who fights for personal gains of money or other recompense instead of fighting for the ideological interests of a country, whether they be for or against the existing government.",mercenary definition
<dbpedia:Gideon>,Gideon,"Gideon or Gedeon (/ˈɡɪd.iː.ən/; Hebrew: גִּדְעוֹן, Modern Gid'on, Tiberian Giḏʻôn), which means ""Destroyer,"" ""Mighty warrior,"" or ""Feller (of trees)"" was, according to the Hebrew Bible, a judge of the Israelites.  His story is recorded in chapters 6 to 8 of the Book of Judges.  He is also named in chapter 11 of the Epistle to the Hebrews as an example of a man of faith.",hebrew name for judge
<dbpedia:Minoan_civilization>,Minoan civilization,The Minoan civilization was an Aegean Bronze Age civilization that arose on the island of Crete and other Aegean islands such as Santorini and flourished from approximately 2600 to 1400 BCE.  It was rediscovered at the beginning of the 20th century through the work of British archaeologist Arthur Evans.,when did the minoan civilization start
<dbpedia:Fraxinus_quadrangulata>,Fraxinus quadrangulata,"Fraxinus quadrangulata (blue ash) is a species of ash native primarily to the Midwestern United States from Oklahoma to Michigan, as well as the Bluegrass region of Kentucky and the Nashville Basin region of Tennessee. Isolated populations exist in Alabama, Southern Ontario, and small sections of the Appalachian Mountains. It is typically found over calcareous substrates such as limestone, growing on limestone slopes and in moist valley soils, at elevations of 120–600 m.",what is blue ash
<dbpedia:Abu_Nidal>,Abu Nidal,"Sabri Khalil al-Banna (Arabic: صبري خليل البنا, May 1937 – 16 August 2002), known as Abu Nidal (أبو نضال), was the founder of Fatah – The Revolutionary Council (فتح المجلس الثوري), a militant Palestinian splinter group commonly known as the Abu Nidal Organization (ANO).",what was abu ndal known for
<dbpedia:Geography_of_Cuba>,Geography of Cuba,"Cuba is an island nation in the Caribbean Sea. Cuba has an official area (land area) of 109,884 km2 (42,426 sq mi). Its area is 110,860 km2 (42,800 sq mi) including coastal and territorial waters. The main island (Cuba) has 5,746 km (3,570 mi) of coastline and 28.5 km (17.7 mi) of land borders — all figures including the United States territory at Guantánamo Bay, where the U.S.",where is cuba
<dbpedia:Tacoma_Narrows_Bridge>,Tacoma Narrows Bridge,"The Tacoma Narrows Bridge is a pair of twin suspension bridges that span the Tacoma Narrows strait of Puget Sound in Pierce County, Washington. The bridges connect the city of Tacoma with the Kitsap Peninsula and carry State Route 16 (known as Primary State Highway 14 until 1964) over the strait.",what is the tacoma bridge
<dbpedia:Illinois_Institute_of_Technology>,Illinois Institute of Technology,"Illinois Institute of Technology, commonly called Illinois Tech or IIT, is a private Ph.D.-granting research university located in Chicago, in the U.S. state of Illinois, with programs in engineering, science, psychology, architecture, business, communications, industrial technology, information technology, design and law.",what is iit
<dbpedia:Edinburgh_Castle>,Edinburgh Castle,"Edinburgh Castle is a historic fortress which dominates the skyline of the city of Edinburgh, Scotland from its position on the Castle Rock. Archaeologists have established human occupation of the rock since at least the Iron Age (2nd century AD), although the nature of the early settlement is unclear. There has been a royal castle on the rock since at least the reign of David I in the 12th century, and the site continued to be a royal residence until the Union of the Crowns in 1603.",edinburgh castle history
<dbpedia:Sieve_of_Eratosthenes>,Sieve of Eratosthenes,"In mathematics, the sieve of Eratosthenes (Ancient Greek: κόσκινον Ἐρατοσθένους, kóskinon Eratosthénous), one of a number of prime number sieves, is a simple, ancient algorithm for finding all prime numbers up to any given limit.",what does the term sieve of eratosthenes mean
<dbpedia:St._Peter's_Basilica>,St. Peter's Basilica,"The Papal Basilica of St. Peter in the Vatican, or simply St. Peter's Basilica (Latin: Basilica Sancti Petri; Italian: Basilica Papale di San Pietro in Vaticano), is a Late Renaissance church located within Vatican City.Designed principally by Donato Bramante, Michelangelo, Carlo Maderno and Gian Lorenzo Bernini, St. Peter's is the most renowned work of Renaissance architecture and remains one of the two largest churches in the world.",where is saint peter's basilica vatican
<dbpedia:The_Black_Pirate>,The Black Pirate,"The Black Pirate is a 1926 silent adventure film shot entirely in two-color Technicolor about an adventurer and a ""company"" of pirates. It stars Douglas Fairbanks, Donald Crisp, Sam De Grasse, and Billie Dove.",cast of black pirate
<dbpedia:Malvasia>,Malvasia,"Malvasia (Italian pronunciation: [malvaˈziːa], also known as Malvazia) is a group of wine grape varieties grown historically in the Mediterranean region, Balearic islands, Canary Islands and the island of Madeira, but now grown in many of the winemaking regions of the world.",what is malvazia
<dbpedia:University_of_Waterloo>,University of Waterloo,"The University of Waterloo (commonly referred to as Waterloo, UW or UWaterloo) is a public research university with a main campus located in Waterloo, Ontario, Canada. The main campus is located on 404 hectares (1,000 acres) of land in ""Uptown"" Waterloo, adjacent to Waterloo Park. The university offers academic programs administered by six faculties and ten faculty-based schools. The university also operates four satellite campuses and four affiliated university colleges.",where is university of waterloo located
<dbpedia:Blacksmith_Scene>,Blacksmith Scene,"Blacksmith Scene (also known as Blacksmith Scene #1 and Blacksmithing Scene) is an 1893 American short black-and-white silent film directed by William K.L. Dickson, the Scottish-French inventor who, while under the employ of Thomas Edison, developed the first fully functional motion picture camera.It is historically significant as the first Kinetoscope film shown in public exhibition on May 9, 1893 and is the earliest known example of actors performing a role in a film.",what is blacksmithing scene
<dbpedia:Carl_von_Ossietzky>,Carl von Ossietzky,"Carl von Ossietzky (3 October 1889 – 4 May 1938) was a German pacifist and the recipient of the 1935 Nobel Peace Prize for his work in exposing the clandestine German re-armament. He was convicted of high treason and espionage in 1931 after publishing details of Germany's alleged violation of the Treaty of Versailles by rebuilding an air force, the predecessor of the Luftwaffe, and training pilots in the Soviet Union.",who is carl ossietzky
<dbpedia:Chulas_Fronteras>,Chulas Fronteras,"Chulas Fronteras is a documentary film from 1976 which tells the story of the norteño or conjunto music which is played on both sides of the Mexico–Texas border.  It was directed by Les Blank. A CD soundtrack of the music played in the film is also available, under the same title.In 1993, this film was selected for preservation in the United States National Film Registry by the Library of Congress as being ""culturally, historically, or aesthetically significant"".",what genre is chulas fronteras
<dbpedia:Flag_iris>,Flag iris,"Flag iris typically refers to several species of iris plant:Iris pseudacorus, the yellow flag irisIris versicolor, the larger blue flag irisIris prismatica, the slender blue flag iris",what is the iris flag
<dbpedia:Island_of_Montreal>,Island of Montreal,"The Island of Montreal (French: Île de Montréal, Kanien’kéha: Tiohtià:ke), in southwestern Quebec, Canada, is located at the confluence of the Saint Lawrence and Ottawa Rivers. It is separated from Île Jésus (Laval) by the Rivière des Prairies.The island is boomerang-shaped (one end pointing roughly west, the other roughly northeast).",where is montreal in canada
<dbpedia:Carmen_Jones>,Carmen Jones,"Carmen Jones is a 1943 Broadway musical with music by Georges Bizet (orchestrated for Broadway by Robert Russell Bennett) and lyrics and book by Oscar Hammerstein II which was performed at The Broadway Theatre. Conceptually, it is Bizet's opera Carmen updated to a World War II-era African-American setting. (Bizet's opera was, in turn, based on the 1846 novella by Prosper Mérimée.) The Broadway musical was produced by Billy Rose, using an all-black cast, and directed by Hassard Short.",who wrote carmen jones
<dbpedia:The_Big_Parade>,The Big Parade,"The Big Parade is a 1925 American silent film directed by King Vidor and starring John Gilbert, Renée Adorée, Hobart Bosworth, and Claire McDowell.",who played in the big parade
<dbpedia:The_Band_Wagon>,The Band Wagon,"The Band Wagon is a 1953 musical comedy film that many critics rank, along with Singin' in the Rain, as the finest of the Metro-Goldwyn-Mayer musicals, although it was only a modest box-office success. It tells the story of an aging musical star who hopes a Broadway show will restart his career.",when was band wagon made
